A fun film filled with performances that are perfect for the story that it's trying to tell. [Full Review in Spanish]|Fresh
There's an intoxicating energy to this unbelievable story, as director Doug Liman plays fast and loose with the actual facts and events.|Fresh
The use of Tommy C's winning smile, reminiscent from his Risky Business days, is about the only thing this movie got right for me.|Rotten
Tom Cruise and director Doug Liman tell an interesting true story that plays like Goodfellas mixed with Top Gun ...|Fresh
American Made. What a suiting title for a Tom Cruise vehicle.|Fresh
[Tom] Cruise is able to make us like an irredeemable character without ever putting us on his side or making us complicit in his wrongdoing. That's a tough trick to pull off, and I doubt it would be as effective for anyone other than Cruise.|Fresh
It doesn't really feel interested in Seal as a character - we don't find out much about him other than the things that supposedly happened to him without any real insight into his decisions or why he made them.|Rotten
Cruise, sporting a Southern accent, is magnetic, a presence with gravity, one that drives the energy of each scene.|Fresh
With a thundering pace and fun energy, American Made is a winner and highlights Tom Cruise at his energetically charming best.|Fresh
The film wholeheartedly embraces its trashiness and spins a mightily entertaining yarn in the process.|Fresh
A fun film filled with performances that are perfect for the story that it's trying to tell. [Full Review in Spanish]|Fresh
There's an intoxicating energy to this unbelievable story, as director Doug Liman plays fast and loose with the actual facts and events.|Fresh
The use of Tommy C's winning smile, reminiscent from his Risky Business days, is about the only thing this movie got right for me.|Rotten
Tom Cruise and director Doug Liman tell an interesting true story that plays like Goodfellas mixed with Top Gun ...|Fresh
American Made. What a suiting title for a Tom Cruise vehicle.|Fresh
[Tom] Cruise is able to make us like an irredeemable character without ever putting us on his side or making us complicit in his wrongdoing. That's a tough trick to pull off, and I doubt it would be as effective for anyone other than Cruise.|Fresh
It doesn't really feel interested in Seal as a character - we don't find out much about him other than the things that supposedly happened to him without any real insight into his decisions or why he made them.|Rotten
Cruise, sporting a Southern accent, is magnetic, a presence with gravity, one that drives the energy of each scene.|Fresh
With a thundering pace and fun energy, American Made is a winner and highlights Tom Cruise at his energetically charming best.|Fresh
The film wholeheartedly embraces its trashiness and spins a mightily entertaining yarn in the process.|Fresh
American Made's creative style of storytelling along with the bond between Cruise and director Liman makes this biopic one of the best movies of Cruise's career|Fresh
American Made doesn't want to do breast-beating. In the end, it feels like a dramatized story from John Oliver or Jimmy Kimmel, jocular as we're watching, horrifying as we let the full impact sink in.|Fresh
American Made may not be first-tier action, but it more than makes up for The Mummy.|Fresh
I spent a lot of the film just feeling like it's ridiculous that these awful men just keep living on in our memories as we glorify their lives of crime.|Rotten
Rather than serving as another vehicle for Cruise's charisma, American Made acts as a showcase for supporting player Domhnall Gleeson, who nearly walks away with the movie despite his limited screen time.|Fresh
Barry Seal isn't even really a hero, but he's not that great of a criminal either. He just seems to be a string of one liners and even when he's knees deep in coke, he's still just that little bit lame.|Rotten
You have to wonder if the real Barry Seal was as likable as the new true-crime thriller, American Made, makes him out to be, or if it's simply Tom Cruise's toothy charisma that makes him seem so.|Fresh
"American made is worth watching...it's a fascinating look at the ""War on Drugs."""|Fresh
American Made is as middle-of-the-road as they come; if the weather is particular depressing and you genuinely have nothing better to do - we've all been there - think about giving American Made a go.|Rotten
The Barry Seal you see onscreen is the man Cruise wants you to see: a guy with limited skills and a lot of dumb luck. It's an energetic and convincing performance.|Fresh
"""Made"" is a hugely entertaining and unpredictable blend of a less offensive Wolf of Wall Street and a Southern-fried Goodfellas."|Fresh
... it's fun, bold, smart and a return to form for Cruise... [Full review in Spanish]|Fresh
American Made is ultimately an anodyne cautionary tale, even if it has a swell time hanging out with psychopaths and is almost light-hearted in the portrayal of drug trafficking and murder.|Rotten
American Made is a great laugh if like me you're happy enough watching rise-and-fall tales of American hubris you've seen a few times before|Fresh
It's easy to root for Seal, because it seems like he's just along for the ride because it's more fun than flying short hops for TWA. And we're along for the ride, because this is a way better Tom Cruise movie than The Mummy.|Fresh
Antiheroes require an actor that radiates charisma, so it's no shock that Tom Cruise (reunited with Edge of Tomorrow director Doug Liman) makes for a likable drug runner, gun smuggler, and greedy scumbag whose financial thirst cannot be quenched|Fresh
...a sporadically intriguing yet hopelessly slapdash endeavor that could (and should) have been so much better...|Rotten
Tom Cruise [is] in a restored state of grace. [Full Review in Spanish]|Fresh
It's not a bad way to spend some time, but neither is it enough to jump on a plane to see it. [Full review in Spanish]|Fresh
[American Made] is most pleasant. [Full Review in Spanish]|Fresh
Tom Cruise seems to be having a great time playing this real-life figure but the film never goes beyond the superficial elements of this man's life.|Rotten
American Made is funny, insightful, controversial and spunky all at once.|Fresh
'American Made' was made for Cruise.|Fresh
Unsurprisingly, what keeps the film from succumbing to its pace and tying everything together is Tom Cruise.|Fresh
It's a role suited to Tom Cruise who portrays the lead character as a likeable larrikin who lacks intelligence but makes up for it with charm and personality.|Fresh
Cruise is terrific and entertaining, freewheeling and funny, and many years into his career, he still carries himself like one of Hollywood's top guns.|Fresh
Great storytelling and a playfully great performance by Cruise make this one of the star's better films.|Fresh
Liman and Cruise keep things at surface level, delivering an enjoyably audacious caper but neglecting the context and subtext that could have made it something more.|Fresh
Tom does it well, but it has all been done before, and better.|Fresh
This is a fascinating story told in a fascinating way. Much recommended for those who crave to see Tom Cruise in films beyond the formulaic but entertaining Mission Impossible series.|Fresh
All in all, it's a pretty diverting afternoon at the cinema.|Fresh
Kudos to Cruise, a proven master at consistently cranking out satisfying cinematic fare certain to keep you glued to the edge of your seat.|Fresh
Cruise gets to toy with his trademark cockiness in ways that are consistently amusing, and we're quickly reminded of why his star persona has proved so indelible for so long.|Fresh
"The joy in watching ""American Made"" is considerably driven by Cruise's wide-eyed astonishment with every twist and turn happening to Seal. This is a role that was tailor-made for the 55-year-old-actor."|Fresh
Barry Seal is a real historical figure, but this film portrays a number of events surrounding his smuggling activities in ways that seem to deviate substantially from the facts. It makes for quite a fantastic yarn.|Fresh
Cruise dominates in this solid, helluva ride. [Full review in Spanish]|Fresh
Like liquor-running evolved into NASCAR, Cruise and a jovial script spins Iran-Contra darkness into the wink-wink, boys-will-be-boys rear-view glow we Americans enjoy shining on our culture.|Fresh
[American Made] fails to present us a film that in much more capable hands, could have become a classic. [Full Review in Spanish]|Rotten
[Cruise] standing in for a portly, devil-may-care Louisianan is an epic miscast.|Rotten
The cast shines, but it will always be at the command of what Tom Cruise has to offer us and he ultimately does not disappoint us. [Full review in Spanish]|Fresh
"Writing that this is ""historically inaccurate"" doesn't do it justice...Regardless of the silly political stuff Liman tries to foist on the audience, the movie is very well done and is highly entertaining."|Fresh
Its colorful style recalls the flamboyant amorality of GoodFellas and Blow, and it's often funnier and more succinct than either.|Fresh
As stylish and dirty as it is devilishly witty.|Fresh
The director-star dynamic made a hit of their first movie together (Edge of Tomorrow), and it's what makes American Made work, too.|Fresh
Light, fun and exciting... [Full review in Spanish]|Fresh
American Made is an undeniably good time.|Fresh
The movie's a bit of a mess, but it does enough things really well that it's always fun to watch.|Fresh
What works best about Cruise in American Made is that it's a role seemingly scripted for him.|Fresh
American Made is the kind of movie that insists reality is much more implausible - and entertaining - than fiction.|Fresh
Cruise is locked in, with a slight Southern drawl painted over his usual onscreen persona, but it's a good fit for his movie star charms. He's having fun, so the audience follows.|Fresh
Edgy, engaging and adrenaline-charged, proving once again that America is the land of opportunity....|Fresh
The result is an easy old watch that doesn't stretch Cruise one jot and gives him plenty of opportunity to combine floppy fringe and flashes of pearly whites to familiar effect.|Fresh
American Made is first and foremost Cruise's chance to show who's still top gun, down to the aviator trade and sunglasses.|Fresh
American Made is a conventional true story crime caper that stays afloat thanks to Liman's solid direction and Cruise's committed turn as an antihero.|Fresh
I'm sure in 20 years' time we will be watching another hot actor (or maybe actress) show us a story of the nutty crap that is probably going on as we speak in the current administration.|Fresh
The tragedy is all there: the coke-fuelled Icarus, the shadow side of the Reagan era, and our perpetual need to make heroes. American Made knows what it is, yet, by for the very same reason, it can't explore the tragic side. It wouldn't be American.|Fresh
Tom Cruise's latest is almost subversive in its breezy, anti-US attitude.|Fresh
Well-crafted, if woefully familiar.|Fresh
American Made gives director Doug Liman and charismatic star Tom Cruise a superior vehicle and plays to their strengths. It's a solid piece of entertainment that takes a stranger-than-fiction story and brings it to life in convincing fashion.|Fresh
Just when it seemed as if we had lost Tom Cruise to the ranks of paycheck-cashing automatons no longer interested in applying themselves on screen, along comes American Made to show there's still some life left in the maverick actor.|Fresh
This is Cruise's show all the way, and he delivers with a performance that will take you higher than any drug or airplane ever could.|Fresh
Those of you who thought earlier this year that Tom Cruise was on the verge of being Mummified as an actor, don't worry.|Fresh
The 'cheeky' opening title card tells us Gary Spinelli's screenplay is 'based on a true lie,' and it is this flippant treatment that keeps the film from soaring higher.|Fresh
Mostly enjoyable and only slightly too long.|Fresh
The march to judge Cruise's career dead is premature. His charm and energy and willingness to look like hell elevates this movie. He's terrific and its a lot of fun.|Fresh
Enjoyment is virtually guaranteed. Misgivings are optional. They're for the walk out into the parking lot -- and after.|Fresh
Tailor-made for Tom Cruise, playing to his charisma, athleticism, humor, even his pilot skills.|Fresh
It's no masterpiece, but it makes a complex story breezy and engaging.|Fresh
A serious treatment might have been more informative, but probably not as entertaining.|Fresh
Cruise and Liman ask us to share Seal's kicks and risk, right up until the inevitable crash puts a stark exclamation point on what has been an enjoyably crazed ride.|Fresh
Cruise dominates, as he has in every recent movie, but this time, it actually works in the story's favour.|Fresh
Quite an airy romp, American Made is worth checking out.|Fresh
If it isn't always as focused or as deep as I wanted it to be, that does not make the finished feature any less invigorating, this romp into arrogant American excess a tragic flight of fancy well worth taking.|Fresh
The story of Barry Seal is indeed a fascinating one but this film just doesn't know what to do with it-it is the kind that makes you want to immediately seek out a book or straightforward documentary that offer a fuller picture of what transpired.|Rotten
It's a movie made to thrill rather than unnerve, and that's because at the end of the day, Cruise is still making movies where he needs to be liked.|Fresh
The outrageous exploits make the presentation a natural for fast-paced energy and hijinks, and Cruise looks like he's having the time of his life hustling everyone, including himself at times.|Fresh
Cruise's Seal often tells his own story in American Made, but it's hard to know when he's on the level. Perhaps it's that difficulty that makes the tale so fascinating 30 years after he flew covert missions.|Fresh
"Together, Cruise and [director Doug] Liman inject a carefreeness to the character and film, respectively, that is reminiscent of Martin Scorsese's ""Goodfellas."""|Fresh
Unfortunately, Gary Spinelli's script becomes too unwieldy for even a superstar like Cruise to carry the load all by himself.|Fresh
Seal's story is a fascinating one worth investigating...As played by Cruise, he's like Maverick gone to seed.|Fresh
Tom Cruise delivers his most audacious - and best - performance in years in this amazing and notorious true story that just might blow your mind.|Fresh
Liman appears to be the only director working these days that can pull old Tom Cruise out of his malaise and make him deliver the performances we know Tom Cruise can deliver.|Fresh
Following The Mummy, American Made is easily the best Tom Cruise film of 2017, though it never strikes quite the right tone for the story it's trying to tell.|Fresh
This is a black comedy, and irony isn't Cruise's most natural mode, yet by playing Seal as a slightly dimwitted cheeseball on the make, he gets into the movie's you-can't-make-up-this-stuff spirit.|Fresh
The movie has a nice, low-key amiability, and it finally puts Tom Cruise back in synch with his talent.|Fresh
Cruise's best movie in about a decade - a return to the type of role that made him a star in the first place.|Fresh
Cruise's performance here is decidedly and admirably calm.|Fresh
The film's high may be fleeting, but it provides quite the buzz while it lasts.|Fresh
It's nobody's idea of an action masterpiece. But American Made is a blast, leveraging star Tom Cruise's on-screen wattage and comedic sense while telling a heck of a story that again confirms truth is stranger than fiction.|Fresh
The quick smile and familiar Cruise charm is obviously hiding something out of place with the character-Seal was more lucky than clever. I got it, because the weakness is there in this slick performance, you just have to look closely.|Fresh
Tom Cruise once again refuses to act his age, this time prancing merrily into some extreme mayhem and a cadre of mostly notorious, '80s-era newsmakers.|Fresh
Is Tom Cruise trying to apologize for his Reagan-friendly 'need for speed?'|Fresh
It's a grand performance of toothy grins, aw-shucks charm and pure movie star magnetism. Barry's so much fun to watch you keep forgetting he's one of the bad guys.|Fresh
An intermittently amusing and muddled retelling of the beginnings of the Iran-contra affair.|Fresh
A terrific Tom Cruise performance anchors a dark, cynical dive into Reagan's America that serves as a counterpoint to 'Top Gun'.|Fresh
Cruise plays this mostly for laughs, and it's a return to the screen of the charmer of his earlier films.|Fresh
There's an aspirational pleasure in seeing Cruise, now in his mid-50s, jump through these hoops. He knows we prefer him when he shades his easy charm with self-doubt, and Barry has a pleasingly sweaty desperation. But not enough ...|Rotten
"The story at times feels too wild, too crazy to be true, but that's what makes it worth telling. ""American Made"" is a real whopper."|Fresh
There's an energy to the flight sequences that I haven't seen since Cruise was screaming about 'the need for speed' more than two decades ago. And there's a jittery, almost cocaine-addled pace to the story.|Fresh
A cocaine-fueled romp that plays like a lightweight blend of Goodfellas and Argo, it's entertaining stuff - as long as you don't expect it to stick to the facts.|Fresh
Stylish, politically savvy, exceptionally well-constructed.|Fresh
It's less the ribald ripped-from-the-headlines commentary it aspires to be than a cynically breezy take on an ugly, unduly buried chapter of American history.|Fresh
American Made is breezy and fun and makes its points without subjecting the viewer to a browbeating.|Fresh
American Assassin is a decently made tour of Europe, utilising easy target villains to maximise cheering from audiences willing to accept diplomacy down the barrel of a gun... as long as the gun is held by a nominally handsome American man.|Fresh
American Made feels way too sprightly, too jokey, for a movie about a guy who -- despite his rationalizations -- was a well-paid drug mule.|Rotten
If American Made were limited to what Seal knew personally, some of the dangling threads in Gary Spinelli's script could be written off. As it is, they hint at stories we'd like to know better|Rotten
The point here is not to depict Reagan-era corruption or cartel ruthlessness. The point is a wild ride akin to [the real-life] Barry's own - you may as well enjoy it.|Fresh
American Made delivers so much as rambunctious entertainment that it's easy to miss the film's withering assessment of American foreign policy during the Reagan years.|Fresh
Doug Liman knows something very important about Tom Cruise: the actor is never more interesting than when he's desperate and unlikeable.|Fresh
Still bizarrely boyish, Tom Cruise, 55, hits a recent career high in Doug Liman's American Made.|Fresh
If comedy is indeed tragedy plus time, then we've had just enough time since the 1980s to chuckle at one of its more tragic narratives.|Fresh
It's nice to see Cruise entering into another risky business and once again performing reckless maneuvers in the sky.|Fresh
American Made may not be truthful, but it is a treat|Fresh
The film may be fact-based but that doesn't stop it from feeling generic, like you've seen it all before. The big difference is that Cruise is spreading his starshine over this one and that (still) counts for something.|Rotten
Cruise doesn't seem fully suited to the role of lovable reprobate, but he knows how to capture an adrenaline rush and his charisma is, as ever, undimmed.|Fresh
It's everything you could want from a flashy true-crime biopic skewering the hypocrisy and malice of the Reagan Administration's covert war in Central and South America.|Fresh
Language, some sex in tense but funny drug war comedy.|Fresh
"""American Made"" is a smart, nervy film, a very modern entertainment made with energy, style and a fine sense of humor that keeps us amused until gradually, almost imperceptibly, the laughter starts to stick in our throats."|Fresh
It's nice to be reminded that Tom Cruise has the chops to play somebody other than Tom Cruise, Action Hero.|Fresh
Just when it seems it may be time to close the book on Tom Cruise's acting career, something comes along to suggest new chapters are possible.|Fresh
"""American Made"" goes down easily, especially if you don't let the historical record with its real-world stakes bother you."|Fresh
Barry is the closest thing Tom Cruise has played to a regular Joe in more than a decade, and the part isn't a snug fit.|Rotten
Though sanitized here, Seal's story is riveting; his life was as duplicitous as the country he sometimes represented. Cruise flying his drug-packed plane in American Made is like a weird extension of Cruise flying for glory in Top Gun back in the '80s.|Fresh
It's the grubbiest, greasiest vision of bad boys gettin' away with it in recent memory, a glass of sour milk specifically timed to curdle just at the moment you think it might be harmless.|Fresh
"""American Made"" is a stinging critique of U.S. foreign policy disguised as a freewheeling action comedy."|Fresh
Mostly, there's Cruise, who at 55 looks a decade and a half younger, and can still fill a cockpit with star power some 30 years after Top Gun.|Fresh
Tom cruises through this high-flying biography in top form.|Fresh
"Unable to present a protagonist that makes sense, ""American Made"" tries something else. It insists that the world doesn't make sense; thus, Barry is just going with the flow and getting carried along by events."|Rotten
Cruise plays Barry as an aw-shucks raconteur, and the routine is amusing at first. But midway through American Made, even Cruise devotees might decide enough is enough.|Rotten
"What could've been a dark-universe inversion of ""Top Gun"" - wherein Tom Cruise feels a need for greed -is instead the star's attempt to tailor an off-the-rack knockoff of ""Goodfellas"" and other party's-over parables into a turgid, toothless bore."|Rotten
"""Glib"" is probably the right word for American Made, a movie that seems to exist purely to be Tom Cruise's rebound after his disastrous attempt to reboot The Mummy earlier this summer."|Rotten
If trafficking in clich were a federal offense, everyone involved with this movie would be looking at prison time.|Rotten
With American Made, [Tom] Cruise and [Doug] Liman once again bring out some of the best work in one another.|Fresh
It's refreshing to see the famous Cruise grin used more as a mask than a crutch.|Fresh
"""American Made"" really does deserve to be on a double-bill with ""Top Gun,"" and I'm betting Cruise knows it."|Fresh
American Made has such style and energy that its hasty patchwork of a narrative becomes a kind of charm unto itself, even when it means losing track of talented actors.|Fresh
American Made points out an unfortunate time in our history when government shenanigans ran amok internationally and people did bad things in the name of greed and power. But hoo-boy, does Tom Cruise have fun with it.|Fresh
What Doug Liman's breezy film lacks in verisimilitude it makes up for in entertainment value, at least for a while.|Fresh
It seems to want to be Goodfellas and it's not that monumental, but citizens should know about the shady schemes in which its government agencies were involved.|Fresh
American Made delivers so much as rambunctious entertainment that it's easy to miss the film's withering assessment of American foreign policy during the Reagan years.|Fresh
To watch American Made is to recall [Tom Cruise's] loose charm from films past-and to think, a little mischievously, that this is one megastar who is very good at playing stupid.|Fresh
As is, at two hours, it's fairly entertaining even when it doesn't quite work.|Fresh
Cruise's latest is the smart, zippy American Made, a movie that plays very much like your type-A Tom Cruise movie before it yanks the rug out from beneath you and reveals the B-movie Cruise we've been missing.|Fresh
Doug Liman may effectively maintain a madcap energy through to the end, but unlike Adam McKay or Martin Scorsese, he isn't all that interested in explicating the complex inner workings of vast criminal enterprises.|Rotten
American Made sells a toxic, shallow, anti-American Dream bill of goods for anybody looking to shake their head about exceptionalism without seriously considering what conditions enable that mentality.|Rotten
Though this over-the-top Cruise-Liman combination is sporadically amusing, its raucousness often comes across as desperately frantic rather than satirically telling....For what it is, though, it earns a marginal pass.|Fresh
Cruise buoys the film's flop-sweat intensity. He seems to understand his character's desperate, ingratiating whirligig restlessness from the inside. This is that rare time that one of his slick charmers lets you see behind the curtain.|Fresh
Based on a true story, it's not difficult to figure out this will unravel, but watching it and Cruise's performance in the process offers much enjoyment.|Fresh
Even as Cruise keeps us rooting for Barry, Liman reminds us that this is a story of bad guys.|Fresh
American Made does everything it should: it educates and it entertains.|Fresh
Cynical though it may be, American Made is undeniably a whole lot of action-oriented fun.|Fresh
With his thick, wavering Baton Rouge accent and his wide-eyed intensity, Tom Cruise sometimes feels like he's doing his best Matthew McConaughey impression, and it's a blast to watch.|Fresh
