Irresistible energy and a strange saga of corruption, while Cruise is simply a force of nature, delivering one of the best performances of his career.|Fresh
"Doug Liman's fact-based film ""Made in America,"" is an entertaining affair that Cruise puts on his shoulders and carries across the finish line."|Fresh
Cruise soars, back in his element in this feverishly upbeat film frolic about a footnote figure in a shady chapter of American history.|Fresh
...can be filed in the category of Tom Cruise performances that function as self-critique.|Fresh
American Made is like Pain & Gain if it had snorted a line of Colombia's finest white.|Fresh
It's all punctuated with the famous [Tom] Cruise grin, which hasn't changed since Risky Business|Fresh
Featuring one of Tom Cruise's best performances in recent years, American Made is a darkly funny, dizzying crime film that nevertheless ultimately feels inconsequential and overly familiar.|Fresh
There's something oddly joyless about the whole enterprise. Its overweening cynicism leaves a curdled aftertaste.|Rotten
Looking back, it seemed that Barry Seal lived his life so that, one day, it could be adapted into a film. That's just how wild it was.|Fresh
What does work well is [Tom] Cruise's winning performance as a corrupt capitalist whose love of country and family ranks considerably lower than cash and adrenaline buzzes. He's an anti-hero we actually like.|Fresh
At the end of the day, it has one hell of a story to tell, and tells it in a visually arresting way, and sometimes that's enough for a proper cinematic experience.|Fresh
Suffers from sluggish pacing, but proves Cruise is still a good movie star.|Fresh
"In the effort to be fun and slick, ""American Made"" loses its teeth and is relegated to Tom Cruise doing the two things he's best at: being a charmer and daredevil."|Rotten
American Made sure makes zipping around in planes loaded with ill-gotten jewels seem like a lot of fun.|Fresh
Flippant, fun and damning.|Fresh
First-class editing helps to make sense of a jumble of plots, including Tom Cruise's performance as a gun running CIA agent, a TWA pilot, and a drug smuggler.|Fresh
Tom Cruise gives his best performance in years in a film almost too intently nuts to notice.|Fresh
The movie avoids wearing out its welcome, accordingly. You won't be bored. All the good scenes are too short, but all the bad scenes are also, thankfully, too short. It's a perfectly fine movie.|Fresh
Tom Cruise and Doug Liman are back with another winner. American Made is a breezy, highly entertaining story of arms and drug trafficking in the early eighties.|Fresh
Seal is not a likable guy exactly. He's actually kind of a greedy, amoral dirtbag. Which is why Liman and screenwriter Gary Spinelli need someone like Cruise to sell him. And sell him he does.|Fresh
Doug Liman's electric film is clear-eyed about the cynicism and corruption beneath its hero's anxious grin. It voraciously breaks down both the star and the country he has symbolized for so much of his career.|Fresh
It gives Liman a chance to stage a few tense aerial sequences ... it gives Cruise the opportunity to re-establish his brand of aggressive good humor and carefree - make that careless - adventure. They know what they're doing.|Fresh
"The ever-in-control Tom Cruise veers wildly off course in a lively, brash and ridiculously entertaining biopic. I hope I had you at ""wildly."""|Fresh
Style and humor galore, and a hugely entertaining performance from Tom Cruise. But should a true story of immense governmental corruption be quite this fun?|Fresh
A more than remarkable approach to an era and political practices that responded to a moment of confusion and, at the same time, dementia that Liman translates well through images. [Full review in Spanish]|Fresh
"It just hits you. ""Are we going anywhere with this?"""|Rotten
The domestic action and melodrama alternate offering a lot of superficial material and leading to an irregular rhythm. [Full review in Spanish]|Fresh
The film holds itself thanks to the good performance of Tom Cruise, who gives us a character as cynical as he is charming, one of his best performances in a long time. [Full review in Spanish]|Fresh
In Doug Liman's sensationally entertaining adventure-comedy biopic, Tom Cruise steps away from his blockbuster tropes to register one of the best and brightest performances of his career... easily as enjoyable a thrill ride as any of Cruise's other epics.|Fresh
The film has a wonderful Polaroid tone that transports us through time without us noticing it, liberates and reassures us of the narrative of events that once terrified the world. [Full review in Spanish]|Fresh
Politically ambiguous and incorrect, but devilishly entertaining. Tom Cruise holds the film well, with a light script and a conventional narrative. [Full review in Spanish]|Fresh
It works wonderfully as an interpretative and acrobatic recital of that orchestra man who is Cruise, knowing how to rise above the average of this type of shows. [Full review in Spanish]|Fresh
American Made is compelling and unconventional: a film clearly made within the system, designed to look outside it.|Fresh
The last film of Liman takes off in such a jocose approach to the excesses of the CIA and the government of the USA towards international relations. [Full review in Spanish]|Fresh
This is one of the more enjoyable Cruise outings in a while, at least for those who prefer to see him sacrifice his indestructible alpha-male persona.|Fresh
[Liman's] film feels - is - derivative, even redundant. But he's got Cruise, and Cruise delivers, in a way he hasn't since Jerry Maguire (1996). I thought I'd never get to say this again: Tom Cruise makes the movie, and is the reason to see it.|Fresh
[American Made] offers nothing new to stand out as anything other than an above-average blockbuster for the end of summer.|Rotten
It's a part tailor-made for [Tom Cruise].|Fresh
American Made is an entertaining, funny and a thoroughly engaging ride which, if for nothing else, is worth seeing for [Tom] Cruise alone.|Fresh
If fighting the undead in The Mummy seemed like a bit of a departure for the A-lister, American Made is a beaming, smooth-talking return to familiar territory.|Fresh
It's brash, funky, exciting and, crucially, it allows Cruise to have some fun with who he used to be.|Fresh
A film that's high on charm but perilously low on historical overview, or morality. I ended up liking old Barry, but really, was I supposed to?|Fresh
This hugely enjoyable, big-budget, semi-political romp is exactly the sort of film Tom Cruise should spend the rest of his career making -- one that harks back to the 1980s and early 1990s, when his charisma effectively ran the industry.|Fresh
Frustrating directorial tics aside, this is an enjoyable peek into the strange place where world events intersected and one man was in the middle of it all.|Fresh
The script for American Made has failed to overcome the film's turbulent production.|Rotten
The role makes Cruise's obsessive energy both believable and pleasurable|Fresh
It's director Doug Liman's refusal to spoon-feed that makes the story so potent.|Fresh
For once that Colgate white smile doesn't cut it. Cruise's star wattage doesn't illuminate the story, it blinds us to its complexities.|Rotten
Liman's film is a playful, if not especially probing, jab in the ribs of Reagan's America and its interventionist politics. It also works nicely as a Tom Cruise star vehicle - his megawatt smile and aviator sunglasses on fine form here.|Fresh
"In the case of American Made, the ""true story"" is more of a serving suggestion, but the fully embellished film is still great fun."|Fresh
It's a lively, gripping romp. But it could have been a lot more than that.|Fresh
He's back! Let the bells ring out, let the choirs of angels sing! Tom Cruise has once again, to the surprise of many, given a great performance.|Fresh
This is all about Tom [Cruise], and by the end you desperately want to slap him.|Rotten
An entertaining if glib film, especially if you are a Cruise fan.|Fresh
It felt like Casino met War Dogs and got on famously. I loved it.|Fresh
Cruise goes all in as Barry, and in having a ball delivers his best performance in years.|Fresh
While he laughs so much in the first 20 minutes that you swear it'll be the last thing you remember on your death bed, Cruise is, as usual, watchable.|Fresh
American Made sees Cruise, for the first time in what feels like years, cast exactly as the character he was born to play; an untrustworthy larrikin who, almost despite ourselves, we just can't help but like.|Fresh
What lets it off the hook - up to a point - is a certain nostalgia for the vehicle that made Cruise a star.|Fresh
Cruise has more fun than he's had in years twitting his image as an ethical action hero.|Fresh
As a statement about America's place in the world this is bolder than the vast majority of Hollywood cinema.|Fresh
Tom Cruise (delivering his best work in ages) plays Barry Seal, a small-time commercial airline pilot recruited by the CIA to conduct top-secret surveillance flights across Latin America in the late 1970s.|Fresh
Liman, who has already established himself as an action-savvy filmmaker, handles the '80s tonal shift with deft assurance. And he is well-served by Cruise, who delivers his best performance in some time in the lead role.|Fresh
The problem is, American Made's Barry Seal was a real person. And real people aren't celluloid gods.|Rotten
Tom Cruise gives one of his finest screen performances in American Made, a film which allows the normally clean-cut star to show his delinquent side.|Fresh
Liman mines the story for familiar but fun comedy|Fresh
The beamingly ingenuous Tom, whose character is not burdened with any doubts or an inner life, somehow sells it to you.|Fresh
Hard to classify and as unpredictable as its protagonist, this comedic drama is part political satire, part absurdist crime caper, part conspiracy thriller.|Fresh
Cruise is on top form in a based-on-fact thriller that overcomes its familiar trappings with audacious details and flat-out pacing.|Fresh
Cruise is as compelling as ever with charm to spare, and this is a ceaselessly entertaining, sometimes tense romp. Although it doesn't dig much below the surface.|Fresh
It's refreshing to see Tom Cruise return to a more character driven piece, playing Barry Seal in Doug Liman's unashamedly entertaining drama American Made.|Fresh
An engrossing true-crime tale spirited in its energy and potent in its execution.|Fresh
A forgettable flight of fantasy.|Rotten
Pictures about the underside of the American Dream are as old as Citizen Kane (actually, older). Still, there's no harm in Liman throwing one more hubristic tale into the pile; certainly not when it's this fun and frantic, shot with grimy vigour.|Fresh
Superb storytelling, tense action, wonderful use of music, a lively sense of fun and Tom Cruise at his very best in a tale that is - well - extraordinary. In short, it's great entertainment.|Fresh
The draw, however, remains Cruise, figuratively walking out on a wing; whether multiplexers rejoin him there will be seen, but after endless formula runouts, it's encouraging to see him being properly exercised again.|Fresh
Kudos are due to Liman and Spinelli... for honing the script into a reasonably manageable two-hour romp around the Byzantine conspiracy-caper seen through the eyes of Seal.|Fresh
"A sweat-slicked, exhausting but glibly entertaining escapade on its own terms, ""American Made"" is more interesting as a showcase for the dateless elasticity of Cruise's star power."|Fresh
The problem is that Cruise, even when trying to cut loose, is always so tightly controlled that we never truly feel the reptilian survivalism of Barry Seal.|Fresh
The film's loose period vibe proves diverting and mostly engaging, as well as driving its sunny-hued visual style.|Fresh
...a propulsively entertaining ride through the underbelly of America...|Fresh
