"BlacKkKlansman wades into the same comic-horror-suspense territory that ""Get Out"" so brilliantly explores."|Fresh
Is historical Spike Lee the best Spike Lee? BlacKkKlansman is a showcase for Lee's passion rather than his technique, and it's his best movie in years.|Fresh
[Lee] is not only still on fire but has found a story that allows him to be as excited and involved as he was when it all began.|Fresh
BlacKkKlansman is as imperfect and wandering as almost all of Lee's great movies but made with their same intense passion; this is a filmmaker who always matches the emotion of the occasion.|Fresh
Lee plays Stallworth's story largely for laughs. How could he not? It's a true but utterly ridiculous tale. Still, make no mistake: BlacKkKlansman matters.|Fresh
Violence is as American as apple pie as Spike Lee is not shy of dramatizing in this entertaining, persuasive and exciting film.|Fresh
"""BlacKkKlansman"" is Spike Lee's best movie in years, bringing together everything that makes him such a dynamic, exciting, urgent filmmaker - as well as some of what can drive you crazy about him, too."|Fresh
Spike Lee's new joint embraces the ongoing conversation between art and culture, race and propaganda, to speak of the malignancy in American life that has manifested from the fringes of David Duke to the mainstream of Donald Trump.|Fresh
The film's masterful storytelling did its job. The message was clear. No need to overdo.|Fresh
Spike Lee and a solid cast spin a bizarre true story into searing racial satire.|Fresh
Through its biting satire, Spike Lee's BlacKkKlansman dares to remind us that we are no stranger to the hatred in the present day.|Fresh
A sobering Spike Lee Joint suggesting that the Klan might very well rise again, especially given equivocating President Trump's frustrating refusal to take sides. Easily, Spike's best offering in ages!|Fresh
"Lee's most important film since ""Malcolm X,"" and his funniest in decades."|Fresh
BlacKkKlansman is audacious; a distinct cinema experience, meant to be provocative and thoughtful. Spike Lee paints a raw and visceral picture of humanity's worst instincts.|Fresh
BlacKkKlansman is a well-crafted dramatization of real events and one of Spike Lee's more effective cinematic sermons on racism in recent memory.|Fresh
There's a uniquely satisfying sense of revenge that comes from watching Lee turn the vile words and hateful actions of racists against themselves. It's amazing that we've made it so easy for him.|Fresh
Features director Spike Lee at his most potent and controversial, while introducing John David Washington as a star on the rise.|Fresh
Before taking a dark swerve into chilling verité at the close, BlacKkKlansman ... kicks up suggestions of the pilot for a great 1970s mismatched cop show. It's that funky.|Fresh
The resounding indictment -- of both the left and right alike -- is unmistakable.|Fresh
I haven't read Stallworth's book, so I don't know precisely how much of Lee's movie is fact versus dramatization, but I do know that the movie is absolutely terrific.|Fresh
"Lee says that his hope is to ""shake people from their slumber"" and he achieves this with his entertaining, ultimately shocking film."|Fresh
A remarkable blend of rage and humor makes BlacKkKlansman at once both a necessary and timeless experience. It will shock most, offend some, but most importantly will spark conversation among all.|Fresh
Alongside this jarring tonal mishmash, Lee seems to have forgotten to throw any filmmaking smarts at the movie, which results in scenes that peter out, poorly edited musical choices, ugly split-screen, and a truly bizarre shot selection...|Rotten
Intellectually, the parallels with the current situation are very clear. And yet, it is again an emotional blow... when Lee presents the film's final sequence. [Full review in Spanish]|Fresh
Don't be fooled by the 70s setting - Spike Lee is taking a squarely aimed swipe at the racial tensions of contemporary America.|Fresh
BlacKkKlansman is a fairy tale in which plucky underdogs run rings around violent idiots. Yet this victory is hollow, and Lee knows it.|Fresh
This could well be a commercial success. It's a blockbuster of an American film and it was much needed...|Fresh
Spike Lee styles the film as a popular entertainment, forgoing the theatrical satire typical of his late-period state-of-the-nation joints, like Bamboozled and Chi-Raq, and settling into the accessible rhythms of the contemporary sitcom.|Fresh
Lee acknowledges the power of cinema as a political tool - the KKK have Birth of a Nation to thank, while Ron and his activist girlfriend list off blaxploitation icons - and here he's engineered a rallying cry to an inert American populus.|Fresh
BlacKkKlansman seldom ever channels that rage. Instead we are presented with a perfectly decent comedy that will be accessible enough for a wide mainstream audience. Fair enough.|Fresh
You are never in any doubt that you are watching a 2018 movie that is less interested in the past for its own sake than for what it can tell us about our current American moment.|Fresh
Spike Lee draws all his political weapons to carry out a forceful and devastating criticism about depravity, the cult of the white race and the Protestant religion. [Full review in Spanish]|Fresh
In these tumultuous days if you don't laugh you'll cry and, by referencing phrases like 'Make America Great Again', Lee shows he knows that only too well.|Fresh
Black KkKlansman tells a story well worth knowing.|Fresh
The film works acceptably as a genre thriller... [Full review in Spanish]|Fresh
Lee has made a movie that feels relevant in the way that Do the Right Thing... felt relevant in its day.|Fresh
If the movie aims to make complacent white people feel uncomfortable about their role in the current American turmoil, it fails spectacularly.|Rotten
A heady hybrid of comedy, polemic and period crime drama.|Fresh
BlacKkKlansman... [has] a blunt power that's terribly, painfully persuasive.|Fresh
BlacKkKlansman, is quintessential Spike Lee, impassioned and messy and vital as anything he's done in decades.|Fresh
This is a film whose broad comedy smuggles dead-serious contraband, a Trojan horse with a 1970s afro. It's not a comfortable combination but it's not meant to be.|Fresh
It was history written with lightning. BlaKkKlansman is a deafening roll of the thunder we've been waiting for ever since.|Fresh
BlacKkKlansman combines absurdist satirical humor and earnest agitprop with mixed results. Despite its tonal shifts, however, it's a supremely personal project that assembles a virtual anthology of Spike Lee preoccupations.|Fresh
I don't know that I've ever seen a movie exploit its tonal mismatches so voraciously and purposefully.|Fresh
Rat-a-tat zeitgeist entertainment that feels as timely as breaking news.|Fresh
Stallworth's mission did not save the country from its original sin, and Spike Lee's film refuses to absolve us.|Fresh
With this fiery work of righteous agitprop, Lee's chosen task is to connect the rose-colored racism of the remote past to the shameless bigotry playing out on the streets of our immediate present.|Fresh
The film could easily have been a fun escapade but the director throughout makes comments on the present day American political divide with ironic jokes.|Fresh
"If ""BlacKkKlansman"" is not above turning its characters into mouthpieces for its ideas, it wards off excessive didacticism by giving those ideas a heady flow and a sustained pulse. There's real, expressive joy in its anger."|Fresh
This is an angry film as well as a hugely entertaining one, and Lee has complete control over its shifting tone, minute by minute.|Fresh
The Klan and the idiocy of their ideology are repeatedly and effectively skewered.|Fresh
A crusading Spike Lee is often the best Spike Lee. He's a powerful artist and when he has a lot to say, as in the case with BlacKkKlansman, he simply won't let you forget it.|Fresh
"Despite its imperfections, Spike Lee's ""BlackKklansman"" is rousing political entertainment"|Fresh
Spike Lee's best film for years.|Fresh
Following 2015's terrifically lively Chi-Raq and Lee's TV spin-off of She's Gotta Have It, this is yet more comeback fuel, attacking the spectre of white supremacism in America with mic-dropping aplenty...|Fresh
Lee's most flat-out entertaining film in quite a long time, as well as his most commercial.|Fresh
Spike Lee hits his targets effectively enough - again and again. They keep popping back up like the targets in a fairground shooting gallery, and get shot back down again with a clang.|Fresh
Lee never takes his eye off the connecting thread between the events of 1978 and the present. The result is one of his most flat-out entertaining films in years, and also one of his most uncompromising.|Fresh
As much a compelling black empowerment story as it is an electrifying commentary on the problems of African-American representation across more than a century of cinema.|Fresh
BlacKkKlansman's joke is an indictment of complacency, particularly that of white liberals who'd rather not confront the distressing fact that not much has changed in 40 years, beyond a re-styling of old, old ideology.|Fresh
Blackkklansman is an excoriating, unapologetic s--- on the chest of Trumpians and their nativist agenda, and may well serve as one of the defining films of this era just as Birth of a Nation and Gone With The Wind did in theirs.|Fresh
