Even the spelling of the film's title highlights the taboo subject and drags its ugliness into the light, calling attention to past and current racism while marginalizing the racists... and nothing scares them more than that.|Fresh
Spike Lee isn't subtle, his is a sledgehammer approach. But being delicate wasn't the point. This is a film that needs to be seen.|Fresh
While it is a pity that the story wasn't told with more visual finesse, this is trivial compared to our real-world problems. It takes a good movie to put that into perspective.|Fresh
Here, as in 25th Hour, Lee often deviates from the plot. However, the difference is that here the appendices underline what the movie transmits... to remind us that behind the film there is a Message, with a capital letter. [Full review in Spanish]|Rotten
One of the best movies I've seen all year.|Fresh
It really made me laugh, but for some moments I was tearing up because I could relate so much.|Fresh
I felt that despite the patches of wobbliness and pomposity in BlacKkKlansman, the film was well worth my time for the sake of that shocking leap into a reality so rotten that spoiler alerts are neither necessary nor possible.|Fresh
BlacKkKlansman benefits from a solid cast and a script... that has a good mixture of comedic and dramatic moments that keep the movie from dragging despite its 2-hour-plus run time.|Fresh
Lee's motivating anger produces a unique, electrifying charge.|Fresh
Cluttered and awkward.|Rotten
D.W. Griffith's The Birth of a Nation is a great film. BlacKkKlansman is a good film.|Fresh
The vibe is authentic, the period detail tasty, yet BlacKkKlansman burns with contemporary anger and concludes on an impossibly affecting, painfully relevant note.|Fresh
Spike Lee's best in years. Sharp, funny, timely and powerful with superb performances .|Fresh
Lee keeps the film, and the audience, on its toes. A laugh is followed by a fright or the chill of recognition.|Fresh
Ultimately, BlacKkKlansman is a carefully thought out provocation, a film that knows it will both make you laugh but also leave you reeling.|Fresh
It's entertaining and angrily thought-provoking, with Lee at the top of his game - even if he can't stay off the soapbox and piles on too many endings.|Fresh
BlackKklansman is a slapstick comedy, a blaxsploitation throwback and an incendiary Molotov cocktail thrown into the foray of the modern multiplex. The most urgent, clear-voiced and, arguably, best of the outspoken filmmaker's recent output|Fresh
Not the tightest endeavor from Lee, but it does showcase rare directorial discipline from the helmer, who's making sure his message is present in the midst of all the undercover cop maneuvering.|Fresh
Some viewers may feel that Lee is being didactic, or literal, but I think that BlacKkKlansman is a vital film arriving at a critical moment.|Fresh
BlacKkKlansman entertains, all right, but it holds the audience accountable, too.|Fresh
The Lee touches are there, yes, but missing from BlackKklansman is the temerity to touch the live wire, the feeling of dangerous imperative. He has found a remarkable subject, but only skimmed its surface.|Rotten
A film of deceptively outspoken contemporary relevance, this is cinema at its most alert, alarming and alive.|Fresh
The tone of this movie is interesting -- the stakes are both dramatic and high, but it's balanced with a lot of fun, tongue and cheek dialogue.|Fresh
Lee refuses to let us close our eyes or fake blindness. Even more so, he's using the period setting as an obvious reflection on the current state of race relations, which is not all that different today than it was in the 1970s.|Fresh
Spike Lee is both a biographer and interrogator, infiltrating confederate belief systems that perpetuate American myths and how they endure in our culture.|Fresh
[BlacKkKlansman] contains both comic aspects and references to buddy movies, but its power derives from the way they are interwoven with a broad sweep of thematic and emotional elements Lee introduces, for the most part successfully.|Fresh
"Go see ""BlacKkKlansman"" because you'll get a smartly entertaining mainstream film that also packs a provocative commentary on America past and present."|Fresh
Lee's latest is a rollercoaster that is laugh-out-loud when it isn't shocking you into stunned silence.|Fresh
Even as he is careening from one extreme to the next, Lee is able to ratchet up the tension and release it in hilariously satisfying ways, never quite letting anyone off the hook. Nobody in the film achieves anything that looks like a real victory.|Fresh
The film may be flawed, but its message is not.|Fresh
Lee has the nerve and the knowledge to bring laughter to this thorny and often revolting true story. And he proves from the opening moments that he still knows how to make our laughter curl up and die in our throats.|Fresh
One of Lee's most thoroughly entertaining works. The cast and the crisp dialogue fire with purpose.|Fresh
There are moments that feel comical, some horrific, and some downright inspiring but the tonal shifts hardly matter as the end results come to a film that's perfect for this time.|Fresh
BlacKkKlansman is pretty enjoyable as a low-key police procedural, but its primary function is to put a comic bull's-eye on the backside of white supremacy.|Fresh
... a fascinating and intense depiction of a too-fantastic-for-fiction story of a black police detective infiltrating the Ku Klux Klan.|Fresh
"""BlacKkKlansman"" is sloppy and a bit all-over-the-place, but it is also a film that needs to be seen, made by an auteur who deserves- no, demands - that his voice is heard."|Fresh
An entertaining jaunt through the '70s, with some dutiful grappling over the enduring question of race in America thrown in...|Fresh
...a straight up, fierce, political polemical from an acknowledged master of the form, who has not and will not run out of reasons to be justifiably angry.|Fresh
"Powerful and pertinent, ""Blackkklansman"" is a film that deals with both the past and the present."|Fresh
BlacKkKlansman is both bitingly funny and stunningly effective as a call to arms.|Fresh
It feels heavy-handed at times, but there's no denying its power. Spike Lee is telling us something we need to hear.|Fresh
BlacKKlansman dances smoothly between being funny, poignant, heartbreaking, scary, and beautiful. BlacKkKlansman is the movie America needs, all people need - for it is a movie for all people.|Fresh
The savagery that Lee is capable of shaved down for a demographic that aren't accustomed to the evolving, bold electricity of Do the Right Thing or Bamboozled and instead in many ways resembles something closer to a Saturday Night Live sketch.|Rotten
Tense and timely, it's cleverly constructed and visually cathartic.|Fresh
BLACKkKLANSMAN lulls you with its satire of American race relations, only to slap you awake at the end of the third act with a montage of grotesqueries from the past couple of years-lest we forget Ferguson and Charlottesville.|Fresh
Lee isn't overbearing about portraying the KKK cell as fools, though not subtle either.The movie veers between the entertainingly campy and preachy.|Fresh
Topher Grace plays David Duke as an upwardly mobile nincompoop in a cheap three-piece suit, pathetic in his lunatic convictions but -- as we saw in Charlottesville last year -- still a force for social chaos.|Fresh
Spike Lee's film is one of the years best; Ron Stallworth's memoir is told with passion & admiration-aptly Lee's finale reminds us of our current gut-wrenching racial tensions.|Fresh
What should be a devastating strike becomes more of a glancing blow.|Fresh
A real life Mod Squad with a grindhouse soundtrack and the most relevant film of the year.|Fresh
Disappointingly erratic and rarely engrossing...|Rotten
Lee has delivered his best commercial film since Inside Man. Not only is it powerful, character-driven with social commentary and politics, but it also has romance and comedy that makes it a pleasurable experience to watch.|Fresh
BlacKkKlansman is urgent and vital. It stands next to Do the Right Thing as one of the best movies ever made about racial intolerance in the United States.|Fresh
"""BlacKkKlansman"" is a hopeful tome that, if we could defeat racist hatred back then, we can do it again. Now, though, it is a bigger job and involves us all."|Fresh
This is one of his best films because he marries the anger and intensity with the restraint and poetry that he's so good at visually.|Fresh
Spike Lee's BlacKkKlansman veers wildly between hilarious and harrowing, thrilling and appalling, smart and stylish.|Fresh
Lee's genius, though, is that it's as entertaining a film as it is worthy.|Fresh
Spike is contained by a true story, and being contained allows him to focus.|Fresh
"A masterful tension of ""I'm going to make you laugh, and I'm also going to make you feel really weird and uneasy""."|Fresh
The movie is smart, funny, and insightful.|Fresh
It's a movie as timely as it is provocative and amazingly, for much of its running time, it is weirdly funny.|Fresh
Not since Bamboozled has a Spike Lee joint been this blunt and tightly rolled.|Fresh
Piercing and poetic, BlacKkKlansman is perhaps best understood as an evolution of Baldwin's work, with Lee wearing the crown as one of the writer's most worthy successors.|Fresh
Lee's wild tonal shifts made his work seem scattershot and unfocused, and it's not that he tamps that down here. But now, the itchiness, gallows humor, and howls of rage just feel like everyday life. Reality has finally become a Spike Lee joint.|Fresh
Lee shapes his adaptation with a certain frenetic energy, eschewing traditional historical tics and instead leapfrogging across genres... The effect of his genre-swapping is as dizzying as it is immensely satisfying.|Fresh
Spike's back, so back. BlacKkKlansman​ is a brilliant satire, a trenchant political statement and a love/hate letter to America, warts and all. It's a comedy and tragedy balled together, the bitterness as pungent as the sweetness.|Fresh
Just as Lee reminds us of his talent and the way it's been overlooked, he also reminds us of what he's been trying to tell us about American racism. Malcolm X was Lee's rainbow sign. BlacKkKlansman is the fire this time.|Fresh
BlacKkKlansman has everything anyone would want from a cop movie, but its candid treatment of its subject matter and the conversation it might inspire are the telegram that audiences deserve.|Fresh
... Lee goes the extra mile to provide us a funny and complex portrait of the 1970s, which is very reflective of today's society. It will entertain, educate, inspire and remind you to stay awake.|Fresh
Not least of Klansman's virtues is its resurrection of Mr. Lee's terrific gift for storytelling.|Fresh
Veering from a blaxploitation spoof to an undercover thriller and ending with a no-punches-pulled real-life coda, BlacKkKlansman is riotously fun one minute, savagely biting the next.|Fresh
Lee heightens the nervy tone with strong visuals, juxtaposing a '70s blaxploitation aesthetic with the Klan's suffocating suburban décor. The jumps keeps you off balance, and engaged.|Fresh
This is intended as a comedy, albeit one of an extremely uncomfortable kind where the depiction of the past is a direct and shocking reflection upon the right here and damn now.|Fresh
The movie's not perfect, but it sticks the landing of its message. It was engaging - thrilling at times - and I personally thought it was a great time.|Fresh
Lee's film about Stallworth & Flip taking on Duke and the KKK is akin to the Keystone Kops taking on the Three Stooges...unfortunately, Lee's polemic-ism eschews comedy and portrays their bungling efforts as heroic, which is hard to buy.|Rotten
A hugely entertaining film that contains a number of huge laughs, a surprisingly effective amount of suspense and thrills, a number of strong performances and enough points of provocation to inspire plenty of post-film discussions.|Fresh
Lee's overarching point... is that we have not come very far at all from the early 1970s. His aesthetic in BlacKkKlansman is that, in making of movies that matter, we have moved beyond the niceties of normal dramatic strategies.|Fresh
Lots of language in Lee's fact-based dark comedy.|Fresh
This freewheeling account of an African-American cop who infiltrated the Ku Klux Klan in the early 1970s is problematic as narrative drama, but stunning as provocation.|Fresh
"Even though it sings with the funky energy of the 1970s, ""BlacKkKlansman"" is absolutely current. Among all the movies that have become supercharged by the terror of our modern times, it's arguably the most essential yet."|Fresh
The cumulative effect is like a bracing cold shower, a reminder that the fight is far from over.|Fresh
"While ""BlacKkKlansman"" has all the pleasures of a '70s genre film, recalling ""Serpico"" or ""The French Connection,"" Lee wants to rattle us as well as entertain us, sounding the alarm about the present-day parallels to today's worrisome world."|Fresh
BlacKkKlansman is an incendiary return to form for Lee, who not only pulls no punches, he adds plenty of haymakers into the mix.|Fresh
Through humor, violence, and drama,'BlacKkKlansman'paints a line of white supremacy from the Civil War to Charlottesville rallies last year.|Fresh
This summer's most brashly entertaining movie is also the most terrifying film of the year. It leaves your sides aching from laughter and your stomach twisted in knots.|Fresh
Spike Lee is back! And so is his inability to see racial progress in the 21st century.|Fresh
Lee shifts from silly spoof to dramatic chill in a heartbeat. As an entertainment that milks its audience's outrage against racism, BlacKkKlansman works exceedingly well.|Fresh
Lee is a true auteur, and at 61, he remains a defiant, daring, gutsy, visionary filmmaker.|Fresh
An interesting and entertaining, satirical black comedy. (Full Content Review for Parents - Violence, Profanity, etc. - also Available)|Fresh
With Stallworth's remarkable true and timely story and Washington's star-making performance, one of Lee's all-time best, most purely entertaining, and most important films.|Fresh
It's rare that a movie is both this fun yet simultaneously elicits flat-out rage. If at times some of the KKK's actions feel overblown and exaggerated, the present day footage at the back end of the film will shut you right up.|Fresh
Lee has always chosen topics rooted in truth and steadfastly spoken out via his films about social justice and the need for change. And BLACKkKLANSMAN is as good as he gets.|Fresh
This stunningly powerful indictment of racism in America should be remembered as one of the best films of this --- or any other year.|Fresh
Snuggly wrapped in a ball of political half-humor and cautionary relevance, BlacKkKlansman packs a blunt wallop alongside its C-4 explosives and cross burnings, which Spike Lee reminds us are a bit more dimensional than a page in a history book.|Fresh
BlacKkKlansman captures the absurd aspects of this story, while still drawing parallels that make the movie feel urgent and dishearteningly relevant. For that reason, it's among Lee's best films in some time.|Fresh
Even the comedic bits absolutely pop and sing, as you can tell Lee's invigorated by the material, and totally invested in letting the audience explore just how audacious the tale he's telling truly is.|Fresh
Lee again puts the pedal to the metal in trying to acknowledge an ugly part of American life that shouldn't be swept under any red, white and blue rug -- then or now.|Fresh
You'll laugh at the antics of BlacKkKlansman, but you may find yourself in tears, or shaking in anger, on the way out.|Fresh
Invites the audience into a complex and impassioned conversation about the power of racism - and the moving image - to influence our lives.|Fresh
Spike Lee is an audacious filmmaker who crosses boundaries and deliberately blurs drama and reality. Never has this been more effective than in BlacKkKlansman, which defies a number of rules and offers a punch in the gut instead.|Fresh
For those who are interested in the history of police procedure, politics and social injustice, BlacKkKlansman is a must-see.|Fresh
There's serious tension in BlackkKlansman's situation, and the film embraces the shifts in mood with shifts in filmmaking style that allow Lee to couch his arguments in a kind of shorthand history of Hollywood's treatment of race.|Fresh
Spike Lee effortlessly blends narrative and analysis with BlacKkKlansman.|Fresh
Lee has once again cleverly flexed his genre-bending muscles. Much as he did with 2015's underrated farcical/musical whatzit Chi-Raq, the director melds comedy and tragedy to come up with entertaining and thought-provoking cinema.|Fresh
Finds Lee in that vintage mode; it's a period piece, infused with anger and sarcasm, that tells a stranger-than-fiction true story, but one that is animated by the tumultuous American present.|Fresh
Lee bludgeons us quite effectively.|Fresh
It's a solid work, albeit one that's flawed in the same ways that nearly all of Spike's best films are flawed.|Fresh
Up and down Spike Lee is mad as hell, and he's not gonna take it anymore. The big surprise here is the humor. The rough-around-the-edges political manipulation? As expected.|Fresh
It's not pretty, which is one reason for the touches of comedy: Sometimes you need to laugh to keep from screaming.|Fresh
BlacKkKlansman uses history to illustrate how we're repeating it.|Fresh
Set in the late 1970s but informed by the here and now, it's fuelled by righteous anger against racial hatred and anti-Semitism, leavened by scathing wit.|Fresh
This is pure Lee, at times both scathingly satirical and trenchantly earnest...[but] Lee has become a master director who has forgotten how to tell a story.|Fresh
BlacKkKlansman is one of Spike Lee's most accomplished films in recent memory, and one of the best films of 2018.|Fresh
There's a lot going on here, and Lee massages it all into a powerful film that can be appreciated by blacks and whites, men and women, young and old alike.|Fresh
BlackKklansmen is messy and conflicted in that way, working through its own identity crisis, not necessarily on purpose, but the result is fitting. The film wavers in its attempts to entertain and provoke; to make light or go hard.|Fresh
[It's] a film that deftly melds wit and social commentary, compounded by a horrifying end crescendo that's impossible to look away from, and stays with you long after you've left the theater.|Fresh
Spike Lee's best movie since 'Inside Man'.|Fresh
Spike Lee using his white voice - for subversive purposes.|Fresh
"A film that engages the mind and enrages the spirit while often provoking gales of laughter, ""BlacKkKlansman"" is can't-miss viewing for adults looking for both fun and substance in the dog days of summer."|Fresh
Don't sleep on this movie.|Fresh
The most compelling-and funniest-movie Lee's made in years, as well as one of his most effective in terms of messaging.|Fresh
Spike Lee's best film in a very long time ... should continue the narrative that began with producer Jordan Peele's film Get Out even if it does so in not nearly as clever a way.|Fresh
Rather than letting the audience reassure themselves that the story is rooted in the past, Lee firmly points the film's conclusion to the present, and to the future.|Fresh
There are few filmmakers as consistently, burningly passionate as Spike Lee. This is vital and timely work that's up there with his best, with a gut-wrenching sting in the tail.|Fresh
One of the director's strongest yet most entertaining works in years.|Fresh
The story's inherent outrageousness is more than enough to grab audiences' attention without Lee adding an extra layer of shock value.|Fresh
Spike Lee returns to form with a true-life story that works as comedy, crime drama and political alarm-bell all at once.|Fresh
So, it has come to this. Spike Lee is relevant again. He's necessary again.|Fresh
For all the ugly truth of BlacKkKlansman, the picture is somehow light, somehow fun. Lee is at his angriest here--and his most playful.|Fresh
This is a big movie from Lee, warm and smart. It's not essentially radical, unless the subject of self-defense is radical.|Fresh
Rhetorical excess is another feature of Lee's filmmaking, and this movie is no exception... These are negligible flaws, though, compared with the superb ensemble acting, another hallmark of Lee's filmmaking.|Fresh
BlacKkKlansman goes all in and quickly pulls you onto its side. Call it propaganda, but it's absolutely on the right side of history.|Fresh
BlacKKKlansman, after 21 feature films and 11 documentaries, is the film that shows what he's learned after thirty plus years behind the camera. BlacKKKlansman is the film Spike Lee was destined to make.|Fresh
Lee uses this bizarre, racially-charged story from yesterday to paint a picture of the common presence of racism today.|Fresh
If you don't like Lee's oeuvre or are offended by openly political movies, this isn't the film for you. Others will find in BlacKkKlansman an opportunity to consider and reflect on the questions that Lee isn't afraid to pose.|Fresh
It's powerful, urgent, unquenchable.|Fresh
BlacKkKlansman is a true-crime story with a happy ending, plus a warning that happiness is not guaranteed. It's one of Lee's finest, and decisively one of the year's best.|Fresh
BlacKkKlansman is an important commentary on America's painfully slow progress of dealing with its deeply ingrained racism.|Fresh
BLACKkKLANSMAN is a compelling drama that is humorous, intense and fascinating.|Fresh
'Blackkklansman' allows Lee to unleash his anger about the situation in 2018 America by masking it in a story of an investigation to shed light on the dark and hateful deeds of a group that ... is trying to soften and politicize its image.|Fresh
The title promises something of a biography, but I left the movie wanting to know more about Stallworth. We know what he did, but getting a deeper read on the man proves elusive.|Fresh
BlacKkKlansman is largely comedy, but even in the movie's most dramatic stretches, Lee robs the Klan and its many costumed peers of their mystical designs. The horrors are real. The politics are farce.|Fresh
Its fiery message couldn't be more timely - and its rage more justified.|Fresh
Lee wants to explain how images in popular culture have social and political consequences-a vital message.|Fresh
Lee's intent doesn't take away from the craftsmanship of his direction and the convincing tonal shifts that make BlacKkKlansman pivot from intriguing crime caper to biting contemporary satire so fluidly.|Fresh
BlacKkKlansman is Spike Lee's best film since 2002's 25th Hour and his most vital and challenging since well before that.|Fresh
Excellent and certainly provocative... If nothing else, the film is a real conversation starter.|Fresh
It is an exhilarating, distressing, funny and profound film, with one of the more memorable film scores in years, from composer Terence Blanchard... It's a Spike Lee joint that is not to be missed.|Fresh
Can be overtly funny in its absurdity. For the most part, however, BlacKkKlansman isn't a comedy at all, but an earnest, vintage Spike Lee joint recounting history and projecting it onto our present.|Fresh
"You leave this film shaken, remembering what happened not so very long ago in the name of ""very fine people on both sides."""|Fresh
His latest movie is unapologetic and witty, but still accessible and relatable. 'BlacKkKlansman' is definitely a Spike Lee instant classic.|Fresh
...director Spike Lee has taken Stallworth's true 1970's tale and made it into a buddy cop comedy targeting Donald Trump.|Fresh
It emerges as one of the best films of the summer, and an essential look at race in America.|Fresh
"""BlacKkKlansman"" announces from the jump that viewers are in for a lush, sensory treat as Lee plays with the film vernacular he's manipulated so adroitly and expressively for three decades."|Fresh
Structurally flawed, conceptually challenged and tonally troubled.|Rotten
Spike Lee's hellraiser about a black cop who infiltrated the KKK in the 1970s is also an incendiary indictment of our current Trump moment and one of the best films of the year. A cinema giant has found his voice again and the power to make it heard.|Fresh
Spike Lee's seriously sensational film not only made me laugh but also left me with chills on the hottest day of the year.|Fresh
[Lee] is firing on all cylinders here. BlacKkKlansman is a true conversation starter, and probably a conversation ender as well.|Fresh
"Headlined by a rapturous performance by John David Washington, and a crackling script full of laughs and deeply moving moments, ""BlackKklansman"" sizzles every moment on the screen."|Fresh
This absurd story works well under the Spike Lee Joint umbrella. As a director, Lee is known to subvert reality in his films and provide fantastical elements to otherwise realistic moments.|Fresh
Lee doesn't do subtlety. But the movie is very entertaining and comes with a stupendous, lushly melodic score by Terence Blanchard.|Fresh
"""BlacKkKlansman"" is a sobering, affecting commentary on right now, yet it's also a thrilling celebration of real brotherhood - and not one of hate."|Fresh
A straight-up, fire-breathing story about the long, painful scar of racism in America.|Fresh
While much of the film is dark and triggering, moments of happiness and humor sprinkled throughout the narrative help keep the audience focused and entertained. Most importantly [it] puts a spotlight on Ron Stallworth's astounding story.|Fresh
Spike Lee's new film empowers audiences to stand up for change. Talking isn't enough; you must do the right thing.|Fresh
