BlacKkKlansman is funny in a way that proves to be absolutely terrifying as the reality of the situation, past and present, comes to light.|Fresh
Spike Lee infuses BlacKkKlansman with modernism and a pointed contemporary commentary that holds you long after its final documentary moments, and that epic panning shot.|Fresh
You may not enjoy what you see but I'll be damned if it doesn't stay with you regardless.|Fresh
An engaging racial drama from the master of the craft Spike Lee.|Fresh
Cultural awareness doesn't qualify as empathy. Director Spike Lee crafts a testament to that without overt finger-pointing.|Fresh
The contemporary elements don't necessarily trip you up too much, because you're in the middle of a period piece, and its a great balance that he strikes because we have been waiting for a return of Spike.|Fresh
Spike Lee returns to form with an electrifying commentary on contemporary American racism...|Fresh
Spike Lee always manages to inject political commentary into very clever moments.|Fresh
Blackkklansman manages to balance entertainment and denouncement perfectly. [Full Review in Spanish]|Fresh
Some of the choices feel self-indulgent and are a bit distracting but overall a really interesting/thought provoking (and even funny) movie.|Fresh
BlacKkKlansman is funny in a way that proves to be absolutely terrifying as the reality of the situation, past and present, comes to light.|Fresh
Spike Lee infuses BlacKkKlansman with modernism and a pointed contemporary commentary that holds you long after its final documentary moments, and that epic panning shot.|Fresh
You may not enjoy what you see but I'll be damned if it doesn't stay with you regardless.|Fresh
An engaging racial drama from the master of the craft Spike Lee.|Fresh
Cultural awareness doesn't qualify as empathy. Director Spike Lee crafts a testament to that without overt finger-pointing.|Fresh
The contemporary elements don't necessarily trip you up too much, because you're in the middle of a period piece, and its a great balance that he strikes because we have been waiting for a return of Spike.|Fresh
Spike Lee returns to form with an electrifying commentary on contemporary American racism...|Fresh
Spike Lee always manages to inject political commentary into very clever moments.|Fresh
Blackkklansman manages to balance entertainment and denouncement perfectly. [Full Review in Spanish]|Fresh
Some of the choices feel self-indulgent and are a bit distracting but overall a really interesting/thought provoking (and even funny) movie.|Fresh
Lee brings his stylized esthetic and flair for genre-flipping to this kooky fact-based story.|Fresh
Another of the great militant films of Spike Lee.|Fresh
Spike somehow juggles a sharp sense of humor with a sharp critique of racial politics, not only keeping every ball afloat, but mesmerizing us with both entertainment and impact.|Fresh
BlacKkKlansman is exactly the kind of movie we need in our racially-fraught climate.|Fresh
The cross-racial team-up of Zimmerman and Stallworth allows BlacKkKlansman to become much more instructional for white viewers than it is for black ones, since we black Americans have lived with the realities of the race-based violence all our lives.|Fresh
BlacKkKlansman makes a bold political statement about racism in an effective way.|Fresh
He's (Lee) attempted to make a blockbuster, laugh out loud comedy about the Ku Klux Klan whilst also sincerely critiquing contemporary race relations. For the most part, he succeeds.|Fresh
This story and the way it is presented to us feels like something very fresh in showing the anger and hatred that can exist in the human being only for having a different skin tone. [Full Review in Spanish]|Fresh
BlacKkKlansman is a film that plays fast and loose with the true story on which it's based, but it's all done in service to the narrative and to the message, both of which are worth conveying.|Fresh
BlacKkKlansman is the perfect movie for the perfect time and just goes to prove you never know who might be on the other end of that phone who will change your life for the better or the worse.|Fresh
Given the current political climate, and the high racial tensions in society, you have to laugh at the outrageous humor to keep yourself from crying at the extreme racism in this film. BlacKKKlansman was entertaining, insightful and ever so timely.|Fresh
Lee's film is well done, although it does get a little heavy-handed at times.|Fresh
"""The militancy of Lee is more than obvious, but BlackKklansman is not a political-racial pamphlet""."|Fresh
Spike Lee returns to the big leagues with a comedy that in between the laughs, hides a profoundly dark reality. [Full Review in Spanish]|Fresh
There are very few films that have enough guts to break the barrier of the politically correct and show the truth as it is. [Full Review in Spanish]|Fresh
In any other hands, this film could have been relegated to a mediocre biopic toeing the line between political validity and a safe marketability. What we get instead is a film that will stay in your mind for a while after leaving the cinema.|Fresh
Lee lets us see that there is a lot of hatred, but also a lot of ignorance, a lot of ridiculousness and a lot of stupidity, which brings humor in the film. [Full Review in Spanish]|Fresh
Aside from its obviously surprising label of 'based on a true story', BlacKkKlansman complies with the tone of Spike Lee and manages to stay real. [Full review in Spanish]|Fresh
Plus ça change, plus c'est la même chose|Fresh
The film's most powerful passages are lengthy digressions that abandon the plot to mourn the role of Lee's beloved chosen art form, cinema, in the stoking of racism; and to condemn the public political encouragement of racial violence.|Fresh
Finds Lee fully honed in on message with one of the most timely, engaging and thought-provoking films of his career.|Fresh
Lee is after the big stuff - namely, the endless civil war roiling at the core of our society, more than ever ready to boil over - and to that end he pulls out all the stops|Fresh
...what makes BlacKkKlansman such a good film is just how challenging it is.|Fresh
Hopefully this film will inspire others to either start or continue speaking out about injustices, wherever they may arise. All power to all the people.|Fresh
The humor in BlacKkKlansman is occasionally overdone, and yet it never dilutes the suspense.|Fresh
Set over 30 years ago, the potent relevancy of this film is in how the language it mocks is now part of the national discourse, emanating out of the White House itself.|Fresh
The film works well when Washington puts on his white voice to prank call Klansmen. He aspirates the word white with the precision Diane Keaton brought to the word wheat in Love and Death...|Fresh
With a great narrative, stunning visuals, compelling leads and sobering themes, BlacKkKlansman is a uniquely powerful experience, perfect for today's socio-political climate.|Fresh
BlacKkKlansman raises some interesting questions about the cost of denying one's heritage and whether it is possible to change a flawed system from the inside out.|Fresh
"I can just imagine a white couple--in their tiny bubble of perfect living--deciding to see that ""comedy about a black guy joining the KKK"". Little did they know their bubble would soon be popped by Lee, whose finger is pointed directly at them."|Fresh
As polemical as you would expect from the black political activist director.|Fresh
At the heart of the film is the struggle of a man attempting to assimilate vastly different groups while keeping true to his own identity.|Fresh
Lee knows that there is a need to place history on the table again and starts the conversation and then leaves us the transformed heritage, the war cry turned into an invitation to change: all power to all people. [Full Review in Spanish]|Fresh
A word of praise for the energetic performances by Washington and Driver and an awesome score by jazz trumpeter Terence Blanchard.|Fresh
A necessity to see in theatres. Utterly entertaining and heartfelt with a wallop of truth waiting for you at the end.|Fresh
BlacKkKlansman is so fresh and rich with ideas that you can forgive its shortcomings.|Fresh
Sharp and perceptive, unfiltered, confrontational, and driven by a deep dramatic current that sees reality without varnish or sanitation.|Fresh
Blackkklansma is one of those films that effectively channel energy, exhibit conviction and even excess in some passages and Lee presents this story in an intensely seductive manner. [Full Review in Spanish]|Fresh
BlacKkKlansman would not be what it is without the two protagonists.[Full review in Spanish]|Fresh
An authentic masterpiece where genre film and political filmmaking combine to perfection. [Full Review in Spanish]|Fresh
Blackkklansman is the best Spike Lee film in years. [Full Review in Spanish]|Fresh
"With Blackkklansman, Lee demonstrates that post-racial America never existed, that hate triumphed and, consequently, launches from its trench an umpteenth call to ""wake up."" [Full Review in Spanish]"|Fresh
BlacKkKlansman, like a serious caricature, it is an oxymoron in itself, sadly funny, peacefully violent and absolutely necessary. [Full review in Spanish]|Fresh
It won't wind up as the best film of the year, but I'll be surprised if something tops it as the timeliest.|Fresh
One of the most compelling movies of the year because of its eyebrow-raising true-life story, one performed so well by the likes of Washington, Driver, and, in a masterpiece of tone control, Topher Grace.|Fresh
Lee has taken the opportunity to deliver an existentially crazy police procedural that ends up saying more about society's disease than many a sober-sided Oscar-chaser.|Fresh
BlacKkKlansman is in constant dialogue with itself, since, like its protagonist, its very method involves pooling available resources and utilizing an oppressive industry as a tool for liberation.|Fresh
This disc is barebones, so Spike Lee fans will have settle for a solid transfer of the film itself when relishing this fo' real, fo' real sh*t at home.|Fresh
"The name ""Spike Lee"" isn't always synonymous with subtlety (this is the guy that made ""Bamboozled"" after all) but in ""BlacKkKlansman"" he finds a balance that exceeds even his greatest work."|Fresh
BlacKkKlansman is a poor detective tale and simple-minded Millennial noir because Stallworth's exposé of a sect of American racists and terrorist (all unhealthy-looking white miscreants) never feels like discovery, just a continuation of his hip cynicism.|Rotten
"Crazy funny and at times and gripping. It's a kick in the pants of ol' boy politics as the civil rights movement began to look like something the ""majority"" feared."|Fresh
The film's tonal constant is the brilliant Washington, giving confident comic timing and no-bullshit charisma to match any recent star-making performance.|Fresh
The film, as uneven as it is interesting, rises at the end with some images that disrupt the feelings that the film sometimes failed to emote. [Full Review in Spanish]|Fresh
The stupendous chemistry between the leads and the precision of the entire ensemble fill this movie with credibility on an already incredible story. [Full Review in Spanish]|Fresh
Visually dynamic with vivid storytelling and award-worthy performances, this Spike Lee joint is an absolute must see film in theaters and one that will resonate long after the somber, powerful coda.|Fresh
Say what you want about the film, but the crux of it is this - Lee is furious, and you should be too.|Fresh
More than a film it resembles an audiovisual assertion and... does not bring anything new to the subject, beyond emphasizing the prejudices and narrow-mindedness of certain individuals, something that everyone already knows. [Full review in Spanish]|Fresh
"Ties the story to the present day and feels specifically calculated to send audiences home shaken, angry and charged-up to ""do something."""|Fresh
More relaxed, less serious, however, the message is the same. [Full review in Spanish]|Fresh
Spike Lee doesn't draw upon the past for parallels to today's horror show. Instead, Spike Lee draws a straight line between the hate of yesterday and the hate of today.|Fresh
It is hard to deny that it is one of Spike Lee's greatest films in recent years. Some may even rank it among his all-time best films.|Fresh
If racism was in retreat in 1980 Lee shows that it never went away, and has now returned in force.|Fresh
Perhaps BlacKkKlansman's greatest asset is Lee's ability to embrace the complications of race and identity along with the broad strokes.|Fresh
A seething account of a true story complete with fine performances, penetrating writing and (sadly) timely messages - it's unmissable.|Fresh
This a film that resonates in today's political climate - with Lee the perfect visionary to bring this story to life. It's easily his best work since Malcolm X.|Fresh
"What would it have taken for Spike Lee to go balls to the walls like he did on his best film ""Do The Right Thing""? We'll never know."|Rotten
Are the parallels of this story to current affairs sometimes presented too on the nose? Sure, but that also makes them more resonant. Sometimes things need to be clear and not clouded in half-telegraphed metaphors.|Fresh
Arriving at a time when racial tensions in America are teetering on a knife's edge, Spike Lee's BlacKkKlansman could be the year's most important and relevant piece of cinema.|Fresh
I'm pretty sure there's something awfully powerful here, though. It's great filmmaking, of course - and something more.|Fresh
BlacKkKlansman is Spike Lee's most ambitious film in years; throwing as many logs on the fire of racial stereotyping as he can, while milking solid performances from John David Washington, Adam Driver, and - of all people - Topher Grace.|Fresh
Fans of Lee's work will recognize so many of his trademarks, while also getting a chance to see him tackle something new.|Fresh
Like a lot of Spike Lee's better films, BlacKkKlansman mixes comedic satire with barely suppressed rage.|Fresh
While BlacKkKlansman may unfold as a triptych of rage, fun and pride, what it is is a call to fly at full-staff the willingness to preserve good.|Fresh
It takes a filmmaker like Spike Lee to continually remind us how little we've progressed in 242 years. BlacKkKlansman is the ultimate form of entertainment, funny, emotional, and timely.|Fresh
Lee employs all of his considerable skill and filmmaking prowess, developing a narrative that is at once blunt and nuanced, horrifying and funny in the most unexpected ways.|Fresh
It's wild and messy, thought-provoking and utterly damning, all while being supremely entertaining.|Fresh
With BlackkKlansman, it feels like his [Lee's] entire career has been leading to this moment. Lee was ready and delivers some of the best work of his career.|Fresh
The first thing you will notice as you watch this film, and be distracted by, is how much Washington sounds like his father, Denzel Washington. Once you get over this, the story draws you in.|Fresh
The film walks a line between comedy and drama to tell the story of Ron Stallworth. [Full review in Spanish]|Fresh
The parallels between the seemingly archaic political climate depicted here and what's subsequently re-emerged in Trump's America, is the polemical bent of Lee's film.|Fresh
A very funny movie about the very unfunny persistence of white supremacy in American culture.|Fresh
"""BlackKKlansman"" Lee gives a dissertation on the potency of satire before hitting the audience with a K.O. It's a movie ""rope a dope,"" from the canvas look up and Spike Lee is daring us to wake up."|Fresh
BlacKkKlansman is a radical movie for a radical time with a radical director at its helm.|Fresh
There's nobody left in Hollywood making broad, sweeping, lively political melodramas like Spike Lee.|Fresh
An ambitious comedy/drama/ thriller that reflects the history of American anti-black racism.|Fresh
Perhaps the film doesn't have any interest in subtlety. Its true purpose is to say what it has to say loudly, with striking visuals that hit you right in the pit of your stomach.|Fresh
Likely to spark debate about how much America has changed... and not changed over the past few decades, BlacKkKlansman is a winning black comedy.|Fresh
This is a film that is both enjoyable and intelligent with director Spike Lee making one of the most thought-provoking films of the year.|Fresh
Part of the blank quality of the film's hero might be due to the fact that the actor playing him, John David Washington, handsome son of Denzel Washington, is too poker-faced in his delivery.|Rotten
Lee is able to flip things on a dime, jerking the audience from laughter into a dead silence.|Fresh
Yet, despite conforming to formula at almost every turn, BlackKkKlansman is still an excellent film, in equal parts comic and thrilling.|Fresh
The film shines through its performances.|Fresh
Spike Lee is a political activist and 'jive artist' of note so you would not be surprised that Blackkklansman is not just strong cinema but strong on propaganda, too.|Fresh
This is Lee's best film for a long time and one that lassos the topic of white supremacy and racism in a highly entertaining way.|Fresh
Washington's portrayal of Ron Stallworth is humorous and understated, but powerful.|Fresh
An incisive critique that demonstrates Lee's ability to relate events from more than forty years ago, with America's current social state. [Full review in Spanish]|Fresh
Lee's extraordinary film doubles as a visceral entertainment and an urgent reminder of a past we haven't been able to shake.|Fresh
It's just about perfect in balance of tone, and it's easily Spike Lee's best film in years.|Fresh
It's funny, suspenseful and educational.|Fresh
It's been ages since any of Lee's fiction features have been so clear-headed and driven by a need to make bold, epochal declarations about The State Of American Culture.|Fresh
A return to form...the acting was really good, surprisingly from the Klansmen.|Fresh
Easily a top-five movie I've seen this year...I was floored by how much I really liked this movie, especially the last five minutes.|Fresh
Spike Lee has turned in a pro-cop film has to be counted one of the stranger cultural developments of 2018, but Lee seems to have accidentally aligned with cops in the course of issuing an anti-Trump broadside.|Rotten
Superb acting by Washington, Driver, Patrice Dumas and the rest of the cast. Inventive camera work and editing by Chayse Irvin and Barry Alexander Brown respectively, highlighting differences in racial perspectives.|Fresh
Most of all though, with its abrupt shifts of tone and mood, BlacKkKlansman is also very, very funny.|Fresh
BlacKkKlansman is an extremely well made movie and for one that talks about the power of cinema.|Fresh
John David Washington... look for this guy... he's able to capture a lot of humor... a lot of tragedy with his character.|Fresh
Ultimately that lack of subtlety and the awkwardness hurts this movie a lot.|Rotten
So whatever your religion, race or sexual orientation, make sure you see BlacKkKlansman. Take some time to digest it and really think about both what it's saying and what is happening in the world today. It's time to start paying attention|Fresh
It's a fascinating story, told by people with skill and passion, but it also keeps trying to teach us something by adding to it, as though the filmmakers don't trust the impact of the lessons inherent in the material.|Fresh
Lee balances unexpected shifts between humor and drama, camaraderie and horror, entertainment and history lesson, popcorn-muncher and experimental indie with a fluidity few other directors could muster.|Fresh
BlacKkKlansman may be the most accessible, and perhaps most entertaining, work of Lee's latter day career but it is also his most important.|Fresh
funny, but often mordantly so in a way that forces you to confront how racism itself is fundamentally absurd even as it stands at the core of centuries of social injustice.|Fresh
Stallworth's operation is just one small victory in an ongoing struggle, and Lee makes sure we leave the theater knowing that struggle is far from over.|Fresh
So no matter how effective the suspense of this dangerous mission, it all pales in comparison to [its] display of empathy.|Fresh
What I especially love is how the movie refuses to offer up any pat or easy answers.|Fresh
A vital piece of Americana, an incendiary work and [Lee's] best film in over a decade.|Fresh
The movie's sharp sense of humour is at its peak in our hero's phone calls to Klan head David Duke, who remains utterly oblivious to teases of Stallworth's true identity.|Fresh
The racism is astonishing, while the parallels with the Trump era are underlined with all the (lack of) subtlety we expect from Lee.|Fresh
The ironic, almost campy tone sugars the racist language to make you swallow more than you might otherwise stomach...|Fresh
Spike Lee brings humor and a hard-hitting message to bizarre true story about the KKK.|Fresh
Spike Lee is one of the best directors of his generation. BlacKKKlansman assures him of that title|Fresh
Until the closing shots of BlacKkKlansman, director and co-writer Spike Lee does more than control the rage. He refines it with riotous wit into a stiletto, and is all the more lethal for that.|Fresh
The film might have had a wider impact if Lee has resisted grandstanding and allowed Stallworth's tale to speak for itself.|Rotten
BlacKkKlansman slips seamlessly from borderline-absurdist humour to all-too-real horror, conjuring an urgent blend of sociopolitical period satire and contemporary wake-up call.|Fresh
Funny, intelligent and very poignant. One of Spike Lee's best films. [Full review in Spanish]|Fresh
An unsubtle film for unsubtle times, all the better for not backing down with what it's trying to say or how it says it.|Fresh
Audacious, even as it deliberates the obvious parallels between then and now, and how little progress has actually been made, BlackKklansman doubles down as meaningful entertainment.|Fresh
The final moments of the movie are very powerful...This movie is right on time.|Fresh
...a movie that has to be reckoned with, about a subject that we seem doomed -- hopelessly -- to reckon with.|Fresh
[Blackkklansman] feels both empowering and uncomfortably exposing that no-one is absolved from the discordant dissection of cultural identity at play.|Fresh
BlacKkKlansman is a clever, furious, fiercely intelligent picture, and easily the best thing Spike Lee has done in years.|Fresh
It works brilliantly as a dark comedy; it works as a muscular, historical drama that educates as much as it entertains; it works as a thrilling cop flick. It works, basically.|Fresh
The veteran director brings the full force of his filmmaking knowledge to bear on proceedings, reckoning again and again with the weight of American history and Hollywood's interpretation of it.|Fresh
By trying to stir audiences into righteous indignation about race, Spike Lee fails to include elements that might make his film entertaining - such as plot, character development, romance, action and suspense.|Rotten
A layered, complex and extremely good film.|Fresh
I view it in a longer conversation with the artist...there's a version of this that is incredibly tight and thematically consistent...but this movie is baggy, and it disappointed me...it just hung around, messing with different styles.|Rotten
A brilliant reflection of the deeply embedded racism in America's DNA. BlacKkKlansman shows Lee in top form.|Fresh
Go for entertainment. Learn about human dignity.|Fresh
It is galvanising cinema, made with an urgency and anger that leaps from the screen.|Fresh
But while Lee keeps things entertaining, often even funny, the director of Do the Right Thing knows answers aren't simple.|Fresh
In my opinion, it's one of Lee's best films to date, appealing to all audiences who want a great story.|Fresh
BlacKkKlansman's determination to be everything for everybody - comedy/ melodrama, wish-fulfilment fable/awful warning - proves its unexpected, unconventional master-choice.|Fresh
BlacKkKlansman blends comic irony and outspoken polemic but still works very effectively as a hardboiled crime drama.|Fresh
"Lee's spot-on, politically prescient serio-comedy BlacKkKlansman shouts it again, ""Wake up!"" but with more urgency, more intensity, more scares and more laughs."|Fresh
Spike Lee roars back to form with his best film in ages.|Fresh
Helming the film it feels like he was born to make, Lee approaches his weighty material with the complexity that it deserves|Fresh
Powerfully, sometimes humorously...encompasses racial , cinematic history...Chilling link between past and present realities. Far more truth in tumultuous film than fiction.|Fresh
The struggle continues, Lee conveys with a satisfying mix of showmanship and social commitment, and there's still a lot of work to be done.|Fresh
Lee's most entertaining and thought-provoking film in years.|Fresh
This film is Lee at his finest. In years to come, we will look at his work and BlacKkKlansman will be up there with his best|Fresh
In BlackKklansman, Lee beautifully re-writes history with thunder, and with Ron's story subverting and destroying the mechanisms of white supremacy from the inside out.|Fresh
BlacKkKlansman is one of Spike Lee's most accomplished films, one of the best films of 2018 and should make a big splash during the coming award season.|Fresh
BlacKkKlansman is as entertaining as it is provocative. It's not a polemic. It's a fully-realized film.|Fresh
This is American filmmaking at its best: urgent, angry, innovative, loud and funny.|Fresh
Spike Lee at his fiery best.|Fresh
