The kind of movie that makes you want to hug someone you love, and thankful you've got them close enough to do so.|Fresh
Brooklyn is about more than choosing between lads. This is about choosing between fates in an era of newly won independence.|Fresh
This is a deceptively complex story, arriving in the guise of simplicity. And what drives it is Ronan's beautiful performance.|Fresh
Beautifully portrays a very universal experience - not only of immigration but of growing up - via an elegantly nuanced performance by Saoirse Ronan.|Fresh
Brooklyn is full of life, color and contrast. Every scene has a crisp vibrancy used to enhance the film's natural effervescence.|Fresh
Its virtues are understated, powerful, genuine.|Fresh
It's the sort of film where apparently minor decisions have changed everything before you know it. A bit like life.|Fresh
"Well-acted, well-directed and well-shot, Brooklyn is one of those flat-out ""good"" films it's nigh-on impossible to dislike."|Fresh
It's a film with few real surprises but plenty to savour, particularly in the performances of its young cast ...|Fresh
There's a basic emotional truth about the material which stays with you.|Fresh
I am sure admirers of the book will feel justice has been done.|Fresh
Those who discover the film, whether by design or accident, will be wooed by its subtle spell and enriched by its deceptively low-key charm.|Fresh
Although at heart an old-fashioned romance, Brooklyn is also a chick flick in another sense: The film is dominated by women.|Fresh
"""Brooklyn"" is at times swooningly romantic, but it's so much more than just a love story. It's a coming of age tale woven into America's coming of age."|Fresh
The atmosphere's charming to be sure, but the drama sags from the weight of its mildness. Still, Ronan is unforgettable.|Fresh
The Irish expat experience, a poignant mix of aspiration and nostalgia, pervades Brooklyn, sensitively adapted by Nick Hornby from Colm Tibn's 2009 prizewinning novel.|Fresh
I hesitate to call Brooklyn heartwarming because that usually implies something overweeningly tender. But it's possible to be heartwarming and tough-minded, as this wonderful film demonstrates. And it's possible to be both old-fashioned and vibrant, too.|Fresh
Poignant immigration drama is romantic, thought-provoking.|Fresh
The really good decision taken here is the constant close concentration on the face of Saoirse Ronan, still only 21. The film lives in her.|Fresh
Armed with an utterly mesmerising performance by Saoirse Ronan, this is a beautifully made, achingly romantic drama that packs a powerfully emotional punch.|Fresh
It's a simple tale, elevated by superb writing and acting, and I shouldn't overlook John Crowley's splendid, unshowy direction.|Fresh
It's hard to write about it without resorting to cliches, because here are some good descriptors: luminous, poignant, poetic, heartwarming, elegiac.|Fresh
Some films you look at. Others are so immediate that you live and breathe and dance with the characters. John Crowley's incomparable Brooklyn is a movie of the second kind, and what a privilege it is to live there, however briefly.|Fresh
Most insistently, the film focuses on Ellis' search, her stunning pale blue eyes, her look over a shoulder, he walk away from the camera down a sidewalk.|Fresh
Saoirse Ronan, who must be among the front-runners for the Best Actress Oscar, gives a remarkable performance as Eilis Lacey, a young woman who moves from small-town Ireland to New York.|Fresh
Warm, wistful and perfectly cast, it's like hearing your gran bang on about the old days after a couple of sherries. Grand, just grand.|Fresh
It breaks no bounds, offers no edges. But it's a hugely likeable piece of old-fashioned entertainment ...|Fresh
Saoirse Ronan's expressive face carries this tender romance across the Atlantic, from small-minded Enniscorthy in Ireland to big-hearted New York.|Fresh
A joyous crowdpleasing experience that's both witty and sweet and way more than the 'chick flick' it sometimes pertains to be.|Fresh
Unashamedly romantic and achieved with a beautifully subtle, old-fashioned elegance, it's a graceful coming-of-age tale ripe for awards.|Fresh
It's a measure of her power and of the spell cast by this lovely movie that for hours, maybe days after you leave the theater, you'll want to stick around and find out what's around the corner for this now voyager.|Fresh
It summons up a full life in a fable about happiness-pursuing it, achieving it. And bestowing it; the film made me happy too.|Fresh
"There isn't a wrong moment in ""Brooklyn,"" a film to get lost in, to mull over. To experience it is like revisiting old family photographs or snuggling up on a cold day with a good book."|Fresh
Although Brooklyn is technically a love story, it's unfair to stop there. It's about discovering who you are regardless of where you find yourself.|Fresh
This is old-fashioned, traditional storytelling at its most exquisite and moving; a tearjerker that doesn't put a foot wrong, and doesn't make you feel as if you've been had.|Fresh
Without Ronan's performance, Brooklyn might have left a sugary taste. But she is the ingredient that brings everything together: her calm poise anchors almost every scene and every shot.|Fresh
This is an old-fashioned entertainment, but one so masterfully crafted and heartfelt that it's hard not to love.|Fresh
Brooklyn has an old-fashioned perfection so incandescent, and so winning, that it's almost spooky. It could have come from an alternative, postmodern universe.|Fresh
Like 'Carol,' another new retro-style melodrama about a cross-culture romance that should play out as normal but for many reasons can't, it takes a view of love from the purely but no less loaded side of the practical.|Fresh
"""Brooklyn"" delivers pure enjoyment in its storytelling, visuals, characters and, most of all, its leading lady."|Fresh
This calm, spellbinding movie is the rare literary adaptation that rewards a book's fans with unexpected insights while taking on a vibrant life of its own.|Fresh
One can't help but...imagine the more resonant and insightful film it might have been if it had aimed to elicit more than longing sighs.|Rotten
Saoirse Ronan lights up the screen in the year's best and most beguiling love story. The surprise is that it also goes deeper, sadder and truer.|Fresh
Brooklyn is one of the best movies of the year and something of a miracle. See it on the big screen or you don't get to complain about anything ever again.|Fresh
Its beating heart is 21-year-old Saoirse Ronan, once the bright-eyed teen from Atonement but now, on evidence here, the most quietly expressive actor of her generation.|Fresh
Brooklyn is an elegant testament to the dream of first experience, relatable to everyone, regardless of where you're from-elevated to no small degree by the blue emerald eyes and creamy complexion of its star ...|Fresh
A triumphant blend of social history and reined-in melodrama. It is meant entirely as a compliment to say that Maeve Binchy would have got on well with it.|Fresh
Brooklyn doesn't quite capture Brooklyn, but its ambivalence about being Irish is gloriously epic.|Fresh
If I may be utterly, unabashedly frank, I admit that the first time I saw this picture I started crying about forty minutes in and never really stopped. They were not all sad tears, I hasten to add.|Fresh
It's unashamed old school style and charm evokes the era of Classic Hollywood, and its characters are beautifully written and portrayed and worthy of our heart and time.|Fresh
There's great humor and touching, tentative romance. And gradually the film turns its very specific story of one immigrant into a moving group portrait.|Fresh
It's certainly a compliment to director John Crowley and screenwriter Nick Hornby (adapting the novel by Colm Tibn) that the film calls to mind Steven Spielberg and even John Ford in its willingness to commit to the grand gesture.|Fresh
Ms. Ronan uses everything - her posture, her eyebrows, her breath, her teeth, her pores - to convey a process of change that is both seismic and subtle.|Fresh
"A godsend for audiences who hunger for rich emotion presented with wit, grace and not a trace of sentimentality, ""Brooklyn"" illustrates the power of restraint in dealing with poignant, impassioned material."|Fresh
Brooklyn appeals as a love triangle, with charming, old-timey romances befitting the era it depicts, but it's more powerful as a story of one young woman's identity.|Fresh
Ronan's big talent, the sweetness and resilience of the characters, and the film's big heart, are almost irresistible.|Fresh
Brooklyn is a story for anyone who has ever left home. It's a story for those who've waffled in indecision, for those forming their identities and forging their own paths. And it's one of the loveliest films to grace cinemas this year.|Fresh
Set in the 1950's New York borough, this especially charming, beautifully made story of an Irish newcomer sweeps us all off our sensibly clad feet.|Fresh
Saoirse Ronan makes a grand case for herself as the millennial generation's finest leading lady in Brooklyn, an immaculately crafted, immensely moving character study about a 1950s immigrant struggling to find her place in the world.|Fresh
An old-school, emotionally soaring take on an Irishwoman's new life in America, interrupted by the lure of the old sod, featuring a star-making turn by Saoirse Ronan.|Fresh
This is a film that never insists or over-stresses its effects, but works its way quietly and irresistibly into our emotions.|Fresh
Led by Saoirse Ronan, the earnest 1950s-set Brooklyn weaves an enchanting love story into the tale of an Irish immigrant's American assimilation.|Fresh
Brooklyn is a touching romance and nuanced exploration of how perceptions of home and family shift as life throws us new opportunities.|Fresh
A timeless movie.|Fresh
Director John Crowley and screenwriter Nick Hornby take the story from Colm Tibn's brilliant novel in a much more conventionally satisfying direction -- but boy do they ever succeed at conventional satisfaction.|Fresh
This is undoubtedly Ronan's coming-of-age role, and she conveys Eilis's quiet strength in the face of huge emotional turmoil without a hint of melodrama.|Fresh
Sweetly poignant assimilation story, enhanced by a superbly confident ensemble...|Fresh
The allure of the road not taken and the power of Saoirse Ronan's performance exert a powerful pull.|Fresh
Director Crowley, in partnership with Oscar-nominated scribe Nick Hornby, create a beautiful and sensitive love story that is everything a Nicholas Sparks film adaptation wishes it could be.|Fresh
A treat for anyone who likes adorable Irish people and trying super hard not to cry.|Fresh
A very likable, romantic take on the immigrant experience with an award-caliber performance by Saoirse Ronan.|Fresh
In the tingling chemistry between two of her young leads, Saoirse Ronan and Emory Cohen, Weir and the film's director, John Crowley, achieve something close to a miracle ...|Fresh
An awards-caliber performance by Saoirse Ronan, as a shy and awkward Irish immigrant who struggles to fit in when she arrives in the Borough of Churches in 1952.|Fresh
A quiet, old-fashioned yet utterly heartfelt film.|Fresh
With old-school romance pumping through its veins, fans of the genre will find this a pleasing indulgence.|Fresh
A romance that hits those with a heart hard.|Fresh
As for Ronan, this is perhaps her best work to date. The way she plays Eilis' transformation from the beginning to end is completely convincing, moving, and beautiful.|Fresh
Saoirse Ronan shines, but relative newcomer Emory Cohen is the true breakout in this tale of a young woman torn between two men on opposite sides of the Atlantic.|Fresh
Handsomely shot and beautifully constructed, Brooklyn is a truly great American story.|Fresh
It's a wonderful film. I was describing it later in the day to someone who hadn't seen it. And I gave HER chills.|Fresh
"A heartbreaking and poignant story about choices, country, commitments, sacrifice and love, ""Brooklyn"" is a superb, luminous and bittersweet portrayal of who we are, where we've come from, where we're going and the places we call home."|Fresh
Brooklyn is a sweet movie, and its time-capsule quality is its real sell.|Fresh
An earnest, wholesome and stirring drama, Brooklyn has all the makings of an indie-film darling.|Fresh
"It's the sweet sincerity of ""Brooklyn"" that stamps it as both refreshing and nostalgic. The film is as welcome as a photo you just discovered of your mother before you were born, in which she looks prettier than you ever imagined."|Fresh
A superb, emotionally turbulent account of a young Irishwoman's attempt to become an American in the early 1950s.|Fresh
I'm not sure where it turned me. It could have been a look in Saoirse Ronan's eyes or a musical cue or just the right image, but I was helpless. It worked its magic. And, yes, this movie is magical.|Fresh
