Emotionally rendered by an attractive cast and crafted in the best traditions of mainstream filmmaking ... Brooklyn is a captivating and rewarding moviegoing experience the kind that at best comes along once or twice a year.|Fresh
I could have hung out with everyone in Brooklyn for hours: It's a world you won't want to leave.|Fresh
With compassion, a touch of melancholy and a sense of wonder, Brooklyn reveals the profound truths in a simple, familiar story, ending on a note that's achingly bittersweet, no matter where you're from.|Fresh
Although not without moments of sadness and tragedy, Brooklyn is sublimely uplifting and life affirming.|Fresh
Fans of the novel, of which I'm one, may find the film sweeter and more romantic than Toibin's original conception.|Fresh
Ronan, in every scene of the film, creates a reserved young woman who seems to mature before our eyes, quietly revealing Eilis' open, yearning heart.|Fresh
An effective transfer from page to screen, Brooklyn is an emotional (but unsentimental) drama, so particular in period details of its singular romance that it also manages to be universal in its dissection of the nature of true love.|Fresh
Brooklyn is a beautiful film, in both presentation, with its lush cinematography, and delicate execution.|Fresh
It is a very sweet, lovely movie that I highly recommend.|Fresh
Brooklyn actually harks back to the kind of escapist entertainment cinema offered in the 1950s. It's all rather lovely, if completely unchallenging.|Fresh
I was surprised at how enjoyable and skillfully made Brooklyn is: I cried when everyone else did and gasped when the rest of the audience did too, but in spite of its excellent art direction and affecting performances the film is mostly hokum.|Fresh
It's a lovely piece of cinema, and one of the best movies of 2015 to date.|Fresh
The look of 1950s Brooklyn and Ireland is beautiful-each glimpse more idyllic than the next to render the film a fairy tale of sorts...|Fresh
There are no real words to describe how moving and emotionally satisfying this story is.|Fresh
An ode to homesickness and longing that also serves as an essential destination for theater-goers this Holiday season.|Fresh
As Eilis Lacey, Saoirse Ronan carries this film so splendidly that in any year that was not so utterly Brie Larson's, it would be a crime not to give her every award; you can practically see her eyes changing colors with her moods.|Fresh
a feast for the eyes|Fresh
It's the ultimate love story, where a young woman finds that she must choose between two men and two very different lives. It's a film about identity and family obligation - and it's truly timeless.|Fresh
A rare feel-good romantic drama that finds something fresh in the most familiar places.|Fresh
[Director John] Crowley guides us through the narrative with precision but it's a performance-driven film and the ensemble cast, especially the chemistry between Ronan and Cohen, deserve any and all accolade.|Fresh
[Brooklyn] goes back in time and deals with immigration in a very delicate manner, and without this subtlety detracting in any way from the importance of the film's subject.|Fresh
Yes, we have seen this story countless times before, but the execution here is on-point and will warm your heart while simultaneously making you chuckle frequently|Fresh
It's this fact that makes Brooklyn so relevant. As our country debates whether to allow refugees in, we need to reflect upon our own histories and recognize so many common dreams and goals. We're all Eilis.|Fresh
Brooklyn undoubtedly has a sweetness and sincerity that will melt the heart for those with a fondness for this kind of thing, and the period production design, on both sides of the Atlantic, is lovely. But the best reason for seeing it is Ronan.|Fresh
Brooklyn arrives duly hyped, and disappoints just as reliably.|Rotten
[Brooklyn] dares to dream an old dream, and we are reminded of the powerful allure of home.|Fresh
Brooklyn is one is for the romantics, and those who appreciate finding beauty in the simpler things.|Fresh
It's refreshing to see this largely internal, cerebral journey of an introverted young woman play out onscreen.|Fresh
Former child star Saoirse Ronan - the girl in Joe Wright's masterful 2007 film Atonement - shines.|Fresh
Although Brooklyn occasionally felt like a Hallmark special, Saoirse Ronan, who played the lead character in the film, possessed a clarity and directness that was singularly refreshing, not unlike a splash of cool water.|Fresh
[Brooklyn] is a modern romance we can root for rather than a relic of the past.|Fresh
[Brooklyn] echoes the persona of the young woman eager to make her own life but admittedly scared of the quest itself, taking each step away from her old life at her own unique pace.|Fresh
Saoirse Ronan stars, and it's her best performance to date, which is really saying something.|Fresh
There are many reasons to recommend Brooklyn - its relatable story for one, its glowing visuals and performances for another.|Fresh
Based on Colm Toibin's novel, and starring Saoirse Ronan as an Irish immigrant in 1950s New York, this genial drama about leaving home welcomes you in.|Fresh
Starring Saoirse Ronan in a career-defining role (even more so than her first Academy Award-nominated performance in 2007's Atonement), it may just be among the finer historical period pieces in recent memory.|Fresh
Brooklyn is one of the best films ever made about leaving one's homeland in search of a better life, and forging a new path. [Full review in Japanese]|Fresh
Simple, sublime perfection.|Fresh
Brooklyn is marvelous, watching it as close to pure bliss as any cinematic confectionary treat as I could possibly have imagined myself.|Fresh
Crowley's unpretentious drama has a sensitivity for its protagonist's emotional journey that's richly rewarding throughout.|Fresh
Brooklyn is heart-warming, funny, and thought-provoking. It also looks just ravishing.|Fresh
The lack of dramatic tension is startling.|Rotten
Brooklyn is the very essence of a simple story, beautifully told.|Fresh
An old-fashioned kind of drama in the best way, where the filmmakers espouse a full and abiding affection for all of their characters.|Fresh
'Brooklyn' might sound like some sort of starchy period piece, which couldn't be further from the truth - it's vibrant and warm and funny.|Fresh
The movie lacks any semblance of a dramatic pulse.|Rotten
Brooklyn is an old-fashioned, beautifully measured story about family, independence and the pain of separation.|Fresh
Set against the backdrop of Brooklyn and Ireland in the 1950s, Brooklyn is a gentle romantic-drama that manages to avoid cliches.|Fresh
A poignant period piece about an American Dream delayed, derailed and possibly denied.|Fresh
It doesn't sound exciting but it is really well done, with a great cast, understated but powerful, it's genuinely affecting, atmospheric, often funny, and very accessible.|Fresh
This is Saoirse Ronan's film. She's given a huge amount to do, and asked to transform before our eyes from a callow, floundering girl into an assured and confident woman. She does so brilliantly, and talk will turn to Oscars.|Fresh
Wistful and Charming this romantic coming of age drama is ably carried by Saoirse Ronan's finely drawn performance.|Fresh
Brooklyn is a superfluous romantic film that's entertaining but nothing more; its dramatic parts aren't captured with enough intensity to break down the audience. [Full Review in Spanish]|Fresh
A film as understated but radiant and layered as its protagonist, Brooklyn succeeds with a simple storyline whose emotional impact aptly hits home.|Fresh
"""Brooklyn"" is a well acted and visually competent drama ... but also an ""old school"" movie. [Full Review in Spanish]"|Fresh
Everything seems to be in place, without being memorable even once. [Full Review in Spanish]|Fresh
The film is certainly lovely and well-acted, but the nerve it has obviously hit is not immediately obvious. Perhaps it's the film's very modesty - its lack of pretense, grandeur and histrionics - that accounts for its appeal.|Fresh
An impeccable, romantic, and realistic film. [Full review in Spanish]|Fresh
A soft movie when it comes to immigration themes that allows her leading lady to shine. [Full review in Spanish]|Fresh
The immigrant story is one that has been told countless times over, but director John Crowley's moving and funny Brooklyn brings a degree of empathy to this particular tale that is rare.|Fresh
While she's surrounded by a name cast, this is Ronan's film, and while she's made big impressions before (from Atonement to The Grand Budapest Hotel), this is her most assured and moving characterisation yet.|Fresh
Sincere, emotional and even touching, but it's far from being a great film. [Full review in Spanish]|Fresh
A subtle drama that work because of Saoirse Ronan's acting work. [Full review in Spanish]|Fresh
[Brooklyn] doesn't just look back wistfully at the past, it also transcends the period setting with powerfully timeless questions: Where do I belong? What can I make of my life?|Fresh
Part of the film's charm is the way that Irish director John Crowley manages the mood, without compromising the momentum. His direction is impeccable.|Fresh
Brooklyn is an excellent film for many reasons. While it may take its title from one small part of the world, it works so well because of the universal nature of its themes.|Fresh
It tells one woman's tale beautifully. The rest of her new country's story, however, is left unfinished... and unseen.|Fresh
A beautiful story about love and self-discovery, a great production with great direction. [Full review in Spanish]|Fresh
Saoirse Ronan creates an unforgettable character. [Full review in Spanish]|Fresh
Brooklyn lacks any real conflict. The ingredients are what make it atractive, however, outstanding manufacturing and notable acting work by the it's leads are not enough to save it from Crowley's bland directorial work. [Full review in Spanish]|Rotten
Subtle and insightful at first, and sweetened as it approaches to the end, the film, directed by John Crowley, benefit from the impressive performance of Ronan. [Full Review in Spanish]|Fresh
The film is a deconstruction of individualism, asking whether a person is bold enough to resolve the concept of cyclical-maturity and determine the self in the absence of our blood families and other oppressive forces.|Fresh
A touching tale originated by a simple story. [Full review in Portuguese.]|Fresh
Brooklyn deals with universal themes, but through the most intimate prism of a young woman who is starting to shape her life, uncertainly, walking into the future without a handrail|Fresh
Superbly told, this engrossing 50s romantic drama captures our imagination in all things - big and small|Fresh
It features first-rate performances, a beautifully designed production and a script from the experienced author Nick Hornby. [Full Review in Spanish]|Fresh
Brooklyn is a sweet, moving, gorgeously-shot tale about a woman trying to find where she belongs. If I see a better film this year, I'll be surprised.|Fresh
Ronan's accomplished performance provides the heart of the film, and, despite the mistakes she makes, the viewer comes to care deeply for this young woman and hope for a happy outcome to her dilemmas.|Fresh
We have an impeccable product, with heart and Irish eyes. [Full Review in Spanish]|Fresh
Lives or dies on Ronan's performance, and it definitely lives, with energy, beauty and grace. Hornby has done a brilliant job adapting Toibin's novel ... as have art departments [with] an Ireland and Brooklyn of the 1950s but also of the romantic mind.|Fresh
Not only significant as a smartly written piece of social and historical commentary, but it's also just a great, well-crafted movie that warms the heart and is a lot of fun to watch.|Fresh
Just because you can never go home again doesn't mean you can't make a new one.|Fresh
Engaging, entertaining and emotional, Brooklyn is unashamedly old-school.|Fresh
There is an enjoyable lightness to the film that is easy to mistake for simple-minded nostalgia.|Fresh
The film should satisfy those who love the book as well as newcomers.|Fresh
There's nothing [characterization] here for me|Rotten
...the sort of movie that any decent person ought to enjoy. It is full of heart and longing, and if it fails to stir something inside you perhaps you should consider that it is you, and not John Crowley's exquisitely crafted movie, that is at fault.|Fresh
Brooklyn at heart is a women's picture, that staple of mid-century cinema in which a woman must choose her path in life, and the film adapts the genre's traditions splendidly.|Fresh
If you leave this film without a smile on your face, you must have done something wrong. Go back and watch it again.|Fresh
A flower named Saoirse Ronan grows in Brooklyn|Fresh
... expertly mixes humor and poignancy into the dilemma of its protagonist, while Ronan and the supporting cast bring resonance to familiar coming-of-age themes.|Fresh
It mixes open-hearted sentimentality with star Saoirse Ronan's sublimely subtle performance|Fresh
Definitely one to watch if you like raw emotion and romance.|Fresh
If there is a more uplifting film making the rounds, I'm not aware of it ... Conditioned by so many misanthropic melodramas, we assume, cynically, that the worst will befall Ronan. When this doesn't happen, we're pleasantly surprised, touched.|Fresh
I can't spot a single thing wrong withBrooklyn. An Oscar-caliber package; start betting on victory for Ronan, at the least. Heart-warming, light-hearted, and perfectly poised. Simple. Beautiful. Lovely.|Fresh
The key word in Brooklyn is restraint. Director John Crowley keeps things impressively under control in this quietly moving Irish immigration tale that is already garnering well-deserved buzz as a serious Oscar contender.|Fresh
Ronan dominates virtually every scene she's in -- and she's in virtually every scene -- with a maturity well beyond her years.|Fresh
From a dramatic standpoint, the film's biggest asset is also its biggest challenge: Brooklyn eschews showy conflict in favor of small character moments and a leisurely pace|Fresh
Screenwriter Nick Hornby and director John Crowley join star Saoirse Ronan in creating a united front against the clichs of romance, comedy and coming-of-age tropes.|Fresh
It satisfies with the nourishing warmth of a cup of sweet, milky tea Eilis may find herself longing for in New York, a comforting taste of home in an unfamiliar land.|Fresh
With sure but small gestures, Ronan manages to suggest both luminous innocence and reserves of strength that Eilis is only beginning to understand. It's a quietly commanding performance.|Fresh
It's a movie you can take Grandma to - and one that might induce Grandma to reminisce about the dark passages and tough choices of her youth.|Fresh
After a week of shameful anti-immigrant rhetoric, Brooklyn is the big-hearted bear hug of a movie a lot of folks could use.|Fresh
Like so many prior films about immigrants looking for a better life on these shores, Brooklyn lays out a wondrous, overwhelming and romantic vision of America's past -- the same vision that brought people here in the first place.|Fresh
Saoirse Ronan plays the role of the Irish girl who comes to America, with determination and personality.|Fresh
"""Brooklyn"" is a wonderful romance, a nice change of pace in which people are permitted to act like real people instead of caricatures that serve as manipulative plot devices."|Fresh
Movies this charming don't come around nearly often enough as they should but it helps make gems like Brooklyn shine all the brighter.|Fresh
The sterling visual qualities Crowley brings to Brooklyn pale next to its casting. Ronan, perhaps, is the most obvious choice to play Eilis, but that's because she's perfect. Is she the best actress of her generation?|Fresh
Brooklyn is escapist entertainment that also is full of depth and turmoil. As such, it is a rare find in movie theaters nowadays.|Fresh
The plot of BROOKLYN is simple--perhaps too simple to justify the high production values.|Fresh
Of all the qualities a movie can have, lyricism is one of the hardest to achieve, and Eilis' journey toward making herself a home in this strange new country is as beautifully realized as the resolution of a great symphony.|Fresh
Brooklyn passes in front of the eyes, yanks hard on the heartstrings, sings a few lines of 'Danny Boy,' and then falls out of the mind an hour later.|Rotten
Expertly directed by John Crowley and adapted (equally well) by Nick Hornby from Colm Toibin's novel, this is one of the smallest, most intimate and best movies of the year, with an aching suspense that bigger, brasher movies can only dream of.|Fresh
Touching and one of the year's best films|Fresh
Brooklyn is a beautiful period drama and rich piece of romantic storytelling that boasts great performances.|Fresh
Ronan emerges here as the quietest spellbinder in movies. She is in every scene, and she is so appealing that Eilis becomes every viewer's ideal: an ideal daughter, sister, employee, girlfriend and confidante.|Fresh
This exquisite film is one of the year's best.|Fresh
Ronan certainly does drive it into solid holiday material for the big screen, but there's also much to cherish about its look, feel and meaningful contributions from just about everyone else involved.|Fresh
The camera never strays too far away from Ronan, who connects this young Irish woman's faraway journey to all of ours, evoking the trauma, the sadness and the joys of change.|Fresh
A beautifully staged and acted immigrant drama.|Fresh
A heart-affecting immigrant love story with a genuine and poignant performance by Saoirse Ronan.|Fresh
Zzzzzzz. Wonderful performances but do we really care about a teenager from Ireland trying to decide between guys, one on one continent, the other on another?|Rotten
No other film of 2015 has dared to suggest something so simple, or do it with such painstaking brilliance.|Fresh
Saoirse Ronan does exceptional work as Eilis. Her subtle expressions keep the character interesting even when she appears withdrawn from those around her.|Fresh
An engaging and winning pic. (Full Content Review - Sex, Profanity, Violence, etc. - for Parents also available)|Fresh
Brooklyn is a fine serving of comfort food, innocent and successfully operating at a deeper level when exploring the difficulties of leaving home.|Fresh
Central to the story's theme are love, family and homesickness, ingredients perfectly blended and served by director John Crowley. What a truly lovely film.|Fresh
Ronan brings Eilis to life in every small gesture and interaction.|Fresh
... a lovely, classically constructed reminder of our best melting pot instincts.|Fresh
It's a witty, dreamy love letter to independence and self-discovery - no matter where you call home.|Fresh
Pleasant and polished and well-played. But sentimental, cliched...the most over-praised film of the fall?|Fresh
Director John Crowley and writer Nick Hornby never even try to temper the flood of emotions that this story elicits, instead wading straight in.|Fresh
Ronan lights the way as our guide back in time, to a place where immigrants found opportunity, as well as open arms, in an America that looks so lovely in Brooklyn.|Fresh
Ronan's subtle performance and guileless gaze make the movie more than a stereotypical immigrant story.|Fresh
A touching historical drama featuring an elegantly understated performance by Saoirse Ronan likely to land the 21 year-old ingenue her second Oscar nomination|Fresh
A film of quiet beauty, 'Brooklyn' reminds me of classic movie gems from the past. It also imparts a sense of place and loving hearts.|Fresh
Despite the obvious plot problem near the end of the film, it benefits from some fine performances and gorgeous location cinematography by Yves Blanger.|Fresh
Saoirse Ronan plays this interior drama with intelligence and a sincerity that seems true to the film's era. In some ways she's an innocent abroad, but she's nobody's patsy. What a refreshingly authentic character to root for.|Fresh
Simply put, I loved this movie. I can't wait to see it again, and it's easily one of my favorite films of the year.|Fresh
It's a fine film for mainstream viewers seeking quality escapist entertainment.|Fresh
An effective (and affecting) period drama...|Fresh
"How, with so little surface abrasiveness and such an absence of apparent conflict, does ""Brooklyn"" maintain its strong emotional hold?"|Fresh
The lavish set design and warm love story, the earnest performances and the movie's unflinching, optimistic tone could make Brooklyn one of the finest films of the year.|Fresh
Saorsie Ronan's immigrant girl undertakes an arduous sea voyage from her Irish homeland to America. Just like Ronan's own odyssey, it's the journey from teen to woman that fascinates.|Fresh
How to define Brooklyn? In the plainest cinematic terms, it's a female coming-of-age story, though that belies the richness and depth of the leading character, on screen for almost all of the film's 111 minutes.|Fresh
Brooklyn is a simple story affectingly told, bridging the emotional gulf one feels when ambition and home are an ocean apart and love is uncertain in either place.|Fresh
Brooklyn is that rare period drama that doesn't lose itself in its dogged re-creation of another time.|Fresh
It's hardly subtle or incisive, but works as an old-fashioned tearjerker bolstered by a strong lead turn from Saoirse Ronan.|Fresh
It's such a beautiful film.|Fresh
Brooklyn should please crowds of all ages and tastes. It's quality filmmaking.|Fresh
Buttressed by Nick Hornby's literate script and an unforgettable performance by Saoirse Ronan as a young Irishwoman adrift in 1952 New York, Brooklyn is a perfectly judged journey in time and place.|Fresh
Big, romantic and as sweet as wedding cake, Brooklyn is a bi-continental love story that proudly wears its heart on its well-crafted sleeve.|Fresh
If you're yearning to take a sentimental journey, Brooklyn is the perfect destination.|Fresh
"If you think they don't make movies like they used to, ""Brooklyn"" is glorious proof to the contrary."|Fresh
Brooklyn is an unabashed immersion in the warmth of an earlier view of the big city.|Fresh
Ronan is a fresh new star whose performance as an Irish immigrant in the 1950s is one of the best of the year.|Fresh
"Moviegoers often caught complaining that ""they don't make 'em like they used to"" should make attendance a priority, as failure to support such endearing, achingly human filmmaking only hastens its obsolescence."|Fresh
John Crowley creates a hauntingly beautiful tale of love on two continents in his period film Brooklyn.|Fresh
What sets this apart from lesser romances is the minor characters. Nick Hornby's script (working off Colm Tibn's best-selling novel) gives the supporting cast plenty to do. Every face fits the part perfectly.|Fresh
In the end, of course, Ronan completely owns this movie.|Fresh
For most of its length, Brooklyn is an enchanting, intelligent mood piece.|Fresh
An exquisite, classically crafted story that conflates the romance of the journey to the New World with the tenderness of a woman's first love.|Fresh
Even if you don't like the film--though it's a fair bet you will--it will prime you for a spirited discussion about the choices of its hero, a resilient Irish lass who strives to sort out her best judgement from her impulses, her hope from her naivet.|Fresh
A beautifully filmed coming of age story.|Fresh
A beguiling screen presence as a teenager... Saoirse Ronan comes of age as an actress with her richly nuanced and deeply affecting portrayal of a young Irishwoman torn between countries and suitors.|Fresh
"""Brooklyn"" is sure to keep you engrossed from beginning to end."|Fresh
"""Brooklyn"" is intelligent, warm, funny and endearing."|Fresh
Brooklyn is one of the best movies of 2015.|Fresh
Composed and powerful filmmaking that makes the complications of life seem poetic, beautiful, and integral.|Fresh
Brooklyn is a conventionally structured but uncommonly affecting film that demonstrates the dramatic power of simplicity, honesty and decency in cinema.|Fresh
The entire enterprise, a 1950s-era struggling immigrant's tale, rests upon Ronan's shoulders, and she triumphs.|Fresh
It's like some lovely modern fable -- a warm embrace of a film, full of compassion, pain, and hope.|Fresh
This could feel like an airport romance novel about a girl whose life is transformed by love, but Ronan complicates Eilis's otherwise simple story arc as much as she can.|Fresh
The film is suffused with the sense that a person is just about to bloom.|Fresh
A cinematic snow-globe of nostalgia, a portrait of two worlds that aches with family lost and freedoms found. It is a beautiful film to experience.|Fresh
A story about having to find the world in order to find one's place in it, Brooklyn recreates an immigrant experience that is separated from us by 60 years in time, and perhaps an eternity in sensibility, but that feels immediate and true.|Fresh
"""Brooklyn"" may be unapologetically old-fashioned, but it's also utterly of its time."|Fresh
It's one of the most satisfying films of 2015.|Fresh
Something in the richness of its relationships puts an essential truth before us - the brevity and immensity of life. We know all about that, of course, but that's the beauty of great art: It takes what you already know and makes you feel it.|Fresh
Director John Crowley has fashioned a film that feels like a natural evolution from the Victorian novel, one in which the circumstances are deceptively modern even if everything else feels somewhat old-fashioned.|Fresh
