Bumblebee may sport a thoughtful character arc and a throwback vibe, but it's not meaningfully different than the other five entries in the Transformers series.|Rotten
Bumblebee is the Transformers franchise sobering up after a decade-long bender.|Fresh
An absolute charmer. This is the best Transformers movie to date, and Hailee Steinfeld's best role. Little kids - and people who were Transformers fans as little kids - will especially love this.|Fresh
It's a charming tale of a girl and her adorable car-robot, flipping the script on the tired, bloated franchise. While hard-core fan-boys may complain it's too soft, this film may turn out to be the perfect way to save Transformers.|Fresh
Bumblebee isn't another dark, grim ogre of a film. It's a breezy, fun, smart picture directed by someone with a keen eye for details, but also for humanity.|Fresh
The best Transformers movie, for whatever that's worth.|Fresh
A not-bad origin story about one of the more more agreeable Transformers.|Fresh
Bumblebee is a welcome reboot for a troubled franchise. Hailee Steinfeld is charming and the story entertaining enough, even if conventional.|Fresh
"Stands on its own, apart from its predecessors as a faithful and pretty fantastic ""Transformers"" installment."|Fresh
Bumblebee remembers its geared toward the youngsters, and doesn't forget to sprinkle a touch of humanity along the way. At last, this could be the Transformers flick you've all been anticipating.|Fresh
"It's happened, sound the sirens - ""Autobots, roll out""...because Bumblebee is the best Transformers movie of them all."|Fresh
It does everything the Bay movies wouldn't, embracing what's made Transformers endure for three decades, and infusing it with a much-needed dose of heart.|Fresh
Tears and thrills for all the family.|Fresh
I think most fans will just be happy that there's a Transformers movie honoring the legacy. Fans can breathe a nice sigh of relief.|Fresh
It's amazing how well a Transformers movie can work when liberated from the worst excessive tendencies of Michael Bay.|Fresh
[Cena] gives good muscle, but Bumblebee brings something even more important - and actually transforming - to the series: a sense of humor, and a heart.|Fresh
It's a Transformers movie to enjoy and even care about... and one capable of turning around this franchise's fortunes for the better.|Fresh
'Bumblebee' is the best live-action 'Transformers' to date, but is that good enough in 2018?|Fresh
Bumblebee is a fun, heartfelt and still action-filled Transformers prequel that ushers in a new - and better - era of movies about the Autobots.|Fresh
The Transformers franchise has given us a breath of fresh air with their latest venture, Bumblebee; the first film in the franchise filled with ample amounts of heart, humor, fun and memorable action!|Fresh
It's certainly a high for the franchise.|Fresh
Bumblebee is one of the strongest films in the franchise and a rebirth for the series going forward.|Fresh
"Flavorful popcorn entertainment and does a fine job reclaiming the core appeal of ""Transformers,"" even if it's something as small as an iconic sound effect or character design that's recognizable."|Fresh
Bumblebee is a surprisingly enjoyable ride for a franchise that felt like it'd long since rusted over.|Fresh
"For the last 10 years we've just been walking through the desert with Michael Bay and finally this director comes up and says, ""I've got that cool water for you."" And this movie is refreshing."|Fresh
The Hollywood machine has retooled the Transformers franchise for a sleeker, quicker and more enjoyable ride in this character driven prequel.|Fresh
Bumblebee is the Transformers movie that should have been made in the first place.|Fresh
But Travis Knight's spin-off/ prequel shrewdly -- and successfully -- sidelines the mechanics and mythology of its predecessors to focus on the changing emotional conditions of its characters.|Fresh
Doesn't just add an invigorating (all)spark to the Transformers franchise, but it also proves that there truly is more than meets the eye.|Fresh
If you like Eighties movies, coming of age stories, or giant robots fighting, Bumblebee is for you.|Fresh
Brimming with fun and charming scenes, a compelling story, and a great hero in Hailee Steinfeld, Bumblebee is a joyride of a film. Way more than meets the eye.|Fresh
[It's] a crowd-pleaser of a movie, and it hits all the necessary beats... The movie succeeds where all of Bay's films failed because, despite being a story centered on battling robots, Bumblebee never loses sight of its humanity.|Fresh
Bumblebee was quite a wonderful experience even for this non-Transformers fan. I can only imagine that true fans should be thrilled that a movie finally captures what they love about those robots.|Fresh
[Knight] replaces Bay's occasionally enticing flair with a series of ... uninteresting visual and storytelling choices that have been seemingly dictated by ... focus groups.|Rotten
It takes all of 30 seconds into Bumblebee for it to be the best live-action Transformers movie.|Fresh
Perhaps the most impressive thing you could say about Bumblebee is that it actually leaves you wanting another Transformers movie.|Fresh
With a narrative on a decidedly smaller scale, a plot that's entirely coherent, and a hefty dose of warmth and heart, 'Bumblebee' is the much-needed and richly-entertaining departure the Transformers franchise so desperately needed.|Fresh
For true Transformers fans this prequel will serve as a melancholic coming-of-age journey into the backstory of Bee and a great 'restart' to the direction of the film series as a whole.|Fresh
...a fun, well-acted, exciting and even emotional piece of popcorn action.|Fresh
In a better, truer cinematic universe, Travis Knight would have been in charge of the Transformers franchise all along.|Fresh
"It's a movie more Iron Giant than Armageddon, though unlike the Vin Diesel-voiced Brad Bird creation, no Autobot will be able to insist they're ""not a gun"" forever"|Fresh
An impassioned ode to both the toys and their era, this, at last, is the Transformers movie we've been waiting for.|Fresh
It was nice to enjoy a Transformers movie again.|Fresh
"Fans of the classic ""Transformers"" will be thrilled by many of the touches here. But there is also now an entire generation of kids who are going to get to watch a girl drive, with a smile on her face."|Fresh
Feels less like another Transformers film as we've come to know them than a live-action spin on the classic Ted Hughes-inspired animation The Iron Giant, slathered in John Hughes-esque coming-of-age trimmings.|Fresh
Knight and Hodson have salvaged something agreeable from an otherwise badly dented series.|Fresh
"""Bumblebee,"" for its part, has just enough wit, playfulness and charm to develop a voice of its own, which is no small thing in the context of a flashy, lunkheaded studio franchise."|Fresh
It's an effective reimagining that also bears a knowing resemblance to classic youth-oriented films from Bumblebee executive producer Steven Spielberg.|Fresh
"""Bumblebee"" is basically the movie that fans of the 1980s animated series wanted all along."|Fresh
I'm as surprised as anyone that I'm about to write this sentence, but here it goes anyway: Bumblebee is a delight.|Fresh
"Charm and sweetness were in short supply in Michael Bay's ""Transformers"" films, but they're the secret ingredients to ""Bumblebee,"" a likeable prequel that indulges in nostalgic affection for all things 1980s."|Fresh
As a course correction for the series, pulling the previously complex mythology way back and starting over from scratch, it's enormously effective.|Fresh
The live-action Transformers movie we all wanted in the '80s.|Fresh
