A mix of genres that appeals not just to comic book fans, but also to a broader audience looking for stories full of emotion and intrigue that are able to hold their own. [Full review in Spanish]|Fresh
Funny, sad, satirical, spectacular... this is that rare blockbuster that proves that more can be more.|Fresh
Grief, anguish, revenge. All of these, when rendered onto the canvas of a well-rounded character, are so much more potent than the sight of a city crashing into another city or a looming CGI spaceship drawing ever nearer to its fatal destination.|Fresh
One of the best superhero flicks until now. [Full review in Spanish]|Fresh
Captain America: Civil War is therefore a stunning achievement: one that far exceeds expectations to deliver one of the most thrilling superhero experiences you are ever likely to see.|Fresh
These films no longer have to delight and surprise us; no, their job now is to manage the brand, not screw anything up too royally, and keep us hooked for the next installment. Civil War pulls all that off mostly well.|Fresh
Iron Man and Captain America duke it out in a round, exciting film in what can be described as the biggest blockbuster of the year. [Full review in Spanish]|Fresh
In spite of having so many characters on screen, the film never turns into Avengers 2.5 and always mantains focus on Captain America. It's not perfect, but it almost is and you will really enjoy it. [Full review in Spanish]|Fresh
No doubt this is the kind of high note Marvel would like to continue indefinitely across the franchise.|Fresh
Captain America: Civil War is overflowing with characters, taking old favourites, introducing new ones, and making them all work together in glorious harmony.|Fresh
It's not just breathtaking in its visuals, it's heartbreaking in its content, making Captain America: Civil War one of the best Marvel movies yet.|Fresh
I feel sorry for DC fans.|Fresh
Revels in it's complacency, spectacular only within the boundaries of what has become the serviceable standard for a Marvel film; it's all glory and no guts.|Fresh
Devotion among bros (debrotion?) is tested in Civil War, which sees suspicious boy scout Steve Rogers battle Tony Stark, in defence of his old Brooklyn buddy Bucky Barnes... [it's] unique; you don't often say that of 13th instalments.|Fresh
Where we afraid we would get tired of superhero movies? if what's comes next is as good as this, send me all the movies you want. [Full review in Spanish]|Fresh
There's enough variety in the action to sustain at least four major arrangements without resorting to more boom, smash and bam. For a two-and-a-half hour movie, everything's surprisingly well-paced.|Fresh
This is how Marvel Entertainment does the multi-hero smackdown thing, and man, does it deliver.|Fresh
This is good ridiculous fun, with a steady stream of wisecracks to accompany the fan-pleasing one-on-one match-ups.|Fresh
Marvel movies don't get much better than this. The trouble is, they don't want to.|Fresh
A large demonstration that Marvel can go much further. [Full review in Spanish]|Fresh
...a bright, vivid, compelling cocktail...|Fresh
It is during those scenes with Spider-Man that Marvel Studios demonstrates its greatest strength: a certainty of tone.|Fresh
Plotwise, there's a lot of ground to cover in Civil War (even at two-and-a-half hours). But the Russos juggle all of the murky motivations and shifting alliances with impressive deftness.|Fresh
Captain America: Civil War, has managed to reinvent the comic book movie once again, creating a film that's thoughtful, mature and moving at the same time as being a thrilling ensemble romp.|Fresh
Thanks to the extraordinary engineering work of screenwriters Christopher Markus and Stephen McFeely and directors Anthony and Joe Russo, this film keeps moving, never losing its sense of purpose.|Fresh
In the 2016 battle for superhero supremacy, Marvel has unquestionably delivered the knock-out blow.|Fresh
There is real maturity in a story of guilt, revenge, torn loyalties and tragic revelations - between the fights, explosions, chases and general awesomeness.|Fresh
Heroes or vigilantes is the question raised in this highly inventive, full-throttle adventure... An agile mind is required to keep up with the never-ending plot twists and leaps; it is refreshing to find genuine originality and flair|Fresh
Unlike Avengers: Age of Ultron, this is leaner and more low-key. Captain America: Civil War is less about citywide destruction or alien hordes being repelled than it is mistrust and internal divisions.|Fresh
Not only is it another stellar Cap movie, it's maybe my favorite Tony Stark movie, and it also proves how you put a million heroes in the same movie effectively.|Fresh
The Russos deliver the goods once again and prove to have a safe pair of hands when it comes to pacey, well-choreographed action and accommodating a large starry cast.|Fresh
It's a magnificent action film, it's a wonderful character piece, it's big, brash, bursting with confidence and brio; it's Marvel firing on all cylinders just when, by rights, we might be expecting the law of diminishing returns to set in.|Fresh
Once the plot kicks in, things chug along nicely, though action scenes are blighted by shaky camera syndrome.|Fresh
The biggest, the boldest and the most ambitious movie yet to come from Marvel Studios.|Fresh
The film's tone and themes feel a tiny bit darker and a lot more grown-up than usual, but the reaction it provokes is still one of giddy, childlike joy.|Fresh
If Captain America: Civil War is the true herald of Marvel's Phrase Three and its carefully planned future; maybe it doesn't actually feel so bad that we'll be getting these movies every year until the Earth collapses in on itself.|Fresh
The characters are multi-layered, crammed full of old allegiances and grudges and irritations. They have personalities. Remember those?|Fresh
There are still imperfections to be found in this Marvel offering, but when the highs are this good, it's hard not to temporarily give in to our new insect overlords.|Fresh
Packed to bursting with the one ingredient 'Batman v Superman' lacked: joy.|Fresh
The pitch is simple enough - liberalism or totalitarianism, heroes or vigilantes - and there's more than a whiff of American imperialism on both sides of the coin.|Fresh
Puts a certain other superhero vs superhero movie to shame.|Fresh
Calling this 'the best Marvel movie' is equivalent to proclaiming 'this is the best Dorito I've ever tasted.'|Fresh
This is the cinematic superhero showdown you've dreamt of since childhood, precisely because that's everything - and all - it wants to be.|Fresh
It's a huge aspartame rush of a film: a giant irresistible snack, not nutritious, but very tasty.|Fresh
This movie is so toothless that you'll probably pay for your ticket in a paper cup on the side of the road... it's so concerned with keeping everything in line for future movies that it ultimately takes no risks...|Rotten
In the best Comic Book film since The Dark Knight, the Russo Brothers along with Captain America and Iron Man completely knock it out of the park.|Fresh
[T]he best Marvel yet, with the greatest superhero action on film. It's immense, marvelous action-packed fun... [T]he single greatest pure superhero movie ever made.|Fresh
The Russos deftly craft compelling blockbuster entertainment out of moral and emotional conflicts.|Fresh
While slightly overlong, this movie is bright, creative, insightful, affecting and, above all else, fun.|Fresh
Tear away the powers, abilities and egos, though, and the third Captain America movie is at its core a deep exploration of friendship and family and what sacrifices should be made to hold onto both.|Fresh
Civil War isn't great despite being the third Captain America and thirteenth overall Marvel movie - it's great because of those things.|Fresh
Directors Anthony and Joe Russo continue to mine their experience with TV comedies, juggling all the members of their superhero family with a playful touch that both informs character interaction and delivers vital breathing room in between battles.|Fresh
If there's a risk of the Marvel 'formula' becoming stale, there isn't any evidence of that here. Civil War isn't just a damn-near-perfect popcorn crowd-pleaser; it doesn't offer any easy answers for its combatants, or the world going forward.|Fresh
Featuring what's arguably the best ever screen depiction of Spider-Man as well as a cool new hero in Black Panther, Captain America: Civil War can't quite recapture the emotional and cerebral strengths of its predecessor.|Fresh
"A gargantuan entertainment that finds room for a little emotional resonance underneath the sterling spectacle, ""Captain America: Civil War"" is a well-paced, thoroughly satisfying, completely overstuffed action-thriller."|Fresh
'Captain America: Civil War' Is Great Fun, Even As It Alternates Between Shameless Fan Service Bits And Subversive Narrative Choices.|Fresh
Matching its blockbuster scale and spectacle with the smarts of a great, grown-up thriller, Captain America: Civil War is Marvel Studios' finest film yet.|Fresh
"Call it ""civil war"" or call it brand extension; call it a ""cinematic universe"" or a corporate behemoth - the latest Marvel extravaganza furthers the studio's cross-pollination of action franchises in a way that's sure to satisfy devotees."|Fresh
The most mature and substantive picture to have yet emerged from the Marvel Cinematic Universe.|Fresh
Finally, a big budget superhero sequel that manages to be both effortlessly entertaining and utterly sobering, instead of just one of those things-or, as we've endured too frequently in the past, neither of them. (Looking at you, Batman v Superman.)|Fresh
This is the best Marvel movie so far. This is not hyperbole. I have my doubts they can make anything better.|Fresh
Bringing together tremendous character dynamics; bold structure; an emotional narrative; and spell-binding, fun action sequences, it's everything a blockbuster should be.|Fresh
It is entertaining without being fluffy. It has consequence without being dire. It is the floor of a child's bedroom, covered in action figures who are perpetually in mid-conflict, whose limitations have yet to be discovered.|Fresh
