Dependable, reliable, comforting - like ordering at a chain restaurant. You know what kind of meal you're going to get every time, and you'll most likely enjoy it.|Fresh
Highly entertaining.|Fresh
Splitsville followed by biffo, all with an extremely agreeable light touch.|Fresh
"My biggest complaint --- and one I'm weary of repeating --- is the habit of such films to include massive carnage by bombings, guns, car chases, etc. ""Captain America: Civil War"" would have been every bit as entertaining without this excessive violence."|Fresh
"""Captain America: Civil War"" has some surprises, but the battle scenes --- here we go again --- are far too long."|Fresh
The action-packed and daring Captain America: Civil War is the most game-changing chapter in the Marvel Cinematic Universe since -- well, since Captain America: The Winter Soldier.|Fresh
It's sure to please those who beat up on Batman v. Superman because it mixes lots of quips in with the action, the moralizing, and the tragic revelations.|Fresh
An impressive achievement, though not an especially interesting one.|Fresh
There is darkness, there is depth, but the important thing is that the element of fun is also most definitely present.|Fresh
Marvel proves yet again that it's not just running on a streak of luck: These guys have enough superhero tricks up their sleeve to keep us coming back for the foreseeable future.|Fresh
A blockbuster among blockbusters.|Fresh
CA:CV moves along at a brisk pace, the effects are fantastic and the superhero line-up is the best we have seen since Avengers Assemble. Bottom line, CA:CV is an entertaining film with some great action sequences.|Fresh
Simply put, when it comes to juggling multiple superheroes in a single movie, Marvel's latest comes close to setting the standard. And the studio, as well as the villagers, should have cause to rejoice.|Fresh
As overwhelming as all this seems, the story stays incredibly focused on what defines Steve Rogers...|Fresh
Mostly, this one registers as sound and fury, signifying sequels.|Rotten
Holland's webslinger is easily Civil War's best surprise. He projects a genuine sense of awe and wonder in the presence of the other heroes.|Fresh
It takes a while to get going, but once it does, it's a blast.|Fresh
Captain America: Civil War may look as if it's made from and operate as if it's beholden to the mold of the regular, old superhero movie, but it doesn't feel that way.|Fresh
The filmmakers ... understand that they've built up a vast ensemble of character types, all of them played by better-than-average actors, and that they can mix and match the drama, comedy, or action as they see fit.|Fresh
"""Captain America: Civil War"" is for every little kid who ever bashed one action figure into another while saying ""Pew! P-Pew! Kapow-shuh-WOOOOSH!!"" In other words, it's nearly perfect."|Fresh
A comic book extravaganza that's enhanced by wit and audacity, not to mention the sort of action that only mountains of money can buy.|Fresh
There's a lot wrong in the film's two and a half hours, but enough that's right to keep the train from falling off the tracks.|Fresh
"After the first two ""Captain America"" entries, the finest comic-book movies of the last five years, this one is disappointing."|Rotten
The biggest of all the Avengers films, and perhaps the most satisfying.|Fresh
Big, Bigger and Biggest doesn't equal Best in this Captain America chapter of the Avengers movie chronicle.|Rotten
Humor becomes a resource that saves the film. But even when that, the superhero formula is starting to feel old. [Full review in Spanish]|Fresh
...works better as big group caper film than action extravaganza.|Fresh
"Heroes fighting each other over a misunderstanding or ideological conflict is a longtime comic book staple. Batman v Superman is a great example of the exact wrong way to present this sort of conflict. ""Civil War"" nails it."|Fresh
Civil War hinges on a public outcry for accountability and oversight. Which sounds about as sexy as the minutes from a zoning meeting, but in practice makes for a toothsome debate|Fresh
The players salvage this thing with their acting and awesome thighs, and the fun really kicks in when Spider-Man (Tom Holland), Ant-Man (Paul Rudd), and Black Panther (Chadwick Boseman) join the squabble in an exhilarating airport sequence.|Fresh
It's not a great superhero fantasy but it's a good one -- genuine fun, thank heaven.|Fresh
"How the emotional dynamics of the schism impacts the characters is what elevates ""Civil War."" These are friends and comrades forced to fight for their beliefs. Each blow they inflict on each other is as painful to them as it is to their opponent."|Fresh
Civil War feels like just another overstuffed Marvel movie working itself through a brand strategy checklist. Plenty will he happy with that. And yes, it's rather more fun than the last time a couple of superheroes went at it on the big screen.|Fresh
This is one of the best movies Marvel has created.|Fresh
Delivers an epic adventure that finds its greatest power by scaling back the superhero antics to reveal the human combatants at their core.|Fresh
While this is one of the better Marvel efforts, Marvel and others are creating serious Super Hero fatigue. How many times can we see the same basic themes writ large?|Fresh
"""Captain America: Civil War"" does not in any way transcend the conventions of the genre. On the contrary: It succeeds because it doesn't really try."|Fresh
"It's a far cry from the grim, feigned gravitas of the Snyderverse. For those who relish the sprawl of the Marvel Comics universe, ""Civil War"" should be a delight."|Fresh
"[It] leaves plenty of ""Yeah, but what about ..."" questions unanswered. But the studio also delivers a few things better than ever here. Order the free-refill tub for what may be the popcorniest ride of the summer movie season."|Fresh
Has nearly all the strengths of the best Marvel Cinematic Universe movies so far, as well as some of the weaknesses.|Fresh
"Much of ""Captain America: Civil War"" is just the laborious working-out of leftover dangling plot elements from ""Captain America: The Winter Soldier"" two summers ago."|Rotten
"""Civil War"" gets right almost everything that the dull, serious and chaotic ""Batman vs. Superman"" got wrong."|Fresh
Civil War is of course a huge payoff for fans who've been following from the start, but even the casual movie-goers will pick up on the fact that there's something slightly more special about this one.|Fresh
Captain America: Civil War is a comic book pulped into today's newspaper.|Fresh
I appreciated Civil War for not only some great action scenes, but also for delving into more internal issues with our heroes, allowing us to see them from an alternate angle than what we're used to.|Fresh
"To the short list of superhero flicks that exceed expectations, add ""Captain America: Civil War."""|Fresh
Arguably the movie that the previous 12 Marvel adventures have all been working towards|Fresh
Lower your expectations and enjoy the CGI ride with characters who can do no cinematic wrong.|Fresh
It's wildly entertaining, emotionally moving at times, humorous, intense, and just plain fun.|Fresh
The Russos continue to prove themselves as fantastic filmmakers especially when it comes to action movies.|Fresh
Captain America: Civil War is the Avengers movie that Age of Ultron aspired to be.|Fresh
A joyous tour-de-force of superhero action with real ideas and strong emotions at heart.|Fresh
Plays out just like any grand superhero epic should, with plenty of edge of your seat action, thrills, comedy and more.(Full Content Review for Parents - Violence, Profanity etc. - Also Available)|Fresh
"""Captain America: Civil War"" appeals to me more strongly than any superhero movie of the last decade."|Fresh
A little too rambling at two and a half hours, but otherwise just the right shade of light and bright for a movie about superheroes fighting superheroes.|Fresh
"There are about ten movies going on in ""Captain America: Civil War,"" which is at least seven too many. The good news is, most of them are fun, and there are enough rousing moments to elevate the movie to Marvel's top tier."|Fresh
"Who emerges as the winner of this ""Civil War""? The audience. The picture delivers in a big, big way."|Fresh
If you live and breathe Marvel, this is one of the MCU's stronger offerings. If you are a spy coming in from the cold, the answer is not so clear.|Fresh
After the formulaic thrills of The Winter Soldier and Age of Ultron, Marvel's Avengers were in danger of getting stuck in a rut, but a smart script for this surprisingly focussed thriller kicks everything into a new direction.|Fresh
The filmmakers clearly understand the unique strengths and weaknesses of the various heroes, and they depict them smartly and distinctly over the course of the fight.|Fresh
Marvel employs its superpowers to ensure Captain America: Civil War is nothing like the underwhelming Batman v Superman. A deft touch, perfect casting and well-paced script does it.|Fresh
Despite its technical polish, it comes across more as just another assembly-line commercial product than the special event that fans are no doubt hoping for.|Rotten
Superhero-on-superhero collisions beyond the dreams of fanboy heaven.|Fresh
Suffice it to say that, rather than psychic powers or super-strength, casting has always been the Marvel movies' secret weapon. That holds true here, up to and including charismatic newcomers Chadwick Boseman [and] Tom Holland.|Fresh
New challenges, darker reflections, stranger characters, and enough dramatic lubrication to feed additional sequels and spin-offs, adding more width to this already gloriously widescreen world.|Fresh
The Captain America series are the most consistent and satisfying films that Marvel have made. And Civil War is the best one yet.|Fresh
The movie fumbles the question at the very heart of the Avengers but not before giving its fan base plenty of reasons to cheer.|Fresh
There are acknowledged costs to the movie's confrontations, from the bruises that almost every character sports to the bystanders who are killed in the crossfire.|Fresh
Toss in a few secrets revealed and Captain America: Civil War kicks off the summer movie season with a punch strong enough to make the Hulk's head spin.|Fresh
Fun, happily, is one of the many ingredients in copious supply here. When you include Paul Rudd as Ant-Man, how could it not be? Then again, there isn't a lot of room for him, so he's kind of wedged in there, but it's pretty swell when he's around.|Fresh
With every new installment of the comic book franchise, the scale gets bigger, relationships get trickier, new forces enter the fray.|Fresh
With Civil War, Marvel Studios has proven, once again, that the world's heroes remain in good hands.|Fresh
It probably doesn't need to run two and a half hours long, but at least it's a case of too much of a good thing.|Fresh
Where Batman v Superman tossed out ideas without ever thinking them all the way through, Civil War is constantly aware of the consequences of its characters' actions, both to themselves and to the people around them.|Fresh
In short, the movie has just about everything.|Fresh
Even if it's a great movie for the genre, the movie is far from perfect. [Full review in Spanish]|Fresh
One of the best blockbusters ever made.|Fresh
It all escalates into a group showdown that's gloriously fun and genuinely sad, because if you've made it through eight years of Marvel features, you care about these quippy oddballs and their imperfect alliance.|Fresh
Captain America: Civil War balances an over-loaded cast with ease, as this action-heavy new Marvel chapter will have viewers salivating over what comes next.|Fresh
The film's real conflict is idealism versus realism... The actualization of that conflict gives the Russo brothers an anchor around which to stage half a dozen top-flight superhero battles.|Fresh
Civil War resonates not only with our current climate of hostile political divisions and questions about American intervention in foreign conflicts. It also carries echoes of American anxieties that stretch back to the beginning of the 20th century.|Fresh
As amiable as he is, Spidey's presence compromises the very stakes Civil War is trying to pitch.|Fresh
A house divided against itself cannot stand. But in the case of Captain America: Civil War, a divided house brings out the best in this supersized superhero franchise.|Fresh
It's fine. But these movies are like going back to a magic show where the illusionist dazzled you the first time or two, and realizing he's just going to keep doing the same tricks.|Fresh
Downey is enough to make you think that an Avengers movie with no action at all might still be good. It might even be an improvement.|Fresh
As far as big superhero mash-ups are concerned, this one whets the appetite without providing a satisfying main course.|Fresh
Sure, it's too much and way too familiar. But Captain America: Civil War brings the fun, the fierce and the fireworks. Summer, we have liftoff.|Fresh
A tremendous feat of filmmaking. It will leave you breathless. It will make you laugh constantly. It will make you cheer. It will make you think about the positions these characters take, and it may put you at odds with a hero you love.|Fresh
There's a lot of something for everyone in this standardly super, superhero movie.|Fresh
Despite a dense first half that might confound newcomers, it delivers all the humor and action that fans have come to expect -- as well as the finest Avengers fight scene yet.|Fresh
It's just stultifyingly dutiful.|Rotten
By this time one would think that the Marvel formula was getting old and that it wouldn't work anymore, and yet the studio just keeps making it better.|Fresh
Ponderous pandering. And no Paltrow as Pepper Potts?|Rotten
Exceeds all expectations as this marvelous epic ensures every other summer blockbuster is vying for second best.|Fresh
It's simply just a story about the bonds of friendship, doing the right thing when presented with a difficult decision and how we're ultimately shaped by our choices.|Fresh
A good amount of self-aware humor permeates the challenging two-hour, 26-minute running time of this movie.|Fresh
If you do not count Guardians of the Galaxy -- because it remains an eccentric outlier -- Civil War now easily ranks as the best movie in the Marvel Cinematic Universe.|Fresh
Kudos to co-directors Anthony and Joe Russo and the team of writers for juggling more than a dozen comic-book characters and nearly that many plot lines, and only occasionally getting us (and by us I mean ME) lost in the Geek Weeds.|Fresh
Nothing in Civil War takes your breath away... Little in story terms is what you'd call daisy fresh. But almost everything in it works on its own prescribed terms, and the quiet moments register.|Fresh
Civil War, at its best, is blessedly light on its superhero-booted feet.|Fresh
Civil War lives in those moments when the smashing starts. The central fight between the two halves of the Avengers group is a tremendous sequence, full of imaginative teamwork and impressive effects.|Fresh
It does prove, if Marvel hasn't already, that something can be both a load-bearing act of brand extension and a nimble, colorful blast of entertainment.|Fresh
"Their respective motivations are convincing, and the 16-minute ""splash panel"" showdown at the Leipzeig airport is fun."|Fresh
In a time when superheros have proven to be complex and able to star in dramas, it feels like a letdown to see them reduced to quips and jokes. [Full review in Spanish]|Fresh
In the race with DC Comics, Marvel still comes out on top when it comes to fun.|Fresh
It's a rollicking and action-packed extravaganza in which every superhero has a moment to shine.|Fresh
The Russos understand how to pace action better than many of their MCU contemporaries, and as such, Civil War moves at a rapid clip despite all the table-setting and it being the lengthiest Marvel film to date at 146 minutes|Fresh
Naturally this is all cluttered and overstuffed to the point of bursting, and yet the convoluted feel and overfamiliarity of much of the plotting is compensated for by the Russo brothers knack for gargantuan action, some tough laughs and real acting.|Fresh
It's the most lively, engaging Marvel movie since Guardians of the Galaxy, and among the very best of the whole Avengers series.|Fresh
The undeniable fun of the action scenes only exacerbates the failure of the narrative to adequately contend with its own themes.|Rotten
The latest Captain America adventure us nothing more than a really long trailer for the new adventures of the new Spider-Man. [Full review in Spanish]|Rotten
While it lacks the sense of surprise of [the last film], its mix of action, humor, effects, the introduction of a new character and the reintroduction of an old one strikes just the right tone for a film that is as much about marketing as moviemaking.|Fresh
The summer movie season has barely begun, and already the remedy for superhero film fatigue has arrived.|Fresh
A taut, sinewy piece of filmmaking with enough brains to keep you engaged and enough brawn to keep you in awe.|Fresh
"The third ""Captain America"" film entertains relentlessly, which is to say loudly and busily, but with enough humor and intelligence to make it seem less pandering than it actually is."|Fresh
Captain America v Iron Man succeeds where Batman v Superman utterly failed. Civil War is Marvel's greatest action film so far.|Fresh
The Marvel blockbuster machine keeps on trucking with a double-sized new issue of Captain America that packs enough punch to distract from its grinding plot mechanics.|Fresh
"Marvel has no peer in this arena, and the utter perfect and sheer awesomeness of ""Captain America: Civil War"" is the best example of their superiority."|Fresh
Civil War is both a Captain America sequel and a third Avengers movie, and that's more than any movie could possibly pull off. It does the best it can, though.|Fresh
Bragging just a bit - see how many franchise characters we've got, DC? - Marvel practically doubles the number of superheroes for this movie. And it's too much.|Rotten
A direct sequel to Captain America: The Winter Soldier...a crazy-cool superhero teamup/smackdown movie to make Batman v Superman: Dawn of Justice look like a tea party, and a franchise-launching introduction to the new Spider-Man...|Fresh
Marvel makes it funny, and that charm and care is what has and will keep audiences coming back over and over again.|Fresh
"Just another entry to the superhero genre, they tried to make it ""the"" definitive film for it but it falls short, however, that doesn't mean this is a bad film at all. [Full review in Spanish]"|Fresh
The audience will truly b satisfied for a very specific reason: this is truly a battle between heroes. [Full review in Spanish]|Fresh
Cinema can also be a playground, and knowing that, Civil War is the best toy you can play with this summer. [Full review in Spanish]|Fresh
A film that doesn't really know what kind of movie it wants to be, and in the end is only entertaining action. [Full Review in Spanish]|Fresh
These films are supposed to make you have a good time at the theater, and Civil War guarantees it. [Full Review in Spanish]|Fresh
Civil War is just a little short from being one of the third best Marvel movies ever, but it's deffinately good. [Full review in Spanish]|Fresh
Marvel, our hats are well and truly off.|Fresh
Civil War has all the trappings to sway your experience and make you feel like you've watched the best superhero movie of your life.|Fresh
It's worth seeing alone for the ultimate superhero face-off battle scene - epic stuff.|Fresh
There's a light touch, and it is often funny. There are many series in-jokes -- the scene where Iron Man recruits Spider-Man (Tom Holland) is a classic example. And the action scenes are outstanding.|Fresh
The two sides arrive on the tarmac of Leipzig airport... [and] the result manages to resemble both a brawl in a Magaluf nightclub and one of the most purely delirious scenes in recent action cinema.|Fresh
A near perfect Superhero film! All that destruction in the previous films have real world consequences and those chickens come home to roost. There's no hugging it out this time.|Fresh
There's some good stuff in 'Captain America: Civil War.' That's what these Marvel things are now: a lot of stuff.|Rotten
If you're a fan of the previous Marvel films, then this film is pretty much just more of what you already like, with all the Marvel-spectacle you could ever hope for.|Fresh
Captain America: Civil War is one of the best superhero movies out there because it dares to break the formula. [Full review in Spanish]|Fresh
The best way to think of Captain America: Civil War is as a toy box in which the sheer quantity of toys partly makes up for the lack of anything new.|Fresh
There are more characters and subplots that a Game of Thrones episode but somehow, directors Anthony and Joe Russo have managed to mash it all together into something that works.|Fresh
A remarkably coherent and tightly focused affair that by virtue of clarity and concision, manages to keep all its ducks in a row while providing both the movies billed, i.e. the sequel to Winter Soldier and the Avengers' civil war.|Fresh
This film may excel at building anticipation for cool things coming a year or two down the line, but does a movie called Captain America that leaves you wishing you were watching one called Spider-Man really count as a win for blockbuster fans?|Fresh
The central debate is topical but it cries out for input from some of Marvel's newer creations (if only there was space for Ms Marvel, aka Kamala Khan, a Pakistani-American teen from New Jersey).|Fresh
Even for those of us who aren't comic-book devotees, Captain America: Civil War scores as pure cinematic escapism.|Fresh
The picture's great achievement is the adept balancing of so many characters. It never feels overstuffed and everyone has their moment and purpose while several new heroes are introduced.|Fresh
In many respects this is the Marvel movies' finest hour.|Fresh
The sheer force of so much superpowered personality on screen makes for a blast of a movie.|Fresh
A near-perfect blend of humour, drama and action.|Fresh
There are lots of other laugh-out-loud moments: self-aware, comic book-aware ones for Marvel fans and straight-out ones for non-expert viewers.|Fresh
Captain America: Civil War is very good, but the connective tissue between the powerful scenes, felt like chewy gristle in a great cut of steak.|Fresh
The Russos have taken a leaf out of Joss Whedon's playbook, remembering that as cool as they are in costume, the most character development happens when these superheroes are in civvies.|Fresh
Captain America: Civil War rumbles busily towards a confrontation between Cap and Iron Man, but that fistfight is perhaps the least interesting bit of this frenetic, hyperactive and intermittently enjoyable film.|Fresh
Tough, unanswerable human questions frame spectacular, innovative action sequences that are like superhero ballets. This series just keeps getting better.|Fresh
Are you #TeamCap or #TeamIronMan? If this question makes any sense to you then Captain America: Civil War and its superb action sequences will bring you untold joy.|Fresh
The directors and wrters know how to nit layers and plots together while also introducing new characters in a very organic way. [Full review in Spanish]|Fresh
Marvel shows how it's done and delivers one of their best movies to date. [Full review in Spanish]|Fresh
The Russo brothers use some elements of political thrillers and spy films to create some beats that give some breath to the visual spectacle we see on screen while giving us other moments to develop the plot. [Full review in Spanish]|Fresh
Civil War is one of the best Marvel movies and superhero movies overall. [Full review n Spanish]|Fresh
A near-perfect comic book movie.|Fresh
Another round of extravagant action, chewy ideas and whip-smart quips.|Fresh
One of Marvel's rare missteps, lacking the joy, excitement and sense of anything being possible that's always been the studio's hallmark.|Rotten
Seriously, DC Comics and Warner Bros. need to consider just outsourcing their movie production to Marvel/Disney from now on so they can do it properly.|Fresh
The best movie produced by Marvel Studios so far. [Full review in Portuguese]|Fresh
It all feels shudderingly hollow; a stack of briefs filled to a fault by a pair of journeyman directors.|Rotten
Not only does Civil War eschew the dull trend of city-wide destruction, it bases its entire plot on the consequences of having caused all that ruin.|Fresh
Marvel returns with their biggest blockbuster ever, proving how well they know how to deliver a product that audiences will love. [Full review in Spanish]|Fresh
Look, I don't begrudge those who love the Avengers, as they so passionately do. I'm just genuinely perplexed.|Rotten
It's not as gloomy as DC's recent efforts (few films are) and judicious doses of wit and charm relieve the angst and the smashing.|Fresh
Civil War, for all of its fanboy shout-outs, continues The Winter Soldier's sense of mystery and intrigue, using the shady shenanigans to drive action sequences that rarely feel forced.|Fresh
The political allegories are mostly abandoned and swapped for character motivation, as if we should never have bothered to contemplate a second meaning in the first place.|Rotten
Marvel movies are not adapted from stories they're based on, they seem to be the product of dreams. [Full review in Spanish]|Fresh
