A-grade filmmaking, as confident as it is competent, and a shiny stone in Marvel's gauntlet.|Fresh
It's commendable for having the right balance of story, character, emotion, humor AND high-octane action. The fight scenes are well-choreographed that you can actually SEE the action despite the sheer number of people fighting.|Fresh
So whose side am I on? #TeamCap or #TeamIronMan? Um, #TeamScarletWitch, OBVS. I was super stoked to see both her and Black Widow get as much screen time as they did.|Fresh
Civil War is the best thing Marvel Studios has produced. Not only does it work well as the third act of the ballad of Steve and Bucky, but it sets up the future of the MCU brilliantly.|Fresh
Marvel is playing it safe and its themes of vengeance never see a real consequence. [Full Review in Spanish]|Rotten
With one plothole that doesn't really derail the film, it's hard not to just applaud it for being able to juggle so much and still make it a satisfying watch. Top stuff.|Fresh
Even in films dealing with such dark subject matter, the MCU still manages to make to capture our hearts and make us laugh.|Fresh
I found the tone refreshing, although some may be put off by all the chattiness and debate in a movie that is nearly two-and-a-half hours long.|Fresh
Now we have Captain America: Civil War, a film in which every single character decision is deeply personal, deeply emotional.|Fresh
"(It) never felt beholden to ""world building"" of establishing the many films that will be following; however, it did feel richly constructed upon the many films made prior."|Fresh
A-grade filmmaking, as confident as it is competent, and a shiny stone in Marvel's gauntlet.|Fresh
It's commendable for having the right balance of story, character, emotion, humor AND high-octane action. The fight scenes are well-choreographed that you can actually SEE the action despite the sheer number of people fighting.|Fresh
So whose side am I on? #TeamCap or #TeamIronMan? Um, #TeamScarletWitch, OBVS. I was super stoked to see both her and Black Widow get as much screen time as they did.|Fresh
Civil War is the best thing Marvel Studios has produced. Not only does it work well as the third act of the ballad of Steve and Bucky, but it sets up the future of the MCU brilliantly.|Fresh
Marvel is playing it safe and its themes of vengeance never see a real consequence. [Full Review in Spanish]|Rotten
With one plothole that doesn't really derail the film, it's hard not to just applaud it for being able to juggle so much and still make it a satisfying watch. Top stuff.|Fresh
Even in films dealing with such dark subject matter, the MCU still manages to make to capture our hearts and make us laugh.|Fresh
I found the tone refreshing, although some may be put off by all the chattiness and debate in a movie that is nearly two-and-a-half hours long.|Fresh
Now we have Captain America: Civil War, a film in which every single character decision is deeply personal, deeply emotional.|Fresh
"(It) never felt beholden to ""world building"" of establishing the many films that will be following; however, it did feel richly constructed upon the many films made prior."|Fresh
Overall, Civil War is the most adult and realized film in the Marvel Cinematic Universe and it comes highly recommended.|Fresh
DC Comics should be worried because Civil War has definitely set the bar high and comic book fans across the world will not be disappointed.|Fresh
Yeah, 'Captain America: Civil War' is true to its frenetic form as revved up entertainment preparing moviegoers for the upcoming summertime sizzle at the box office. After all, the on-screen Marvel Comics gravy train keeps moving merrily along|Fresh
With world domination planned and films mapped out for over a decade, Marvel need an injection of originality before the masses start to realise their schtick is wearing thin.|Rotten
Armed with the confidence that can only come from an unprecedented record of sustained success that's without comparison in this genre, Civil War emerges as as the strongest offering yet from Marvel Studios.|Fresh
Captain America: Civil War balances all of its moving parts effortlessly to craft what could easily be the MCU's grandest adventure yet.|Fresh
The movie does wander off-topic just a bit at moments, but for the most part, this is a superhero epic with something real on its mind and the chops to present it well.|Fresh
Civil War is an assured, confident conclusion to a trilogy that builds organically upon its established elements.|Fresh
It manages to capture the super hero team as its only ever been done in animated series. It's next to impossible to get this kind of emotional connectedness in a few hours.|Fresh
This is Marvel Studio's best film to date bar none.|Fresh
At least these superfriends can still crack a joke (I've never been more grateful for Anthony Mackie's light touch) and, for all its seriousness, Civil War sustains a much-needed sense of humor.|Fresh
Most of the film's pleasures come from dorky pipsqueak Tom Holland taking up the mantle of Spider-Man and joining the fight between Avengers factions.|Fresh
"With swift pacing, a generally well-rounded story, and fantastic action sequences, ""Civil War"" is not to be missed."|Fresh
This is one for the whole family, and even worth the extra investment to see it in IMAX 3D... And while you might find some of the scenes a bit stretched out (the film is almost two-and-a-half-hours long), you'll certainly get your money's worth.|Fresh
Overall, the lack of ingenuity makes for a lackluster story in need of major content editing.|Rotten
The film is actually quite funny (tons of inside jokes for the comic book devotees) charming and heartfelt in many places. The other places, well, mega destruction and over-the-top action rules.|Fresh
Captain America: Civil War focuses on the approach of superheroes to what's right and what's wrong. This movie makes you pick a side because both have very valid points.|Fresh
At the heart of Captain America: Civil War is an amazing shape-shifting ability. It is a film that confronts the consequences of super-heroic intervention, while also providing a popcorn-worthy bang-pow experience.|Fresh
There are a lot of superheroes in this, they found the right amount of time for each superhero. Everyone feels right with the amount of time that they are in this movie...This feels like an Avengers movie. Everyone shines in this.|Fresh
The new characters totally live up to their new expectations...probably the best live action Spider-Man I have ever seen.|Fresh
If we can continue to get movies as good as Captain America: Civil War, comic book adaptations are not a bubble about to burst; we're entering a golden age where everything is firing on all cylinders|Fresh
There are a lot of players in this film but it never really feels like it's too crowded. It's just crowded enough to be an enjoyable film.|Fresh
While it's immensely entertaining and has a biting sense of humor to boot, the film feels more like an Avengers series film than a stand-alone Cap pic.|Fresh
Captain America: Civil War is very much a sequel to Winter Soldier but, regrettably, too long, tryingly complicated and it takes the best part of 75 minutes before it breaks into anything resembling comic exuberance.|Rotten
Good luck picking a favorite fight, because every action scene is incredible.|Fresh
Only the Russo brothers have knocked it out of the park twice. This is the film with everything.|Fresh
From start to finish, Captain America: Civil War reminds us that there is a capable soldier and a remarkable human behind the mask and shield.|Fresh
Actually, instead of Captain America: Civil War, a more appropriate title might be Captain America: Cap and Iron Man Get Their Iddy-Biddy Feewings Hurt.|Rotten
Emotionally satisfying in a way that most other MCU movies can only dream of being.|Fresh
"""Captain America: Civil War"" is a movie about faith - in each other, in leaders, in an ethos - in a universe that is becoming increasingly secular."|Fresh
It's the balance of conflict at its core, and the film's willingness to expose and explore the deep-rooted feelings of its characters that makes Captain America: Civil War such a success.|Fresh
In many ways, Civil War is Marvel's darkest and heaviest movie to date, but that's part of what makes it the studio's best.|Fresh
This is one of the best films Marvel have produced.|Fresh
An interesting ending to the Steve Rogers saga and a promising start to the third stage of the Marvel Cinematic Universe. [Full review in Spanish]|Fresh
Captain America: Civil War proves that Marvel knows how to lay down a stunning foundation in order to detail an epic saga.|Fresh
Coming out a month after the miserable bomb that was Batman V Superman has only helped to make Marvel's latest entry into the Avengers franchise look like a damn classic in comparison.|Fresh
With some incredibly innovative action, some deeper, thought-provoking themes, and a plethora of dynamic characters, both old and new, Captain America: Civil War is among the very best of the Marvel Cinematic Universe.|Fresh
Captain America: Civil War turns The Avengers inside out, forcing conflict between the characters while managing to stage big action set pieces and even bigger jokes.|Fresh
It's nearly a perfect comic book film.|Fresh
The good news about Civil War is that those willing to bone up on the backstory will find characters they actually care about enough to root for.|Fresh
Captain America: Civil War is without a doubt my new favorite superhero movie.|Fresh
When the big battle between two feuding factions of the Avengers finally happens, it's a doozy.|Fresh
Never mind if his stuff is cut with unbelievable dross, if the acting is terrible, the costumes are hideous, if the wigs are preposterous and the codpieces are disappointingly flat, loyal fans will still come back to be expertly fleeced.|Rotten
... this is exactly what we asked for since (Steve) and Tony squared off in The Avengers... but it is also not what we wanted - and that's a good thing.|Fresh
[While] the Russo brothers in the directors chair show a fairly deft hand at balancing a dozen characters and keeping the action exciting, elsewhere there's a bit of flailing.|Fresh
A perfectly fine brand deposit in the Marvel Cinematic Universe.|Fresh
If we don't have something quite as fun and thrilling as The Avengers, we're still a hell of a long way from Zack Snyder's regrettable, murky Batman v Superman: Dawn of Justice fiasco.|Fresh
Thanks to its unpredictable story and avoidance of bombastic supervillain showdowns, Civil War stands out from Marvel's fun but formulaic back-catalog.|Fresh
Joe and Anthony Russo (who directed the earlier Captain America: Winter Soldier, which introduced even more story threads picked up in this film's dense plot weave) are actually quite adept at this kind of big team juggling.|Fresh
Its many ideas, plot-points and characters are expertly conceived, written and portrayed to make for a roller coaster of a superhero movie.|Fresh
A tour de force in action and intrigue, Captain America: Civil War has raised the bar when it comes to what a Marvel movie can achieve.|Fresh
Captain America: Civil War may seem like just another action-packed Marvel outing on the surface, but delving a little deeper, we find a fascinating entry to the series that allows us to explore these characters from an alternate angle than usual.|Fresh
Captain America: Civil War is fun; it's too well made, acted and scripted for it to be anything less.|Fresh
The real key to Captain America: Civil War is its sense of inevitability, and its acceptance that sometimes things change-they change big.|Fresh
Despite the name on the marquee and the content of the advertising campaign, this is very much a film about Tony Stark (Robert Downey Jr.).|Fresh
Captain America: Civil War is good, but too stuffed to be great.|Fresh
Civil War is the Marvel machine doing things right, but the machine is still designed to make films with all of the corners rounded off and all of the themes simplistic enough for ten-year-olds.|Fresh
"Recalls last year's extravaganza ""Avengers: Age of Ultron,"" although it's less slick and has a stronger emotional center."|Fresh
It's this light-heartedness that keeps Captain America: Civil War from succumbing to the kind of pretentiousness that marred Batman V. Superman.|Fresh
The most mature, smart and fun Marvel movie. [Full review in Spanish]|Fresh
Marvel's response to superhero fatigue, then, is clear: Double-down on character and up the storytelling's short game as well as its long game. It's an old-fashioned strategy, and it absolutely works.|Fresh
Marvel, with its comic strip cool, Industrial Light & Magic control of gravity, what may be the largest ensemble of characters in its movie history and visual artistry, has done it again.|Fresh
It wields an equally large cast with surprising dexterity, never losing sight of which players matter most to the story it's trying to tell.|Fresh
"Joe and Anthony Russo effectively hit the pause button on the Avengers franchise to address the human cost of ""collateral damage,"" while still delivering the impressive action we've come to expect from the Marvel franchise."|Fresh
Civil War is fun. It's smart. It's coherent. And, most importantly, it allows its heart to beat strongly amid the chaos, with character moments and set pieces working in tandem to create perhaps Marvel's best film so far.|Fresh
It's more of the same, of course it has a little more entertainment, but it's the same tendency to repeat what has worked in the past, nothing new. [Full review in Spanish]|Rotten
This satisfying adventure is rich with the things Marvel comics always did best: critiquing the consequences of power in explosive, four-color form.|Fresh
Like guest star Ant-Man in his new Giant-Man identity, this somewhat ungainly Marvel sequel almost collapses under its own weight.|Fresh
In Captain America: Civil War, the intelligent plotting, thoughtful character development and blockbuster action of the past two instalments comes to a thrilling apex.|Fresh
Anthony and Joe Russo's first-rate feature provides both invigorating action and genuine contemplation. It's an engaging superhero movie that actually ponders the human cost of doing all that cool stuff.|Fresh
On par with the recent Avengers combo films, but quite inferior to the prior Captain America outing.|Fresh
Very entertaining, and a far tighter production than much of Marvel's recent output.|Fresh
Not the best Marvel movie, but does do the best job balancing its obligations, while also boasting the series' best action sequence (Splice Today)|Fresh
A good, disposable piece of FX-driven entertainment, even if it comes with the obligatory one-act storyline, lack of originality and 30-minute over-run.|Fresh
Anthony and Joe Russo make a cheerful show of it, giving their gee-whiz comic book audience all they could wish for -- and more. But that's the problem -- it's still just 90 minutes worth of story stretched out to two-and-a-half hours.|Rotten
It's this levity that makes the much-touted battle royale between Team Cap and Team Iron Man so much fun.|Fresh
Hey, two superheroes can do battle without totally sucking.|Fresh
The fact that Civil War ponders the importance of those who've died in conflicts doesn't add complexity to the film, it just fills it with hipocrisy. [Full review in Spanish]|Rotten
SO entertaining it wll feel short, even if it's two and a half hours. I wanted more. Please give us more! [Full review in Spanish]|Fresh
"Captain America and Iron Man almost represent the schism that now divides American voters, politicians, and pundits. I say ""almost,"" because the film...doesn't inspire reflection upon the dire seriousness of our current ideological civil war."|Rotten
When I saw that this was going to be a clash of superheroes, with former friends fighting each other, I wondered how they were going to set it up. Very carefully, it turns out, with a solid screenplay and strong performances.|Fresh
A magnificent superhero film, with endearing characters, humor and action to go with an interesting plot and a well told story. [Full review in Spanish]|Fresh
The Russo Brothers created and exciting film with one of the best action scenes in the whole MCU. [Full review in Spanish]|Fresh
(Visually), the Russos aim for clarity and hit the bullseye. And more importantly, they'll satisfy a core audience of fan-types that can be, shall we say, high-maintenance.|Fresh
"""Civil War"" invites too many people to the party and is a little too beholden to other once-and-future movies to match the excellence of its predecessors."|Fresh
http://www.spiritualityandpractice.com/films/reviews/view/28172/captain-america-civil-war|Fresh
Captain America and Iron Man have always had a humorously antagonistic relationship, with the former's red-white-and-blue purity conflicting with the latter's narcissistic vulgarity, so watching them truly at odds with each other packs a punch|Fresh
Marvel has defied expectations yet again with this action-packed but thought-provoking entry that masterfully introduces Tom Holland as the next Spider-Man.|Fresh
A barely adequate, tonally berserk lyric to the pains of franchise building. In other words, it does absurdly little with a whole lot.|Fresh
An underwhelming exercise in sound and fury striclty for brains on pause. .|Rotten
The fun and excitement of Captain America: Civil War carries it through a slow start and weak premise. It sets up great expectations for new chapters, and after this epic fracturing of their Avengers friendship, we want to know where they go from here.|Fresh
Dull, overlong, exhausting and mildly entertaining without rising to the heights of the first Captain America's palpable thrills, suspense and intrigue|Rotten
Cap has not just saved the world, he's saved a comic book universe from complacency by boldly raising the ante on all who dare follow this wonderful, magnificent entertainment.|Fresh
In an era when superhero flicks hit theaters with the same frequency as bugs hit windshields, Captain America: Civil War still manages to rise above the fray and declare itself one of the finest pictures yet from Team Stan Lee.|Fresh
These are real characters, not empty action figures, and they're the reason the MCU has gone from success to success while other superhero franchises have stumbled or stalled.|Fresh
a rip-snorting action adventure with a clever plot that appeals to both the fan-boy and fan-girl, as well as an intelligent consideration of the uses and responsibilities of power|Fresh
POW! Crammed with action, it's a superhero slog as the Marvel Cinematic Universe marches on...|Fresh
Captain America: Civil War is the movie equivalent of the all-dressed potato chip: A junk food classic that can't be denied, but can never truly satisfy our desire for something original.|Rotten
Above all, it's simply a well-made movie: juggling a staggering number of characters with absolute effortlessness and readily expanding Marvel's collection of heroes without cramming them in.|Fresh
Captain America: Civil War is precisely crafted as one of the best comic book films of all time. It's as if Return of the Jedi stole all of the action sequences from Die Hard: With a Vengeance and Mad Max: Beyond Thunderdome.|Fresh
Captain America: Civil War is a great superhero blockbuster that lays the groundwork for even bigger and better things to come in Phase 3 of the MCU.|Fresh
a powerful film dealing with complex human emotions with roots in revenge and loyalty|Fresh
A perfectly well paced and coherent tale about revenge and the question of absolute power resulting in absolute corruption.|Fresh
Civil War maintains the same balance of action and significant (if brief) character development/interaction that made Winter Soldier so enjoyable.|Fresh
An entertaining, intelligent, and smart film for a blockbuster. Definately not just for fans. [Full review in Spanish]|Fresh
The film flows smoothly because of the great physical and verbal gags, but also because of the perfectly constructed fight scenes. [Full review in Spanish]|Fresh
Exciting and ingeniously conceived, this is Marvel working at the top of its cinematic game.|Fresh
Buckle in. The ultimate battle of superhero titans is about to take off in Marvel's Captain America: Civil War and hold onto your seats, folks, because this is one helluva ride - and the best Marvel movie to date.|Fresh
Chris Evans, with his pumped-up muscles and thawed-out all-American good looks, adds greatly to making this a satisfying watch.|Fresh
Massive, overstuffed, overlong and yet fleet-footed, witty and terrifically entertaining.|Fresh
Slid off my senses like Thor's hammer across Cap's vibranium shield -- the powerhouse hits land without so much as a scratch.|Rotten
The sad middle-aged dudes who cling so desperately to these films require constant reassurances that they're not just fun stories for children in which men wear tights.|Rotten
Listening to the applause of cheers for deaths and devastation was a bit scary and more and more what we are seeing in real life. No wonder why!|Rotten
Captain America: Civil War, the third and perhaps final installment of the Captain America movie franchise is the kind of smart, emotionally resonant and visually exhilarating movie fans of the genre have been waiting for.|Fresh
The latest Marvel movie to build on the series' past while setting up its future, Captain America: Civil War is also the most ambitious film yet in that comic-book cinematic universe.|Fresh
Civil War's conflict is earned rather than contrived. It's the culmination of tense friendships and strained egos that Marvel has cultivated for years. The stakes feel real, which gives this comic book spectacle more heft than the genre usually deserves.|Fresh
The balance that Captain America: Civil War strikes between action, character, emotion, humor, and intellectual debate makes this a compendium of all the best things the Marvel movies have had to offer.|Fresh
It isn't a perfect effort, but it's plenty to reach summer blockbuster status, and Civil War will leave fans salivating for the next installment in the series.|Fresh
Not as bad as Batman v. Superman. But way too long and dumb. Who believes they are out to kill one another?|Fresh
This movie feels like the fanboy event we've been sold before that wasn't delivered, epically constructed and briskly paced.|Fresh
Intense, entertaining adventure is a great threequel.|Fresh
"""...for me to consider  Captain America: Civil War a good movie - good enough to make me forget Prince had just died - it must be pretty good indeed."|Fresh
...while one of the story lines does pick up from Captain America: The Winter Soldier, it's Iron Man who steals the show.|Fresh
Damned if it isn't fun to watch Spider-Man pull off a Johnny Lawrence-approved leg sweep of Captain America.|Fresh
Civil War is a shiny, inoffensive product meant to make millions for Disney on a global scale. It also delivers more pure entertainment than any film in recent memory.|Fresh
A big, sprawling superhero mega-movie, with more spandex to the gallon than any flick that's come down the pike in a long time.|Fresh
"...make no mistake, this movie plays like a third ""Avengers"" film hidden within the thin, sub-hero veneer."|Fresh
Scads of characters, oodles of travel, acres of eye-punishing shakey-cam action - the movie's excess of just about everything overwhelms its virtues.|Fresh
The Russos devote substantial time undoing the incoherent mess Joss Whedon left behind in AGE OF ULTRON...|Fresh
A non-stop action movie, but they can't stop the deeper, more interesting film emerging.|Fresh
As long as talented, passionate filmmakers continue to be brought aboard to take these stories and characters in fresh directions, there is no reason to expect this massive franchise will grow stale or lose its vitality anytime soon.|Fresh
This is a stark example of what movies have become, which is intellectual diarrhea...there is no acting...just one ridiculous fight after another between and among people who are more or less invulnerable. But, get used to it. This junk makes money.|Rotten
Civil War is much better than Age of Ultron, but as a sequel of The Winter Soldier it falls short. [Full review in Spanish]|Fresh
There remains a lot to like about it, such as an opening battle offering some sparkling 3-D effects, the thrilling final showdown, and its showcase cast.|Fresh
...just another loud, overblown Marvel misfire...|Rotten
In the end this is a movie about friendships and conflict, and what can happen when the latter overwhelms the former. It's about two genuine heroes who can't reconcile their obligations and duties with the friendship they both cherish.|Fresh
If there's something that we need to mention above civil war's perfect technical execution and rollercoster rythym, it's the way the characters connect with the audience after many years of exploring them. [Full review in Spanish]|Fresh
"The ""civil war"" that erupts among Avengers foments filmmaking invention, not anarchy. It harks back to a comic-book tradition that predates the Avengers."|Fresh
The good news about the latest Marvel project to land on the screen is that it's livelier and more entertaining than the other Avenger offerings -- even if this one technically waves the Captain America banner.|Fresh
Civil War makes a pretense of pondering the consequences of going rogue. But Marvel is all about playing it safe.|Rotten
Downey Jr. persists in trying to give a real performance in these Marvel movies, and, against all odds, succeeds.|Fresh
The super-charged 'Captain America: Civil War' is a winner.|Fresh
