Oldman commands every inch of the frame, and director Joe Wright often finds him in dark spaces, with a shaft of sunlight miraculously touching only him.|Fresh
Everything about the film is exemplary and would fit well on a double bill of history with Dunkirk.|Fresh
Gary Oldman's transformative portrayal of Winston Churchill in Joe Wright's Darkest Hour achieves the same rarefied orbit as Marlon Brando's interpretation of the Godfather. If this be critical blasphemy, so be it.|Fresh
Darkest Hour rises above the trappings of its genre thanks to a stirring performance by Gary Oldman.|Fresh
Wright tones down his usual visual flourishes, but his dramatic command is the strongest it's been in years.|Fresh
While Dunkirk is all visceral action and Their Finest gentle satire, however, Darkest Hour is mostly talk, focusing on political negotiations between the faction who wanted to sue for peace and those who wanted to fight...|Fresh
Oldman disappears into the role...and Kristin Scott Thomas is impeccable in showing us Clementine's elegance and resolve.|Fresh
Makes you wish we had someone like Churchill to help fight the Nazis this time.|Fresh
It's less effective in crafting a portrait of this man outside of the political and military realm.|Rotten
From an historical point of view, there are aspects of Wright's film one might debate, but, capped by Oldman's strong performance, it's one of the better recent films about the great British statesman.|Fresh
Joe Wright slathers this biopic with self-conscious artistry, but Gary Oldman is terrific as Churchill.|Fresh
By showing Churchill's fears and anxieties, Oldman elevates the man from a two-dimensional historical figure to a flawed human being, who mustered the courage to meet a great and grave challenge that could alter the course of history.|Fresh
"Far from being a dry biopic, ""Darkest Hour"" reminds us that some things - such as honor and freedom - are worth fighting for."|Fresh
As played by [Gary] Oldman, Churchill has perhaps never seemed greater. Or more human|Fresh
Buried under pounds of makeup, puffing cigars as if his life depended on it and railing against the Nazis (Nazzis in his pronunciation) at every turn, Oldman is terrific.|Fresh
The main attraction here is Gary Oldman as Churchill. As an act of physical transformation and emotional expression, it's something close to supernatural.|Fresh
"""Darkest Hour"" pulls from both extremes of Oldman's prodigious but often unexploited skill set, the subtlety as well as the flamboyance."|Fresh
"As a portrait of leadership at its most brilliant, thoughtful and morally courageous, ""Darkest Hour"" is the movie we need right now."|Fresh
"""Darkest Hour"" is a persuasive window into history, and so arresting in its portrait of one of the 20th century's most important leaders that every minute of it is absorbing."|Fresh
"""Darkest Hour"" is good, glib entertainment."|Fresh
Director Wright, a renowned maker of Oscar bait (Atonement, Pride and Prejudice), coats the action in the hazy ochre tint that spells H-I-S-T-O-R-Y, but it's Winnie we want.|Fresh
There hasn't been a historical figure this convincing and meticulously brought to life since Daniel Day-Lewis put on the iconic black top hat to play Abraham Lincoln|Fresh
Nimble Brit director Joe Wright arrives again; it seems like he's always arriving every couple of years, every other film announcing himself as a bold maker of thumping entertainments, who alternates precise, startling work with fancies that fail.|Fresh
Suitably stylish, emerging as a career-defining Oscar vehicle for Gary Oldman.|Fresh
Churchill's darkest hour is Gary Oldman's finest. Gripping, touching, amusing and enlightening, his performance is the prime reason this film must be seen - but not the only one.|Fresh
Mr. Oldman's interpretations of the great man's speeches elevate this film...|Fresh
In every aspect, Oldman proves a charismatic draw.|Fresh
A stirring but flawed World War II film.|Fresh
Now it's Churchill's turn to be shrunken down to a more manageable size.|Rotten
A history lesson for many and an acting clinic for most, Darkest Hour features an outstanding cast and inspirational themes, some of the elements of good cinema.|Fresh
Oldman is quite special, nevertheless. It's a performance that's as technically astonishing as it is, simply, fun to watch.|Fresh
"""Darkest Hour's"" greatest achievement is reminding us how different the world almost was but for one man's ability to lead others to fight against fascism."|Fresh
"While ""Darkest Hour"" is a showcase for Oldman's incredible performance, Wright's aesthetic visually transports the viewer, the images heavy with subtext and meaning."|Fresh
It is always Gary Oldman's phenomenal performance that keeps the film airborne.|Fresh
Were Darkest Hour just a symphony of World War II nostalgia, it'd probably still be a good watch. But because the film makes the effort to go deeper, it becomes something much more memorable.|Fresh
How badly we need another Winston Churchill film is open to question. Nonetheless, Joe Wright's contribution to the genre is welcome, largely because of Gary Oldman in the leading role.|Fresh
It is not a bad movie, or even a mediocre one. And yet it's an impossible film to get all that worked up about, because it seems to exist solely so we can all weightily exhale over how much Gary Oldman has Disappeared Into His Role.|Fresh
"""Darkest Hour"" is a by-the-books biopic anchored by a towering performance."|Rotten
The film as a whole is a bit flawed, but when you put such a glorious piece of acting into the recreation of a captivating piece of history, it's hard to go too far wrong.|Fresh
Gary Oldman delivers a career-defining performance as British Prime Minister Winston Churchill in Darkest Hour.|Fresh
Pure Hollywood Poppycock. The War Cabinet, including Chamberlain, was almost totally behind Churchill and opposed to Lord Halifax's desire to sue for peace, not the contrary shown in this movie. This entire movie is fiction, and shame on it for that.|Rotten
The movie has sweeping cinematic texture, expressed in Wright's affinity for long takes.|Fresh
Oldman ... seizes upon the role of Winston Churchill the way an old bulldog takes hold of a lamb bone. He gets his teeth into it. He shakes it about. And he will absolutely not let go until he's gotten every bit of marrow out of it.|Fresh
Hidden behind resplendent latex jowls, Gary Oldman plays Churchill as a stout-hearted but deliberative man who's willing to paddle against the political tide, but doesn't arrive at his confidence easily.|Fresh
This ambitious film takes what we know as history and captures the immediacy and uncertainty of that fateful period. But the real strength ofDarkest Hour-and the reason it must be seen-is Gary Oldman.|Fresh
Too bad that, for all of its political savvy and recently unearthed details, the movie built around this magnificent performance gets corny and cutesy with dispiriting regularity.|Rotten
What distinguishes Darkest Hour is that it's a film based on words: the three famous speeches Britain's prime minister rallied the world with in 1940.|Fresh
There is definitely greatness in the way Oldman takes a role that has already been played by so many actors, and makes it utterly his own. Don't bet against him flashing that 'V For Victory' sign on Oscar night.|Fresh
Darkest Hour is a stirring film and an entertaining one, and it feels inspiring at the end of a trying year.|Fresh
The film itself may skirt stodginess, but Oldman, who has played everyone from Sid Vicious to Ludwig van Beethoven to Lee Harvey Oswald, never does. (The extraordinary makeup job is courtesy of Kazuhiro Tsuji.)|Fresh
Mild but talky look at Churchill's early days in power.|Fresh
An immensely important time period, but [one that] also succeeds in feeling tremendously relevant.|Fresh
The transformation makeup artist Kazuhiro Tsuji and Oldman achieved in this film is mind-blowing.|Fresh
While Gary Oldman's phenomenal work as Winston Churchill had been heralded in advance, it is astonishingly equaled by the film's achievements in direction, screenwriting, score and cinematography.|Fresh
The movie doesn't quite extract blood, sweat, or tears, even if it does toil.|Fresh
Oldman's portrayal of Churchill is that much more forceful and convincing, thus he should be the front-runner come Oscar season for Best Actor.|Fresh
Did the world really need yet another version of Winston Churchill's first few days in office? With Gary Oldman portraying the crusty Prime Minister, the answer is yes.|Fresh
Darkest Hour is more challenging and even more revelatory than run-of-the-mill awards-season releases.|Fresh
Hello, Oscar! Gary Oldman gives the performance of the year as Winston Churchill in director Joe Wright's rip-roaring take on the celebrated Prime Minister's first tumultuous month in office.|Fresh
Gary Oldman gives an impeccable performance as Winston Churchill in a gorgeously photographed, suspenseful World War II film that suffers from too much hero worship.|Fresh
I don't think we'll ever see anyone else do Churchill this well again unless the man himself comes back from the dead.|Fresh
"""Darkest Hour"" is proud of its hero, proud of itself and proud to have come down on the right side of history nearly 80 years after the fact. It wants you to share that pride, and to claim a share of it. But we have nothing to be proud of."|Rotten
Oldman's brassy presentation goes well beyond a collection of mannerisms. It gives us a sense of a flesh and blood person behind the bulldog-fierce political leader who presided over his country's celebrated World War II resistance.|Fresh
Gary Oldman should probably skip past Oscar talk and jump directly to knighthood for Darkest Hour, a screen portrait of Churchill against which all others will be measured.|Fresh
All the political infighting and wartime drama is just window dressing for Oldman's performance as Churchill, and it's one for the books.|Fresh
The film has a crisp British comportment-a dutiful, cheerio resolve-that serves it quite well.|Fresh
Darkest Hour is fine, but forgettable. You can feel the filmmaker's fear of failure in every bog-standard biopic scene.|Rotten
Oldman's leonine prowling satisfies as statesman theater, even if there are scenes that too easily tip toward mythic silliness.|Fresh
Few actors put their blood, toil, sweat and tears into a role like Gary Oldman.|Fresh
...a film predicated on dialogue and performance, and in those areas it delivers completely.|Fresh
It's a rousing wiki-deep summary of the gist of Winston Churchill's first month in power, from his assumption of the office of prime minister to his delivery of the second most famous to-arms speech in British history.|Fresh
... a lukewarm academic final result. [Full review in Spanish]|Fresh
The performance is a marvel, not merely leaping over what could have been a stunt, but deepening into a soulful portrayal of wartime leadership, tinged with ego, doubt and the demands of a terrible moment.|Fresh
Polished Oscar bait with an award-worthy performance by Gary Oldman.|Fresh
Gary Oldman hasn't done a deep dive into a character for years, but he makes up for lost time with a spectacular performance as British Prime Minister Winston Churchill, rousing the country to fight the Nazis against all odds at the start of World War II.|Fresh
Oldman immerses himself so deeply in the role that the actor disappears.|Fresh
The cast often transcends the hokum of the screenplay.|Fresh
...a handy political strategy companion piece to the more abstracted combat narrative of 'Dunkirk.'|Fresh
Oldman has disappeared into roles before - from Dracula and Beethoven to Sid Vicious and Lee Harvey Oswald - but never so wholly and superbly as in director Joe Wright's Darkest Hour.|Fresh
The details aren't as important as the grand sweep, and these historical figures are tools to illustrate big, fat human themes of perseverance and identity.|Fresh
Darkest Hour is a worthy companion to Christopher Nolan's Dunkirk because it reveals how difficult it was for the politicians to engineer the earlier film's valiant rescue.|Fresh
Darkest Hour runs the risk of falling into standard historical drama territory, but Wright and screenwriter Anthony McCarten work hard to avoid that stigma.|Fresh
It's hard to say the star doesn't deserve an award, but it's easy to state that little else about the movie does.|Fresh
Rousing, riveting and triumphant, this portrait of a hero is electrifying in terms of the genre and the awards season rush.|Fresh
It's unafraid to indulge in cinema's ability to create these fantastical scenarios.|Fresh
Though Wright directs only a few scenes of pure melodrama, his interpretation of Churchill's character visualized through all the man's hesitations and doubts, may be the most authentic yet portrayed on film.|Fresh
The new movie about Winston Churchill's rise to leadership in World War II could actually be a prequel to this summer's Dunkirk. It is about the decisions made that led to Operation Dynamo. It could even be a bigger Dunkirk Cinematic Universe.|Fresh
Gary Oldman has given us his gift to cinema with his effulgent interpretation of one of history's most complex political figures.|Fresh
How better to locate such counterintuitive heroics than through a retroactive contextualizing of Churchill as a least-likely-to-succeed buffoon (albeit with a gift for rhetoric)? Cue Gary Oldman as Oscar bait.|Rotten
This film won't have as much longevity as Churchill's immortal speeches, despite the fact that many viewers will likely laud Oldman as the definitive Churchill.|Rotten
There are many corridors that the film could have explored to flesh out the contradictions that informed its subject, but they're kept out of view, all the better to reinforce an image that's been solidly in place for 70 years.|Rotten
When presenting a biopic of such a famed figure, you hope to leave having learnt something new about them, and yet here we seem to be treading over familiar ground, albeit in a rather entertaining way.|Fresh
But the one reason to see the movie is Gary Oldman, whose embodies Churchill in a staggering performance, one that ranges from the mumbled nuance of a dithering alcoholic to the towering rhetoric of a supernatural statesman.|Fresh
Darkest Hour showcases a performance by Gary Oldman that is so good, you'll often forget you're watching an actor working from a script.|Fresh
It is a staggering misstep in a film that does not trust the power of the unvarnished story of Churchill's premiership.|Rotten
Jowly, bald and portly, [Oldman] matches all the familiar physical characteristics of Churchill with an expert approximation of his vocal mannerisms from an alcohol-slurred splutter to the spellbinding rhetoric that inspired a nation at war.|Fresh
Gary Oldman has never been better and he can consider himself the winner of that Oscar because I highly doubt there will be a better performance this year.|Fresh
Wright's staging is often eye-catching, guaranteeing that the film remains unflaggingly watchable even in its plodding stretches.|Fresh
An urgent retelling of a pivotal moment in world history.|Fresh
Darkest Hour is a study of age and power, and the achieving and decline of both.|Fresh
Gary Oldman has already locked up the Best Actor statue.|Fresh
Darkest Hour is a timely film, then, a call to arms from the Brits to the Yanks again that the bad guys are actively plotting the end of the world and isn't it time America did something. Isn't it?|Fresh
There's a living, breathing soul at underneath all that makeup, at the center of all those tics, and Oldman makes him fascinating to watch.|Fresh
An acting exercise weighed down by costumes, make-up, and over-lighting that has a few things to say about the backbone of a great world leader but nothing you haven't really heard before.|Rotten
Gary Oldman carries off a tremendous performance here, and it's impossible not to enjoy it.|Fresh
The magnificent clutter of Buckingham Palace or the swirling staircases of Whitehall begin to read like empty gestures in film that, for all that Oldman soldiers away at it, cannot make Churchill's dilemma dramatic.|Rotten
Darkest Hour will be known and remembered as Oldman's show.|Fresh
"Like its central character, Darkest Hour has ""mobilised the English language and sent it into battle."""|Fresh
The film is far less ostentatious than Joe Wright's previous works, rather leaving all the showboating to the worst performance of Gary Oldman's career, a Winston Churchill impression that plays out like a procession of award show clips.|Rotten
It's a rousing, engaging chronicle of British politics, and also a surprisingly moving story about great leadership.|Fresh
It feels alive and fresh -- the kind of cinema that doesn't waste a second.|Fresh
The MVP here, the one person who's able to hold the movie together despite all the dodgy bits in its latter half, is composer Dario Marianelli... his score for Darkest Hour is a rare thing of beauty.|Fresh
Balances the great orator's public triumphs with more vulnerable private moments of self-doubt, elevating the inner workings of British government into a compelling piece of populist entertainment.|Fresh
A snappy and straightforward crowd-pleaser that focuses on new Prime Minister Winston Churchill's mighty efforts to rise to the occasion of rescuing his country from the appeasers and defeatists in Parliament and stirring the public to defiance of Hitler.|Fresh
Few would argue that Gary Oldman isn't one of the finest actors of his generation, but this is a tour de force portrayal that will define his body of work for decades to come.|Fresh
