An impressive performance cannot save this movie from being blubber. [Full review in Spanish].|Rotten
Although Darkest Hour has already garnered critical praise and may prove a greater success, it is in some ways a more dangerous warping of the truth.|Fresh
This complex portrait is only made possible by an equally complex performance from Gary Oldman.|Fresh
It's dramatically engaging and powerful in its own right, but it is Oldman's outstanding performance that really pushes it over the top.|Fresh
A weighty and eloquent historical drama film about a visionary leader.|Fresh
It's Churchill that keeps Darkest Hour just above par through Oldman's absolutely heavyweight performance|Fresh
Oldman towers over everything, his Winston as full of self-doubt as he is of hubris and bombast. (Though after so many recent WW2 films I can only imagine the fights between props departments over London's last starched collar, gas mask or 40s typewriter)|Fresh
While Darkest Hour is an interesting examination of the first few weeks of Churchill's premiership, it suffers from its dedication to portraying him as a golden hero.|Fresh
I imagine in a decade's time, Darkest Hour will be known as The Film That Won Gary Oldman His Oscar, and little more.|Fresh
Joe Wright captains this cinematic vessel with the artful poise and stately confidence that typically defines his features.|Fresh
An impressive performance cannot save this movie from being blubber. [Full review in Spanish].|Rotten
Although Darkest Hour has already garnered critical praise and may prove a greater success, it is in some ways a more dangerous warping of the truth.|Fresh
This complex portrait is only made possible by an equally complex performance from Gary Oldman.|Fresh
It's dramatically engaging and powerful in its own right, but it is Oldman's outstanding performance that really pushes it over the top.|Fresh
A weighty and eloquent historical drama film about a visionary leader.|Fresh
It's Churchill that keeps Darkest Hour just above par through Oldman's absolutely heavyweight performance|Fresh
Oldman towers over everything, his Winston as full of self-doubt as he is of hubris and bombast. (Though after so many recent WW2 films I can only imagine the fights between props departments over London's last starched collar, gas mask or 40s typewriter)|Fresh
While Darkest Hour is an interesting examination of the first few weeks of Churchill's premiership, it suffers from its dedication to portraying him as a golden hero.|Fresh
I imagine in a decade's time, Darkest Hour will be known as The Film That Won Gary Oldman His Oscar, and little more.|Fresh
Joe Wright captains this cinematic vessel with the artful poise and stately confidence that typically defines his features.|Fresh
As a marvellous character study, with Oldman heading up the film with a soon-to-be Oscar-winning performance, it is unmissable.|Fresh
I'm not saying we shouldn't make films about Winston Churchill, or historical figures like him. But we shouldn't be fawning over them uncritically, or canonizing actors like Gary Oldman in their making.|Rotten
Delbonnel's cinematography is particularly striking ... there's a persistent haze that's as equally eerie as it is strangely invigorating.|Fresh
Led by an astounding performance by Gary Oldman, Darkest Hour is a tale of finding hope amidst hopelessness and how one unusual leader was able to rally a nation towards an unexpected victory.|Fresh
Joe Wright doesn't rest on the incredible work of his lead actor. A crisply paced film with many layers, thanks to a supporting cast that brings depth to the story and Wright's sharp eye behind the camera.|Fresh
Tip-toes on the edge of British propaganda, only seeking to showcase Churchill as a heroic politician, which makes for a very one-sided affair.|Fresh
It's fascinating and will leave you feeling excited and inspired upon leaving the theater.|Fresh
I needed more than paint-by-numbers scripting to fill in the blanks between those legendary speeches.|Rotten
"It's worthy of an award for ""most acting"", but as for giving the year's best performance, that accolade should be reserved for a performer who disappeared in to their character, instead of merely disappearing into the excessive make-up design."|Rotten
In (Oldman's) hands, Churchill is realistic. He's insecure. He's uncertain of himself ... in relation to the situation he finds himself caught up in. This take is unique|Fresh
Darkest Hour demonstrates the immense courage Churchill had. It doesn't fully absolve and deify him, rather humanizes.|Fresh
Wright has made a film of great words and visual elegance, but fueled by what is one of the year's greatest performances.|Fresh
I don't want to undermine my admiration for Gary Oldman's performance, but I think the film itself is flawed.|Rotten
The film stands strong and tall as one of the most prominent biopic films.|Fresh
You'll leave the theater stunned -- not only by what the British accomplished in WWII, but also longing for leaders whose words touch the hearts of their citizens.|Fresh
For an actor who has spent his career embodying unclassifiable human enigmas, it's unfortunate that [Gary Oldman] and Wright chose to depict Churchill in such broad, deliberate strokes.|Rotten
While Oldman is absolutely fantastic...this isn't even the best Winston Churchill performance of the year (that would go to Bryan Cox...in the film 'Churchill').|Rotten
... a fascinating look inside the war room of a former empire considering actual surrender in the face of insurmountable odds... and what it takes to overcome them.|Fresh
As the credits rolled, the strongest opinion I had about it was a shrug.|Rotten
Gary Oldman anchors a fascinating look at the war room behind the scenes of the evacuation of Dunkirk.|Fresh
Oldman brings plenty of fighting spirit, transformed by strikingly realistic prosthetic make-up to play the then 66-year-old with a spry mind, cranky demeanour and creaky body propped up with whiskey and cigars.|Fresh
Wright doesn't allow us to forget that all the words, speeches, and arguments are not only about politics but also about human beings, men on the beaches and stuck in trenches who are being killed and sacrificed.|Fresh
[Darkest Hour] inspires and gives more than would be expected from yet another biographical picture. Aside from a few moments when it feels slightly overdramatised, it's a definite success. I'd recommend it highly.|Fresh
Nevertheless, Darkest Hour is entertaining and beautiful to watch.|Fresh
"""Darkest Hour"" is a brief, and presumably misleading, biopic aimed more at winning awards for acting than in connecting our modern political problems with those of the past."|Rotten
It's unclear whether Joe Wright, the film's director, is trying to fight fire with fire in Darkest Hour by using a filmic style associated with the rise of Hitler to tell the story of an outmatched England preparing to fight the Nazis.|Rotten
In Darkest Hour, Wright's charged, blustery framework pulls the audience into a distant political landscape. But his approach here is also limiting and nearly wearying.|Fresh
It's when Churchill is at his most beleaguered that Darkest Hour spirals off into the further realms of fantasy.|Rotten
Joe Wright is less interested in historical details, more cinematic detail, and that leaning makes for an absorbing and flamboyant spectacle with Gary Oldman's barnstorming theatrical take on Churchill at its heart.|Fresh
Darkest Hour may be a little average in its telling of these critical events of WWII, but what it lacks in narrative power, it more than makes up for with a grand sense of style and a phenomenal performance from Gary Oldman as Winston Churchill.|Fresh
Mr. Oldman looks like a swirling gourd. [Full Review in Spanish]|Rotten
"More than a biopic, ""The Darkest Hour"" is a study of the character and personality of the English Prime Minister Winston Churchill. [Full review in Spanish]"|Fresh
Is it possible to separate a great performance from a less than great film? [Full Review in Spanish]|Fresh
A droll, listless experience of a movie, an exercise that functions only because it is made in the service of its actor, who is more than up to the challenge of conveying a seamless portrayal.|Rotten
As great an actor as Gary Oldman has proven to be, his performance as the embattled PM is a miracle of timing, execution, body language and sheer grit.|Fresh
...describes without too much subtlety. [Full Review in Spanish]|Rotten
...the excellent work of the actor ends up it it into Oldman's show. [Full Review in Spanish]|Fresh
Gary Oldman immerses himself in the character, giving every aspect of Churchill a memorable resonance, from his sense of humour, to his mastery of language to his short temper and bursts of humility.|Fresh
Gary Oldman...shines above everything else. [Full Review in Spanish]|Fresh
Maybe its rhythm can be a bit tedious for some, especially by the excessive use of dialogues, but without a doubt it is a film that is worth seeing. [Full Review in Spanish]|Fresh
Wright is at times more patriotic than Spielberg in The Post... [Full review in Spanish]|Fresh
'Darkest Hour' is Gary Oldman's finest hour.|Fresh
Despite the occasional Old Vic melodrama, Oldman lends it all an irresistible credibility.|Fresh
Gary Oldman and Kristin Scott Thomas are extraordinary in bringing to life two characters who history has covered numerous times.|Fresh
Just give Oldman the Oscar already.|Fresh
All in all, Darkest Hour is a competent film. And it has its gems.|Fresh
...a historical drama that's both handsome and alive.|Fresh
[Gary] Oldman delivers a magnetic performance. [Full Review in Spanish]|Fresh
Gary Oldman does not embody Winston Churchill, but directly becomes Winston Churchill. [Full Review in Spanish]|Fresh
The script is crisp, the acting topnotch all around.|Fresh
It may not be particularly original, but it should be of interest to history buffs, or to those who want to see one of Gary Oldman's finest performances. [Full review in Spanish]|Fresh
The ever-reliable Kristin Scott Thomas is the standout among the supporting cast, as Churchill's stoic wife. If only for Gary Oldman's Oscar-calibre performance, and hers, Darkest Hour merits a trip to the multiplex.|Fresh
Oldman delivers a vibrant and complicated portrayal not only marked by its impressive imitation, but by the immense range on display.|Fresh
... a meritorious effort, without being really innovative... [Full review in Spanish]|Fresh
...more than remarkable. [Full Review in Spanish]|Fresh
"A good ""dad movie"" centered on the days of May 1940 when Churchill becomes prime minister... [Full review in Spanish]"|Fresh
The tone is, then, precise: we will see everything from Churchill's perspective... [Full review in Spanish]|Fresh
Oldman has already bagged the Golden Globe for his performance, and it is he who elevates Darkest Hour beyond Wright's stuffy, sluggish and stagy filmmaking into a reflective and passable drama.|Fresh
Darkest Hour initiates a genuine, modern approach to political heroism and the Western sagacity that is out of favor. . .[It] is not jingoism; it is a politically aware, reflective performance.|Fresh
Gary Oldman is a force of nature... [Full review in Spanish]|Fresh
Gary Oldman delivers one of the finest performances of his career in director Joe Wright's technically brilliant but narratively flawed companion piece to Christopher Nolan's Dunkirk.|Fresh
The script has been written with the caps lock on and Joe Wright directs accordingly.|Rotten
Joe Wright's direction is excellent and the Anthony McCarten's script is perfect. [Full review in Spanish]|Fresh
You come, and you stay, for Oldman ... [His performance is] uncanny, it's technically virtuosic, it's mesmerising ... [he] gets the humour, the doubt, the drunkenness, the moods, the intelligence, the heart and soul.|Fresh
Wright infuses the film with as much style as it can hold without becoming unduly bloated|Fresh
Darkest Hour is pretentiously flawed in its obvious award-baiting, but well produced and rousing enough thanks to Gary Oldman in one of his most impressive performances.|Fresh
If you aren't interested in this stuff, it might lose you. [Gary Oldman] is engaging, there's no doubt about it, but the subject matter could lose you.|Fresh
For Gary Oldman to embody that, when we already know the audio of the real man's voice, I thought it was just a magnificant performance.|Fresh
There are many representations of Churchill and the King, many more depicting Britain and its soldiers and people during WWII, so Joe Wright had a lot to follow with this film, and quite a bit to live up to, however ,Darkest Hour was excellent.|Fresh
"The pejorative ""Oscar bait"" is immaterial when it's this good."|Fresh
Oldman's superlative work prohibits the movie from fading into the hedges like dozens of other dehydrated period pieces.|Fresh
Generally this is a rousing, immensely entertaining crowd--pleaser with a thoroughly mesmerising performance from Oldman in one of the finest hours of his career.|Fresh
It is unapologetically wordy. And at its best, this showcase for Churchill's ornate verbal flourishes is rousing and satisfying.|Fresh
Oldman wins, with a bespoke version of his distinctive voodoo. The sight of Churchill scarfing down eggs, bacon and whisky for breakfast is, in its own way, as rock'n'roll as the sight of Sid Vicious windmilling his bass in Sid and Nancy.|Fresh
A film that is watchable and entertaining, but rather stilted dramatically, unimaginative in its storytelling and a little too in thrall with its waddling hero.|Fresh
Oldman gives a performance rather than an impersonation and Darkest Hour is all the better for it.|Fresh
As far as the overall package goes, Darkest Hour is kind of just proficient, a perfectly competent and effective period film. What elevates it is Oldman's full-bodied, tour-de-force performance.|Fresh
Not event Oldman's brilliant performance can save the awful screenplay - and the scene in the subway is a perfect summation of the script's many flaws. [Full review in Portuguese.]|Rotten
Personally, I would prefer a rerun of Dunkirk or The Crown. But what Darkest Hour lacks in imagination is made up for, to an extent, by Oldman's presence.|Fresh
A feature-length Oscar clip, two hours of Gary Oldman stomping around in a Winston Churchill suit. There's too little drama and too much inevitability in what amounts to a reanimated Madame Tussaud's waxwork scene.|Rotten
Oldman delivers the greatest-hit speeches not just with mastery of cadence but with enough raw power to make the exceedingly familiar sound fresh.|Fresh
Essentially, Darkest Hour is a thriller, skilfully woven out of events to which we all know the ending.|Fresh
Oldman makes the role entirely his own, by turns mischievous, grumpy, panicked, vulnerable, blustering, stubborn and a whole host of other adjectives besides.|Fresh
Ultimately, if you want to hear Churchill talking about fighting them on the beaches, you could just watch Dunkirk again - Oldman's performance is literally transformative, but Darkest Hour is just another pedestrian biopic.|Rotten
Darkest Hour is one of the better examples of the British prestige pic, an absorbing study of an over-mythologised political figure that depicts him not so much as a hero as a principled man snatching victory from the jaws of defeat.|Fresh
Oldman dominates the film, capturing Churchill's outsized, blustery personality, along with a mischievous sense of humor ...|Fresh
Oldman seizes upon his character's many flaws and magically turns them into saving graces...|Fresh
... Darkest Hour is a mostly entertaining, enthralling and at times very moving film.|Fresh
Oldman's performance is the sole, sufficient reason to see a film in which little else finally lingers.|Fresh
It's a remarkable performance, any way you look at it, and one of the unreliable Oldman's best.|Fresh
Director Joe (Atonement) Wright exhibits his trademark flashes of visual aplomb and captures the peril of Nazi invasion with thrilling immediacy, despite being almost entirely confined to the claustrophobic corridors of power.|Fresh
When it comes to triumphs, here's one for the ages.|Fresh
Who wouldn't want to see the Nazis taken to task by George Smiley, Count Dracula and Jean-Baptiste Emanuel Zorg?|Fresh
No disrespect to either John Lithgow or Brian Cox, but this is the Winston Churchill performance from the past year to you need to see.|Fresh
This isn't an uncritical celebration of British bulldog spirit but a nuanced portrait of Churchill at a key point early in the war.|Fresh
It is interesting mainly because it was made at this particular historical moment and for the messages it delivers to us right now. Though not a major cinematic achievement, the movie is valid - and worth seeing - for this reason alone.|Fresh
The film is carried by Oldman, of course, who can now add Churchill to his career gallery of real life characters that includes Sid Vicious, Beethoven and Lee Harvey Oswald.|Fresh
Taking us from Chamberlain's resignation to the aftermath of Dunkirk, the film resists no opportunity to indulge in clunking exposition.|Rotten
It's an amazing performance: the only star turn I've seen in which a famous actor visible in nearly every scene would be unrecognisable if we didn't know his name already.|Fresh
Oldman is sheer joy in a role which transcends an otherwise uneven affair.|Fresh
An Oscar-aimed turn from Gary Oldman anchors this WW2 portrait of Churchill at his most beleaguered. Just mind the gap...|Fresh
Gary Oldman is magic as Winston Churchill. Just give this man the Oscar already. [Full review in Spanish]|Fresh
There's no argument that this is a polished production from director Joe Wright.|Fresh
Gary Oldman plays Churchill, and suffice to say that if he finally wins an Oscar, it will not be undeserved.|Fresh
Darkest Hour may be brash, but it's never less than riveting when actors such as these are doing their stuff.|Fresh
[Director Joe] Wright's restless camera tracks Churchill's immortal words as they fly from his mind before landing on the pages of typist Miss Layton (Lily James). This is mental activity framed as martial arts.|Fresh
Gary Oldman might finally win the Oscar that has long eluded him for his sterling portrayal of the British Bulldog.|Fresh
Despite its flaws, Darkest Hour is still worth catching, just to watch a seasoned veteran such as Oldman show you the craft he has practised and perfected over the years.|Fresh
Grappling with Churchill's inner humanity and steely resolve, Oldman has offered a portrayal for the ages.|Fresh
The period piece of the year combines good historical accuracy with a vibrant portrayal of prewar Britain.|Fresh
It is [Gary] Oldman, though, who rules. As he did while portraying characters as diverse as punk-rocker Sid Vicious and the fictional spy George Smiley, Oldman again disappears into the role.|Fresh
Casting Gary Oldman as Churchill seems like a risky gamble, given that both are known commodities. But Oldman, who has already portrayed such disparate figures as Sid Vicious, Lee Harvey Oswald and Ludwig van Beethoven, proves to be up to the task.|Fresh
Darkest Hour takes a while to get going, but once the pieces are in place and Churchill gets down to business, Wright's film picks up a great deal of momentum.|Fresh
The pandering to modern sensibilities left me feeling insulted, and it would be enough to derail a better movie than this.|Rotten
There's something wrong when a biopic's best scene never happened in real life.|Rotten
Sure, it's a paint-by-numbers biopic about British Prime Minister Winston Churchill facing down the Nazis, but when the acting is this good, who gives a damn|Fresh
Mostly just boring in-between the bits where Oldman says something famous.|Rotten
If history is of any interest to you, this is one of three current films dealing with one of the most momentous events of WWI|Fresh
Intelligent and informative, with a knockout central performance by Gary Oldman.|Fresh
Comparisons with the powerful 'Dunkirk' are inevitable, but Gary Oldman soars as a bigger-than-life Winston Churchill in a first-rate, historical film.|Fresh
...more about a singular powerful performance rather than telling a cohesive and satisfying story.|Fresh
With impeccable direction, engaging dialogue, consummate costume and makeup, and one of the best performances ever to grace the silver screen by Oldman, Darkest Hour is an overwhelming achievement.|Fresh
"Oldman's Star Shines Bright in ""Darkest Hour."""|Fresh
Therein lies the joy of Darkest Hour: watching someone like Oldman ply his trade in what may be a career-defining role. The movie in itself offers plenty. Oldman offers more.|Fresh
[Oldman] plumbs the depths of Churchill's character in order to give us a three-dimensional take on the iconic, dour-faced politician.|Fresh
This film is a showcase for Gary Oldman's powerful portrayal of Churchill. Just as masterful are the makeup and prosthetics artists who make Oldman look like Churchill.|Fresh
Truly a political film, Darkest Hour aims to fulfill the needs of its constituents.|Fresh
"In a time when the film scene is flooded with sequels, remakes, spinoffs and an avalanche of superhero adventures, it is considerably miraculous that a film like ""Darkest Hour"" manages to stand out. [Full review in Spanish]"|Fresh
It's a stirring portrait of real political leadership that makes Darkest Hour not just a lively slice of history, but also relevant for today.|Fresh
Aside from Oldman's frisky pleasure in hamming it up, Darkest Hour collapses in a great pile of hogwash.|Fresh
"""Churchill just mobilized the English language and sent it into battle,"" Halifax admits at the end. But did he really need a 100-piece orchestra to do it?"|Rotten
A sturdy biopicture about Winston Churchill's triumphs and struggles as England's Prime Minister in 1940.|Fresh
It's too long. Everything the film has to say could have been easily and neatly packed into 80 brisk minutes.|Rotten
... a handsomely produced, dialogue-driven history lesson that rests on the broad shoulders of its indelible protagonist, Winston Churchill.|Fresh
Darkest Hour is a fine film about Winston Churchill and his decision-making as Hitler swept through Europe that will ultimately be remembered for one thing: Gary Oldman is Churchill.|Fresh
Oldman takes the reins of Darkest Hour. It's his performance, capturing the British bulldog's oratorical fire but most important his life-affirming lightness, that makes this movie worth sitting in the dark for two hours.|Fresh
Darkest Hour demonstrates how, considering that everything and most everyone were working against Churchill, it's fairly extraordinary that there's still an England.|Fresh
With a blubbery voice and a penchant for cutesy physical movements, Gary Oldman does a smashing impersonation of Benny Hill's Mr. Scuttle, but the resemblance to Britain's wartime leader isn't quite there.|Rotten
Oldman has always possessed the ability to disappear behind the roles he plays, with and without latex, and his work here is further proof of his talent. [Full Review in Spanish]|Fresh
[Gary] Oldman also does justice to Churchill's famous inspirational speeches, delivered in the dark, tradition-bound chamber of the House of Commons.|Fresh
A visual symphony of performance, pacing, editing, cinematography and music that only Wright and perhaps three or four other directors are capable of conducting.|Fresh
"Britain's ""Darkest Hour"" turns out to be Gary Oldman's finest."|Fresh
It scores on any number of technical levels, but it's Oldman's award-worthy performance as Churchill more than anything that proves to be the linchpin to the whole exercise.|Fresh
Ultimately the film over-romanticises its subject and, in so doing, fails to illuminate the real complexities of this pivotal moment in social and political history.|Rotten
So the verdict is mildly mixed. Darkest Hour isn't as great as the historical moment it depicts but Oldman's performance certainly rises to the occasion.|Fresh
Gary Oldman blubbers and bellows from under wads of makeup as Winston Churchill in this lifeless biopic.|Rotten
The script - and Oldman's portrayal of Churchill - make the movie riveting. Yes, folks, words really matter.|Fresh
A nagging question persists throughout Darkest Hour: Is Oldman's compulsively meticulous turn here anything more than a brilliant impersonation?|Rotten
Wright's restlessness can be off-putting, but his technique feels like a reasonable match here for the high-stakes subject matter, and the heightened (but not hammy) pitch of the performances.|Fresh
Which is why Darkest Hour transcends its biopic trappings to work, almost despite itself. It's a beautiful thing, Wright's film.|Fresh
Joe Wright's Darkest Hour stylishly follows Winston Churchill's early days as Prime Minister with a transformative performance from Gary Oldman.|Fresh
It's somewhat interesting to witness the events that led to one of the most famous speeches of the 20th century, but not 2 hours, 5-minutes worth of interesting.|Rotten
"Except for the make-up job on Oldman, not much to write home about--least of all the idea that Churchill was defending ""Western Civilization"" against the brutes. Tell that to the Indians and Kenyans."|Rotten
A superb portrayal of Winston Churchill.|Fresh
... manages to capture Churchill's high-profile charisma as well as his eccentricities during the film's quieter and more contemplative moments.|Fresh
Oldman's turn here at times feels like a great performance, and at others, like a parody of a great performance.|Fresh
A career-capping personal best for Oscar contender Gary Oldman. Kristin Scott-Thomas and Lily James also shine.|Fresh
