Deadpool 2's meta-heavy brilliance-and really, the best part of the film-comes when you stick around for the post-credits scenes.The movie's stingers are better than anything the Marvel Cinematic Universe has put out in the last 10 years.|Fresh
It's not nearly as good as the first Deadpool, but it's definitely worth seeing and 100-percent a good movie...a refreshing sequel that will keep this franchise around a long time.|Fresh
His jibber-jabber gets tiresome after a while, however, and irreverent, subversive and shocking humour is funny only upto a point. After which, the grand action scenes aside, it feels like a pattern: Offend. Kill. Make an inside Marvel joke. Repeat.|Rotten
Deadpool 2 entertains, but it doesn't compare to its predecessor. [Full Review in Spanish]|Fresh
If you enjoyed the first film and wanted to see more of the same, you're going to have a grand time here. (Full Content Review for Parents - Violence, Profanity, Nudity, etc. - also Available)|Fresh
It's one of the funniest movies you'll see this year, visually spectacular and consistently entertaining.|Fresh
The Deadpool writers, and that team includes Reynolds, get to have their cake and eat it, too, with a movie they can dismiss and cherish all at the same time.|Fresh
Deadpool 2 is certainly funny, but never as much as it thinks it is (apart from maybe during its truly excellent closing credits sequence).|Fresh
Really, just take the plot from Terminator 2? More of the R-rated same, so amusing, but not as novel.|Fresh
When Deadpool 2 works - and it works far more often than not - it's a riot. It's profane and insane and unpredictable.|Fresh
Nonstop violence, profanity, adult humor in super sequel.|Fresh
As Deadpool himself might say, it's a superhero film that exists to be bad for all the right reasons. So why not just go with the flow?|Fresh
Perhaps Deadpool 2 works because the title character saves most of his fury for the fourth wall.|Fresh
Deadpool 2 could easily have been a letdown. The fact that it's not is a happy surprise.|Fresh
But what does all of this really mean? Not a whole lot. It's a very fun watch, if this is what you're into.|Fresh
A superhero spectacular... [Full Review in Spanish]|Fresh
This is the death of the comic-book movie. Or it should be. The savage, inhumane nihilism here says, Yup, comics haters are right: this is dangerous nonsense with no morality or redeeming qualities.|Rotten
He's back and still nasty. Does not disappoint, even better than the first.|Fresh
Deadpool 2 is at its best when it cheerfully doesn't give a sh-t. The more it cared, the less I did.|Fresh
Deadpool 2 scorches those X-Men, Reynolds himself and, of course, the GOP|Fresh
With his athleticism and unerring timing, Reynolds was obviously born to don Deadpool's apparently smelly catsuit.|Fresh
The comedy is as dark as the blood in Deadpool 2, showcasing a truly inspired character's blend of invincibility and self-deprecation, flinging off one-liners faster than a machine gun spits bullets.|Fresh
An entertainingly nihilistic night out.|Fresh
Deadpool 2 ... comes equipped with enough laugh-out-loud gags, wince-inducing kills and surprising cameos to delight diehard fans and casual viewers alike.|Fresh
Ryan Reynolds still looks like a hard boiled Voldemort, and he's still running that mouth like there's no Deadpool 3, but Deadpool 2 is a bigger, filthier and better movie than the original.|Fresh
Deadpool 2 embraces its enhanced output of blood, guns, and violence with open arms...before they're blown off.|Fresh
Easily in a different class to pretty much everything else out there in its genre.|Fresh
"Though in many respects Deadpool 2 is funnier, filthier and certainly better directed in the action stakes than its predecessor...it's also a film that gleefully sacrifices sacred cows while remaining reluctant to touch any labelled ""cash."""|Fresh
Deadpool 2 is even more ribald and subversive than the first film, and pulsates with sardonic, self-aware wit from the opening shot.|Fresh
It is relentless, occasionally exhausting but frequently hilarious.|Fresh
The film's greatest asset is Reynolds, who in Deadpool finally found the role of his dreams.|Fresh
In the face of this pretence of cool cynicism, the film's eventual nod to sentiment and pathos doesn't seem maudlin or ridiculous. Credit should go to Reynolds, who brings to bear the sincerity and vulnerability he's expressed before in his rom-com roles.|Fresh
It's clearly a stab at recreating grittier, more emotionally fraught origin story moments that Deadpool 1 certainly didn't shy away from, but this time it feels like the movie is trying to punch way, way above its weight class.|Rotten
It's hard to follow up on a brilliant film but Ryan Reynolds has done it again, taking risks which a studio might hesitate to take and going beyond the premise of the film in the process.|Fresh
Deadpool 2 is an entirely predictable affair that, at 120 minutes, spoils itself.|Rotten
It's worth the watch for the laughs alone - especially if you, too, aren't a superhero fan.|Fresh
It's overstuffed, and essentially empty.|Rotten
There's little that's genuinely daring or subversive in Deadpool 2...|Rotten
More profanity, more Troma-esque ultra-violence, more snarky adolescent meta-commentary. In short: more Deadpool.|Fresh
Deadpool 2 does not stop being fun for a second and surprises at various points. [Full Review in Spanish]|Fresh
It's not a bad movie, but it tries so hard to emulate its predecessor that you feel the screen sweating.|Fresh
Deadpool 2 is bold, audacious, outrageous, and wickedly funny.|Fresh
Happily, Reynolds, who has a co-writing credit, has found a fine balance between the snappy, vulgar, perfectly-timed one-liners and the source of pain that causes the humor, Deadpool's defense mechanism.|Fresh
Some great, great meta-humor...the movie itself is very good as well.|Fresh
It felt more like an action film with a lot of comedy in it. I liked what they did and I thought it was a worthy sequel.|Fresh
I had such a ball watching this movie.|Fresh
They're all great; it's the movie around them that comes up short.|Rotten
Indeed: if the sequels' eternal challenge is how to live up to the original without repeating itself, let's say that Deadpool 2 is a worthy second part, but it does not have the advantage of [surprise]. [Full review in Spanish]|Fresh
Deliriously over-the-top from start to finish, the follow-up may not be as novel as its predecessor, but there's no denying that Deadpool 2 is hugely entertaining.|Fresh
The plot is as dispensable as the limbs of the titular character, so I do not intend to delve much into it, except to say that this sequel is exactly what comics movies need right now... [Full review in Spanish]|Fresh
Why is Deadpool 2 so bloody winning? Chalk it up to Reynolds's/Deadpool's adherence to his own waggish sensibility.|Fresh
The irreverent R-rated humor that made 2016's 'Deadpool' such a refreshing spin on the genre returns in this juiced-up deadpan sequel.|Fresh
True to form, the film calls out its own lazy writing, which is probably the laziest writing of all.|Rotten
Deadpool returns in a sequel that manages to up the in-joking, violence, cameos and meta plot points, which will please fans but royally annoy anyone looking for a more straight-forward story.|Fresh
Deadpool 2 is awesome and you should go to see it. Especially if, like me, you're suffering from a bad case of superhero fatigue. It could be good for what ails ya.|Fresh
[Julian] Dennison as the volatile Russell is the heart of the picture, providing an emotional anchor in a production that might otherwise be too snarky for its own good.|Fresh
It's so extreme, it's hilarious.|Fresh
It's not often a sequel surpasses its predecessor, but Deadpool 2 improves on the original in pretty much every way; packing in funnier jokes, better characters, and even some genuinely touching moments.|Fresh
The lesson learned before applies here: never underestimate Reynolds and his determination to pull off the impossible.|Fresh
It all boils down to one important fact: Reynolds gets these comics.|Fresh
"For good of ill, ""Deadpool 2"" delivers more of the same."|Rotten
How many times can one go back to the well? DEADPOOL was great fun because it was new, and well --- exciting. DEADPOOL 2 --- not as much.|Fresh
I'm not convinced that a third entry is necessary, or what the filmmakers can come up with to support yet another encore.|Fresh
It mostly just puts a loud, explosion-filled gloss on the same few jokes.|Rotten
As explosively funny as the movie is at times, the self-referencing comes dangerously close to ruining the moment.|Fresh
The star does his schtick and invites us in for a giggle but there's no weight to the character or to Reynolds's playing of him. He's like Robert Downey Jr. without the soul.|Rotten
A wild, non-stop avalanche of snarky humor and grossly comic violence...overall it's an improvement on its predecessor, even if it remains a patently obvious effort to adhere to the template of the superhero genre while pretending to subvert it.|Fresh
Deadpool 2 feels about as fresh as an old jelly doughnut covered with fire ants. Sure, you could eat it if you were starving, but it would never occur to you to recommend ingesting a mouthful of stinging ants and crusty pastry.|Rotten
It's offensive as hell. Gory. Ridiculously campy. But it never fails at being laugh out loud hilarious, self-deprecating to the extreme, and often unexpectedly charming and poignant, if in a completely disgusting way.|Fresh
Deadpool 2 is everything that it is supposed to rail against: a generic comic book movie that is only a step above the lesser entries in the Marvel/Fox continuum.|Rotten
I'm totally fine with Deadpool 2... [but] part of me can't help but wish that, after this adventure becomes a global hit, he finally decides to shut up.|Fresh
What Deadpool 2 manages to pull off best is that it easily juggles all its characters, the old and the new, and gets them to play off Deadpool's wild and zany personality, making for a constantly engaging dynamic.|Fresh
It's funnier, more dramatic and emotional, has a better story, and has a killer supporting cast who all work tirelessly to make Deadpool 2 feel as fresh and surprising as the original.|Fresh
The majority of Deadpool 2 is a production that hits you in the gut with the action and repeatedly slams your funny bone with the often juvenile humor. That's because the team doesn't hold back a single gunshot or rimshot.|Fresh
It's in such ways that Deadpool 2 retains enough good will to get by.|Fresh
Gratuitously and graphically violent... crass and juvenile, and above all belly-achingly funny.|Fresh
It's good enough, with only a whiff of seen-it-before around the edges.|Fresh
Deadpool 2 barely pauses for breath, which is admirable given the additional cast members. It's a bigger, brasher, swearier older brother to the first film.|Fresh
Boasting of some great unsuspecting cameos, the story humanises Deadpool, without letting go of what makes him different - deviant ways, indulgence in gory violence, sarcasm and narcissism.|Fresh
A movie that often blends action and comedy with visual wit and efficiency, offering an unexpected new angle to a sequel that returns with the expected load of R-rated snark and in-jokes for movie buffs.|Fresh
I hated the first Deadpool for its quippy smugness and ultra-violence. This one is still smug, quippy, violent. But some helpful mastermind has introduced wit.|Fresh
The film is not as overfilling as the first Deadpool, and from a nerd standpoint it has a little more respect for the chrome giant Colossus than its predecessor.|Fresh
Despite lacking the freshness of 2016 feature, the sequel is funny, energetic, and determined not to take itself seriously (even when serious things happen).|Fresh
Wherever you fall, it's safe to say viewers can at least agree that it's unapologetically crude and that Ryan Reynolds once again proves he is the perfect choice to play the titular anti-hero.|Rotten
One of the new century's best comic-book movies...|Fresh
Yes, it more of the same - hardcore action sequences (in slo-mo, of course) set to cheesy-brie ballads, Deadpool demolishing the fourth wall, and plenty of dick jokes - but it's still fun.|Fresh
A superhero version of Airplane! in the frequency of its gags (some of them groaners). With the winky fourth-wall-breaking of a Bob Hope movie, only with explosions and severed limbs. To be clear, this is what I like about it.|Fresh
Ultimately, it lives or dies by how tiresome you find its hero, who is, as Cable puts it, 'a jabbering butt plug'.|Fresh
With plenty of genuine laughs, balls-out action sequences, and a whole lot of emotion and heart, this is the sequel that you'd hoped for.|Fresh
At one point, Deadpool compares the domestic grosses of the first Deadpool movie with The Passion of the Christ, which is surely what our culture's over-analysis of movie box office deserves.|Fresh
Deadpool 2 is funny. Maybe not quite as funny as the first film, but the barrage of jokes - some obscured because the audience was still laughing at the last one - should stand up to multiple viewings.|Fresh
A fine sequel, with the ribald ridiculousness that is to be expected with this series. Reynolds is having the time of his life, but the newcomers steal the show.|Fresh
Die-hard fans of Deadpool's fourth wall-breaking, superhero-subverting, ultraviolent antics will find much to enjoy in Deadpool 2. Everyone else: Deadpool is basically your Poochie.|Fresh
The story is more cohesive than the first and somewhere amid all the mocking and the 37th pastiche might just be an original voice. Or, at least an original voice 2.0.|Fresh
It can't match its predecessor for originality, but the Merc With The Mouth once again brings the mirth.|Fresh
Deadpool 2's scathing critique of the 2008 credit default swap crisis is a timely reminder for the need for rigorous global financial regulation.|Fresh
"""Deadpool 2"" is annoying and bad."|Rotten
It's often very funny, but periodically Deadpool 2 has to drop the ironic facade and shoot for real emotion, and here it stumbles.|Fresh
"The quips and pop culture references come at you ""Airplane!""-style, meta times meta, breaking the fourth wall and probably the fifth, sixth, and seventh as well."|Fresh
...a joyous, violent, profane and occasionally quite sweet cinema experience worthy of the original.|Fresh
[Brolin's] beefed-up baddie and Dennison steal the thunder from Reynolds, and that's great as Reynolds' wise-cracking shtick can get annoying after a while.|Fresh
This sequel is snarky but never smug, playfully riffing on superhero cliches without falling back on them.|Fresh
There is something defeatist about a franchise that acknowledges stereotypes, tropes and clichés, then does little to circumvent them and nothing to counter them.|Rotten
It's a very fun time. I have a feeling it will improve upon multiple viewings, but it's not quite as great as the first film to me.|Fresh
Deadpool 2 arrives as a worthy sequel with a great amount of gags. [Full Review in Spanish]|Fresh
True to form, Deadpool 2 doesn't skimp on one-liners and visual gags, many of them referencing signature moments in other movies... In a way, Deadpool 2 doesn't try to speak to the audience; it is the audience.|Fresh
If you enjoyed the guilty pleasures of Deadpool, it's an immutable law of Physics that you will love Deadpool 2.|Fresh
Upping the emotional ante, Deadpool 2 proves richer and deeper than the very good original. Plus: new-and-improved curse words and 20 percent more mayhem!|Fresh
Deadpool 2 was never going to surpass the original, but it is the second coming of something immensely fun and unlike anything else in the oversaturated superhero market. In particular are two huge set-pieces that are going to leave audiences in stitches|Fresh
Deadpool 2 is a worthy sequel for sure. Everything salacious from the first film is pretty much injected with steroids here.|Fresh
Deadpool 2 still has enough of its own qualities to work as an individual movie, that is, it does not matter if it is a sequel. [Full review in Spanish]|Fresh
Some of the film's elements may be inconsistent, but the demented humor is always dead on.|Fresh
[Ryan Reynolds] gives a great performance in a film that's so much fun, and so swaggeringly confident, that you can't help but overlook its flaws.|Fresh
When it comes to the new faces in Deadpool 2, Zazie Beetz steals the show as Domino, and is an incredible addition to the mix.|Fresh
A deliriously violent concoction. Better than the first.|Fresh
Even at a generous running time of 120 minutes, Deadpool 2 still packs a stack of fresh, fast and furious material into the mix, which all but guarantees hard line fans will up for a repeat viewing sooner than later.|Fresh
Unfortunately, two movies in, the Deadpool franchise has not only already run out of jokes-it's become everything it was supposed to hate.|Rotten
It's a long movie and when its star isn't on screen and cracking wise, the boundary-pushing shocks and endless self-references wear thin.|Rotten
In a year where we have a superhero movie every other month, here's someone to point out the sillier aspects of the superhero craze.|Fresh
A least as funny as the original Deadpool, and better in virtually every other respect: better plot, better villains, a few unexpected narrative swerves, and, yes, at least one genuinely moving sequence.|Fresh
The sequel is not a letdown. It may not be as refreshingly clever as the first Deadpool, but it certainly delivers in laughs and lunacy.|Fresh
The result feels a bit like a lavishly produced, superhero- and supervillain-stocked standup comedy special, with fight scenes, chases and explosions spliced into footage of the hero telling you about the wild couple of weeks he just had.|Fresh
It is a fairly brilliant sendup of comic-book action movies, as well as also being an excellent example of one.|Fresh
It's smarmy and snarky - with outrageous post-credit scenes which will delight whether you're a fan of superhero sagas or sick of them.|Fresh
In the narrow prism of superhero tentpoles, Deadpool 2 refreshingly shouts, with four-letter words aplenty, that there is more to cinema than one-size-fits-all blockbuster boilerplate.|Fresh
Deadpool 2 is a tighter, smarter, better version of its predecessor.|Fresh
Deadpool 2 utilizes the character's popularity as a MacGuffin for more rapid-fire jokes, but errs too far on the side of that clownishness to stick the landing once director David Leitch pivots to a payoff that's (slightly) more serious.|Fresh
Maybe not as [good as the first] since the element of shock and awe can't be put back into its bottle, but anyone who enjoyed [his origin tale] should have as much fun.|Fresh
After the heaviness of Avengers: Infinity War, Deadpool 2 arrives just in time to pants the comic book movie genre with more hilarity and craziness than before.|Fresh
Deadpool 2 offers a glorious sugar high, but that inevitably means it comes crashing back to Earth.|Fresh
Pure entertainment with storytelling that achieves a level of fun few superhero movies are able to achieve without pandering to the fans.|Fresh
'One of the guys who killed the dog in John Wick' has delivered a genuinely moving family film, albeit an R-rated one with pedophile jokes, and one of the rare instances where a sequel surpasses the original.|Fresh
"""Deadpool 2"" is as entertainingly distasteful (perhaps even more) than the first movie."|Fresh
"""Deadpool 2"" is funnier and more action-packed than its predecessor. Filled with unconventional kills, four-letter words, sexual references, and even more idiosyncratic kills that leave a high, but comedic, bodycount, fans will be thrilled."|Fresh
While he's migrated from the dead of winter to prime summer blockbuster season, Deadpool hasn't gone soft with success.|Fresh
It's relentless, often exhausting and frequently hilarious.|Fresh
Wants so badly to be something more interesting than it really is.|Rotten
As with the original, Deadpool 2 thrives on tone over narrative.|Fresh
The temptation might have been to go brasher yet, rather boldly, Deadpool 2 goes deeper and expands its core cast appealingly, making for a sequel that's not only funnier but more ambitious and satisfying.|Fresh
Rather than face its own moral incoherence, Deadpool 2 blinks.|Rotten
Seriously subversive, seriously funny, seriously profane, occasionally even serious, Deadpool 2 is the best kind of cinematic entertainment. Seriously.|Fresh
It's Family Guy: The Movie.|Rotten
Bigger, funnier and filthier than the first film, Deadpool 2 doesn't disappoint, delivering a potent cocktail of action and humour.|Fresh
High-energy raucous fun, Deadpool 2 is a hoot: a rollicking, no holds barred explosion of irreverence and action, wired with violence, language and attitude.|Fresh
For the snotty little brother of 20th Century Fox's crown jewel franchise that it aims to be, Deadpool 2 is clever enough in its giddily obnoxious way.|Fresh
Bigger, badder, funnier, and more meta than ever,Deadpool 2is the overstuffed chimichanga of awesomeness we were hoping it would be.|Fresh
Bless its profane, bloody, fourth wall-breaking heart.|Fresh
Doesn't build on the first film, choosing instead to replay the greatest hits. If you're a fan of those hits, then you'll enjoy this encore, but anyone who wasn't amused by the first go-round isn't going to hop on board for this do-over.|Fresh
Better than the first one. Funnier and more bananas, with better action and a better plot. Ryan Reynolds crushes it once again. [Full review in Spanish]|Fresh
The film's impulse to profess a knowing, snarky superiority can become painfully awkward.|Rotten
The Deadpool movies occasionally push the bounds of taste, but they don't take real comedic risks. Viewed as more of an action-comedy, then, Deadpool 2 works passably well. [Full review in Spanish]|Fresh
Deadpool 2 is far more ambitious than the first film, elevating the action, humor and overall scope for an even more fun experience in the sequel.|Fresh
Despite a tendency toward elephantitis in story and scope, not to mention blatant franchise pandering, Deadpool 2 still plays like the runt of the comic-book litter. We mean that as a compliment.|Fresh
Deadpool 2 has as much heart as the original, and the humour is more consistent. And while we wondered whether Wade Wilson's brand of comedy had had its day, the series has moved with the times and feels as relevant and contemporary as it could be.|Fresh
In two years, Deadpool has gone from the scrappy class clown to the annoying wiseass in the back of the room spewing crude insults to amuse himself.|Rotten
As Deadpool 2 unfolds, we come to see that beneath the wisecracks, it is very sincerely about the importance of family in everyone's lives.|Fresh
Caustic and unexpected.|Fresh
A movie that feels scribbled in pencil crayon, drenched in Jolt cola and coated with the dust of a thousand discarded bags of Flamin' Hot Cheetos... As it is, Deadpool 2 is a film that is merely aggressively aggressive.|Rotten
If you enjoyed the first one, there's every chance you'll like this one as well. Similarly, if you hated the first one, you probably won't find much to love about the follow-up either.|Fresh
Deadpool 2 ups the ante by delivering a bigger and ballsier sequel.|Fresh
Snappy, self-aware, fourth-wall-breaking lines like that flow fast and rarely miss their targets in the ensuing adventure.|Fresh
While Deadpool 2 delivers the gags and the gun-shot geeky Marvel insider references, the plot could have done with some more finesse.|Rotten
If the filmmakers were as self-reflexive as they pretend to be, they'd find a way to show that Deadpool's insides are becoming as charred as his face.|Rotten
In the age of constantly escalating superhero stakes, Deadpool stays fresh by aiming small.|Fresh
Every cultural moment needs a smart-ass, and sometimes, you take what you can get.|Fresh
Surprisingly we didn't hear any cracks about sequels that suck, perhaps because Reynolds, Leitch, and the rest know that this one doesn't.|Fresh
This ultra-violent sequel to one of the most successful R-rated movies of all time is often hilarious, but the skeleton holding it together can't really hold up its end of the bargain. For most people, though, that will be OK.|Fresh
Deadpool 2 makes a point of not taking itself too seriously, which can be harder than it looks. And if that works somewhat fitfully, the sequel delivers consistently enough to keep this colorful mercenary laughing all the way to the bank.|Fresh
That said, as someone who remains fond of its predecessor, the Merc with a Mouth's eagerly anticipated sequel... is a superior sort of tongue-in-cheek men-in-tights work.|Fresh
Deadpool is no longer the underdog making good, but the focal point of a very prolific franchise. And he kinda can't be that.|Fresh
Much like its predecessor, Deadpool 2 is less a movie than a smirky, feature-length meme generator.|Rotten
Where it surprises - and why it works so well - is how it balances an actually touching undercurrent alongside superhero subversiveness.|Fresh
From start to finish - and especially through the now-mandatory post-credit scenes - Reynolds delivers every punch, kick and hard-edged witticism with conviction and relish.|Fresh
Saucy, overstuffed and very entertaining.|Fresh
Deadpool 2 is about as funny and action-packed and entertaining as Deadpool was, which is good news for fans, and bad news for entitled fanboys who demand every sequel be some kind of cinematic revelation...|Fresh
