Deadpool proved that audiences were hungry for a superhero as self-aware as they are; Deadpool 2 proves that character can actually ground an ensemble.|Fresh
Filthy, ferocious and funny to a near-indecent degree, Deadpool 2 bests its predecessor by doubling down on the gleefully self-aware source comics' idea that anything worth doing is worth overdoing: excess and escalation are, essentially, in its DNA.|Fresh
Unfortunately the new sequel... doesn't have enough of too much; less charitable viewers might even argue that it has too much of not enough.|Rotten
Dizzy fun for a while, like eating Twinkies on a Gravitron. Eventually, though, it just wears you out.|Fresh
Although it runs short on plot, Deadpool 2 delivers a sequel that's crasser, gorier, and funnier than its predecessor.|Fresh
With its uncompromising commitment to gross-out injuries, nerdy pop culture in-jokes and inappropriate touching, Deadpool 2 was clearly made to cater to existing fans with every innuendo-filled moment...|Fresh
The eagerness of Deadpool to call out its own shortcomings earns this trash-talking franchise a lot of goodwill.|Fresh
Deadpool 2 isn't a complete bust, but it's missing a chunk of what made me look back so fondly on Deadpool.|Fresh
Deadpool 2 isn't as immortalized as Deadpool 1, but I still enjoyed myself.|Fresh
Wisecracking and fourth wall-breaking as ever.|Fresh
"We'd say it's the rare sequel that surpasses the original - but as Deadpool would put it: ""That's just lazy writing."""|Fresh
Led by Ryan Reynolds as the Merc with a Mouth, Deadpool 2 is a wildly entertaining ride that ups the stakes after 2016's hit predecessor.|Fresh
Deadpool 2 is, above all else, a lot of fun. Sometimes it maybe doesn't take itself seriously enough. But in a genre that takes itself so deadly seriously, this is like a breath of fresh air.|Fresh
A delirious exhibition for the bawdy, acerbic humor of Ryan Reynolds.|Fresh
Comes blazing out of the shoot, but dips in its second hour, like a stretched-out piece of taffy. Still, there is a lot left to like here, and Reynolds and company crank out better, more outrageous laughs than most pure comedies.|Fresh
What drives this franchise is the same force that drives so much culture and politics right now: the self-pity of a white man with a relentless need to be the center of attention.|Rotten
Reynolds, one of three credited writers, took more creative control with this sequel. That may sound like trouble, but the innate self-effacement built into the actor's breezy motormouth skill set apparently kept his better instincts at the fore.|Fresh
With Reynolds' charismatic irreverence at its core, the pic moves from bloody mayhem to lewd comedy and back fluidly, occasionally even making room to go warm and mushy.|Fresh
A fine, funny and filthy comic book superhero sequel that makes sure to be a coherent and entertaining movie first and a giant self-referential in-joke second.|Fresh
Deadpool 2 is kind of like that zany guy you met at a party once. Yeah, he was fun that first time out. But when you meet him again, he's just more of the same and that's ... boring.|Rotten
Deadpool 2 muddies the distinction between parodying comic-book-movie conventions and perfunctorily adhering to them.|Rotten
The sequel recaptures more than enough of the first film's impish spirit to provide a big, raucous, bloody good time.|Fresh
With higher highs and lower lows than Deadpool, the sequel has a lot of the problems all sequels do.|Fresh
"Deadpool 2 is an overstuffed cinematic burrito of raunchy insults, dismembering violence and a ""no f#*ks given"" attitude that's ready to burst at any second, but somehow holds together bite after enjoyable bite."|Fresh
"Deadpool 2 is wicked, dark fun from start to finish, with some twisted and very funny special effects, cool production elements, terrific ensemble work -- and for dessert, perhaps the best end-credits ""cookie"" scene ever."|Fresh
In almost every respect, this sequel is an improvement on its 2016 predecessor: Sharper, grosser, more narratively coherent and funnier overall, with a few welcome new additions.|Fresh
Le ratio de gags hilarants semble beaucoup plus élevé dans ce second volet. [Full review in French]|Fresh
Deadpool 2 is an outrageous, surprising, hysterical, emotional, vulgar, creative and uproarious summer blockbuster that fans of this genre -- and of comedy, in general -- will devour.|Fresh
A filthier, funnier sequel that doesn't try so hard to be irreverent.|Fresh
Still the only comic book superhero movie smart and witty enough to mock comic book superhero movies.|Fresh
The perfect Avengers antidote.|Fresh
"The original ""Deadpool"" caught lightning in a bottle. The sequel sparks only intermittently."|Fresh
He's back and he's as hilarious, homicidal and outrageous as ever, although maybe a little mushier.|Fresh
You may come for the action, I'm in for the decidedly punchy jokes and, now don't freak out, the surprisingly pungent emotion. Yup. This superhero spoof is laugh out loud funny, blows a whole lot of stuff up and is full of heart. Go figure.|Fresh
