Intriguingly, Don't Breathe plays with the kind of moral relativism that escapes most studio pictures.|Fresh
From the opening shot, the R-rated Don't Breathe drops us into an ominous environment crackling with suspense, jolts and uncertainty about what will happen next.|Fresh
More methodical than innovative, Don't Breathe is nevertheless an effective suspenser.|Fresh
Taps into our deepest, darkest fears, and offers us a bloody, instant horror classic that's not for the faint of heart.|Fresh
"Alvarez, who directed the 2010 remake of Sam Raimi's ""The Evil Dead,"" effectively sets up a brutal cat-and-mouse game; the problem is that sometimes you don't know who to root for."|Fresh
It's a very effective '90s throwback thriller, where a broken man is robbed by a group of morally bankrupt kids. Have fun deciding which side are heroes and which side are villains.|Fresh
The kind of morality play that toys with audience loyalty and conveys its protagonists' predicament by making us feel claustrophobic right alongside them.|Fresh
A clever if increasingly mechanical suspense contraption, yanking our sympathies this way and that, before turning into a different sort of movie entirely.|Fresh
Three young burglars who think a blind man is easy pickings are in for a surprise in this tense, expertly crafted thriller.|Fresh
A nice little mix tape of a horror movie, incorporating elements of familiar films into something satisfyingly different.|Fresh
Alvarez appears to have consciously toned down the gore from his blood-saturated Evil Dead remake, trusting unnerving visuals and foreshadowing what terrors are about to unfold.|Fresh
Lang, snorting and enormous and bestial, seems like the Minotaur stalking intruders in his deadly labyrinth. For the first hour, the psychological cruelty far outweighs the physical.|Fresh
It leaves the audience in the same place as the characters: gasping for air.|Fresh
What started as an intense, gripping thriller becomes a ridiculous cartoon.|Rotten
While its script could have been written on the back of an envelope, its editing and use of sound design is a triumph.|Fresh
"""One of the most twisted movies you'll see this year."""|Fresh
Connoisseurs of creepy and sometimes brutal chills will have a good time.|Fresh
Don't Breathe makes for a very fun little thriller, though it also veers into being exceptionally stupid or eye-rollingly gross.|Fresh
Once Don't Breathe detonates its big twist...some audience members will feel the film stops being fun while others will feel the fun has started in earnest.|Fresh
The script, by Alvarez and Rodo Sayagues, steadily and inventively heightens the tension of the break-in and the inevitable hiding and chasing, at least until everything gets ridiculous toward the end.|Fresh
What happens on the screen spreads to the audience. The silence, like the fear, is contagious.|Fresh
While the sight-based conceit offers the opportunity for clever suspense and scares, it's the starkly realistic setting and all too newsworthy themes underpinning the spooky tale that makes the horror of this film so bone-chilling.|Fresh
Director Fede Alvarez is a pro at creating tension with nothing more than sound effects and shots that constantly have us thinking of what's outside the frame.|Fresh
Don't Breathe's sustainment of its corkscrew tension is so elegant and methodical as to feel dance-like.|Fresh
While it is definitely time for Alvarez to stretch beyond his brand of housebound horror, he just may be the current master of it.|Fresh
An intense, streamlined exercise in gruesome thrills, with a tiny glimmer of social context (it's all about the economy) which doesn't take away from the exciting struggle to get out of this house of horrors.|Fresh
The type of edge-of-your seat thrills promised by its commercials, but also takes you into far darker territory than anticipated.|Fresh
DON'T BREATHE works on a primal level with a few shocking surprises along the way.|Fresh
The blind man's house becomes a Rube Goldberg machine of suffering, for just about everybody, and it's a twisted delight to watch that chain of events unfold.|Fresh
Simple, brutal and intense.|Fresh
The ending leaves room for a sequel, but it's not just a half-baked teaser. As with all strong horror stories, the conclusion of one dangerous scenario feeds the fear of more to come.|Fresh
Don't Breathe is a punch to the face, delivering everything you deem tense and thrilling. It's an adrenaline shot of genre-bending ferocity.|Fresh
Don't Breathe indeed reaches a unique destination in horror filmmaking. Unfortunately it fails to deliver a worthy emotional hook to pin its savagery onto.|Rotten
A trapped-in-a-house thriller pitting thieves against an unexpectedly resourceful victim, the lean and mean pic offers scares aplenty and at least a couple of game-changing twists.|Fresh
It's nice to see [Alvarez] flex his filmmaking muscles a bit more independently, and I do hope this is only the start of his very promising career as a genre director because Don't Breathe is an amazing sophomore effort.|Fresh
Alvarez's Evil Dead left many wondering what this visually talented director would do next. Inconsistent and offensive, Don't Breathe is not the follow-up many will have wanted.|Rotten
Don't Breathe is a masterful combination of suspense and violence that'll have you squirming in your seat and enjoying every minute of it.|Fresh
A muscular exercise in brutal, relentless peril.|Fresh
The first two-thirds are as solid a piece of thriller filmmaking as Hollywood has produced in a while.|Fresh
