It's a curious mix of old fashioned mawkishness, dewy eyed, if understated, patriotism, and contemporary art house narratological experimentation. It is, appropriately, very British (as we like to think of ourselves).|Fresh
A contemporary war movie that echoes classic combat films but eclipses them at the same time, Nolan's new epic puts Dunkirk on the cinematic map.|Fresh
I appreciated and liked a lot of what Nolan accomplished, but it was too impersonal and distant to fully love.|Fresh
Ambitious, emotional, impressive, beautiful, terrifying and superbly cast, it's a fitting testimony to one of the most remarkable episodes in modern warfare.|Fresh
Heroism is celebrated, Spitfires fly, Churchill is reverently quoted and we're offered scenes of plucky British pathos that could have been written in the 1940s.|Fresh
It is hard to imagine a better tribute to this victory of survival than Nolan's spare, stunning, extraordinarily ambitious film.|Fresh
Dunkirk is a war movie that plays particularly well for people who don't typically like war movies.|Fresh
A little carnage goes a long way when it's punctuated with sweeping money shots of thousands of soldiers on an expansive, haunted beach. You don't experience the misery in the misery-you feel it in the spaces in between.|Fresh
Nolan uses unusual and new techniques to make the viewer feel as if she/he is actually experiencing the action--for better or worse. This is one of the great WWII films.|Fresh
This astonishing film demands to be watched on the biggest screen available.|Fresh
Dunkirk brings a lump to the throat and a tear to the eye. Highly recommended.|Fresh
A film that will doubtless become the definitive cinematic depiction of this remarkable chapter of history.|Fresh
Nolan has given us the cinematic equivalent of the British stiff upper lip.|Fresh
It's the anti-blockbuster blockbuster, full of brains, grit and a fearlessness to challenge superhero-drunk filmgoers to invest fully of themselves by finding meaning in every exquisitely shot frame.|Fresh
Dunkirk is being hailed in some quarters as one of the greatest war films ever made and in others as a typically overrated Christopher Nolan endeavor. Neither claim is accurate, although the enthusiasts are closer to the mark than the Nolan naysayers.|Fresh
"Impressive ""Dunkirk"" Hampered by Gimmick."|Fresh
Spinoza once opined that you couldn't use words to describe God, because by choosing any one or several, you would be eliminating the infinite nature of the deity. That essential inadequacy of words drives much of Nolan's stunning film.|Fresh
From the start, Nolan gives the action a terrifying immediacy, pummelling us with the intensity of his images and the throbbing power of Hans Zimmer's score.|Fresh
...instantly enters the pantheon of great modern war films... that don't glorify war, but respect and honor those who have had to endure it.|Fresh
Allows us to feel as much as possible how the soldiers must have felt during that trying evacuation, where death was all-around them at the beach.|Fresh
Technically awe-inspiring, narratively inventive and thematically complex, Dunkirk reinvigorates its genre with a war movie that is both harrowing and smart.|Fresh
It's an extraordinary undertaking, and Nolan delivers a spellbinding ride. Out of the depths or man-made horror, he's created a gripping tale of human resolve.|Fresh
Despite all the substandard characterization, what we do see sucks us in enough to keep us invested and, at times, riveted.|Fresh
"Watching ""Dunkirk"" for the first time takes me back to my first viewing of ""The Thin Red Line;"" I'm ready for its mastery to emerge in repeat viewings..."|Fresh
Land, sea and air, all disturbed by war and freckled with humanity, merge splendidly in another near-masterpiece from writer/director Christopher Nolan.|Fresh
Surely the filmmaker's insistence upon imposing his favourite device upon all his narratives is edging towards Shyamalan-like overkill.|Rotten
Nolan deserves to be commended for his superior craftsmanship. Ultimately, however, Dunkirk falls way short of such contemporary genre classics as The Big Red One, The Thin Red Line or Steven Spielberg's Saving Private Ryan.|Fresh
Deploying his mastery over filmmaking technology, Nolan has made World War II look fresh and exciting by focusing not on the action sequences as much as the desperate struggle for survival.|Fresh
Mr. Nolan can be forgiven, or even praised, for refusing to pander to sentiment. He's given filmgoers far more to see and hear -- and Dunkirk will be heard from at Oscar time.|Fresh
Nolan has crafted not just his own best film but one of the finest war films of the 21st century.|Fresh
Christopher Nolan's biggest departure yet is successful in showing the horrors of war without relying on action-heavy expectancies.|Fresh
This is real cinema: spare, terse, expertly edited. I saw it in 70mm, and so should you if you can. But mostly, you should just go see it -- it's a masterpiece.|Fresh
Ambitious, sophisticated and gloriously cinematic, Christopher Nolan's Dunkirk bursts into the heart of the summer moviegoing season.|Fresh
Dunkirk is a powerful work from one of the great directors of our time.|Fresh
Despite the curtailed run time, as chaotic as it may seem, it still bears the director's meticulous attention to detail and technical mastery, which pays off over and over in many suitably distressing ways|Fresh
This is a magnificent achievement accomplished with staggering buoyancy and grace, the victory of survival its own form of heroism worthy of celebration.|Fresh
[N]early two hours of uninspiring mayhem...Dunkirk uses history as a pretext to show off the director's fascination for calamity.|Rotten
Director Christopher Nolan delivers one of this summer's most precisely crafted, visually astonishing films in the simultaneously gorgeous and devastating Dunkirk.|Fresh
All [the actors] succeed, but special mention goes to Whitehead's Tommy, whose mixture of fear and determination in the opening scene sets the movie's tone, and Rylance, whose civilian skipper suggests quiet dignity like no other.|Fresh
Dunkirk's relatively brief running time, though, means there's rarely a dull moment. Viewers are thrust into the action, and like many of the soldiers, they're left on their own to sink or swim.|Fresh
Each setting features its own editing rhythm, characters and score... Far from being a Memento-like puzzle to piece together, Dunkirk is a series of tense standoffs whose resolutions all funnel into the same prerequisite; get the soldiers home.|Fresh
Brings a refreshing unconventionality to the war movie genre.|Fresh
Dunkirk's plot is fairly uncomplicated. The thrill is in the deeply exhilarating pace at which the action unfolds.|Fresh
It is a good movie. One bordering on great, even. The best movie Christopher Nolan's done in years... and I say that as someone who likes (most, sorry The Dark Knight Rises) Nolan movies.|Fresh
It is Nolan's control of the visuals that makes this among the most harrowing of war films.|Fresh
Christopher Nolan's genius for treating movies like chess matches... is brilliantly employed in this account of the British (and French) attempt to retreat across the English Channel from the coastal city of Dunkirk in the early years of World War II.|Fresh
On top of the non-stop action, Nolan succeeds by acknowledging weak spots that have plagued his entire career. Instead of improving on these weaknesses, he crafted a film that has no need for them.|Fresh
Nolan makes up a triptych with war's relativity -- time stretching or standing still in the presence of death.|Fresh
Anyone hoping to be guided through all this morass of detonations and drownings by the handrail of dialogue, the nuance and shade of human drama, will have to go whistle. Dunkirk is not about characters but character.|Fresh
In absence of his usual brand of intellectual complexity, Nolan instead packs each of his uncharacteristically minimalistic tales with a career-best effort in emotional fortuity.|Fresh
It's a harrowing, moving, and minimalist epic that haunts the soul while satisfying those fleshy urges with spectacular and unforgettable action alongside an unrelenting hum of anxious intensity. It's about people, not war.|Fresh
Christopher Nolan steps in a new direction this time, delivering a picture that engages the intellect and the senses, if not exactly the heart.|Fresh
Dunkirk becomes much more than a war film. It can be classified within the war genre but it's more of a personal affair rather than a two-hour shootout on battlefields.|Fresh
Christopher Nolan's Dunkirk is a stunning technical accomplishment -- like all of writer/producer/director Nolan's films, I suppose -- and also the leanest, sharpest thing he's made since Memento.|Fresh
Dunkirk manages to be a stirring , yet intimate epic all at the same time. At its core though it is a gripping thriller that is unlike anything I have ever seen in this genre, a bravura triumph for Christopher Nolan.|Fresh
Dunkirk is very, very good- but it's not transcendent|Fresh
It's a series of riveting tableaux, but the human center is lacking.|Fresh
Its flaws may keep it from reaching the highest levels of Nolan's directorial catalog, but as a portrait of a pivotal moment in world history, Dunkirk is the kind of gripping and powerful experience that Imax screens were made for.|Fresh
A war film that is not a war film and yet will immediately enter the ranks of the best war films made so far.|Fresh
[A] breathless, awe-inspiring depiction of war by land, sea, and air... [O]ne of the few perfect films of the 21st Century.|Fresh
Dealing with a real-life event, Christopher Nolan has shifted out of cerebral overdrive and rediscovered a welcome directness and simplicity.|Fresh
It's one of the great films of the year so far, make no mistake, and yes, it's one of the best war dramas ever made, full stop.|Fresh
Nolan's array of unique POV shots and his peerless command of scale relay the terrifying subjective experiences of Dunkirk's characters in a hauntingly visceral way.|Fresh
Exhilaratingly claustrophobic, Christopher Nolan's latest is the best film of the year thus far.|Fresh
Yet, for all the heroic effort, there is no heroic result.... Dunkirk pulls itself apart on the beaches, in the air, and on the seas. It never surrenders a single strand of storyline so the others may survive.|Rotten
...[Dunkirk delivers] film-going experience that is more visceral than intellectual or emotional.|Fresh
"""Dunkirk"" is a faithful and well-crafted retelling of an overlooked, but crucial, event in World War II, which is enough to make it worth your time."|Fresh
A World War II movie your dad will fall asleep watching on the couch.|Rotten
Communicates the dislocations of war in a powerful new way, and will likely be mumbled over by film-school scholars for years to come. How many non-scholars will be wanting to see it a second time we will soon discover.|Fresh
"The brilliant, unconventional structure adds to the immersive nature of ""Dunkirk,"" reinforcing the sense that the war is everywhere, that characters who haven't even met make decisions with life-or-death consequences for each other."|Fresh
Relentlessly barreling between dive bombings, torpedo attacks and dogfights, the movie works your nerves. It's just one damn thing after another.|Fresh
Easily an early Oscar contender in various categories, including Best Picture. (Full Content Review for Parents - Violence, Profanity, etc. - also Available)|Fresh
Nolan's WWII epic is unlike anything you've seen on screen before. So why are we so disengaged?|Fresh
Extremely ambitious yet rarely effective...|Rotten
Dunkirk left me feeling vaguely dissatisfied, with too many unanswered questions. For me it missed the big picture. If that means I'm swimming against the tide, so be it.|Rotten
Important to the film's success is Hans Zimmer's unique score, which becomes a living entity unto itself due to pulsating sounds.|Fresh
A beautifully shot, shallow, and nauseating video game. Too much Spectacle and not nearly enough humanism, a truly special effect that money cannot buy. It's the equivalent of dry, stale bread.|Rotten
Other critics are raving about this one. Did we see a different movie? This one is terribly disjointed and you are never connected to the characters. Wanted to like it but...|Rotten
Absolutely Stunning|Fresh
A vivid symphony of visceral experiences.|Fresh
With an interwoven script that intersects when you least expect it, the film is a mighty example of storytelling and the power of atmosphere.|Fresh
Although Dunkirk looks at one of the most amazing military/civil operations of World War II (or maybe of any military conflict in history), it's not a war movie. It's Christopher Nolan's view of a war movie.|Fresh
Nolan again continues his proud tradition of eschewing computer-generated shots in favour of actual ships, planes and men. The result is a film that will look authentic, bloody, honest and real for as long there are people to watch it.|Fresh
Dunkirk isn't striving to immortalise English heroism as a sepia-toned portrait. Dunkirk simply wants to transport you to the battlefield, and experience the horrors that lie there.|Fresh
It is brave, and even admirable, but if you are fond of an emotional core? Then you will sorely feel the lack of it.|Rotten
The miracle of Dunkirk is that it's different from other war movies in the best ways, and it's exceptional in every technical sense, making it one of the most emotionally powerful films of 2017.|Fresh
"As both a fresh approach to historical action and a thunderous throwback to old-fashioned war movies, Christopher Nolan's ""Dunkirk"" is a triumphant feat of white-knuckle storytelling."|Fresh
The picture is distinguished by a knack for undercutting genre conventions without diminishing them emotionally.|Fresh
Dunkirk is Nolan's most directly cinematic of his works, knocking plot and melodrama down the totem pole in favor of furiously transportive images and sounds that elicit emotion in a more primal, instinctual way.|Fresh
Arguably Nolan's best film, Dunkirk is a propulsive descent into Hell that celebrates the indomitable human spirit.|Fresh
A vivid, heart-pounding, emotional rollercoaster of a film, Dunkirk is also one of the most immersive experiences you could ever wish to endure. But therein lies its genius.|Fresh
Ultimately, this is an unsentimentally masterful chronicle of a propaganda victory plucked from the jaws of military disaster.|Fresh
The film is a wonder to experience (especially in Imax), but it's not perfect. For all the technical brilliance, there's something emotionally removed about the storytelling that keeps a viewer at arm's length throughout.|Fresh
The pleasure in the storytelling arc is how elements move swiftly together. Nolan's biggest trick is the film starts out being epic and moves effortlessly to the intimate ....|Fresh
What it is, essentially, is 106 clamorous minutes of big-screen bombast that's so concerned with its own spectacle and scale that it neglects to deliver the most crucial element -- drama.|Rotten
His exciting set pieces of sinking ships and aerial dogfights will thrill audiences who head to big Hollywood films for spectacle. But when Nolan gets the subtler moments right, you see something much more.|Fresh
So many of us wanted Dunkirk to be truly great. It's too virtuous and not vulgar enough to be great. It's a brilliant film that embraces grandeur but has a tasteful horror of rhetoric.|Fresh
Christopher Nolan's first non-fantasy movie is bold, visceral, and powerful, with many moving sequences -- though some of his filmmaking choices can be challenging.|Fresh
Christopher Nolan affirms his status as contemporary cinema's boldest blockbuster director with this intensely immersive and relentlessly stirring chronicle of the famous World War II evacuation.|Fresh
Given little context and even less character arc, Dunkirk emerges as an emotionally hollow exercise in wartime spectacle.|Rotten
Not a second is wasted in the taut 105-minute running time, something Nolan emphasizes by giving it the ticking-clock structure of a thriller, albeit a very Nolan-style thriller.|Fresh
From the get-go Dunkirk is a relentlessly tense affair...|Fresh
"The tension starts from minute one and doesn't let up until the credits roll in ""Dunkirk,"" Christopher Nolan's terse, nerve-jangling WWII drama."|Fresh
It's a gripping addition to the canon of war on film that is definitely worthy of attention, and some of the images are electrifying.|Fresh
There's so much to absorb and appreciate in this movie that one viewing just might not be enough.|Fresh
Is it ethical to make a war movie this beautiful?|Fresh
Both intimate and epic, as emotional as it is tension-filled, it is being ballyhooed as a departure for bravura filmmaker Christopher Nolan, but in truth the reason it succeeds so masterfully is that it is anything but.|Fresh
It only takes a matter of minutes for Dunkirk to convey the unmistakeable notion you are in the presence of true cinematic greatness. This is what a masterpiece looks like. Sounds like. Feels like.|Fresh
Nolan's simplest and at the same time most complex narrative film. [Full review in Spanish]|Fresh
"""Dunkirk"" bolts out the gate not like a thoroughbred racehorse, but like a pack of them, never stopping until - thunderingly, and with a feeling that encompasses both victory and defeat - it crosses the finish line."|Fresh
Christopher Nolan's Dunkirk is not so much a war story as it is an attempt to communicate the experience of war.|Fresh
When the structure of Dunkirk becomes visible, when it stands as a mathematical demonstration of brave individual choices lining up in a tidy row, you might realize that you've been had.|Rotten
As an examination of collective triumph and spirit it is a decisive victory.|Fresh
"""Dunkirk"" is a finely crafted examination of a historical event that changed the direction of the war."|Fresh
As magnificently well crafted as Dunkirk is, it is a film destined to be respected more than it is loved, and given Nolan's record -- I credit him with five great movies -- I call this a highly honorable achievement that nonetheless slightly disappoints.|Fresh
An intense, carefully calibrated mini-epic about surviving war.... Packs the punch of something far more graphic.|Fresh
This is a grand spectacle, not an empty one, a rare example of the Hollywood blockbuster dollar well spent.|Fresh
See it on the biggest screen you can find.|Fresh
A cinematic triumph that will awe some viewers and alienate others - for the same basic reasons.|Fresh
"Seldom has a film so eloquently captured the craziness, brutality and arbitrariness of war. ""Dunkirk"" just might be Nolan's masterpiece."|Fresh
As a big-screen experience this can be overwhelming, especially when characters are trapped below oncoming planes or inside beleaguered sea vessels; few war movies have communicated more viscerally how it feels to be a sitting duck.|Fresh
Director/writer Christopher Nolan masterfully revives the classic war film with an edge-of-your-seat, emotionally-charged thriller.|Fresh
Whenever it creates or recreates the bigger picture, Dunkirk itself becomes a bigger, bolder, better picture.|Fresh
A streak of honest sentiment, earned under the most hellish of circumstances, courses through this movie and provides it with spine and a soul.|Fresh
The first film Nolan has made that feels bigger than the director's preoccupations and obsessions.|Fresh
An inspirational tribute to Britain's Greatest Generation that just might be Chris Nolan's best picture yet!|Fresh
With magnificent visuals, tension is the star.|Fresh
Its images are most obviously big in size, more importantly fluid in movement in a way not equaled (let alone attempted) by just about anything you might find anywhere.|Fresh
In a time when prestige TV is hogging lots of attention (and deservedly so!), Christopher Nolan's stunning WWII saga makes a pretty strong case for the continued sustenance of film.|Fresh
Nolan has made a war movie that provokes both thrills and thought. Consider Dunkirk another must-see.|Fresh
Nolan has delivered a visceral, suspenseful, at times jaw-dropping historical war movie, the lone disclaimer being that he sacrifices character development in his steadfast focus on technical virtuosity.|Fresh
World War II history buffs won't want to miss this large, sprawling colossus of a film.|Fresh
It's beautifully shot, with a panoramic depth and breadth of landscapes. It is also unrelenting.|Fresh
Dunkirk will bowl you over. It is almost too much power for one filmmaker to have.|Fresh
The most emotional moments in Nolan's film are the smaller ones, a soldier slipping into the sea swimming towards home, a young hero recognized in a local newspaper.|Fresh
A display of both Nolan's dark, wizard-like powers as a filmmaker and his weaknesses and neurotic affectations as a storyteller.|Fresh
"Watching Dunkirk, the word ""masterpiece"" comes to mind -- often and effortlessly."|Fresh
"The finest war movies examine the personal struggles within the larger framework of a battle: the eye-level conflict. That's the strategy of ""Dunkirk,"" an ambitious, evocative (but at times too aloof) World War II epic."|Fresh
I'd go so far to say that Dunkirk could easily serve as its own master class in the art of film editing. Add to that an absolutely terrifyingly discordant score from Hans Zimmer and the result is, well, a bona fide classic. Well done, sir, well done.|Fresh
[Dunkirk] captures this struggle for survival with visceral intensity. It offers an immersion into this harrowing moment that is vast in its ambition and comprehensive in the degree to which it fulfills it.|Fresh
"Wisely, Nolan's movie is not about the ""big picture."" At about 106 minutes, it's a fast-paced, rousing story of soldiers and civilians confronting overwhelming odds, their moral compasses, fear and the specter of death."|Fresh
"""Dunkirk"" is a tour de force of cinematic craft and technique, but one that is unambiguously in the service of a sober, sincere, profoundly moral story that closes the distance between yesterday's fights and today's."|Fresh
"This blockbuster spectacle is an intense experience of pure cinema that far exceeds the standard ""miracle at Dunkirk"" narrative."|Fresh
Nolan is challenging himself to try and tell a war story in a different way.|Fresh
Christopher Nolan's ghostly and taut war story is his best film in years.|Fresh
From the first frame to the last, it's a propulsive ride that wrings so much tension out of the audience that by the time the credits roll, there's little you can do but stare at the screen in stunned silence.|Fresh
Nolan's film could only have been made by a cinema master with the perspective of time and all the history since, and we are fortunate to be here when he did.|Fresh
Christopher Nolan's recent output has been a master class of technical precision, as if that alone were enough. It's not, by the way.|Fresh
"At a relatively short running time for an ""epic"", the characters are not developed enough to allow us to care about their survival."|Rotten
"No doubt that ""Dunkirk"" is technologically well conceived and crafted. Unfortunately, a clever idea and expert editing cannot compensate for a dearth of human emotions."|Rotten
Nolan's made an intimidating endeavor, but those hoping for an exhaustively emotional event should seek their wartime blues elsewhere.|Fresh
In his ever-growing oeuvre, Dunkirk ranks as one of Christopher Nolan's best.|Fresh
Dunkirk, a film about men, created by men, is a force of nature - an elemental beast of a movie about finding the meaning of life surrounded by the meaninglessness of war.|Fresh
Dunkirk is a return to true form for director Christopher Nolan and it may very well be his best film yet. It combines the clever structure of Memento, the scale and ambition of The Dark Knight and the incredible cinematography of Inception.|Fresh
Christopher Nolan remains an abstract artist at core, and the tricky structure of his spectacular Dunkirk is not far removed from the games played in his science-fiction blockbusters Inception and Interstellar.|Fresh
A disappointment, a visual marvel but one lacking in emotional resonance, the sort of film one respects for its craftsmanship-but feels distanced from.|Rotten
Nolan challenges everything you might expect from the subject matter: be it in terms of narrative, plot structure, or even the basic notions placed on war films in general, and World War II movies in the main.|Fresh
It isn't a masterpiece or the best film from Christopher Nolan, but it's quite impressive. [Full review in Spanish]|Fresh
I wanted to walk out of Dunkirk with my heart beating. And I walked out with my brain humming.|Fresh
Primal and exhilarating, full of dread and tension. Drops us right into the chaos of war to tell an intimate story about fear and intensity of purpose.|Fresh
The star of the show is cinematographer Hoyte van Hoytema, whose serene photography provides a necessary counterbalance to the breathless editing.|Fresh
...there are maybe ten minutes in the middle where I felt my attention waning-and yet I'd hate to discourage Nolan from trying to take this approach more often.|Fresh
DUNKIRK's triumph owes to the simplicity of the finished product, not the complexity of the technical inputs. That masterful distillation is the piece that Nolan has finally brought under his command.|Fresh
Christopher Nolan has created something new in the annals of war films - an intimate epic.|Fresh
[Nolan] has managed to combine the epic and the intimate. We are a long way from next year's Oscars but Dunkirk must surely already be a frontrunner.|Fresh
