What Nolan gets right in Dunkirk -- from the action to the spare dialogue -- is so good that it makes the fact that any narrative deficiencies exist seem all the more disappointing.|Fresh
An immersive, bombastic historical epic more interested in how things happen than the people who things actually happen to.|Fresh
This is a movie that deserves to be seen on the largest screen possible and, no, whatever you have in your home doesn't count unless you reside inside an IMAX theater.|Fresh
Even with its overly complicated structure and scarcity of emotion, it's no exaggeration to call it a technical masterpiece, offering a stunning look at a key moment in WWII.|Fresh
... A fresh, innovative take on the war movie and an engrossing, unique experience for the audience.|Fresh
An instant war classic that finds its power in individual tales of heroism and renders them larger than life.|Fresh
It's possible you're more impressed with the filmmaker's bravado than with anything the characters are doing onscreen.|Fresh
Rigorously staged and artfully photographed...Christopher Nolan applies his trademark ingenuity and clockwork precision to an otherwise straightforward story.|Fresh
Dunkirk makes for Christopher Nolan's most intense and nerve-wracking thriller yet, delivering a strikingly terse viewing experience in the process.|Fresh
It's at once minimalist and maximalist, cynical and dopey, a big-boy white elephant art film that is actually a lean and mean suspense set-piece machine.|Fresh
In a swift 106 minutes, watching Dunkirk becomes a stunning and genuine experience, enveloping viewers in a way few movies ever do.|Fresh
Thanks to Nolan's unapologetically immense and imposing style, Dunkirk is as cinematically close as one can get to wartime trauma, survival impulses, and heroic altruism.|Fresh
"""Dunkirk"" is one of the great war pictures of our time. It's haunting, it's rapturous, and it's unforgettable."|Fresh
It's one of the best war films ever made, distinct in its look, in its approach and in the effect it has on viewers.|Fresh
Go ahead and engrave the Oscar now, for this is the best film of the year and one of the 10 greatest of the century.|Fresh
A bold, intentionally bloodless film that for the most part works spectacularly well.|Fresh
"Marked by subtle moments of epic silence and a unique structure, writer/director Christopher Nolan's ""Dunkirk"" is a timeless classic."|Fresh
A visceral, nerve-shredding pulse-pounder that needs to be experienced on the biggest screen you can find.|Fresh
Tightly focused, even minimalist approach to telling the true tale of a military disaster and how hope was cultivated in the sands a mighty failure.|Fresh
Christopher Nolan's relentless Dunkirk turns a wartime retreat into a cinematic triumph.|Fresh
Christopher Nolan's greatest cinematic achievement, a masterpiece on every level.|Fresh
...one of of the most gut-tightening, engrossing, downright suspenseful films of the year.|Fresh
...encourages us to hail heroes whenever we have the slightest excuse, and give considerable pause before calling anyone a coward.|Fresh
This accomplished, exceptional piece of cinema delivers summer-scale spectacle, albeit without the escapism audiences often crave from blockbuster releases at this time of the year.|Fresh
For all its taut direction and editing, its thunderous sound and its historic origins, the film doesn't quite move us as deeply and as often as we expect. Perhaps Nolan is trying too hard to construct the mood with the tools at his command.|Fresh
Nolan is the star of this explosive mood piece that soars on the wings of its visuals and sound and makes it truly a visceral experience.|Fresh
Being as objective as it is may ultimately rob the film of some of its potential for emotional impact, but there is no denying Dunkirk is unlike any war film we've ever seen.|Fresh
Dunkirk is a great last half of a movie, but alone is an emotionless vacuum.|Rotten
The film's fussy ambition ultimately results in aesthetic and thematic sloppiness.|Rotten
"""Dunkirk"" is a great movie, both an old-time inspirational war epic and at the same time very much a Christopher Nolan movie."|Fresh
You disappear inside of it and it changes you, as all great movies do.|Fresh
Human nature is on full display, for better, for worse, or both. The man who commits a selfish act in order to survive and the man who acts gallantly to save others may, in fact, be the same man.|Fresh
Here's a classical-yet-modernist action film that will be taken apart and put on display in film schools and film clubs for years to come.|Fresh
"It's the most essential ""see it on the big screen or else"" experience since 'The Walk'."|Fresh
The Oscar race for Best Picture is officially on. From first frame to last, Christopher Nolan's Dunkirk is a monumental achievement, a World War II epic of staggering visual spectacle (see it in IMAX if you can) that hits you like a shot in the heart.|Fresh
I don't know if my heart stopped racing for all of Dunkirk's brisk, unbearably tense 107-minute runtime.|Fresh
It deserves to be seen and argued about. They don't make them like this anymore. Never did, really.|Fresh
Christopher Nolan has created the most intense, immersive war story since 'Saving Private Ryan.'|Fresh
Once again Nolan shows himself to be a master of pure cinema. Incomparably immersive, Dunkirk does admirable justice to its story - it's a film that never lets up, never surrenders.|Fresh
It's a magnificent movie of staid heroism, utterly opulent in its bleakness.|Fresh
Dunkirk is a gripping story of survival told through cutting edge camera work and bare bones storytelling. Christopher Nolan has delivered a classic war film.|Fresh
The crunching realism, as captured on large format film stock, is unmistakable, and puts every other rival summer spectacle to shame.|Fresh
Dunkirk is the film Nolan has been building to his entire career. It's his masterpiece, it's the best film of the year so far, and it's the one to beat come awards time.|Fresh
An immersive, exhilarating experience; see it on the biggest screen you can find.|Fresh
Dunkirk, tellingly, is the first of Nolan's films to induce tears in its final frames. The director's technical mastery finally transcends craft to become art and, as a result, this is his best film to date.|Fresh
Nolan crafts a frighteningly realistic portrayal of the Allied soldiers' evacuation, with some of the best aerial dogfights ever put to screen.|Fresh
No war film you've seen before - from Das Boot to Saving Private Ryan to The Thin Red Line - comes close to what Nolan has created here.|Fresh
The swift-moving, pulse-pounding Dunkirk reveals its filmmaker at his most nimble, supple, and simple.|Fresh
"Dunkirk the event may have been ""a colossal military disaster"" according to Churchill, but Dunkirk the movie is a glorious, breathtakingly vivid triumph from a director at the top of his game."|Fresh
What's so ambitious and ultimately so masterful about Dunkirk is that it is almost entirely an action sequence.|Fresh
Clocking in at only 107 minutes long, Dunkirk is tightly paced, and end-to-end it is furnished with stunning sequences that leave you holding your breath.|Fresh
Nolan has crafted a tight, gripping, deeply involving and unforgettable film that ranks about the best war movies of the decade.|Fresh
Christopher Nolan's epic isn't just the best film of his career, but one of the best war movies in decades.|Fresh
Even as we are left exhausted and stunned by what we've watched, there is an underlying lack of emotional connection that leaves the film as chilly as Nolan's detractors have accused his other pictures of being.|Fresh
Sensational in every sense of the word; it aims for both the heart and the head, to be sure, but arrives there via the central nervous system.|Fresh
For his next, and possibly greatest trick, Nolan has whipped up a war movie fearful of and resistant to combat itself, instead preoccupied with the rough interplay between duty and fear.|Fresh
Dunkirk wants us to sense what made this moment so pivotal without reducing it to an individual tale. And at that, it succeeds richly.|Fresh
Christopher Nolan's relentlessly tense historical epic Dunkirk is a war movie like no other, a gripping, edge-of-your-seat thriller than doesn't give you a moment to catch your breath.|Fresh
From script level, which pilots three time frames and strafes his own fiction onto the reality of the Allied evacuation of June 1940, to its astonishing technical prowess, this is heart-stopping entertainment.|Fresh
In spite of my want for deeper or more oblique notes in it, Dunkirk is an unbelievably assured and thrilling war film. Nolan is at the top of his game, and what a joy it is to watch him construct such grand scale filmmaking.|Fresh
This is Nolan's finest film to date, an immersive and emotional masterpiece and a superb return to form.|Fresh
'Dunkirk' gives us a short, sharp dose of the oddness and horror of war, dropping us right into the fray.|Fresh
Dunkirk may be [Nolan's] first historically based fiction, but it's his latest in a long line of survival puzzles, designed to thrill and to provoke the response moviemakers of all kinds have been after for more than a century: whew! Followed by: wow.|Fresh
Christopher Nolan's astonishing new film, a retelling of the Allied evacuation of occupied France in 1940, is a work of heart-hammering intensity and grandeur that demands to be seen on the best and biggest screen within reach.|Fresh
The rush of cold open water leaves you shivering. A nosediving fighter plane causes you to gasp for air. An explosion makes you want to duck for cover. All that and . . . Harry Styles?!|Fresh
Effectively one enormous, stunningly rendered and thunderously intense set-piece stretched to feature-length, Dunkirk thrusts you into a pressure cooker and slams the lid on.|Fresh
The nerve-racking war thriller Dunkirk is the movie Christopher Nolan's entire career has been building up to, in ways that even he may not have realized.|Fresh
From the off you know you're in great hands. This isn't your typical churned out war movie: this is war and you're in it. Nolan completely immerses the audience in the soldiers' world.|Fresh
Haunting, thrilling and emotional, Dunkirk is a prestige pic with guts and glory that demands multiple views.|Fresh
[Nolan has] found a way to harness that technique in service of a kind of heightened reality, one that feels more immersive and immediate than whatever concerns we check at the door when entering the cinema.|Fresh
This is visceral, big-budget filmmaking that can be called Art. It's also, hands down, the best motion picture of the year so far.|Fresh
Let other directors play with toy soldiers and computer effects. This is big-time, old-school filmmaking. Dunkirk isn't overdone. It's simply done epically.|Fresh
Dunkirk is ambitious, monumental filmmaking, to say the least, but director Christopher Nolan handles it all masterfully, delivering an unconventional and stunning war movie.|Fresh
Dunkirk feels like this decade's Band of Brothers, a film likely to be the launchpad for the next set of hot, young British actors.|Fresh
Christopher Nolan's Dunkirk is a stone cold masterpiece. It's a stunningly immersive survival film told in 106 thrillingly realized minutes.|Fresh
... its timeless heroism and state-of-the-art execution makes me think they don't make 'em like Dunkirk anymore. In fact, they never have.|Fresh
Anchored with a winning ensemble, this unflinching look into war may have just redefined the genre. An Oscar player has emerged.|Fresh
A directing and editing masterpiece.|Fresh
"The story of a miracle should have been thrilling; but given the non-linear approach, ""Dunkirk"" lacks the kind of center that would prompt the audience to stand up and cheer."|Rotten
Dunkirk is just a masterclass in the art of storytelling, with a variety of different characters, in different places, fighting their own different battles, all intertwined as we progress, without any sense of contrivance.|Fresh
Britain's great pyrrhic defeat or inverse victory of 1940 has been brought to the screen as a terrifying, shattering spectacle by Christopher Nolan.|Fresh
Christopher Nolan's largely bloodless but profoundly harrowing war epic is the best film he's ever made.|Fresh
"There have been countless films this summer that have engaged in endless spectacle but ""Dunkirk"" is the rare blockbuster that will leave a bruise."|Fresh
Dunkirk is an impressionist masterpiece.|Fresh
Pure sensory experience; incredible visuals, intense battles.|Fresh
Nolan's feat is undeniable: He's made an immersive war movie that celebrates the good of mankind while also making it clear that no victory is without sacrifice.|Fresh
The war movie as sensory overload, and the opposite of a Wikipedia movie.|Fresh
Great directors make Great Pictures.|Fresh
