Eighth Grade is a revelation of both a remarkably natural young performer and a clever, sensitive young filmmaker.|Fresh
"An extraordinary movie about an ordinary girl named Kayla, ""Eighth Grade"" follows her through a final week of middle school."|Fresh
This is what adolescence feels like, and this is what we worked hard to forget. If Eighth Grade is sometimes too painful to be enjoyable, well, we can't blame it for telling the truth.|Fresh
Burnham is clearly conflicted about the emotional effects of the constant comparisons, competitions and invidious voyeurism young people are subjecting themselves to nearly all day long. And he gets the subjective experience right.|Fresh
Burnham has constructed a remarkably thoughtful first feature film.|Fresh
I loved the look and simple but effective style of this film.|Fresh
What most stunned me about 'Eighth Grade' was how well directed it is. It's rare that teen movies have the kind of visual acuity and verve that Burnham achieves here.|Fresh
"""Eighth Grade"" turns out to be an appealingly generous portrait of adolescent awkwardness, also of parental awkwardness, though Josh Hamilton's fumbling dad is a keeper."|Fresh
Burnham's sociological precision as a screenwriter and director, however, would likely not feel as genuine if not for Fisher in the pivotal role of Kayla. She doesn't act the part as much as she breathes it.|Fresh
Everybody who has been through eighth grade needs to see Eighth Grade.|Fresh
Burnham's filmmaking is unfussy yet thought through, so Fisher's seemingly artless performance is actually a pretty brilliant piece of acting.|Fresh
"""Eighth Grade"" is a beautiful and uncompromising piece of art, from a distinctive new talent."|Fresh
It's indie-movie self-pity, served-up with obvious, preening social criticism.|Rotten
"The transition between junior high and high school is exhilarating, traumatic, funny and horrifying, and Bo Burnham's ""Eighth Grade"" captures the whole experience perfectly."|Fresh
Burnham'sEighth Gradeis the most realistic depiction of those awkward middle school years ever on the big screen.|Fresh
Eighth Grade masterfully captures the emotional horror of being a Generation Z middle-schooler, yet tells a universally relatable coming of age story.|Fresh
It's a modest, intimate movie that contains a whole world - and one I could recognize and understand even though I grew up in an entirely different era from Burnham or Kayla.|Fresh
Burnham doesn't revel in Kayla's misery or exploit her for shock value. She does have her own share of heartache, but plenty of moments of happiness too.|Fresh
A refreshingly thoughtful exploration of adolescent online and offline identity, and how the two intersect, or don't.|Fresh
It's special, and rare, to see such a complex yet understanding and respectful look at a young woman's life.|Fresh
In the film, you're so immersed in the awkwardness of Kayla's life, that her long, timid walk from the guest bathroom in her lime green one-piece to the pool almost makes you sweat with anxiety.|Fresh
Whether through natural acting prowess or natural being-13-ness, [Elsie Fisher] nails the part.|Fresh
A small, lovely, touching movie that sums up all that's wrong and all that's right with being a teen and feeling unmoored.|Fresh
"""Eighth Grade"" is both revelatory and all-embracing."|Fresh
The culmination of [the stars'] onscreen relationship is profoundly moving... just as Eighth Grade points toward enduring careers for its writer/director and star.|Fresh
Eighth Grade is absolute vital viewing for anyone in the age range and parents; the best movie of 2018 so far, no question about it. Elsie Fisher better receive an Oscar nomination|Fresh
"I may be on the wrong end of the age spectrum to really know how ""Eighth Grade"" will strike the target audience - teens, not just teen girls. But, I think they will like it."|Fresh
Eighth Grade is a film that perfectly captures the spirit and awkwardness of being a student in the final year of middle school.|Fresh
A genuinely warm, tender and wise coming-of-age film that ranks among the great coming-of-age films like Boyhood, Ghost World and The 400 Blows. Elsie Fisher is a revelation.|Fresh
For a gloriously funny and heartbreaking 94 minutes, you will feel like you're 13 again.|Fresh
The film reflects arguably the worst stretch of growing up in America's education system, but it's rarely if ever ugly. Instead, it's compassionate, radiating retroactive kindness for the children we all were to soothe the adults we are now.|Fresh
... loaded with sharp dialogue and insightful subtext that captures the awkwardness of contemporary childhood without feeling watered down.|Fresh
It's less a movie, and more a cringe-inducing, full-body flashback to the exquisite excruciation of being an adolescent.|Fresh
Eighth Grade is low-key but a comparable landmark in the history of realistic teens on-screen.|Fresh
Elsie Fisher carries the movie in a performance that's nuanced and thoughtful.|Fresh
Painfully realistic, tenderly acted coming-of-age dramedy.|Fresh
EIGHTH GRADE is a sublime debut for Burnham.|Fresh
This movie feels genuine. It loves the characters, but it doesn't let them off the hook necessarily.|Fresh
This is a damn near perfect movie.|Fresh
I was just surprised over and over again at how deeply touching it is while seeming effortlessly so.|Fresh
Eighth Grade expertly captures those middle school growing pains every American kid for generations has endured.|Fresh
Startlingly empathetic, wincingly honest, and always completely charming.|Fresh
Writer-director Bo Burnham, in his feature debut, skillfully intertwines the timeless aspects of adolescent humiliation and the very particular ways in which today's tech has changed them.|Fresh
Eighth Grade is so grounded in the reality of middle school it almost operates like a horrible collective flashback.|Fresh
Writer/director Bo Burnham is a comedian, singer/songwriter/musician, actor and poet, but to the best of my knowledge, he's never been a thirteen year-old girl, which makes his feature film debut all the more impressive.|Fresh
Many filmmakers have tried and failed to do what Burnham's achieved in this remarkable debut.|Fresh
It is so viscerally authentic to the experience of being in middle school that for a moment I felt like I was standing in the lunchroom clutching my tray.|Fresh
Eighth Grade's only real drawback is how accurately it depicts being an awkward tween.|Fresh
Throughout, we're invited to chuckle at the ironies of Kayla's hobbies and activities, but underlying such scenes is a strain of eeriness, as if the film were offering up a post-human spin on Pretty in Pink.|Fresh
"Poignantly funny, wrenchingly wise and meltingly beautiful, ""Eighth Grade"" is a not-so-small miracle of independent filmmaking."|Fresh
The most authentic portrait of budding teenagerdom you're likely to see in theaters anytime soon.|Fresh
"In a landscape dominated by teen movies that bank so heavily on well-worn archetypes and weepy melodramatic situations, experiencing a film like ""Eighth Grade"" can feel almost miraculous in how natural it is."|Fresh
Every moment drips with aching - and, at times, heart-swelling - authenticity. The heart swelling is where the ugly cry kicks in.|Fresh
First-time director Bo Burnham's tender take on teen angst, starring an incandescent Elsie Fisher, is a flat-out triumph-a film that is both indelibly of the moment and achingly timeless.|Fresh
More than anything, this emotionally unsparing but never-punishing movie feels like the work of someone who kept his eyes and ears wide open.|Fresh
"""Eighth Grade"" is a simple story of an unremarkable girl, tenderly and movingly told."|Fresh
Eighth Grade isn't easy, both on screen and in life, but it's a film that should be a rite of passage for all, no matter the age.|Fresh
A stirring, painfully accurate slice-of-life, the kind of film so authentically observed it sometimes feels more like a cinéma vérité documentary than a scripted feature film.|Fresh
Bo Burnham's funny and heartwarming 'Eighth Grade' is also a deeply serious film about female adolescence in the age of social media, with plenty of casual wisdom to spare.|Fresh
Burnham's screenplay doesn't just feel attuned to the mindset of 13-year-old girls like Kayla - it feels like a paean to embracing the final moments of childlike innocence, instead of rushing to grow up.|Fresh
It's heartbreaking, heartwarming, and a total charmer.|Fresh
If there's a more haunting portrait of what it's like to grow up now, I'm not sure I could take it.|Fresh
A deeply kind movie, curious and nonjudgmental even about the characters who in most coming-of-age films would be hissable villains.|Fresh
[Burnham] smothers the story in sentiment, stereotypes, and good intentions.|Rotten
Highlights Elsie Fisher's stunning performance as an awkward 13-year-old who tries to overcome her shyness by posting videos of advice to her peers.|Fresh
Fisher delivers a glorious symphony of awkward poignancy, from Kayla's cringe-worthy attempts to chat up a popular girl to her ultimately sweet connection with her kind, befuddled single dad.|Fresh
I usually find coming of age films to be formulaic and unimaginative, but Eighth Grade had me hook, line, and sinker the whole time.|Fresh
Bo Burnham's narrative feature debut finds humor and hope in a painfully realistic middle school story.|Fresh
Elsie Fisher makes Eighth Grade a triumphant manifesto for all who have felt awkward, misunderstood and abused at a time when they just wanted to be cheered.|Fresh
Eighth Grade is a brilliantly raw, honest portrayal about the middle school experience.|Fresh
Bo Burnham's directorial debut is a marvelous subversion of expectations.|Fresh
[Elsie] Fisher is a real find, wielding the character's roller-coaster mood swings and open-wound insecurities with bravery and wit, and the supporting roles are equally convincing.|Fresh
This film is incredibly painful because the story is told well and hits so close to home that at certain points it will have you in tears, or make you cringe in your seat.|Fresh
It doesn't hurt that it's anchored by Elsie Fisher, who looks like she's giving an incredible performance as the film's lead, Kayla.|Fresh
Burnham thankfully never loses sight of the belief that things truly can get better if you want them to.|Fresh
Eighth Grade is an insular film, teasing out larger observations about the confluence of awkward and unfamiliar territory.|Fresh
By its moving bonfire conclusion, the entire press screening I attended was weeping. Such is the power of Eighth Grade, the achingly true-to-life filmmaking debut of Bo Burnham.|Fresh
Caustic, hilarious, and wonderfully effective, Burnham's Eighth Grade may drum up anxious feelings long buried, but it does so with a wit and intelligence that's unbeatable.|Fresh
Burnham's accomplished debut offers plenty for viewers of all ages, along with a filmmaking vision that is well beyond many of his comedy peers.|Fresh
... a simultaneously harrowing and sweet look at early adolescence.|Fresh
For the life of me, I don't understand how writer-director Bo Burnham tapped into the psyche of an eighth-grade girl, but somehow he did.|Fresh
It keeps threatening to become a cringe-fest, but pulls back, as Burnham opts instead for something more human and realistic. There's a lived-in wisdom in the film.|Fresh
Elsie Fisher is a wonder as the awkward Kayla.|Fresh
Your heart absolutely aches for Kayla, who is an adorable bundle of mumbles and stutters around her peers. As an adult observer, you know that Kayla will be okay, but those days seem fantastically improbable from her vantage point.|Fresh
"A winning film. ""Welcome to the Dollhouse"" for the millennial generation."|Fresh
Eighth Grade is lovely work, lifted up by a timeless piece of indie wisdom: Keep it real, as cringe-inducing as that can be.|Fresh
As Burnham branches out to explore new avenues, he has offered a fine example of what he can do and left it with a promise that there is more to come. Same goes for Fisher, who has proven she is able to balance so much in the matter of a scene.|Fresh
Perhaps most impressive ... is that Burnham manages to create a film that feels so deeply authentic.|Fresh
A lovely, truthful comedy about the pure nightmare that is junior high.|Fresh
Nevertheless, thanks to a wonderfully sensitive and bold performance from [Elise] Fisher and some standout work from Burnham behind the camera, Eighth Grade is ultimately an effective-if not exactly revelatory-watch.|Fresh
Whether it's due to Elsie Fisher's lovable turn as Kayla or Bo Burnham's frustratingly accurate portrayal of life as a teen, Eighth Grade is full of life, even if it's from the terrible teenage years of that life.|Fresh
Adolescence was always a minefield, but the present-day situation feels like the Normandy Invasion.|Fresh
[Bo] Burnham's comedy has always been adept at exploring human insecurities, so it's no surprise he zeroes in on the overwhelming emotional vulnerability that afflicts young teens.|Fresh
Burnham really understands the voice of teenagers. Kayla can't quite articulate what she's trying to say, but she has meaningful thoughts. All you need to do is read between the likes and you knows to hear her message.|Fresh
The kind of comedy that hipper parents might just be able to watch with their own offspring and enjoy.|Fresh
Burnham has tapped into a byproduct of social-media-saturated adolescence that's often overlooked in favor of parental panic and worst-case-scenario horror stories.|Fresh
"A winning film. ""Welcome to the Dollhouse"" for the millennial generation."|Fresh
It might be easy to laugh at Kayla, but Burnham and Fisher endow her with so much pathos that audiences are more likely to feel sympathy.|Fresh
"""Eighth Grade"" shines as, like, a totally spot-on, you know, portrait of Millennial angst and stuff."|Fresh
"""Eighth Grade"" isn't a documentary, but it hews as close to the modern coming-of-age experience as currently seems possible."|Fresh
What Bo Burnham has accomplished with his directorial debut is nothing short of extraordinary. He manages to bring to life a genuine story about a 13-year-old girl that will redefine the genre.|Fresh
