Sweet, poignant, funny, beautifully observed and delivered, this little gem is a potential classic and I loved it.|Fresh
The film's emotional depth may catch you by surprise somewhat, given how gently and unassumingly its drama is drawn|Fresh
At times, this is painful to watch...but Elsie Fisher is a naturalistic joy in the central role and there's an underlying and eventually rather touching optimism to what unfolds.|Fresh
In short, it is a warm, relatable comedy drama that captures the teenage experience to a tee.|Fresh
Eighth Grade is a masterpiece.|Fresh
The real genius of Eighth Grade is its universality - an honesty and compassion that cut across generational boundaries.|Fresh
There are moments of great darkness...Bo Burnham does a brilliant job of judging just how far to push any particular scene. And there is kindness, and joy, and the lurking underbelly of friendship.|Fresh
It's just sweet, sad and beautifully observed.|Fresh
This is a film that gets under the skin of Generation X with humour and heartfelt emotion that makes it a genuinely great coming-of-age movie that hooks you by the heart.|Fresh
Make no mistake Eighth Grade is a landmark in the packed hall of coming-of-age stories and in its humour, pathos and authenticity it can stand tall with the best of them.|Fresh
Sweet, poignant, funny, beautifully observed and delivered, this little gem is a potential classic and I loved it.|Fresh
The film's emotional depth may catch you by surprise somewhat, given how gently and unassumingly its drama is drawn|Fresh
At times, this is painful to watch...but Elsie Fisher is a naturalistic joy in the central role and there's an underlying and eventually rather touching optimism to what unfolds.|Fresh
In short, it is a warm, relatable comedy drama that captures the teenage experience to a tee.|Fresh
Eighth Grade is a masterpiece.|Fresh
The real genius of Eighth Grade is its universality - an honesty and compassion that cut across generational boundaries.|Fresh
There are moments of great darkness...Bo Burnham does a brilliant job of judging just how far to push any particular scene. And there is kindness, and joy, and the lurking underbelly of friendship.|Fresh
It's just sweet, sad and beautifully observed.|Fresh
This is a film that gets under the skin of Generation X with humour and heartfelt emotion that makes it a genuinely great coming-of-age movie that hooks you by the heart.|Fresh
Make no mistake Eighth Grade is a landmark in the packed hall of coming-of-age stories and in its humour, pathos and authenticity it can stand tall with the best of them.|Fresh
A character study of singular sensitivity. Burnham and Fisher hit upon too many defining aspects of the young-teen experience to list|Fresh
[Director Bo] Burnham may have crafted a simple story about the most ordinary of teenage girls, but it speaks with the emotions of a true cinematic epic.|Fresh
Unmissable piece of art.|Fresh
Burnham has made a minor classic.|Fresh
A sweet, funny, wonderfully nuanced coming-of-age film that modifies the daily trauma of being 13 for a digital age that demands at least the pretence of a perfectly realised life.|Fresh
While Kayla Day is very much a teenager of her precise time and place, her gruelling anxiety - and Fisher's wonderful yearning in the role - make her universally relatable anyway.|Fresh
Eighth Grade is also deeply sweet in unexpected places and howlingly funny, attuned to the timeless indignities of any adolescence.|Fresh
Despite the harsh realities of teenage life in the social media era, this is an incredibly positive movie with a closing beat that delivers a powerful message for young people: give yourself a break.|Fresh
Effortlessly brilliant, [Elsie Fisher] possesses the plucky, conflicted vulnerability of a young Amy Adams.|Fresh
A beautifully observed exploration of adolescence in all its excruciating awkwardness and devastating uncertainties.|Fresh
Elsie Fisher is absolutely outstanding in the role of Kayla Day, like an undiscovered Fanning sister: her smart, observant performance gives the audience instant access to her vulnerabilities, hurt feelings and quiet determination.|Fresh
All in all, Eighth Grade is just an excellent film, well-acted, well-shot, well-written and perfectly paced.|Fresh
Eighth Grade doesn't capture the world ending, but never discredits the moments when Kayla feels like it could.|Fresh
The movie catches every marginal cringing embarrassment and each infinitesimal joy. Very little happens in it, and yet everything does.|Fresh
Gloriously, cringe-inducingly authentic, watch to understand the teenagers in your life - or just to forgive the teen you once were.|Fresh
Bo Burnham's Eighth Grade is an honest and authentic portrayal of the teen experience.|Fresh
Eighth Grade is not a loud or mainstream version of growing up; it's an authentic one. Like teens today who speak in so many ums, likes and whatevers, it may have you grinding your teeth, but it captures youth like no other film has.|Fresh
Powerful, emotional, funny, smart and empowering, Eighth Grade scores a perfect A.|Fresh
Without moralizing intentions, director Bo Burnham explores the adolescent anguish in the era of the social networks, showing it, without dramatic bursts, like a state maintained without resolution. [Full Review in Spanish]|Fresh
One of the things I think works really well is that they show not only her perspective but her single fathers perspective.|Fresh
A really, really amazing film. In fact, it's one of the best of the decade.|Fresh
My brain slipped right back into middle school as I shrank down into my seat, pulled my sweater cuffs over my fingers & remembered the torture of being a 13-year-old girl.|Fresh
Charming, poignant, hilarious and cringe-inducing Eighth Grade is a modern coming-of-ager made with real candour and features a spellbindingly lovable performance from Fisher.|Fresh
Boasting ample empathy and just enough hope, Eighth Grade is a coming-of-age film to savour.|Fresh
It's sweet, funny, endearing and everything else. I loved it.|Fresh
Heartwrenching, heartwarming and disquieting in equal measure, Eighth Grade is essential viewing for the parents of today's tweens.|Fresh
The great achievement of Bo Burnham's debut feature is that he manages to visually articulate teen angst, and the results are hilarious and oh so cringe-worthy.|Fresh
Bo knows movies. Wonderful performances, a keen sense of humor, and most importantly a deep authenticity make Burnham's directorial debut a powerful look at modern adolescence.|Fresh
It definitely rang true to me.|Fresh
"We're all still growing up, and ""Eighth Grade"" resonates powerfully with memories and experiences deeply buried, recent and raw, or witnessed in our own adolescent offspring. It is a painful but worthwhile experience."|Fresh
A film that stands out for the freshness of its script, although in the end it struggles to be profound. [Full Review in Spanish]|Fresh
Buoyed by a breakout performance by Elsie Fisher, who exhibits all the uncertainty, angst and trepidation of the awkward teen, Eighth Grade is an endearing and insightful glimpse into the dark recesses of a young mind on the brink of adulthood.|Fresh
Eighth Grade is an incredibly effective, brilliantly empathetic, uncompromisingly honest and downright scary coming-of-age film that is a fantastic showcase for the untapped cinematic talents of writer/director Bo Burnham and actress Elsie Fisher.|Fresh
Eighth Grade is one of the most thoughtful and nuanced films made about the teenage experience, an authentic story of angst, anxiety and confusion - in other words, what it's like to be 13 years old.|Fresh
For all Burnham's skill in making the artfully-composed film, it's Fisher who really carries all the humour and heart, delivering a stunning performance that serves as a painfully relatable avatar for everybody watching.|Fresh
Eighth Grade is absolutely an insightful study of the current generation of teenagers, touching on ideas of insecurity, hormones, fitting in, and everything in between.|Fresh
And here you thought Avengers: Infinity War was the ultimate word on edge-of-your-seat entertainment.|Fresh
Eighth Grade helps fill a void of complex young women in film, but its complete disinterest in characters of color feels limiting.|Fresh
A recent graduate of eighth grade herself, [Elsie] Fisher gives a performance that is bracing in its honesty.|Fresh
Eighth Grade is filled with insights, both humorous and painful. All the acting is fine, but Elsie Fisher is a revelation.|Fresh
Her journey [is] handled with an honesty and unforced delicacy that imbues the film with pungent authenticity, right down to Kayla's facial blotches, imperfect teeth and her secret joy over a blossoming friendship.|Fresh
A fantastic and honest 'coming of age' film that does everything but simplify the stage we like to remember, but keep getting embarrassed about. [Review in Spanish]|Fresh
Writer / Director Bo Burnham's intimate ode to early teenage angst feels like a documentary rather than a fictional narrative, making it just as awkward and relatable as its lead character.|Fresh
There's no schmaltz, no faux tragedy, no bullshit in Burnham's movie. It's got integrity, compassion and respect for its subjects and audience.|Fresh
Because he originally hails from the world of comedy, Burnham is perfectly in tune with the painful absurdities of adolescence, when simply walking out into a pool can feel like a walk of shame.|Fresh
an ode to coming of age in a world where social media is part of our every day lives. But for adults watching the film, it's also a story about anxiety and its overwhelming effects.|Fresh
[Elsie Fisher] is, without a doubt, one of the great revelations of 2018. [Full review in Spanish]|Fresh
Can I warn readers that Eighth Grade is the most triggering experience of recent memory while also recommending it as highly as is humanly possible?|Fresh
Anxiety is only one click away.|Fresh
Fisher's performance is piercingly real--frankly the best performance from a teenager I have ever seen.|Fresh
A stunning feat of artistic empathy. No film in recent memory has so precisely captured the trifecta of constant anxiousness, horniness, and embarrassment that overwhelms the newly teenaged.|Fresh
Eighth Grade is cinematic in the way every young girl believes her life to be.|Fresh
...a cinematic act of love honoring those significant years of identity formation by paying attention ... This film is truly awkward and awkwardly true. In a word, it's lit.|Fresh
An impressive debut film for writer-director Bo Burnham and a breakthrough for Fischer.|Fresh
Hysterical and touching, Eighth Grade is easily one of the top films of the year, and the Blu-ray is just as satisfying as the theatrical experience.|Fresh
It's not only an extremely authentic film, but the directorial chops of Bo Burnham are quite impressive for his debut.|Fresh
It's like Burnham had the film tested for authenticity by real eighth graders. ... It ends with my favorite big-screen conversation of the year, a joy in its spontaneity.|Fresh
Achingly honest, robustly witty and strangely tender, Eighth Grade is indescribably mesmerizing in its confines of adolescent angst and defiance.|Fresh
Beautiful, terrifyingly real, and packed with more tension than most thrillers. I just wanted Kayla Day, and every teenage girl she represents, to be okay.|Fresh
Eighth Grade finds the healing in the horror of adolescence|Fresh
A bighearted DM of awkwardness and warmth.|Fresh
A visceral, gripping tale, Eighth Grade captures an innate authenticity and sense of place within modern culture for teens and pre-teens both cinematically and emotionally.|Fresh
Burnham has managed to make a film that is both specific and universal, a movie that has stuck with me for the two months since I have seen it and will continue to stick with me.|Fresh
Eighth Grade is hilarious and heartfelt and I absolutely adored Elsie Fisher.|Fresh
...there is a timelessness to Burnham's writing, speaking to the deeper emotional toilings that can only accompany a body rampant with hormones.|Fresh
Wondering if our plugged-in world is short-circuiting our most haywire years, Eighth Grade is neither alarmist nor condemning -- just wincingly sensitive.|Fresh
Fisher is the film's anchor ... This is an Oscar-worthy performance.|Fresh
If you ever wonder how a movie can be terrifying and chilling without being a horror movie, Eighth Grade is the answer. [Full review in Spanish]|Fresh
Eighth Grade is the kind of movie that makes you feel like you've stumbled onto buried treasure...|Fresh
It's basically the Lady Bird for the introverted crowd, and almost just as perfect.|Fresh
In the avalanche of coming-of-age movies past and present, Eighth Grade jumps into the top echelons with a confident leap.|Fresh
"""Eighth Grade"" is not only a showcase for Burnham, it's also a breakthrough for lead actress Elsie Fisher. Together, they've crafted something that will stand the test of time."|Fresh
Eighth Grade, you'll be happy to know, is also very funny. No surprise, as 27 year old Burnham has been writing for quite some time and it's clear the director has pose and a promising career as a filmmaker.|Fresh
Eighth Grade is one of the most sincere and authentic films of the year. You will laugh, and likely cry depending on the moment in the film.|Fresh
Hamilton's performance as the single dad, who is as awkward as his daughter, is warm and positive. Fisher is a revelation and plays her role painfully well.|Fresh
Should be standard viewing for younger audiences and anyone that appreciates genuine, heartfelt teen cinema.|Fresh
Perhaps our premium on awkward indie realism is just a tad high?|Rotten
Funny and heartbreaking, and anchored by Fisher, whose performance ranks among the best by a teenager ever, the film makes surviving early adolescence seem heroic, both for the children and for those who love them.|Fresh
Lives spent looking at devices and screens is a reality for most of us, for better or worse; Eighth Grade is notable because it consciously avoids serving up a familiar media brew of technophobia and misogyny.|Fresh
And that honesty comes down to Fisher's performance. The brilliant sound design helps punctuate her spot-on comedic timing, but the drama is hers alone.|Fresh
It's equal parts heartbreaking and sweet, and it miraculously never hits a false note.|Fresh
Beneath the veneer of a quippy teenage dramedy, Eighth Grade is a devastating study of anxiety, depicting with keen insight the crushing weight of the disease.|Fresh
The writing is superb. There's a balance of naive adolescence that's leveled with Burnham's unique brand of humor.|Fresh
Eighth Grade beats back toxic masculinity with kindness.|Fresh
A hilarious and often horrifying exploration of the trials of growing up.|Fresh
Elsie Fisher deserves significant praise for her take on Kayla. The young actress puts forward an incredibly layered and realistic performance in a challenging role.|Fresh
Eighth Grade brings it all back. Few films can be said to truly capture a generation, this one does.|Fresh
A sweet, compassionate, and clear-eyed depiction of adolescence.|Fresh
Eighth Grade sometimes ducks the hardest parts of its own story, but Burnham's grasp on the agonizing uncertainty of not knowing who you are or where you belong is undeniable - and so is the hope he leaves us with: Kayla will figure it out.|Fresh
While Bo Burnham is the genius behind the screen, the movie is fearlessly led by Elsie Fisher.|Fresh
A very impressive directorial debut.|Fresh
While over-stylized at times, Eighth Grade manages to reveal constant social frustrations young people experience during this potentially unnerving time in life.|Fresh
Penetrating, poignant, and often painful to watch, Eighth Grade is one of the smarter American coming-of-age films of late.|Fresh
Eighth Grade is personal, uncomfortable, and lovely, a slice-of-life look into current adolescence, our reliance on social media, and growing into oneself.|Fresh
The best film of 2018 to date.|Fresh
Brings back for me in a good way the unwanted memories I have of the eight grade, something I'm still trying to forget without resorting to therapy.|Fresh
Such is the miracle of this movie that I felt pangs of recognition all throughout it even though I am basically the dad's age and not the daughter's, and also not a parent.|Fresh
With age comes wisdom and growth, and Burnham is the one of the least likely people to have created a gentle, contemporary, surprising look at teen girlhood, but here we are.|Fresh
A lovely but cringe-inducing film about one of the most precarious times in a person's life.|Fresh
Eighth Grade Directed by Bo Burnham, is a frankly ingenious and honest film about the life of any teenager in these times. [Full review in Spanish]|Fresh
As funny as it is heartfelt.|Fresh
A unique movie that can crush your soul and leave you in stitches at the same time.|Fresh
Great in so many freaking ways...|Fresh
"It isn't a question as to whether or not ""Eighth Grade"" will appear on year-end ""Best of"" lists, it's just a question of where on that list will it fall."|Fresh
Will catapult you backwards in time to the worst moments of your life. I had to put my hands over my eyes a couple of times to block out the agony. It is infinitely more harrowing than Tom Cruise dangling from a helicopter.|Fresh
Extremely well done.|Fresh
A fascinating and nuanced portrait of a 13-year-old compulsive cell phone user yearning for connections.|Fresh
A hit at January's Sundance Film Festival, this portrait of one shy girl weathering middle school is one of the funniest, most cringe-inducing and most poignant films of the year.|Fresh
A marvelously, horrifically authentic dramedy. Burnham uses music and other cinematic effects to heighten the comedy, but the characters remain down to earth.|Fresh
There's no doubt that watching Eighth Grade will remind you deeply of all the pains of adolescence, but the movie's relatability isn't just limited to that age, which might be what makes it such a transcendently heartbreaking experience.|Fresh
This is not a coming-of-age film about a girl finding her voice, but rather realizing its worth, regardless of the approval of others.|Fresh
The movie feels like a documentary to so many of our young lives.|Fresh
Eighth Grade is uncomfortable to watch, but that's a sign it's getting things right (Broad Street Review)|Fresh
Insightful and excruciating, proving that Junior High is horrific, even more brutal than you remember...|Fresh
What Eighth Grade captures best, and with an expert realism, is what it's like to be a teen with undiagnosed anxiety, wandering around life feeling like everybody knows something you don't.|Fresh
The terrors of Eighth Grade are completely relatable.|Fresh
Brilliantly elicits gulps of horrified recognition as it recreates the experience of that first teenage year... Eighth Grade is also a genuinely lovely story about a young woman not quite finding herself.|Fresh
Beautifully written & brings us all - no matter what age - back to how hard it was to be 13. Kudos to Bo Burnham & to Elsie Fisher who gives us the best acting of the year.|Fresh
Eighth Grade is an awkward coming-of-age comedy done well.|Fresh
Despite her awkward delivery, Kayla's actual philosophy is pretty spot on, and, more amazingly, in the course of the film, she actually follows her own edicts, generally to positive effect.|Fresh
"This is part of the sweet charm of ""Eighth Grade,"" even if it means it doesn't have as much narrative arc as it could. It lives in those small moments that feel big."|Fresh
Burnham captures that teenage feeling you get that the world is a hopeless pit of despair, and at the same time he shows that it doesn't have to be. Summer is always just around the corner.|Fresh
Transports you to a very specific and tumultuous time - moving from middle to high school. Burnham makes you engage specifically with Kayla, but also hits all the right notes when sparking nostalgia and challenging the viewer to do some self-reflection.|Fresh
An extremely intimate look into the mind of an average girl in an era when social media and cellphones have destroyed much of human interaction.|Fresh
It's a lovably shaggy ode to anyone who's ever tried to fit in, failed miserably, and then brushed herself off and slouched back out there again.|Fresh
It's a return trip most of us would not care to make in real life, but we can view Burnham's intense replication from a safe distance, with a spectator's eye - and escape, intact, after only 93 minutes.|Fresh
Eighth Grade captures the palpable fears of kids like Kayla in the face of the oppressive indifference from her peers and her failing attempts to achieve the recognition she earnestly strives for.|Fresh
Burnham gets a knockout performance from Elsie Fisher - heretofore mainly known for voice work in the Despicable Me movies and the English dub of Russian children's cartoon Masha and the Bear.|Fresh
An astutely observed film built around honesty and genuine emotion, it's smart, funny and heartbreaking -- and it shouldn't be missed.|Fresh
Here's what Eighth Grade is good for: practicing compassion.|Fresh
Crucially, Kayla's emotions are never treated as a joke. Burnham has immense respect for his character's fragility and earnestness, as does Fisher, who brings an uncanny naturalism to her performance.|Fresh
A coming-of-age dramedy marking the impressive writing and directorial debut of Bo Burnham as well as a breakout performance by Elsie Fisher.|Fresh
A couple of scenes in this movie absolutely will make you squirm until your seat breaks.|Fresh
Totally harrowing.|Fresh
"""Eighth Grade"" has style and confidence, but Burnham's attention to the nuances of adolescence and his respect for his lead character is downright thrilling, making a teen movie that's perfectly in step with the real thing."|Fresh
With Fisher's endearingly open face projecting every insecurity along the way, Kayla's journey of baby-steps self-empowerment resonates.|Fresh
OMG, Eighth Grade is, like, going to give you all the feels.|Fresh
It's a fairly compelling slice of life examination. (Full Content Review for Parents - Profanity, Sexual Content, etc. - also Available)|Fresh
"Watching Eighth Grade, you want to gently shake Kayla-and your eighth-grade self-and assure her, ""It gets better."""|Fresh
You feel every lunchroom snub, every birthday-party fumble that 13-year-old Kayla (Ellie Fisher) experiences deep in your bones. And yet as uncomfortable as watching can be, I would pay money in a heartbeat to see this movie again.|Fresh
Eighth Grade gets as far inside the miserable aspects of eighth grade as I think it's possible to go.|Fresh
A low-key slice-of-girlhood for viewers who found Lady Bird too commercial.|Fresh
Burnham nicely captures the quirks and cadences of teen-speak. In that sense, Eighth Grade also serves as a nifty time capsule of 2018.|Fresh
An achingly honest film about some of the ghastliest years of adolescence. Funny, tender and endearing.|Fresh
Adorably cringe-worthy|Fresh
Burnham... ends up making a movie about internet immersion that ratifies the importance of human contact.|Fresh
Insightful without being mean and revealing without taking itself too seriously.|Fresh
This is a movie that refuses to shy away from some fairly dark realities yet at the same time doesn't dwell on them in ways that feel exploitive or supercilious.|Fresh
Eighth Grade is a harrowing portrait of anxiety and acceptance in a post-social-media landscape, showing how all of us cope with an ever-changing, constantly refreshing world.|Fresh
There's plenty of discourse on how The Youth spend too much time with screens, but Eighth Grade is more interested in understanding Kayla's story on her terms than judging it on someone else's.|Fresh
...an exhausting, if ultimately uplifting, experience.|Fresh
Its strength is reminding of an experience that we forgot, but one to which we can all relate, even if you weren't a kid like Kayla.|Fresh
Elsie Fisher is a bright new discovery cementing herself as the Molly Ringwald for the Snapchat generation.|Fresh
You quiver, you cringe and you want to break down and cry. That's how powerful Elsie Fisher's turn as Kayla is in its ability to summon the worst memories of your early teens.|Fresh
"Surely one of the year's most notable writing and directing debuts, Bo Burnham's ""Eighth Grade"" gets as close to the heart, mind and soul of a young person as a movie can."|Fresh
Where Burnham surprises is in his directing. He possesses a keen eye for how young teens see the world, everything bigger and broader or smaller and suffocating, and nothing in between.|Fresh
As much as Burnham can be applauded, it's impossible not to clap even harder for the pitch-perfect acting of newcomer Elsie Fisher, a marvel in the lead role of an apparently unremarkable 13-year-old.|Fresh
The real treasure of Eight Grade, the one that transforms it from a very good film into one of the year's best, is the knockout performance by Elsie Fisher.|Fresh
Writer-director Bo Burnham and lead Elsie Fisher give coming of age film fresh twist.|Fresh
Bo Burnham's big-hearted, emotional tidal wave of a movie shows how the look-at-me / leave-me-alone contradictions of adolescence, powered by social media, are cranked up to 11...|Fresh
Burnham delivers shivery small quiet images like a splinter of a smacked, cracked phone screen drawing a flawless pinprick of blood from Kayla's thumb.|Fresh
Eighth Grade is a work of supreme empathy ... it's a film that feels resolutely both of its time and timeless.|Fresh
