"""Eye in the Sky"" is an important story that should stand the test of time because of its originality, execution and immediacy to current events."|Fresh
A rare thriller that grips the mind and heart equally.|Fresh
There's wit, integrity and insight here, but it cries out for a lighter touch.|Fresh
The movie is both provocative and fairly gripping, if not altogether convincing.|Fresh
"Fundamentally serious, if obviously flawed, ""Eye in the Sky"" argues both sides of its specific case, and, by extension, the merits and perils of a radical new tool for fighting wars."|Fresh
Director Gavin Hood pulls off some really tricky tonal shifts. He's abetted by a terrific cast, including Barkhad Abdi as a surveillance expert who tries to save the girl -- and Rickman in his final on-screen appearance, one of his very best.|Fresh
Rickman deserves our salute, as does a film that honors his fierce intelligence.|Fresh
Eye in the Sky is a solid thriller, but a visually static one that doesn't particularly requires a big screen.|Fresh
In Hood's Eye in the Sky, Aaron Paul's conscience-stricken pilot is affecting, and you cheer him on when he challenges an order that he considers inhumane and precipitate.|Fresh
A grim, suspenseful farce in which unpredictable human behavior repeatedly threatens an operation of astounding technological sophistication.|Fresh
This is a film that doesn't want to be easily pegged, either in terms of its politics or generic allegiances. Such ambiguity is a virtue, but for all his technical facility, Hood doesn't really have the finesse of a great, fearless satirist.|Fresh
Sells itself as a race against time thriller, but any tension presented gets bogged down by so much talking.|Rotten
[It] dwells with the faraway triggerpeople killing from comfortable chairs but refuses to interrogate their actions in any truly meaningful way.|Rotten
At its core, the film is a welcome piece of mindfulness and moral complexity on our increasingly black-and-white world stage.|Fresh
Hood and Hibbert show the nuts and bolts involved in calling for a drone strike, and it's suspenseful, inherently dramatic and sometimes terrifying to watch unfold.|Fresh
The threat of an international incident ... invokes a chain of political grandstanding and second-guessing, which Oscar-winning director Gavin Hood plays out with artful, measured intensity.|Fresh
In stressing the point that there are no easy answers in war, it scores. In trying to say something insightful, however, something we don't already know, then not so much.|Rotten
In war, everything has consequences, the movie declares, and if you think you can predict all of them, you're either a fool or running for office (or both!). No answer is perfect.|Fresh
Taut, provocative and timely, Eye in the Sky has the all the right elements.|Fresh
Director Gavin Hood treats the aesthetics of high-tech surveillance as the opaque membrane through which the prosecution of the War on Terror must pass.|Fresh
Never has a movie been able to wring so much tension from shots of people staring at screens and computer monitors.|Fresh
A taut film, photographed in real time, that supplements vivid action sequences with a moral debate.|Fresh
"""Eye In The Sky"" doesn't always get it right, and sometimes makes some wrong-footed moves, but it opens a discussion and study of how we engage in acts of war that doesn't happen often in the mainstream media."|Fresh
A tense, morally complex and extremely prescient thriller.|Fresh
A tightly-coiled thriller that refuses to take the moral high ground despite the subject matter. Mirren, Rickman, and Paul are all excellent.|Fresh
While this performance gives the drama psychological weight, efforts of those on the ground to get the girl out of harm's way introduce very satisfying action elements.|Fresh
Eye in the Sky is a tick-tock suspense exercise as well as a neat little ethical echo chamber, a plea for reason in a world exploding too vigorously to give it the time of day.|Fresh
Hood has relied on terse and efficient storytelling to showcase the intricate morality of drone warfare and takes us through one very long and very stressful day in the lives of those tasked with making life or death decisions.|Fresh
A rivetingly suspenseful drama that deftly intertwines elements of ticking-clock thriller and tragic farce.|Fresh
The military thriller occasionally grinds to a halt to host a Reddit-like debate on drones. Surprisingly, it still works and manages to present valid, even-keeled positions, too. No trolling necessary.|Fresh
Eye in the Sky presents a talented ensemble of differing perspectives on the controversial use of drone missiles, forcing us to confront our own feelings about the complicated implications of modern warfare.|Fresh
