The complexity and intensity of the dramatic texture of Stephen King's film positions it as one of the best films of this genre in 2017. [Full review in Spanish]|Fresh
It ... is worth watching for its crackerjack opening and the strength of its young cast, but mainly because of its inherent promise of (possibly) better things to come.|Fresh
This is an entertaining horror show that knowingly reflects its '80s influences.|Fresh
It's actually quite refreshing when the thrills and chills provide the much-needed break from all the pleasantness. How's that for something new?|Fresh
I liked It a lot. Its aftermath is so busy in my mind, that I'm tempted to award it four stars just for that. But based on what is on the screen I'll stick with 3 1/2.|Fresh
The key actors here, all hovering around the age of 15, are uniformly good, and director Andy Muschietti, whose last film was the shivery Mama, handles them with rare assurance.|Fresh
The climactic confrontation is long-drawn-out and merely serves to set the tone for the proposed Chapter Two. Here's hoping it takes another 27 years for It and the gang to creep back into cinemas.|Rotten
Director Andy Muschietti, cinematographer Chung-hoon Chung, Bill Skarsgard (Pennywise) and young cast make King's tale a real scream.|Fresh
Put together, the focus on the kids both redeems It through charm and robs the movie of a greater power.|Fresh
It may not be as terrifying as the novel I read when I was 12. But the film transported some part of me to that liminal space between childhood and adolescence, a space of freedom and powerlessness and fear.|Fresh
I can't say the first half of It scared me senseless, but it built up enough goodwill toward its young heroes to make me curious about what they'll be like in their grown-up incarnations.|Fresh
Argentinean director Andy Muschietti is more concerned about sustaining dread than making sense.|Fresh
"Sometimes a picture on a wall can give someone the creeps. ""It"" gets its power to produce actual spine-tingles from these images, not necessarily from the fear of a machete-wielding killer, but things that are coming to get you."|Fresh
"Even though ""It"" has all the jumps and splatter horror fans crave, it's the movie's heart that leaves the longest impression."|Fresh
[Bill Skarsgard's] Pennywise the Dancing Clown will haunt your nightmares.|Fresh
One of the more successfully spooky cinematic translations from the writer's horror collection. (Full Content Review for Parents - Violence, Profanity, Sexual Content, Scary Scenes, etc. - also Available)|Fresh
The bottom line is that It is one of the better Stephen King film adaptations, but falls short of the pantheon...|Fresh
"""It"" is scary, but the film also makes magical use of foul language. Wolfhard (""Stranger Things"") introduces an almost supernatural use of the f-bomb. He delivers the word with such rapidity and, frankly, innocence, that even George Carlin would blush."|Fresh
It hasn't quite got that it factor.|Rotten
The It films have the potential to be the horror equivalent of the Kill Bill movies, where Volume I has all of the splatter, but Volume II has the depth and winds up being even better.|Fresh
A horror movie that grabs you right out of the gate. By the throat.|Fresh
You'll scream bloody murder!|Fresh
Here's how the new It finishes what the TV version started.|Fresh
A brilliant adaptation - faithful yet fresh, at once funny and frightening.|Fresh
Bill Skarsgård puts the cool into coulrophobia, bringing an arch, languid evil to Pennywise along with a faint Scandinavian brogue.|Fresh
I actually looked in a shop window to check my hair hadn't turned white.|Fresh
"While the killer clown Pennywise is the center of the film's marketing campaign, the image on the film's poster, it's the kids in this surprisingly robust adaptation of Stephen King's novel who give ""It"" its center."|Fresh
Even if it's not especially scary, It is highly entertaining with excellent performances from its teen cast.|Fresh
Wordplay from all kinds of irresistible angles comes to mind. It isn't all that scary and It is a little too long but considering horror fare these days, It is pretty good.|Fresh
As a coming of age parable, IT succeeds at being both horrifying and emotionally-resonant, even while adapting only half of King's original story.|Fresh
It is funny and warm and touching and frightening and profane and profound. It's one of the best horror movies of the year. You'll float alright.|Fresh
'It' succeeds because the kids are relatable and director Andy Muschietti ... spends as much time in letting us get to know the kids as he does on the terrifying events that propel them to band together and take action.|Fresh
It has been a long time since a Stephen King adaptation could be called fun.|Fresh
'IT' is the 'Stand By Me' of Stephen King's cinematic horror canon.|Fresh
Even if this new It's ambitions to be Stand By Me with horror aren't ever quite properly fulfilled, it stands as a valiant pursuit of that ideal.|Fresh
Proving just what can be done with a now familiar concept if lavished with care, attention and craft, It really is one of the most gripping and glowing Stephen King movie adaptations.|Fresh
While at some points the movie's effects get in its own way and some of the main characters feel slightly underdeveloped, it's a thrilling entry in the genre and one of the better King adaptations.|Fresh
An overly CGI-ed killer clown who looks like a drag queen in need of a solid lace front just isn't scary in 2017. Many critics are praising 'It,' but I doubt audiences will feel the same punch. 'It' is one of the biggest disappointments of the year.|Rotten
It works best exploring the comedic, playful and tightly knit dynamic between the boys ... proving that King's strength really lies in depicting boys' clubs.|Fresh
"""It"" fills its 135-minute run time with enough impressive visuals to keep its audience rapt, if not as emotionally invested as the source material deserves."|Fresh
To its genuine credit, Muschietti's movie adds up to something decisively more than just archetypes and scares, though how much more is up to you.|Fresh
While It contains a number of effective set-pieces and scares (although not nearly as many as last month's Annabelle: Creation managed in a shorter running time), it really doesn't hang together as a narrative.|Rotten
Watching this is like listening to a perfect pop hit on the car radio - one can clearly sense the intense finessing and production that has gone into the work and just how cleverly manipulative and formulaic it is.|Fresh
[It's] themes survive the mayhem that pops up with metronomic regularity, but just barely.|Fresh
What is it about clowns, anyway?|Fresh
Muschietti's It strikes a nice balance between sleepover-ready gross-outs (tiptoeing through raw sewage, for example) and tender coming-of-age storytelling.|Fresh
The story of the kids is good enough that the film works as a twisted variation on a coming-of-age tale...|Fresh
I liked the kids but this one's mostly for King fans and horror film lovers.|Fresh
...like walking through the world's creepiest haunted house-15 times in a row.|Fresh
An entertaining adaptation where the interpretations and the period recreation truly shines. [Full review in Spanish]|Fresh
A joyful cinematographic experience, a recognizable comfort food, pleasant and frightening. [Full review in Spanish]|Fresh
Horror and a dash of humor keep this Goonies-style chiller afloat.|Fresh
A solid, well-made picture, one of the better King adaptations if not of the very top rank among them, even if its over-reliance on CGI effects grows tiresome by the close.|Fresh
The movie earns its R-rating less by bloodletting than by long, slow buildups, creepy shadows and half-glimpsed things that go bump in the night in sewers and derelict old houses. That's a good thing.|Fresh
This adaptation, rather than inspiring deep-seated terror, tends to be frightening in the carnival funhouse sort of way.|Fresh
It occasionally reminds you of how awful it can be a kid, and it also occasionally makes you jump out of your chair. But it never figures out how to do both at the same time.|Rotten
It, on the page or the screen, is a complex mix of coming-of-age elements with ideas about childhood fears, memory and human nature - good and bad.|Fresh
This is a worthy entry into the King cinematic universe and one that I hope to see more of with the promised second half if this one does well enough. Despite minor flaws IT is still effective where it counts.|Fresh
Director Andy Muschietti delivers that kids-on-a-mission vibe well enough to recommend the first chapter of It.|Fresh
"If you're looking for a film that's guaranteed to have you gripping your seat, this is ""It."""|Fresh
What makes this film so distinctive and so evocative is youthful innocence of the protagonists in the face of grinning evil.|Fresh
It's an unfocused hodgepodge of ineffective scenes and conflicting tones that disintegrates into an unsatisfying pile of... blah.|Rotten
This is a handsome, diligently respectful adaptation.|Fresh
[It] is genuinely eerie and touches on a kind of fear far more universal and upsetting that killer clowns and such.|Fresh
The movie will undoubtedly successfully engage and entertain fans of the horror genre.|Fresh
Call it a symphony of orchestral meta-horror, an elaborate waking nightmare in which you, as the dreamer, are constantly reminded of what the film is trying to do, and yet are powerless to stop it.|Fresh
But for all its shocking imagery, IT is more successful as a coming-of-age story-aided by a talented cast of unknowns-with the monster serving as a stand-in for our collective loss of innocence.|Fresh
I can't pass a sewer anymore without half-expecting Pennywise's frightening face to appear!|Fresh
It is a white-knuckle horror show blessed with an R rating, by which I mean it doesn't have to rein in its gory, toothy terrors, like other, lesser, PG-13-rated King films must.|Fresh
If The Dark Tower was the underwhelming studio-trimmed Cliff's Notes YA version of that Stephen King story, (this) is the R-rated unabridged directors-cut vision of this one.|Fresh
Despite the many terrifying moments they endure in their quest -- scenes that will leave you trembling and giggling at once -- It is even more powerful in the warm, easy camaraderie between its young stars.|Fresh
The last hour collapses into junk.|Rotten
Director Andy Muschietti goes back to the source, creating a movie that's true to King's novel while making changes that create lighter, humorous breaks before you're scared witless.|Fresh
A vintage throwback feel recalls several other touchstone movies of its 1980s era, while the reset hews true to the dark, twisted soul of King's source material.|Fresh
An entertaining, and genuinely quite terrifying horror; a difficult balance to get right.|Fresh
The premiere King joint of the year, but it's also one of his finest translations overall, with the production getting the author's macabre imagination just right.|Fresh
The kids' gradual discovery of the clown's lethal doings is tense enough, but again, all the red-nose-and-fangs stuff isn't as absorbing as the ode-to-pubescence dynamic.|Fresh
Muschietti understands the Spielberg-ian rule, that creating a recognizable and convincing backdrop makes the supernatural thing in the foreground feel tangible and believable.|Fresh
"The literal ghouls here take a back seat to the subtler ones, which are really where ""It"" shines darkly."|Fresh
The more Muschietti piles on the CG terrors - heavy on the red stuff - and the more he shows of the demonic doings of the clown Pennywise, the less terrifying Pennywise becomes.|Rotten
When it comes to watching kids get spooked by not only a shape-shifting monster, but by a spate of dramatic and everyday childhood traumas, the film delivers.|Fresh
Much more successful as a coming-of-age movie than as a horror film.|Fresh
The film is frequently scary (especially for coulrophobics) and always absorbing, with a measured yet affectionate nostalgia for the period.|Fresh
It falls short of being a great movie, but it's easily the best big-screen King adaptation in a very long time.|Fresh
Contrary to the brilliant trailer-cutting department at Warner Bros., It is not a scary movie ... we get an awful lot of Pennywise-as-special effect, being churned through the digital funhouse mirror. And, well... obvious digital effects just aren't scary.|Rotten
Fear is given a face in It, a hugely entertaining half-adaptation of Stephen King's doorstopper of a novel.|Fresh
It cashes in on trendy retroism--the remedial, brash distant second cousin to nostalgia--instead of utilizing the perspective of, to borrow from Joni Mitchell, seeing clowns from both sides now.|Rotten
IT is Stephen King done right - full of respect for the source material, and full of winning performances and legitimate scream-out-loud scares.|Fresh
'It' quickly proves unafraid of inflicting gore on innocent kids and boasts a freaking terrifying Pennywise thanks to Bill Skarsgård...|Fresh
...a big, ballsy, crowd-pleasing monster movie with wonderful characters, creative scares and a sense of style...|Fresh
It is a horror movie that should delight fans of the genre and general audiences equally.|Fresh
It doesn't work as a horror movie, but that's not where it finds its strength. It is fun - like Steven Spielberg, Stranger Things-level fun.|Fresh
A new modern classic for the horror and suspense genre. Pennywise now joins the ranks of Freddy, Jason and Michael Myers. [Full review in Spanish]|Fresh
So while the movie isn't necessarily buoyant, as assembled, it floats just fine.|Fresh
... Muschietti's eye for striking images is one of the film's core assets...|Fresh
You almost wish the movie had jettisoned the horror elements entirely, and converted It into what it feels like it wants to be - something more like King's Stand By Me, with a teen girl in the mix.|Fresh
In Stranger Things' wake, It feels like the driftwood shoring up on the Stephen King nostalgia.|Fresh
For a movie with so much blood, It feels disappointingly bloodless.|Rotten
The hype machine has been working overtime to promote Muschietti's adaptation...as 'terrifying.' It's not. What it is is boring, predictable and too safe, its scare set pieces so competently over stylized they lose any sense of the frightening unknown.|Rotten
Yet for all its dark social relevance, It is also moving, emotional, and even optimistic.|Fresh
As a child of the '80s, this reviewer had high expectations for this classic horror fable and director Andy Muschietti mostly manages to live up to them.|Fresh
Derry is the true monster of IT, and Muschietti gets Derry very, very right.|Fresh
Andy Muschietti's It is a wholesome adaption that never sacrifices story for cheap scares, which makes for a brilliantly chilling tale rooted in heart and fluent in screams.|Fresh
But like King's best work, the movie wants to be greater than the sum of some cheap scares. Often, thanks to its strong cast and quieter moments, It succeeds in this goal...|Fresh
It's scary and funny but by the time all is said and done, It falls short of being a classic.|Fresh
Creepy, killer clowns have been around for a long time, and [Bill] Skarsgard's Pennywise is one of the nastier incarnations, expressing joyous schadenfreude in the fear of the children he takes.|Fresh
"It, unfortunately, is loaded with superfluous screams. The effect is akin to having someone poking you in the ribs, relentlessly, and shouting: ""Scary, isn't it? Scary! Right!?"""|Rotten
While It is a classic horror at its heart, the film is also a coming-of-age story in equal measure as friendships forge and promises are made, sliding the door open for a sequel that is sure to follow.|Fresh
These young performers manage to play their characters as heroes, while never relinquishing the elements that make them seem like the kids next door.|Fresh
Two things that are true: 'It' is a fun movie, and unexamined nostalgia is poison.|Fresh
"What makes this ""It"" work so well is the way it pulls us back into our own childhoods with a cast of young characters and the shared experiences - some horrifying, some hilarious - that bind them together."|Fresh
There is more to It than scares though. It, at heart, is a coming of age tale.|Fresh
IT is pure popcorn horror: crowdpleasing, gruesome and guaranteed to make you jump. It just may not crawl under your skin like you want it to.|Fresh
The costume and effects departments play an absolute blinder, but it's [Bill] Skarsgard's manic energy and presence that brings a level of unease and intensity to proceedings that is just incredible.|Fresh
We understand these characters, we understand so painfully their fears. That's the kind of horror that nestles deep inside your brain. It's the kind that follows you home.|Fresh
The fraught, yet immersive It experience delivers a complete and lasting rush, not unlike an entire season of the Netflix classic Stranger Things administered in a single, powerful two-hour dose.|Fresh
Strong performances and production carry the day. This pop culture psychodrama still works, and linked up to its pending sequel should add up to a bit more than the sum of its parts.|Fresh
Predictably, Andrés Muschietti's lush-looking adaptation, while a marked improvement on the tedious 1990 TV miniseries, has the same shortcomings as King's original material.|Rotten
The film spends enough time shading in the backstories and drumming up emotional investment in the gang's quest to make the prospect of Part Two thoroughly appealing.|Fresh
A genuinely bloody, creepy and terrifying piece of classic horror mixed with brilliant teen humour, romance and a classic coming of age story.|Fresh
Instead of building tension and suspense, It just jumps from scene to scares with no connection or coherence to thread them together other than the mere fact that they've been placed on top of one-another, like toys mixed up from different sets.|Rotten
This is less an adaptation of the book and more a Cliff Notes version of the TV mini-series.|Rotten
Andres Muschietti's IT, based on portions of King's enormous 1986 horror novel, comes close to capturing the essence of what this author is all about.|Fresh
What we have here is a new rendition of a classic book (or rather half of it) that vastly improves upon the original adaptation by giving us something that has a little heart, a few good scares, and a great cast.|Fresh
Andy Muschietti's It is Stephen King distilled in its purest form - namely, terrifying.|Fresh
What do we have here, really? We have a story that feels not so much freshly imagined as dutifully recounted.|Rotten
It could have been one of the greatest Stephen King adaptations ever. As it stands, it's simply a very, very good one|Fresh
They've finally stopped clowning around with a Stephen King adaptation.|Fresh
The filmmakers honor both the pastoral and the infernal dimensions of Mr. King's distinctive literary vision.|Fresh
IT is beyond a shadow of a doubt the most blood-curdling film of the year and possibly the best King adaptation yet.|Fresh
'IT' Achieves Horror Greatness as Pennywise Becomes a Horror Icon for the Ages!|Fresh
The great comeback of Pennywise the killer clown is scary and surprisingly fun.|Fresh
An extremely entertaining studio horror movie that will make you laugh as much as jump in fear.|Fresh
There are so many jump-out-of-your-seat moments, that I have no idea how I managed to maintain a steady heart rate throughout most of IT.|Fresh
Nosferatu-like incisors punctuating his grimace grin, Bill Skarsgård brings a new level of unpredictable malice to the childkiller entity that haunts King's benighted Derry, Maine. And he does it within a trimmer narrative that maximizes the horror.|Fresh
"The film compellingly articulates the universal anxieties associated with adolescence. Consistently, persuasively unnerving, ""It"" turns the coming-of-age drama into a nightmare."|Fresh
Functions more as a roller coaster ride of frights and humor than a dread-inducing exercise in terror.|Fresh
It's a riveting coming-of-age yarn that centers on the horrors of being an adolescent. Irrational fears are shining bright. But loyal friends that stand by you can make all that the misery more tolerable.|Fresh
It (the movie) is suffused with a sense of suffocating dread and contains some particularly nasty violence, but also captures the heart and soul of the story.|Fresh
The final impression is of middle-ranking Kingiana sold and displayed by the yard.|Rotten
Really good. Scary good, even.|Fresh
Hits the ground running as a deliciously entertaining, legitimately shuddersome horror feature, but it excels as something altogether more profound, a cathartic fable constellating the twilight of childhood innocence.|Fresh
Certain aspects of It remain burned on your brain like a flashbulb on exposed film.|Fresh
"""It"" fashions and establishes itself as one of the new age horror classics for audiences to relish for decades."|Fresh
More successful as a coming-of-age movie than a horror, It still ranks among the better Stephen King adaptations - no small praise indeed.|Fresh
"Not the most original tale, and it drags through the middle acts, but the most hellish depiction of childhood this side of ""Schindler's List"" is something to behold."|Fresh
The terror that crept up your spine as a kid hiding from the closet monster is here in bloody spades.|Fresh
Fresh, frightening, inventive, with exceptional performances from the young cast, we can't imagine a movie more viscerally and emotionally true to King's text.|Fresh
For all the warm familiarity and unexpected sweetness conjured by the production's adherence to nostalgia, 'horror' it most certainly is.|Fresh
Once the characters have been set up, Muschietti is free to linger as much as he wants over certain set pieces, and the results are as scary as they should be.|Fresh
The infamous clown is plenty freaky, though it's the youngsters, bursting with hormones and one-liners, who make It one of the better Stephen King adaptations.|Fresh
The real reason IT works is because it takes time with the kids, revelling in their colourful lingo and comradeship as much as their fears.|Fresh
The whole movie is so affecting that Pennywise doesn't even matter. In a way, he's more of a McGuffin to the real horrors at hand, from parental abuse to violent bullying to the unnerving revelation that life has only just begun.|Fresh
This is very much a ring-the-changes update, with the ramped-up set pieces and state-of-the-art grisliness to match.|Fresh
The film works beautifully as a straight-arrow genre piece, and a portrait of young people taking command of their own destiny.|Fresh
It is scary, yes -- but it's heartbreaking, too. And that, even more than the clown's nasty tricks, might be what lingers with you.|Fresh
Everything about the film hits all the perfect notes-the cast, the score, the aesthetic, the unflinching horror, and an astute attention to the details-making IT one of the very best horror movies to come out during 2017.|Fresh
The new version of King's classic demonic clown story delivers two of the author's signature pleasures -- an emotional re-creation of those beleaguered years of childhood, when it was us-against-the-adults, and a truly visceral sense of horror.|Fresh
"While the idea of a ""creepy clown' is pretty much an oxymoron - just put a regular clown out there and the creeps will flow naturally - Skarsgård's performance gives Pennywise some much-needed shading between the jump scares."|Fresh
Since the adult characters are nearly as inconsequential as the grown-ups in Peanuts, the movie rises and falls on the strength of its young ensemble. The seven are consistently good, with solid chemistry and a natural way with sarcastic banter.|Fresh
This is a really fun movie. Good, too. Not great, but old-school in its approach to scares and, even better, in its approach to the relationships between kids, outsiders who band together to try to take down a monstrous evil.|Fresh
It is essentially two movies. The better by far (and it's very good) is the one that feels like a darker Stand by Me.|Fresh
When a film of this magnitude has so many young characters front and center in the lead roles, so much depends on the casting -- and in this case, there's not a single misstep.|Fresh
Yes, I crawled out of my skin and yes, Pennywise is still scary as all get-out, but the real strength of this film lies in The Losers Club and that incredible cast.|Fresh
This is an ensemble smorgasbord of scariness, or maybe a portmanteau of petrification, throwing everything but the haunted kitchen-sink at the audience in the cause of freaking us out.|Fresh
It is a solid thriller that works best when it is most involved in its adolescent heroes' non-monster-related concerns.|Fresh
It's not only exciting to see a movie that can elicit such an impressive visceral reaction, but also create a rich, cinematic world that somehow manages to be both terrifying and inviting.|Fresh
The resulting two-and-a-half hour horror-adventure saga winds up a serviceable adaptation and nothing more.|Fresh
It may not be the best Stephen King movie (even though it comes impressively close), but it's probably the MOST Stephen King movie.|Fresh
King fans will surely appreciate the clear effort and affection that went into this adaptation, even as it struggles to become more than the sum of its parts.|Fresh
There's never a scene in IT that wants you to pause and appreciate how creepy it is; instead, those scenes serve to build tension and illuminate what the characters fear. The pacing, visuals, and score are all exquisite.|Fresh
