Portman's body language, a profound interior burn, is brilliant.|Fresh
Jackie paints a chilling portrait of the former first lady, spectacularly portrayed by Natalie Portman, in the moments and days after her husband's assassination in Dallas.|Fresh
The success of any biopic rests squarely on the shoulders of the actor playing the subject, and Natalie Portman harnesses every bit of the strength and fragility she displayed in her Oscar-winning role in 2010's Black Swan to astounding effect.|Fresh
Love and ambition struggle again, this time to world-shaping effect without and (in the devastating last scenes) despair within.|Fresh
The film doesn't dwell exploitively on these things. It just makes abundantly clear what this woman was dealing with when she insisted on dealing with the details of her husband's funeral.|Fresh
The serviceable movie you make about this subject. But it does offer a little bit more, peeking through with an interesting insight every quarter-hour or so.|Fresh
Portman's performance reaches past mere impersonation to capture her sense of dignity that allowed her, in the face of her husband's horrific death, to complete the task of establishing his place in history.|Fresh
There's no denying Portman's depiction of class and grace under pressure, capturing the emotions of that time and showing people who were scared and confused a way to heal.|Fresh
Natalie Portman's performance is a masterpiece of carefully controlled emotion...|Fresh
... 'Jackie' is an extraordinary and intimate look at an iconic figure who put her stamp on the White House, the nation and our perception of grace and beauty.|Fresh
An impressionistic portrait that says more in images than in words.|Fresh
Larrain spins a tale of dignified anguish and calculations less sympathetic. Anchored by Natalie Portman's uncanny impersonation - wispy voice, aristocratic posture - Jackie fascinates and frustrates, sometimes at once.|Fresh
The film instead becomes preoccupied with trendy period detail and the mannered performance of its star, rather than in finding deeper truths about the subject.|Rotten
"The best film about any Kennedy since ""JFK."" This is not a safe, comfortable, amber-encased reminiscence people may want. It's a mesmerizing, insidious suggestion of how deep the American political rot may run and for how long it has done so."|Fresh
Jackie breaks new ground inside the biopic genre, thanks to a magnificent direction by Pablo Larráin and Natalie Portman's best performance to date. One of the best films of 2016. [Full review in Spanish]|Fresh
Natalie Portman is sensational in what ends up as a powerful, intimate and award-worthy portrait of a very public grief.|Fresh
Natalie Portman delivers a tremendous performance in a movie that marches to its own beat without ever taking its eye off the ball.|Fresh
This is a cinematic work of art, and taking the time to see it in a theatre should be priority number one.|Fresh
There's an eerie rightness: the bright Dallas sun; the long Washington shadows; the delicate bouclé of that pink Chanel suit; the clarion clip-clop along Pennsylvania Avenue.|Fresh
Portman's scarily composed performance is laser-focused, an act of empathy without tears.|Fresh
Jackie proves that grace and composure are qualities that matter in our leaders in a year when many Americans want to deny it.|Fresh
Whether...this amounts to much more than a bit of tabloidism with pretensions...is open to question.|Rotten
The casting of Portman turns out to have been perfect.|Fresh
Jackie begins at a fever pitch and never lets up. What Noah Oppenheim's dazzling screenplay & Pablo Lorrain's direction manage to thrust us back in time and make us see a series of historical events in a way we never have before|Fresh
All the perfectly manicured technical elements assembled by Larraín are the reasons to watch Jackie, even as they overwhelm a slight and not particularly revealing story.|Fresh
How about just telling the story straight?|Rotten
It is a fever dream of a movie, tracking its subject as she tries to maintain control, maintain her composure, her sanity.|Fresh
Enormously moving, but flawed.|Fresh
Larrain's gorgeously grim and austere vision bolsters a bravura performance from Natalie Portman. She inhabits Jackie as a woman who has been shaken to her core with grief.|Fresh
Jackie's power is in the sticky quality of the moments of pure cinematic composition. Those images, moments and chords in the score flicker in your memory long after the viewing.|Fresh
"""Jackie"" is mesmerizing; a familiar story told from an entirely different angle."|Fresh
It's an impressively bold go at such a revered presidency, and much of the project's success hangs on Natalie Portman's fully immersed and utterly mesmerizing portrait of the grieving first widow.|Fresh
How do you dramatise history on film without adding a large dollop of fiction to the mix? Many have tried and most have failed. But Pablo Larraín succeeds better than many with Jackie.|Fresh
It's a very intimate character study that shows this woman, who is known for her poise, break down like any other human being.|Fresh
...wrenching and unforgettable|Fresh
Portman nails the intonation and characteristics of the famous First Lady without them ever feeling like imitation|Fresh
Larrain succeeds - to a point. His hindrance is Portman, whose Jackie exists without an inner-life.|Fresh
Portman reconciles the indulgent and extravagant aspects of Jackie's character with the strong-willed first lady looking to create something for the American people out of a nationwide tragedy.|Fresh
Revealing her strength during the end of the presidential Camelot, 'Jackie' is a royal depiction.|Fresh
Portman's Jackie is certainly haughty (she cannot hide her disdain for the Johnsons), and she's got that excessively breathy speech pattern down pat.|Fresh
"Yet another film about the Kennedy family may seem like an eye-rolling prospect, but Pablo Larrain's ""Jackie"" is so painfully alive, so painstakingly intimate, it rises above such simple descriptions."|Fresh
Powerful and profoundly spectacular. (Full Content Review for Parents - Violence, Profanity, etc. - also Available)|Fresh
To watch Portman's every move is to not only watch history being recreated, but to also witness history being made. No one will ever be able to touch this role again. Or, at least, no one should.|Fresh
A Slaughterhouse-Five adaptation starring the former First Lady. I'm pretty sure most people are going to hate it.|Fresh
Portman's performance carries the day.|Fresh
Natalie Portman is flawless as a string of pearls, and Peter Sarsgaard lends valuable support underplaying Robert Kennedy, but the ghoulishness of reenacting the assassination for the millionth time overwhelms the film's pretended merits.|Fresh
At the core of it all is Natalie Portman's masterful performance of a strong, tightly-reined personality, seen in almost painful, constant close-up.|Fresh
The film is wise in the way it sees Jackie as a constructor of narratives, and it's tragic in its recognition that those narratives have little to do with her.|Fresh
What emerges is more serious docudrama: a fully rendered vision of a woman ill-served by most previous accounts, featuring an Oscar-worthy lead performance by Portman. It's also one of the year's best movies.|Fresh
Instead of devolving into a Warholian pop artifact, the prescient Jackie offers a raw blast of electoral catharsis.|Fresh
An iconic performance packaged in a film good enough to support it.|Fresh
"""Jackie"" would have been an exceptionally smart, intriguing movie as an astutely conceived, well-crafted meditation on political mythmaking. In Larraín and Portman's hands, it becomes something deeper and more emotionally potent."|Fresh
"Even if it lacks full dimension, and a final imaginative leap past the biopic strictures, ""Jackie"" pulls you into its web, shot by shot, moment by moment - most of them Portman's."|Fresh
It's not a one-woman show but it's clearly Portman's film, and she makes the most of it, helping Larrain to answer the question: How are myths made?|Fresh
A carefully compiled dossier on the life of an ordinary woman in extraordinary times whose dignity and grace under pressure humbled the world at the time and influenced future generations without planning to.|Fresh
While the gorgeous and mesmerizingly subversive biopic itself is destined to be cult rather than classic, Portman's is a performance for the ages, and one that makes Jackie utterly irresistible.|Fresh
Dazed yet undaunted, grief-stricken but determined, genteel yet steely, Jackie is the role Natalie Portman was born to embody, swaddled in a brilliant skin of a score by Mica Levi.|Fresh
If the film is about grief, then the film must act as grief acts. Unmoored and aimless, Jackie acts like a bad dream.|Fresh
Jackie is a triumph of production design, period costuming and vintage cars and props, all captured by Stephane Fontaine's formal camera lens in a mix of sharply defining close-ups and scenes constructed of Kubrickian symmetry.|Fresh
Though Larraín sometimes fails entirely to convince on that emotional level... his talent and intelligence have never really been in question. And then there was Jackie.|Rotten
Unlike previous projects, this unique film zeroes in on a particular timeframe, in which the indelible legacies of both Jack and Jackie Kennedy first came to pass.|Fresh
It's the feel of the piece that's so unique.|Fresh
What is this movie trying to do? Simply dramatize everything that can go on inside a woman simultaneously marginalized and revered.|Fresh
What is the tension of the movie? Where is the drama? There's nothing at stake, no transformation to witness, just the weird spectacle of Portman's peculiar Jackie impersonation and the promise, hinted at throughout, that the assassination will be shown.|Rotten
There's no way around it. Natalie Portman is astonishing in a surprising and engrossing look at a Jackie Kennedy we only thought we knew.|Fresh
Portman's portrayal of Jackie is almost startlingly immersive, and the film is an invaluable glimpse into the mind and heart of a tragic figure.|Fresh
takes a topic that could so easily have become a one-dimensional hagiography or a cruelly biting hatchet job and turns it into a powerful study in loss and resolve|Fresh
Intense, complex film about assassination and aftermath.|Fresh
One of 2016's most interesting, adventurous, and just plain best films, the most thorough revivification of the biopic form in a good long while.|Fresh
"The scene of Jackie playing the original song ""Camelot"" while she drinks wine and floats through their White House rooms in a daze is as heartbreaking a sequence as any I've seen. For just these moments, Portman deserves an Oscar nom."|Fresh
"Portman's turn in ""Jackie"" may end up to be the defining one of her career, even though she's only thirty-five. The more the film moves along, the more convincing she becomes."|Fresh
"""Jackie"" transcends mimicry to achieve something greater - bringing the first lady's grief and resolve in the face of unspeakable loss to vivid life."|Fresh
The many nonlinear flashbacks in 'Jackie' made me feel like I was lost in a crazy time machine.|Rotten
Solemn and mesmerizing, propelling Natalie Portman into serious Oscar contention...|Fresh
Yikes, could they have gotten worse performances out of an outstanding cast? Portman plays Jackie as if she's a moron. Sarsgaard, Hurt, and Crudup are perfectly awful, but Laurence Olivier wouldn't have been any better given the lines they utter.|Rotten
If Portman's portrayal seems studied, that's because the woman herself was, and not since Black Swan has the actress been so in command of such a substantial role.|Fresh
[Larraín's] film deepens the general understanding of this person at this terrible time, while also keeping her truest and deepest thoughts exactly where they must be - out of our reach.|Fresh
It is well acted and informative, revealing a side of Jackie Kennedy that is relatively unknown.|Fresh
It's a revelation, a steady gaze into the early years in which the American presidency was a site for crafting an image not just for the history books, but for the cameras.|Fresh
Stéphane Fontaine...uses rigidly composed frames for the interview which anchors the film while operating more fluidly in flashbacks, a device which mirrors Jackie's carefully composed legend building against real life.|Fresh
[Portman] captures Jackie's mincing, tinkly speaking voice and brittle politesse, but some inner emotional core, even in Jackie's most resonant moments, as in the weeks after the assassination, is lacking.|Rotten
It's as beautiful as it is sorrowful, and as reassuring as it is disheartening.|Fresh
It's a stunning historical snapshot and nifty piece of filmmaking.|Fresh
One of the most barbed and breathless movies of the year ... grief and social pressure haunt [Portman's Jackie] like Freddy Krueger.|Fresh
Unfortunately, Portman's performance is the kind of boilerplate biopic mimicry that, while certainly attractive to Oscar voters, is the antithesis of the kind of critique she and Larraín are attempting.|Rotten
Every detail shines with significance.|Fresh
Natalie Portman is stunning as Jacqueline Kennedy in the aftermath of her husband's assassination. Chilean Director Pablo Larrain crafts a sublimely artistic and intimate portrayal of her struggle.|Fresh
A brilliant exploration of Jackie's role in creating the Kennedy mythos, though it also doesn't really ever question that mythos.|Fresh
Pablo Larraín's Jackie is an elegy to two slandered traits: self-consciousness and superficiality.|Fresh
There are two movies in Jackie. One of these movies is just OK. The other is exceptional. The first one keeps undermining the second.|Fresh
The movie devolves into a suffocating examination of its star as she unleashes a tsunami of acting-weeping, simpering, smoking and snapping-much of it captured in relentless, oppressive close-ups.|Rotten
Jackie is at its strongest not as a making-of-history biopic, but as a perceptive and aphoristic essay on history.|Fresh
We all know the Kennedy story by heart, but you'll still never look at Jackie the same way again.|Fresh
It's a very rare thing when a movie transcends so perfectly making the viewer feel something of what its tormented protagonist experienced.|Fresh
Jackie is not a feel-good movie; if you have any empathy in you, you'll feel sad at best and terrible at worst. It's meant to upset, and maybe motivate|Fresh
Vibrant and melancholic.|Fresh
"In some roles, Ms. Portman stiffens up and never seems to get out of her head; in ""Jackie"" this works as a character trait."|Fresh
A profoundly haunting and powerful film that examines grief in its most raw form. Natalie Portman is extraordinary.|Fresh
Although often gut-wrenching, the movie is supremely compassionate toward its subject. Yet Larrain and Oppenheim pull no punches when it comes to Jackie, who emerges as incredibly complex.|Fresh
There's a mesmeric intensity to Jackie that's unlike any biopic of its kind, marked by a deliberate effort to narrow the scope to one woman's actions and reactions over the course of a few fraught days.|Fresh
It's not a conventional biography, or even a historical drama. It's deeper and darker than that, and Portman bores down to the complex, most challenging parts of its core.|Fresh
The real question is what Jackie as a whole adds up to, and the returns are mixed.|Rotten
A potent cinematic provocation. Powered by a transfixing Portman as Jackie, Larrain's film - one of the year's best - is appropriately hard to pin down and impossible to forget.|Fresh
Portman is simply magnetic in the role, but it's a performance that works when in concert with all the other elements of the filmmaking... It's entirely of a piece; a perfect film because all of the details are perfect together.|Fresh
Moving but fitfully realized.|Fresh
He offers glimmers of what lies beneath the near-mythic, elegant exterior, but Larrain's take is more impressionistic than revelatory, more presumptuous than knowing.|Rotten
"""Jackie"" does more than a disservice - bordering on an insult - to its subject: It's so obtuse about the history of mores that it's the equivalent of showing Abraham Lincoln reading the Gettysburg Address off a teleprompter."|Rotten
Jackie is a remarkably composed, artful piece of storytelling about storytelling, as an examination of the gauzy reputation of the Kennedys and the darker myth-making involved.|Fresh
For all its disorienting intensity, emphasized by Mica Levi's keening and discordant score, Jackie operates at a chilly remove from the viewer.|Rotten
Larraín pieces together the fabric of Jackie's character with striking command and unmistakable purpose.|Fresh
"Ultimately ""Jackie"" isn't that different from ""Manchester by the Sea."" Both films deal with bottomless torment, but also with the way the death of a loved one brings headaches big and small."|Fresh
There are no shortage of stories about the Kennedy assassination, but this may be the first to show us the event through the eyes of the woman in the pink suit and hat. It's beautiful, and ugly, and long overdue.|Fresh
Both wildly stylized and feverishly intimate, a surreal collision of private and public selves played out simultaneously in the exclusive back rooms of power and on the world's biggest stage.|Fresh
Jackie is a hard movie to love, but its brittleness might be its most admirable quality.|Fresh
Director Pablo Larraín and screenwriter Noah Oppenheim have crafted a dazzling 99-minute drama.|Fresh
An ambitious but jumbled drama in which the central figure remains elusive. Portman's performance gets lost in the chaos.|Rotten
"Larraín told his producers he wouldn't do ""Jackie"" unless Natalie Portman agreed to take on the role, and her superb performance, utterly convincing without being anything like an impersonation, vindicates his determination."|Fresh
Natalie Portman falls back on excessive Acting 101 shtick that seems aimed for generating film awards rather than seriously trying to decipher the soul of a beloved figure.|Rotten
For Portman, this isn't so much the role of a lifetime as maybe the roles, plural: The notion of multiple Jackies affords her a range of personas ...|Fresh
Natalie Portman excels in this uncanny portrait of Jacqueline Kennedy's anguish and dignity following the murder of her husband.|Fresh
A searing, almost scary thrill ride through the psyche of one very determined woman ... a reminder that JFK's visage owns the half dollar because Jackie owned Americans' hearts.|Fresh
The opening frames of Jackie lead one to believe they're about to see a horror film. One wouldn't be far off.|Fresh
Pablo Larrain's Jackie, a work of probing intimacy and shattered stereotype, is an electrifyingly fractured portrait of the former First Lady.|Fresh
Gorgeous and emotional, Jackie is the kind of introspective film about American history that just doesn't come around very often.|Fresh
All those beautiful artificial vistas remind us that we are strangers here, that all we can do is watch; that the real Jackie, and her celebrated pain, are unknowable.|Fresh
Portman brings life to a complicated character, infusing it with a high level of consistent intensity and a sympathetic malaise that is beyond reproach.|Fresh
Pablo Larrain taps into a challenging and intriguing perspective on the traditional White House bio-pic.|Fresh
"Portman's been a committed, in-the-moment actress since she was a skinny kid running after ""Leon: The Professional"" but ""Jackie"" is an accomplishment on the Oscar-winning order of ""Black Swan."""|Fresh
The iconic first lady is given emotional complexity and rich understanding through a stirring and ambitious performance by Natalie Portman in director Pablo Larrain's powerful drama.|Fresh
Natalie Portman depicts the former First Lady not as an enigmatic glamour icon, but as a flesh-and-blood woman grieving her husband - as well the end of her fairy-tale Camelot life.|Fresh
A well-conceived intimate portrait of the widow First Lady, Jacqueline Bouvier Kennedy (Natalie Portman).|Fresh
Pablo Larraín's film bluntly hammers home the notion that history is framed by perception rather than reality.|Rotten
"I happen to find the result intrusive, presumptuous, and often absurd, but, for anyone who thinks that all formality is a front, and that the only point of a façade is that it should crack, ""Jackie"" delivers a gratifying thrill."|Rotten
A film that manages to circumvent the conventions of biopics and common historical films. [Full review in Spanish]|Fresh
There is real grace, sorrow, and beauty to Jackie, and it is a rich and rewarding cinematic experience.|Fresh
A biographical film that tries to break the mold and play with the pieces, where Jackie's troubled face is the perfect complement of Larraín's aesthetic. [Full review in Spanish]|Fresh
Though the unconventional biopic does not often spring to life, Natalie Portman's awards-worthy performance must be seen.|Fresh
It is both the Oscar bait drama we thought it would be and yet fuller, richer due to Larrain's direction and Portman's vivid, unforgettable performance.|Fresh
When it comes to making films that work as much for the sake of artistic expression as for capturing a moment in history, there's little question Jackie might be one of the finest pieces of cinematic storytelling we see this year.|Fresh
Every scene is kind of perfectly-honed.|Fresh
Rarely has a picture about events 50 plus years in the past felt so immediate and bruising.|Fresh
"A biopic that breaks the barriers and conventions of the genre, Pablo Larrain's ""Jackie"" layers itself as a deeply felt drama masquerading as a new form horror venture."|Fresh
The film is fascinatingly moribund, more meditation than narrative, a sort of monument to a singular act of public and private mourning.|Fresh
Jackie [delivers] a way for Portman to give one of the best performances of her career, maybe her best performance.|Fresh
Natalie Portman gives a tour de force with her performance, that will possibly make her win another Oscar. Nevertheless, I believe that the movie suffers from the film festival hype. [Full review in Spanish]|Fresh
Her elegance, pedigree, and fame made her seem the most remote of figures, but for just over 90 minutes, 'Jackie' seems to exist alongside her. It's an electrifying and unexpected piece of work.|Fresh
While it's certainly of interest, this predictably grim, grainy, gloomy movie only periodically splutters into life.|Rotten
Good enough to make Portman this year's best actress Oscar front-runner.|Fresh
Jackie is Natalie Portman's show, and she never wastes an opportunity to dazzle as JFK's glamorous grieving widow.|Fresh
It's unorthodox but good approach to telling her story.|Fresh
It's an intellectual experience rather than an emotional one, but the ideas in play are so heady they're enough to sweep you away on their own.|Fresh
Eclipsing her work in Black Swan, Portman flutters like a sail in a brisk wind. She is scattered, tense, wrecked and compellingly defiant in the face of those who would have her act a certain way.|Fresh
Natalie Portman is wondrously good in this part: surely her best and an Oscar contender.|Fresh
It's a singular vision from an uncompromising director that just so happens to be about one of the most famous women in American history.|Fresh
Instead of observing its historical subject from behind a glass case, Jackie offers a piercing portrait of a woman's psychological and emotional journey.|Fresh
Larraín doesn't see a hero or a victim in Jackie Kennedy but a person, and with the aid of Portman's astonishing performance, we feel like we come to some truths about her even if those truths aren't the pretty picture of Camelot.|Fresh
There is much to like about Jackie, from the pitch-perfect period detail to Noah Oppenheim's inspired script, but it's Portman's portrait of grief that will linger long after the credits roll.|Fresh
Extraordinary in its piercing intimacy and lacerating in its sorrow.|Fresh
It's a character study that projects its subject's inner turmoil onto the whole map of the movie. A final cliché: it's as if we're inside Jackie's head. It's a thrill to have Portman give us a tour.|Fresh
Jackie is Larrain's first foray into English-language film and his first attempt to tackle non-Chilean political issues. The result is supremely accomplished and fascinating.|Fresh
"""Devastatingly human."""|Fresh
An elegant, highly intelligent attempt to humanise a legend - while showing its subject's acute awareness of what it means to become a legend.|Fresh
A strange, refreshingly cynical, and unexpectedly cerebral account of former First Lady Jacqueline Kennedy's actions in the immediate aftermath of John F. Kennedy's assassination in 1963.|Fresh
Chilean helmer Pablo Larraín makes an extraordinary English-lingo debut with this daring, many-leveled portrait of history's favorite First Lady.|Fresh
