Natalie Portman gives a virtuoso performance as Jackie, capturing her breathy feminine tones and the fashion-plate public image that hides inner devastation, hinting at a contained breakdown in the privacy of her own empty bedroom.|Fresh
This film paints a complex picture of a woman who lost her tether to the world and gained her power back by creating a legend.|Fresh
An intoxicating and quietly horrific look at one of the most public tragedies of the 20th century, that overcomes the flaws in the screenplay due to strong performances and direction.|Fresh
As we dip in and out of the life of Jackie Onassis, Larraín maintains a fierce sense of focus. This is not Jackie's biography. It is a portrait of her grief.|Fresh
The film crystallises Jackie's dignity and pathos, and, also crucially, the sheer brutality of a way of life being completely wrenched from someone in a matter of hours.|Fresh
It's a performance that doesn't quite transcend. I never felt like I was watching Portman become Kennedy, but more of Portman just playing Kennedy, but it is still stirring in its own right.|Fresh
Jackie looks at the assassination and aftermath through the widow's eyes, which is a haunting examination of the intersection of loss and legacy that is led by a powerful performance by Natalie Portman.|Fresh
Natalie Portman's performance carries the film entirely.|Fresh
The lion's share of praise that will be heaped upon Jackie will largely fall at the foot of Portman, and rightfully so, but there's still a lot to love beyond the soulful performance at the centre of the film.|Fresh
Portman's vivid portrayal is the film's greatest strength, coasting through woebegone New England accents and the script's on-the-nose airing of themes in the final act.|Rotten
Natalie Portman gives a virtuoso performance as Jackie, capturing her breathy feminine tones and the fashion-plate public image that hides inner devastation, hinting at a contained breakdown in the privacy of her own empty bedroom.|Fresh
This film paints a complex picture of a woman who lost her tether to the world and gained her power back by creating a legend.|Fresh
An intoxicating and quietly horrific look at one of the most public tragedies of the 20th century, that overcomes the flaws in the screenplay due to strong performances and direction.|Fresh
As we dip in and out of the life of Jackie Onassis, Larraín maintains a fierce sense of focus. This is not Jackie's biography. It is a portrait of her grief.|Fresh
The film crystallises Jackie's dignity and pathos, and, also crucially, the sheer brutality of a way of life being completely wrenched from someone in a matter of hours.|Fresh
It's a performance that doesn't quite transcend. I never felt like I was watching Portman become Kennedy, but more of Portman just playing Kennedy, but it is still stirring in its own right.|Fresh
Jackie looks at the assassination and aftermath through the widow's eyes, which is a haunting examination of the intersection of loss and legacy that is led by a powerful performance by Natalie Portman.|Fresh
Natalie Portman's performance carries the film entirely.|Fresh
The lion's share of praise that will be heaped upon Jackie will largely fall at the foot of Portman, and rightfully so, but there's still a lot to love beyond the soulful performance at the centre of the film.|Fresh
Portman's vivid portrayal is the film's greatest strength, coasting through woebegone New England accents and the script's on-the-nose airing of themes in the final act.|Rotten
Portman's performance does hint at an inner strength, particularly in the magazine interview, but the script betrays her.|Rotten
At a very brisk 95 minutes, Larraín's Jackie is stripped of any fluff or distractions and is streamlined for maximum focus on a moment in American history so steeped in controversy and conspiracy by focusing on the most human element of it.|Fresh
Natalie Portman, who stars as the Iconic former First Lady, is sure to get plenty of awards nods for her finely nuanced portrayal.|Fresh
A subtle, mesmerizing, mind-altering character study.|Fresh
Larrain's picture is a curious but engaging affair.|Fresh
It's enlightening and insightful, using unusually creative filming, to experience Jackie's life and perspective firsthand.|Fresh
"""Jackie"" struggles in its pacing. It's Natalie Portman that saves the film from flat-lining completely and her performance is one that is far superior than the film itself."|Rotten
While many small details are profoundly beautiful, Larraín's attempt feels weighed down by self-importance, as if history were a wet blanket of one's own making that is ultimately inescapable.|Rotten
Portman's performance and Larraín's flowing camera overcome a screenplay that too often seems like a one-act play. They do more than just move a play outdoors. They explode it into lush, grand visions of American history.|Rotten
Although the film suffers from complacency, it is still a visual spectacle, full of emotions, great performances, an impressive production design and above all, much intimacy within the pain. [Full review in Spanish]|Fresh
Not without aesthetic interest, the movie is still a complete mess, weighed down by an expositional script and extremely mannered performances.|Rotten
Shot beautifully by cinematographer Stephanes Fontaine. The haunting score by composer Mica Levi drives home the grief felt through the entire picture.|Fresh
Sometimes when people say a film is all about one singular performance, it's meant as a slight. In Jackie, that's the point.|Fresh
And yet, for every element in Jackie that's obvious and overplayed, there are stray, marginal details that manage to resonate, moments during which the pretense falls away and its amorphous stew of ideas finally coalesce.|Fresh
"""Jackie"" shows us how Kennedy gave birth to the legend of the modern-day Camelot, but it also captures the ongoing evolution of a star, right before our eyes."|Fresh
As much as Jackie is about emotional process, it is also about Kennedy's liberation.|Fresh
An examination of the character and her need to purge or repair her pain. [Full review in Spanish]|Fresh
Portman does a tremendous job balancing an accurate impersonation of Mrs. Kennedy's unique voice and mannerisms with a performance that is genuine and fresh.|Fresh
In her portrayal of former First Lady Jacqueline Bouvier Kennedy, Oscar-winning actress Natalie Portman is absolutely superb in Jackie.|Fresh
Director Pablo Larraín's biopic JACKIE is soaked in atmosphere, bleeding emotion, life, death, happiness, sadness and anxiety.|Fresh
A disturbingly intimate portrayal of Jacqueline Kennedy, 'Jackie' is a film that unmasks her in such a tender yet objective manner; you feel like an intruder who is tailing the first lady of America and a widow in her most trying time.|Fresh
It's one of the must-sees of this award season.|Fresh
It's easy to recognize some of the shared elements between Jackie and Neruda. But it's still striking to see Larraín tackle such quintessentially American material (and with a largely different crew) and managing to hit the mark so cleanly once again.|Fresh
If Jackie has a conceptual emblem, this is it: messy reality splattering all over a carefully maintained façade.|Rotten
Pale and gaunt, Portman not only looks the part - those vintage costumes are perfect for her - she manages to channel the grief and pain powerfully.|Fresh
Not your typical biopic, Jackie is an extraordinary exploration of a complex woman navigating her loss, her children's grief and a nation through an unprecedented political and personal tragedy. Don't miss it.|Fresh
It's an intensity that never lets up - you have to take your moments to stop and remember to inhale and exhale when you can. But that intensity is also to the film's detriment, as at no point does it allow warmth to seep in.|Rotten
Jackie is too focused to teach history to the young and too invasive to appeal to the old, who watched TV that November.|Rotten
Portman's portrayal is nothing less than amazing, perfectly capturing Jacqueline's intense drive, strength, occasional pettiness, and overwhelming grief.|Fresh
Jackie is a self-serious affair, and despite its dedication to getting under the skin of the former first lady, it remains largely on the surface of things - glossy, sleek, and to a certain extent oddly detached.|Rotten
Pablo Larraín's disappointing Jacqueline Kennedy biopic tries but ultimately fails to reconcile the person with the persona.|Rotten
It tries not to fall into cheap patriotism and for the most part succeeds, but more than anything is the Portman show. [Full review in Spanish]|Fresh
Here's how you know the new film Jackie is working: You move from trying to decide just how credible Natalie Portman's impersonation is to thinking about anything and everything except that.|Fresh
For the most part ... Jackie keeps things clear and preserves its subject's sadness in amber.|Fresh
A look at a woman who uses the cameras to transmit the version that suits her. Part of Jackie's success lies in not knowing when we are seeing the woman or her creation. [Full review in Spanish]|Fresh
As a whole, the movie is very cold. Director Pablo Larraín shoots much of it in a very controlled, almost Kubrickian way|Rotten
A movie that is as brilliant as it is frustrating.|Fresh
This is essentially asking us to celebrate the birth of spin in modern politics.|Rotten
Larraín is an artist, and his skills show throughout, both in his ability to meld so many different sequences into a narrative whole and in how effectively he uses Portman to portray one of the world's most memorable figures.|Fresh
Jackie is a great recreation of a very important time and context, but it didn't stimulated me emotionally or intellectually as much as I would have liked. [Full review in Spanish]|Rotten
Jackie may not be the highest point in the Chilean filmmaker's career, but there's enough material in the film to avoid going unnoticed. [Full review in Spanish]|Fresh
While the movie may not sit well with those looking for perhaps a more conventional Hollywood approach to biopics, it is worth seeing for Ms. Portman's outstanding performance alone.|Fresh
The emotions are muted, suggested in gestures and details, as is the drama. Jackie doesn't deliver the catharsis you might expect from the subject matter. It's more interested in the nuances of character...|Fresh
The center of the whole film is Jackie and neither the witty narrative nor Larraín's staging would have worked were if not for Natalie Portman's performance. [Full review in Spanish]|Fresh
What a tense, absorbing, startling film it is. Natalie Portman is simply astounding.|Fresh
The result of the film is in some ways a bit disconcerting, but - beyond certain moments dominated by coldness and calculation - it's still a valuable film. [Full review in Spanish]|Fresh
Distinct and sensitive, this unique feature offers an emotional and enthralling look at the former first lady.|Fresh
"""Jackie"" is artful when it needs to be heartful; its overly ambitious visual dramatics are often a glass wall between Portman and the audience. But when she breaks through it, watch out."|Fresh
The director shows us the mourning as a staging, but doesn't condemn, shows; criticizes and also builds bridges for compassion. [Full review in Spanish]|Fresh
A film that questions the show within the show, opening up to unpublished meditations and contexts, to continue surviving adversity and internal dismemberment. [Full review in Spanish]|Fresh
It ended up pushing me further away from the character. In other words, I can appreciate the formal achievements of the film, but what surrounds this calculated and talented woman couldn't interest me less. [Full review in Spanish]|Fresh
Despite some impressive visual flourishes - the slain President's limousine racing to the hospital - the much-hyped Jackie is ultimately a big let-down.|Rotten
Portman does a stellar job of drawing out all the hundred emotions of sadness, grief and hopelessness that one would have thought are humanly possible. Her performance, however, is not as nuanced and varied as in the... Black Swan.|Fresh
Jackie, the first English-language film by Chilean director Pablo Larraín, offers a compellingly uneasy and nuanced portrait of one of the best-known first ladies in American history, engagingly played by Natalie Portman.|Fresh
As a tightly controlled exploration of the pageantry of grief, Jackie works very well, even when the stylisation tips into excess and the close-ups begin to feel more intrusive than intimate.|Fresh
An artificially enlarged portrait that has empty, superficial and apolitical reflections. [Full review in Spanish]|Rotten
Although the film doesn't reveal any secrets, it constructs a dramatically powerful x-ray of what Jackie might have experienced. [Full review in Spanish]|Fresh
Director Larraín, working from a script by Noah Oppenheim, delivers a frequently mesmerizing drama that benefits greatly from Portman's striking performance...|Fresh
Natalie Portman shines on Jackie, a film that is far from the traditional biopic, focusing on the feelings that follow a tragedy. [Full review in Spanish]|Fresh
Pablo Larraín's direction ties every loose strand together with ease and grace, his camera condemning, challenging, coaxing out meaning, and wringing beauty from a bloodstained pink suit.|Fresh
A spiritual look at Jacqueline Kennedy's search for meaning after the death of her beloved husband.|Fresh
It manages to circumvent the conventions of biopics or ordinary historical films thanks to its spooky but alway sober atmosphere loyal to the period portrayed. [Full review in Spanish]|Fresh
The minimalist style of the film, full of silences, sounds like the tears of a woman as they hit the ground. [Full review in Spanish]|Fresh
Jackie is a mesmerising tour de force, as brutal as it is gentle and as jaw-droppingly gorgeous as it is bleak.|Fresh
An educated and transparent film, which tries not so much to reconstruct or imitate reality as to recreate it on the inside and make it possible in the strict margins of the myth. [Full review in Spanish]|Fresh
Portman, with her fabulous upper-crust accent, is the best thing in this piece, essentially a longish radio play.|Fresh
Natalie Portman as Jackie Kennedy is perfectly imperfect in one of her best roles until today and the music of Mica Levi drags us to follow the same path of despair that she must have had. [Full review in Spanish]|Fresh
This idiosyncratic polysemy is gradually digestible thanks to a well-grounded narrative structure. [Full review in Spanish]|Fresh
The great performance of Natalie Portman, the incredible score by Mica Levi, and the direction of Pablo Larraín make a very relevant reflection on modern celebrity culture.|Fresh
Politics is given a back seat, and that's what makes Jackie interesting - it unspools as a deep character study of its subject rather than a history lesson.|Fresh
Portman skilfully mimics Jackie's mannerisms but more importantly, you understand her character's complexities.|Fresh
Jackie is one of the most conflicted films I've had the pleasure of watching. It is good -- but it does take a while to work out exactly what type of film it is supposed to be.|Fresh
An incredibly immersive experience that is hard to shake after the credits role, a film that illuminates and moves in its artistry and its spirit.|Fresh
"Portman returns to form in ""Jackie."""|Fresh
It feels both random but suddenly relevant today, when the American presidency has become something other than Camelot.|Fresh
That the film is nearly as good as Portman's performance is remarkable.|Fresh
This is Portman's film through and through: she gives one of her best performances (better even than her Oscar-winning turn in Black Swan).|Fresh
It's a time-fractured but close-focused look at the bereaved First Lady, and thanks to Natalie Portman's performance as the fragile, ferocious Jackie, it's one of the strongest dramas of the year.|Fresh
A fine film boasting some notably detailed period recreation...As a historical drama about how a nation looked to a single person for its cue about how to react to the murder of its leader the film does make for a solid, if somewhat repetitive, journey.|Fresh
While brilliant French cinematographer Stephane Fontaine paints the picture, Noah Oppenheim's screenplay makes you wonder why it's taken so long to essay this endlessly fascinating historical figure.|Fresh
Bizarre yet irresistible.|Fresh
Portman is excellent but it's hard not to know why the story is being told.|Rotten
From the saddening glissando strings of the opening theme, with its falling invocations of death and discord, Levi provides the unifying emotional glue for Larraín's deliberately shattered film.|Fresh
A brilliant depiction of shock.|Fresh
With eyes wide and startled, pale skin drawn tightly over cheekbones, Portman is hypnotic.|Fresh
It's a complex, provocative film, artfully directed by Chilean filmmaker Pablo Larrain and anchored by a riveting performance from Natalie Portman.|Fresh
Clever, beautiful images about a clever, beautiful image-maker.|Fresh
Portman's portrayal of explosive yet restrained grief packs a punch, and Jackie's loneliness is palpable, emphasised by the White House's enormous rooms, Mica Levi's disquieting score... and cinematographer Stéphane Fontaine's long shots.|Fresh
[An] engagingly unconventional chronicle of the days between JFK's assassination and his elaborate state funeral.|Fresh
[Jackie Kennedy] is played to perfection by Natalie Portman.|Fresh
Don't expect a comprehensive biopic of the wife, mother, widow, tastemaker and White House style icon. This is a rigorous exploration of Jackie Kennedy's steely determination ...|Fresh
Daringly intimate and unusually insightful, Jackie sees a South American provocateur take on an all-American idol - and the results are unforgettable.|Fresh
A fascinating film with a complex, moving performance from Natalie Portman, sounding strangely like Marilyn Monroe in places, and a sentimental belief in the enduring promise of Kennedy's brief, shining moment as president.|Fresh
In a word: Oscars!|Fresh
By immersing us in Jackie Kennedy's (Natalie Portman) subjective experience rather than observing her from the outside, Larraín gets closer than a traditional biopic to capturing an individual's capacity to shape history.|Fresh
Was I riveted by Natalie Portman as Jackie Kennedy? I was... But was I aware it was Natalie Portman, Acting? Always. And there isn't much else here.|Rotten
For all the bustle around her, the film insists on Jackie's aloneness and Portman gives a performance in which there is as much tantalisingly concealed as fearlessly exposed.|Fresh
It is well made, handsomely furnished, punctiliously designed and the use of Richard Burton's sonorous tones on the Kennedys' LP of the musical Camelot is a nice moment.|Fresh
There is kitsch but no corn in this piercingly intelligent film. Even the press-interview framing device, a tired trope in some cinema, proves its sly mettle.|Fresh
Has almost unbearable extra resonance in these waning days of the Obama administration ... The themes are big but the focus is tight as a drum ... astonishingly effective production and costume design ... Portman [give]s [a] tremendous performance.|Fresh
More mood piece than standard narrative, more character sketch than study, Jackie is a fascinating film that rewards as it confounds.|Fresh
It's the incongruity of the Jackie Kennedy story told in Pablo Larrain's Jackie that makes the film so compelling.|Fresh
The woman comes across as imperious, mercurial and sometimes eccentric, but always real.|Fresh
Larraín has made an incomparable film on the process of moving queasily into uncertainty.|Fresh
To be moved by this film, directed by Chilean filmmaker Pablo Larraín, it is important to absorb it as a visual experience first and allow yourself to be entranced by its images.|Fresh
An interpretation of how the bereaved woman at its core copes... purposefully restless in look and in mood yet still attuned to the impact of glances, choices, words and objects.|Fresh
Breathes life, hope, blood, sweat and tears into despair.|Fresh
A captivating and unflinching portrait of private grief amidst one of history's most public tragedies.|Fresh
Jackie does what the very best biopics should: it makes you view someone you've seen countless times as if you were seeing them anew.|Fresh
Portman's Oscar-worthy work crowns an unconventional study of an icon, while Mica Levi's score is sublime.|Fresh
A mesmerising reflection on celebrity, memory and the determined individual crafting history.|Fresh
Natalie Portman's central multi-layered performance is unforgettable for many reasons. Beyond the physical illusion... her portrayal is both internal and external|Fresh
Natalie Portman captures every facet of Jacqueline Kennedy. The smiling, laughing young woman and the embittered widow, refusing to change out of her clothes, stained with her husband's blood|Fresh
Immensely powerful.|Fresh
Natalie Portman's performance is as good as everyone says.|Fresh
Working from a nuanced script by Noah Oppenheim, Larrain has fashioned a solemn film that mourns what never came to be more than what was lost.|Fresh
A beautiful, bewildering film that bounces from haunting to overblown and back again without a moment's notice, ending up an oddity most befitting of its subject.|Fresh
The entire movie resonates with an authenticity that stems from Portman's performance. From the wardrobe to the re-creation of historical moments, there are no shortcuts taken.|Fresh
[Jackie] is held together by a startling performance by Natalie Portman, who goes beyond mere chameleonic imitation and offers something truly emotionally wrenching.|Fresh
A fascinating, high energy, character study and well worth your time if you don't mind the emotional cost.|Fresh
A bewitching study of mythmaking that underlines Pablo Larraín's status as cinema's most daring political filmmaker.|Fresh
Portman and Larrain have done a terrific job presenting a complex, conflicted and often-contradictory character, who struggled at times to be the person others wanted her to be.|Fresh
This is a cinema of no escape, and few if any actors will have to shoulder the same burden of expressive responsibility this year - yet the never-better Portman simply shines beneath it, giving a performance of mesmeric complexity and commitment.|Fresh
Larrain has carried off a perfect fusion of the personal and the political. The story of one woman's loss has become a study in America's sustaining need to turn its leaders into myth.|Fresh
This film is less an isolated Jackie Kennedy biopic than a dark and conceptual statement on how the American people classifies, experiences and remembers historic tragedies.|Fresh
By the end of the film, Portman has drained the iconic Jacqueline Kennedy of every last drop of her famously fluid grace and poise, and we have watched it harden into resilience and defiance.|Fresh
If the winners write history, the survivors become guardians of the legacy.|Fresh
...sets the new standard for the biopic genre against which all future attempts will likely be measured.|Fresh
Pablo Larrain has crafted a visually stunning and emotionally raw film but what really brings Jackie to life is Natalie Portman's extraordinarily complex performance.|Fresh
[Jackie is] a tour de force that works precisely because it doesn't have to be totally convincing, just insightful.|Fresh
An intelligent and emotional biographical piece. It's the tragedy in the face of a young widow. [Full review in Spanish]|Fresh
From the beginning of the film, with its mournful, atonal music score by Mica Levi, it's obvious that this is no conventional dramatisation of the events that arguably brought to an end America's innocence.|Fresh
There are two narratives at war in Jackie: One is a decent but disposable showcase of dialogue, the other a masterpiece streaming through sentiments.|Fresh
History comes to life and a former First Lady becomes a walking ghost in Pablo Larraín's strange, disquieting biopic, Jackie.|Fresh
Torture-lot.|Rotten
Yes, the actress nails Jackie's soft, breathy, almost brittle voice. Yes, she moves about with the perfect posture and grace that Kennedy was known for. Yet her Jackie rarely feels lived-in.|Rotten
A movie like this stands or falls by its lead performance. Fall it does.|Fresh
[Here is an] ill-conceived movie further hobbled by an inarticulate script ineptly executed by miscast actors - gross political exploitation at its lowest.|Rotten
One could excuse the lack of factual detail if the movie had some focused impression to suggest.|Rotten
Viewers who were alive and witnessed it will find it inspiring. Those who were not will find it flat.|Fresh
The film is not a document, nor a myth, nor a political indictment, but a completely subjective, artfully wrought fragment of the American mystique.|Fresh
A brilliant performance surrounded by an otherwise unremarkable movie. (Splice Today)|Fresh
Director Pablo Larraín's Jackie is a powerful if traumatic achievement, in approach as well as execution. So is Natalie Portman's performance in the title role.|Fresh
... A mesmerizing picture that stays with you after the lights go up, but it's not one to be enjoyed.|Fresh
It is, in its own way, a eulogy not just to Camelot but to the American dream itself. It is grace in the midst of madness.|Fresh
...a psychodrama more than a standard biopic.|Fresh
We've known for some time that Natalie Portman is a fine actress, but with her portrayal of Jacqueline Kennedy she steps into the front ranks.|Fresh
