No Austen adaptation, even the most revisionist ones, has ever felt as vicious as Whit Stillman's Love & Friendship.|Fresh
The delight of its director, Whit Stillman, enlivens every scene, so what might have seemed stilted is full of human faces in exquisitely subtle states of panic. Heretical as it sounds, Stillman has improved on his source.|Fresh
The charmingly manipulative Love & Friendship shouldn't be as periodically enchanting as it is, but dammit if Kate Beckinsale doesn't hypnotize us from scene one.|Fresh
Not among the best of Jane Austen's novels is given a decent adaptation.|Fresh
Streaked with the director's decidedly modern strain of cynicism, Love & Friendship might very well be the most faithful translation of Austen's biting humor and highly practical feminism to date.|Fresh
Above all (and surely to the relief of those prone to resist costume drama) it's just a very playful picture.|Fresh
The stuffiness of the environment, with the beautiful mansions and elegant gowns, seems to have prodded Stillman to be even more playful than usual here.|Fresh
The most refreshing take on Austen's work ever put on screen.|Fresh
One of the funniest comedies of manners since the heyday of Ernst Lubitsch.|Fresh
Whit Stillman relishes societal pomposity and self-obsessed characters, and his latest film, Love & Friendship, shows that he's adept at skewering ridiculous relationships and selfish people no matter what setting.|Fresh
[Stillman's] dry sense and cutting sensibility are suited to the meaner edge this story has in comparison with the rest of Austen's oeuvre.|Fresh
Whitman respects and relishes in Austen's creation but is no slave to it, inventing additional characters to help the story flow.|Fresh
Whit Stillman and Jane Austen are a match made in comedy rapture.|Fresh
Finally, a Jane Austen movie that's fresh and deliciously rotten at the same time.|Fresh
Despite its period trappings, Stillman's film never feels stilted, largely thanks to his bracingly modern heroine who takes no prisoners, and makes no apologies for her conniving behavior.|Fresh
It's pure fun, suitable for most everyone -- and a worthy addition to the Austen canon.|Fresh
The film is a fine showcase for Stillman's typically inspired bon mots and the atypical charms of his leading lady.|Fresh
In the case of Love & Friendship, the match between adaptor and adaptee is exquisite and advantageous to both.|Fresh
Jane Austen, who used dialogue as a veil that reveals and conceals, and writer-director Whit Stillman, with his love for the elegant pense, are such an obvious match that you wonder why it took them this long to get together.|Fresh
...Whit Stillman's adaptation of Jane Austen's Lady Susan is a surprisingly hilarious period piece that centers on Austen's titular character, played perfectly by a deliciously nefarious Kate Beckinsale|Fresh
Perhaps only by reading the book after you've seen this is the skill of Stillman's treatment to be fully grasped - it's one of the deftest feats of literary interpolation in ages.|Fresh
Stillman's fleet and funny adaptation makes it a pleasure to follow these entanglements (and to understand the strict social rules regulating everyone's behavior).|Fresh
A lovely and intricate web with a seductive spider at the center, played deftly by Kate Beckinsale.|Fresh
"""Love & Friendship"" is a most particular pleasure."|Fresh
Whether debutants in New York City or landed gentry in England, Stillman is perfectly at home, delivering the same dry humor and tender observations about the affairs of the highest echelons of society.|Fresh
"Sharp insight, coupled with the amusing way that the heroine phrases her quips, make ""Love & Friendship"" pleasurable to watch even when it all starts to feel like too much about too little."|Fresh
Although it's difficult even by the end to entirely sort out who's related to whom and how, the actors acquit themselves nicely, and it's always good to have Stephen Fry around in this sort of tony affair ...|Fresh
"A supremely elegant and delicately filigreed adaptation of Jane Austen's epistolary novella ""Lady Susan."""|Fresh
With his ebullient and scaldingly droll latest - a superlative screwball adaptation of Jane Austen's novella 'Lady Susan' - Stillman may have finally located an ensemble of characters who exist in their own time.|Fresh
