Though it tells an emotional story about identity and coming out, it's an easygoing movie, glossy and kind and cozily corny. And yet, for me, it was also a fraught experience, both pained and giddy, cheering and dismaying. It's a lot, this little movie.|Fresh
This film treats 17-year-old Simon Spier's quest for love and self-acceptance with the tender, timeless, Hollywood touch of John Hughes: It's a classic story of a first crush made groundbreaking by centering on a closeted gay kid.|Fresh
"The element that keeps ""Love, Simon"" from fully realizing its potential is that it feels like something you'd see on TV. And not on TV in 2018 - TV you'd see in the 1980s."|Rotten
If what teens watch on their screens shapes future teen behavior, Love, Simon's utopian society is a gift to the teens of the future who may grow up on it - and to anyone who has to deal with teens.|Fresh
A surefire sleeper hit.|Fresh
Love, Simon isn't a subtle movie by any means, but it ought to be praised for normalizing something that should have been normal from the start.|Fresh
How refreshing to see a teen boy on a big screen that's not a sleepy-eyed, monosyllabic jerk just hoping to get laid.|Fresh
Love, Simon is the kind of movie you could easily catch up with on cable TV years later and forget just as quickly-but even that's a kind of step forward.|Fresh
If this heartwarming teen-oriented bildungsroman is any indication of how Hollywood plans to handle homosexuality in the future, the culture has truly turned a corner in terms of teaching tolerance of sexual preferences.|Fresh
The perfect high school movie for 2018.|Fresh
"The beauty of ""Love, Simon"" is in its astute, slice-of-life observances about family, friendship, and that delicate moment in every LGBTQ person's life when he or she must gather the courage to begin living as their authentic self."|Fresh
This winning comedy about a gay high schooler looking for love hits you right in the heart.|Fresh
Kids like Simon, in 2018, already have a good shot of fitting in. They don't need this movie.|Rotten
Love, Simon has the same endearing quality as the John Hughes teen comedy classics of the 1980s.|Fresh
The dialogue didn't feel forced; it was charming, witty and extremely relatable.|Fresh
An unapologetically joyous experience, rich with dramatic stakes, but also wickedly funny and intently designed to leave the audience with great feelings leaving the theater.|Fresh
Love, Simon is so full of heart and emotion that you can't help but fall in love with it.|Fresh
Indie dramas routinely tackle coming-out issues far better; in 2018 there's no reason or excuse for a commercial film to be so unwilling to honestly engage with the sexuality of its protagonist.|Rotten
Love, Simon is a funny, heartfelt, and truly touching teen romantic comedy that instantly becomes a modern classic for today's generation.|Fresh
"""Love, Simon"" never feels like it exists merely because it should; its endearing charm makes it a film that viewers will watch regardless of its valuable social impact."|Fresh
But Love, Simon's greatest triumph is that it manages to highlight the small ways in which even the most accepting and open-minded among us can make coming out difficult, even in 2018.|Fresh
The film focuses on the one thing it does differently... and it can't be denied that it does make the tired formula feel ever so slightly fresh for having done so.|Fresh
From a romantic standpoint, the most beautiful aspect of Love, Simon is that through nothing but emails it's believable that these two students could fall for one another; it's not about physical appearances or social status or anything superficial|Fresh
Greg Berlanti's charmingly heartfelt film is a remarkably successful attempt to give shape to the experience of the closet by drawing an incredibly intimate portrait of a teenage boy about to leave it behind.|Fresh
Love, Simon is touching as a gesture. As entertainment, it's nothing Degrassi hasn't done better.|Rotten
It's too bad that the movie isn't as vibrant, funny, and entertaining as the community it wishes to represent - but it's a start.|Fresh
Love, Simon won't be short of critics (and many of them will be adamant that its story is either unimportant or, gasp, amoral) but within its sleek studio skeleton, there's genuine heart.|Fresh
"At a cultural moment when it matters so much for audiences to see themselves represented on screen, ""Love, Simon"" broadens the spectrum to include those who are questioning their sexuality."|Fresh
It's an expertly carved chunk of cheese. But taken on its own, limited terms, Love, Simon is also a charmer - warm, often funny and gently touching, tickling rather than pummeling your tear ducts.|Fresh
Not only would this make John Hughes stand up and cheer, its honesty and tenderness are destined to leave a lasting legacy.|Fresh
There's a place in the culture for adolescent gay kids to enjoy the shiny, shallow coming-of-age stories that their straight peers consume on a daily basis. The first one out of the gate always plays it safe; the trick now is to keep the gate open.|Fresh
There's something about Love, Simon that feels like a bona fide event...It's a film that we swooned and winced and cringed and grinned through, the journey the best coming-of-age movies take their audiences on.|Fresh
