In an age where the facsimile of spectacle can be produced via green screen, Cruise realizes there is no replacement for stunning vistas and genuine danger.|Fresh
McQuarrie has now directed two Mission: Impossible films; his understanding of the franchise and its characters proves to be the secret weapon of the series.|Fresh
Bless this franchise, we're truly not worthy.|Fresh
If a scene calls for people to parachute onto a building from 30,000 feet, why not throw in a lightning storm?|Fresh
In Mission Impossible 6, Christopher McQuarrie and Tom Cruise deliver one of the biggest summer action movies ever seen. [Full Review in Spanish]|Fresh
The Mission Impossible series has been consistently thrilling. Fallout kicks everything up a level. It's ridiculously enjoyable.|Fresh
In the sixth installment of the saga, Tom Cruise returns as agent Ethan Hunt and gives the film a texture of realism thanks to his physical effort. Director Christopher McQuarrie reminds us why big-budget films can be interesting. [Full Review in Spanish]|Fresh
The series accomplishes if not the impossible then at least the highly unlikely by delivering more satisfying cinematic spy thrills in its sixth installment.|Fresh
A three-hour movie that doesn't feel like three hours...the best action movie this year, so far.|Fresh
Fallout is a determinedly old-fashioned action thriller that rarely stops to take a breath for fear that the loose ends of its twisted plot will be exposed. The always-on-the-go quality ensures momentum.|Fresh
In a time of lacklustre franchise offerings, it says a lot for MI6 that we can't wait for a part 7.|Fresh
Till he is physically capable, Tom Cruise will continue to accept such films, be sure of that...|Fresh
... A scintillating symphony of stunts, set pieces and action choreography.|Fresh
You can expect the nifty tricks that we've come to associate Hunt and the IMF with, but the moments I quite enjoyed were those of honesty and gentleness from the super spies.|Fresh
If there is an action movie to watch right now, then this is it.|Fresh
Brilliant. You're constantly on edge.|Fresh
A ticking time bomb of harrowing action, frazzled nerves, and edge-of-your-seat mystery. But, at the same time, it is way too long and its plot far too complex and convoluted|Fresh
[The] almost two and a half hours (the longest in the series) deliver an introspective and reflective film that is entertaining, and whose plot... never suffers from the frantic but perfectly framed action. [Full review in Spanish]|Fresh
Completes possibly the most improbable cinematic hat trick in Hollywood history: An unpromising series that began with three patchy, uneven entries has now produced three terrifically entertaining ones.|Fresh
Mission: Impossible - Fallout is a finely crafted entertainment machine meant to deliver summer-movie satisfaction, and after six chapters, I'm ready for more.|Fresh
Grows bolder and bigger, turning into a series of eye-rolling whoppers by the end.|Rotten
"""One saves the world; the other, entertains us as children in matinee. For Cruise / Hunt, it's the same""."|Fresh
The McDonald's hamburger of action movies. Well, maybe that's not entirely fair. Maybe the Wendy's.|Fresh
Tom Cruise is really good at running. This is what people refer to as perfect summer entertainment: big, long, splashy, and (overall) fun.|Fresh
While a sequel is pretty much guaranteed, it'll be a very tough to top this absolutely stellar installment...|Fresh
As summer franchise movies go, Mission: Impossible - Fallout is near the top of the heap... If the film has one overriding flaw, it's that it's about 20 minutes too long.|Fresh
Without a doubt, Mission: Impossible - Fallout is the summer's best action movie!|Fresh
An entertaining ride that's near impossible to resist. (Full Content Review for Parents - Violence, Profanity, etc. - also Available)|Fresh
Mission Impossible: Fallout is like a nuclear fallout shelter against boredom. [Full Review in Spanish]|Fresh
Ethan Hunt will not only save the world, he'll do it in the most ridiculously dangerous and flamboyant way possible, with a lot of glass flying all over the place.|Fresh
I guess it depends on what your expectations of these films might be: The action is, as always, formidable, but without the same care given to the storyline, the film is a good deal less satisfying than some of the predecessors.|Fresh
The sixth movie in the Mission: Impossible series is a truly maximalist work of art. The plot is stupid but the stunts are terrifying, the tension vibratory, the muscles rippling. In short, it's a masterpiece.|Fresh
This is how Cruise returns to Zeus-level stardom. He gives his fans no stuntmen in masks and costumes. No green screen. Its him and he's spectacular.|Fresh
"Say what you will about ""Avengers: Infinity War,"" but at least its story took risks. ""Fallout"" offers a highly predictable form of fun -- although it's still fun."|Fresh
Tom Cruise is as ageless as this remarkably fresh franchise.|Fresh
Once again, Cruise pours every ounce of adrenaline-junkie effort onto the screen, skydiving, riding motorcycles, climbing cliffs, flying helicopters and yes, running really fast.|Fresh
Fallout is not only (easily) the best pure action movie of Summer 2018, it's also the perfect culmination of the Mission: Impossible films thus far.|Fresh
"""Mission: Impossible - Fallout"" is a propulsive viewing experience, captured at a true break-neck pace."|Fresh
Cruise tumbles through the overly complicated globe-skipping action flick as though he's collecting punches on the Break A Bone On Every Continent Rewards Card.|Fresh
"While the stakes certainly are high, ""Fallout"" turns up the fun with references to the increasingly implausible lengths to which Ethan and his team will go to save the world."|Fresh
You can just feel the care and craftsmanship in every scene, like when you eat a fancy meal or drive an expensive car.|Fresh
Mission: Impossible has become the blue-chip action franchise of the 21st century. Choose to accept it.|Fresh
There's nothing to think about. You just set your mouth to AGAPE and lean back.|Fresh
Froths with terrific, clattering violence that - staged with as little CGI as possible - makes competing summer flicks ... feel like clouds of generic software.|Fresh
Quick pacing and impeccable action scenes compensate for predictability.|Fresh
A seamless, wildly entertaining summer blockbuster that won't soon be forgotten.|Fresh
if you're looking for high-octane action, filled with unpredictable surprises, this is the film. Scene after scene becomes one mind-blowing experience after another.|Fresh
Mission: Impossible - Fallout has some of the most stunning action ever put on film - Nolanesque in tone, paced like a bullet, and breathtaking in IMAX.|Fresh
We're back for the sixth episode of Ethan Hunt's continued battle against the bad guys and, bloody hell, if it hasn't just gone and delivered the best action film of the year so far . . .|Fresh
This sixth outing for Ethan Hunt (Cruise) and his disaster averting/disaster causing Impossible Missions Force is up there with JJ Abrams's Mission: Impossible III as a contender for the best of the bunch.|Fresh
Even the bladder-bursting 147-minute running time of Mission: Impossible - Fallout can be forgiven, given the number of thrilling action sequences it facilitates.|Fresh
Fallout is the perfect Mission: Impossible sequel; so good it makes knees wobble and (broken) ankles heal.|Fresh
Fallout is thrilling in a way that is out of sync with blockbuster fashions. It doesn't try for any sort of political resonance, and while it's a more direct sequel than past installments, there's still nothing you really need to know in advance.|Fresh
Watch Mission: Impossible - Fallout to experience old-fashioned action cinema at its best. Just be prepared to be strapped in for longer than you're used to.|Fresh
"Plenty of pleasures apart from pure action turn up in the film, which, like the previous episode, ""Rogue Nation,"" was written and directed by Christopher McQuarrie."|Fresh
Astounding, gripping, heart-pounding set pieces.|Fresh
The relative lack of CGI, the way bodies run and leap and climb and slam into things in this movie makes you catch your breath.|Fresh
Fallout may be the most viscerally satisfying blockbuster sequel since James Cameron changed the whole game with Terminator 2.|Fresh
Cruise's inexhaustible appetite for creating wow-worthy stunts and action-packed set-pieces doesn't disappoint.|Fresh
It's a difficult task to keep viewers connected to a sprawling series and to put together two and a half hours of solid thrills and surprises with a good level of emotional investment. That's exactly what M:I 6 has done.|Fresh
It's all so godd---ed beautiful. I love these movies.|Fresh
It's a rare beast for a Hollywood blockbuster to leave me speechless. Mission: Impossible - Fallout did exactly that.|Fresh
The Mission: Impossible movies are not emotional experiences, but a visceral expression of Cruise's dogged desire to remain an action star. Even with top-notch filmmakers at the helm, he's become the true auteur of this series.|Fresh
And, bless him, Cruise should be an inspiration for any AARP member. He is the best runner in movies. When he begins to sprint, you are impressed by the clenched jaw, the legs churning like pistons and the arms propelling him forward.|Fresh
For fans of nonstop jaw-dropping stunts, this epic is bliss.|Fresh
In a way, this entry, while nowhere near the best of the series, might serve as the perfect distillation of what we expect from a Mission: Impossible movie.|Fresh
Mission : Impossible-Fallout knocks itself out to keep you awake and entertained. The result is a film that won't make a dent in cinema history but, with an ebullient gusto, it is impossible to resist.|Fresh
It's a pleasure to see the way Cruise fully exploits his physicality in Fallout; he's like a contemporary emulation of Buster Keaton. [Full Review in Spanish]|Fresh
The film holds up well as an action piece, but the intrigue dissolves when we step outside the theater and read about the clandestine way 12 Russian military intelligence officers were caught in the act intefering in the 2016 U.S. Elections.|Rotten
Whether you're a hardcore fan of these films or not, there's more than enough wow factor to leave a lasting impression.|Fresh
Manages to score a place as one of the best M:I outings yet.|Fresh
Mission Impossible has been able not only to reinvent itself for these times but do so with amazing power, conviction, and vitality. [Full Review in Spanish]|Fresh
With his partner, returning director-writer Christopher McQuarrie, Cruise delivers all the above in the ridiculously entertaining Fallout, his sixth outing as Ethan Hunt.|Fresh
In terms of pure, sustained, crowd-pleasing excitement, it's the must-see, big-screen event of the season.|Fresh
There's a bit of an excess happening here, but it's excess of all good stuff.|Fresh
It is jaw-dropping. See it on the biggest screen you can find.|Fresh
Mission: Impossible - Fallout is the most emblematic of the entire series. If you've watched this one, odds are you've watched all the previous ones.|Fresh
Mission: Impossible - Fallout gives one nothing to suffer over except for the winching of nerves during one of its expert fight sequences, it's rousing soundtrack by Lorne Balfe and it's soaring mountain and cityscapes.|Fresh
It's like they are trying to make the world simultaneously pass out from tension. This movie soars as high as possible without actually burning its wings.|Fresh
'Mission: Impossible - Fallout' cruises at high velocity.|Fresh
We are before a very good action movie and probably one of the three best of this saga carried out by Tom Cruise. [Full Review in Spanish]|Fresh
Writer-director Christopher McQuarrie is on his second tour with the series, and he's strongest on the most important aspect of these films, which is the stuntwork.|Fresh
It's one of those perfect modern blockbusters like THE DARK KNIGHT, CAPTAIN AMERICA: THE WINTER SOLDIER, SKYFALL, and MAD MAX: FURY ROAD. It illustrates just how good a movie like this could be.|Fresh
Here is the best action movie of the year. [Full Review in Spanish]|Fresh
You might want to get your blood pressure checked before you see it.|Fresh
...the philosophy of this series is to embrace the ridiculous and run with it and if the third act comes to resemble a Road Runner cartoon, so be it. Cruise and McQuarrie deliver a thrilling piece of escapist fare.|Fresh
This is one of the most entertaining movies of the summer.|Fresh
A relentlessly entertaining exercise in putting Cruise's Ethan Hunt through his paces again. And again. And again. But hey, there's much pleasure in watching him continually fall off things.|Fresh
Mission: Impossible - Fallen doesn't reinvent the wheel. It just ups the ante, intensifies all the elements and makes everything look bigger-like you're looking at life through a microscope.|Fresh
In terms of pure action cinema, Fallout absolutely sings.|Fresh
Fallout is good, but it could have been the best of them all if it had done a better job of keeping its cover.|Fresh
[McQuarrie] est devenu au fil des années un des meilleurs réalisateurs d'action de Hollywood, et son plus récent long métrage n'est rien de moins qu'un chef-d'uvre du genre. [Full review in French]|Fresh
hands down the best of the six films, a continually twisting exercise in double and triple crossing, non-stop action, insane stunts and, most importantly, emotional resonance.|Fresh
Cruise is an unhinged stickman, outrunning the devil, the aging process, time itself. He will outrun us all.|Fresh
At its best, an exercise in pure action-movie propulsion and an essay in how to get from Point A to Point B in the most ingenious and exhausting way imaginable.|Fresh
Fallout continues the series' tradition of making every choice count.|Fresh
Incorporates all of the best elements of the five films to make one of the most exhilarating, explosive and exciting action extravaganzas ever put on the big screen.|Fresh
"It would be something to see McQuarrie return to duty for a third picture, just for the chance to watch him try to top his work in ""Fallout."" That's going to be the real mission: impossible."|Fresh
Tom Cruise is granted ample opportunity to pull off death-defying stunts that range from HALO jumps to motorcycle chases to a helicopter chase that is an all-timer in terms of both thrilling action and crisp direction|Fresh
A breathlessly exciting action spectacular: the blockbuster spy thriller as sustained endorphin rush.|Fresh
It's a strong, engaging spy thriller with plenty of action and a convoluted storyline.|Fresh
The movie is propelled by action scenes that transmit a little something about the characters while nudging the story forward, much like the song-and-dance numbers in a musical.|Fresh
At 56, Cruise still runs like wind, even over Paris rooftops. It's as though someone's chasing him with the contract for a Mummy sequel.|Fresh
At 147 minutes, Fallout is the longest film in the series, but it manages to feel like the swiftest ride.|Fresh
A bedtime story for adrenaline junkies, a Jack-In-The-Box of predictable surprises, Mission: Impossible - Fallout rattles through its two-and-a-half hour running time like a runaway train.|Fresh
McQuarrie returns for another installment, and he not only maintains the excitement of his first outing but in some respects even exceeds it. 'Fallout' might very well be the best 'M:I' movie yet.|Fresh
Mission: Impossible-Fallout doubles as a manifesto for the ridiculous spy thriller, pitting Hunt's boundless optimism against Walker's cold-blooded realism.|Fresh
You have to let yourself be carried away by what you feel... and forget the rules of conventional cinematic story-telling. [Full review in Spanish]|Fresh
This is sure-handed filmmaking that fires on every conceivable cylinder.|Fresh
If you think Dwayne Johnson's stunts in Skyscraper are insane, wait till you see what Cruise does in Fallout.|Fresh
The film takes its breakneck tempo from [Tom Cruise]. That is why it makes such invigorating but exhausting viewing.|Fresh
As committed to being the ultimate blockbuster as Tom Cruise is to being the ultimate action hero.|Fresh
It has become everything that recent Bond films have failed to be: fun but not dumb, serious but not glum, frantic yet always lucid, and with an array of dynamic roles for women.|Fresh
While set pieces are executed brilliantly...and photographed with striking clarity and invention by cinematographer Rob Hardy, the movie still feels like less than the sum of its parts...|Fresh
The truly impossible mission in Mission: Impossible - Fallout is surprising the audience with something new after six movies. But somehow the movie succeeds.|Fresh
If you find the action in Mission: Impossible - Fallout to be pedestrian, it probably means you're a disgruntled James Bond fan.|Fresh
Writer-director Christopher McQuarrie, who directed Rogue Nation and Cruise's first Jack Reacher movie, keeps the movie humming at peak performance.|Fresh
Look, I'm not made of stone: Pretty much everything in Mission: Impossible-Fallout is fun.|Fresh
It's got that finely-tuned, perfect blend of every technical element that it takes to make a great action film, all in service of a fantastic script and anchored by great action performances to not just work within the genre but to transcend it.|Fresh
Topping this will be the toughest Mission: Impossible ever.|Fresh
There is a fluidity and a cohesiveness to the storytelling that's spectacular.|Fresh
It's all outrageously enjoyable and so expertly put together, I couldn't be bothered outlining any more of the story. Just go see.|Fresh
"""Fallout"" plays like a kind of ""Mission: Impossible"" greatest-hits album. If you like the franchise, you'll love it. If you don't ... well, you still might."|Fresh
Better than Bourne, better even than Bond - this is the definitive spy thriller and will be remembered as one of the year's best films.|Fresh
Cruise once again shows that being 56-years-old is no barrier to being an action hero while the movie itself proves that being a summer blockbuster cash cow that doesn't veer wildly from the unexpected doesn't have to be uninspired.|Fresh
Mission: Impossible - Fallout is full of outrageous stunts, exotic locales, an engrossing plot and nerve-shredding tension.|Fresh
The problem here lies in a script full of head-scratching plot points that depends on an audience not overthinking it.|Fresh
Even its most irritating parts don't fatally damage a whole that works amazingly well, despite its own excesses.|Fresh
While younger, more generic action stars pop up every year in paint-by-numbers, explosion-heavy drudgery, it's Cruise who remains top gun.|Fresh
One of the best action films to come along in years.|Fresh
"""Mission: Impossible - Fallout"" is definitely everything we expected, and more. You might need to go lie down afterward, in a good way."|Fresh
this is the kind of action filmmaking that proves to be an effective antidote for superhero fatigue, with a sense of realism baked into every shot.|Fresh
The mission family... offer[s] the greatest action show of the year. [Full review in Spanish]|Fresh
Masterful. I had so much fun with this, often laughing out loud in relief when the tension of a breathless action scene finally broke. So why am I feeling a bit meh about it?|Fresh
Among the most spectacular action pictures of all time.|Fresh
...you'll wonder if you can ever respect CGI-assisted stunt work again.|Fresh
"Directed by Christopher McQuarrie, ""Mission: Impossible - Fallout"" is the sixth film of the series, and, quite possibly, the best. Maybe only rivaled by Brad Bird's ""Ghost Protocol."" Nah, know what? I think we have a new champ. ""Fallout"" is THAT good."|Fresh
The Inception of the franchise...|Fresh
It's breathtaking stuff that not only demands a second viewing (and a follow up) but also confirms Tom Cruise as the true Hollywood action star that he deserves to be.|Fresh
Fallout proves deliberately dizzying, not just with its oft-vertiginous action, but in its outrageous plotting, its deliriously absurd entanglements of double agents, double crosses, and just plain doubles...|Fresh
"With its combination of spycraft, intrigue and insane physicality, ""Fallout"" again proves ""Mission: Impossible"" is the gold standard for international action-adventure and that Cruise is this generation's James Bond."|Fresh
In Fallout, Tom Cruise literally falls from space down to Earth, a visual metaphor that is hardly coincidental, because if there's one takeaway from this chapter, it's that Cruise, or rather Ethan Hunt, is human after all. Kind of.|Fresh
Plutonium-powered action on a truly epic scale.|Fresh
With the sixth Mission: Impossible installment in the books, the question is where the franchise goes after Fallout continues to raise the bar.|Fresh
Everything a summer action picture should be|Fresh
In today's willowy world of CGI effects, it means something incalculable to the human eye that [Cruise] does his own stunts. He's turned his body into its own special effect. Then someone tells you he's 56. Impossible.|Fresh
Christopher McQuarrie once again delivers a platinum action blockbuster, with huge energy and momentum throughout and a fabulous third act.|Fresh
The second incursion of McQuarrie is a monumental compendium of excellent sequences of action that remit and amplify other moments of the saga, and confirm Ethan Hunt as twin brother of the most tragic Bond... [Full Review in Spanish]|Fresh
If they had a competition for the all-time all-action blockbuster, Fallout would be in with a very plausible shout. Suck it up, James Bond.|Fresh
Tom Cruise is still at the top of his game - not to mention the top a Paris skyscraper and a snow-capped mountain in Kashmir.|Fresh
A cinematic centrifuge of acrobatic stunt work, breakneck chases and immersive action, Mission: Impossible - Fallout is a perfectly calibrated piece of filmmaking that plays the viewer like a drum right from the start.|Fresh
Fallout... isn't the best of the bunch (that would be number four, Brad Bird's Ghost Protocol), but it's easily the second-best and certainly the Cruise-iest, meaning it's nearly as entertaining as it is strenuous. Which is a mighty high bar!|Fresh
"It's not just ""Impossible,"" it's irresistible."|Fresh
Cruise's sixth M:I action adventure is most intense one yet.|Fresh
The Mission: Impossible series reconfirms its status as one of the all-time great action franchises with one jaw-dropping thrill sequence after another.|Fresh
That being said, Fallout really delivers where it matters most: in spectacle. The action sequences genuinely do astound, by virtue of their chutzpah, magnitude and ability to exhilarate.|Fresh
Cruise commits to an insane degree, and in mainstream entertainment terms, 'Fallout' is up there with his best work.|Fresh
"McQuarrie piles on the mayhem like a boss. His ""M:I"" films exude class, intelligent expense and giddy expansiveness in equal measure."|Fresh
Tom Cruise continues to do what he does best: be a movie star in mind-blowing stunts.|Fresh
Fallout features a badass, brilliant action hero who also never kills anyone without looking them straight in the eye first and visibly weighing the moral choice before him.|Fresh
Mission: Impossible - Fallout is that sequel in spades. It elevates the franchise to next-level status - and then some.|Fresh
A dream come true for action junkies. At 56, and so not looking it, Tom Cruise is in the running, jumping, climbing, diving, flipping, fighting shape of his life. Off-the-charts spectacular.|Fresh
Fallout confirms that lightning can strike twice and that it will be nearly impossible that any other action film this year will be able to top it.|Fresh
This latest installment of the Mission Impossible franchise is unmitigated fun with its deliciously overwrought motorcycle chases, hellish helicopter skirmishes, frenzied fisticuffs, plus rooftop jumpings galore.|Fresh
I enjoyed watching the movie. If you're a fan of the franchise, go watch it in the theater...but predictable, not as clever as the other ones.|Fresh
I could be up for ten more of these movies. I love seeing these.|Fresh
The M:I franchise is now 22 years old, but it isn't folding anytime soon.|Fresh
Can you enjoy his knockabout adventures? Definitely. But can you care about them? Impossible.|Rotten
Every ounce of credit I can summon goes to Cruise and his fellow stuntmen and coordinators and choreographers... It's only a shame that other elements of the production let them down.|Fresh
The writer-director Christopher McQuarrie and his indefatigable leading man Tom Cruise deliver two and a half hours of cake-and-eat-it mayhem, a globetrotting blockbuster that's ironic and bombastic, predictable and ingenious.|Fresh
Fallout uses film conventions, page-turner dialogue and precision action to write an IMAX-sized textbook on how to have a hell of a good time at the movies.|Fresh
It's the most effective execution of the Mission: Impossible formula so far - a heady mix of humour, action and adventure, distilled to its purest form.|Fresh
With impeccable stuntwork and crisp direction, Fallout delivers intense and thrilling set pieces that pack a punch with a weight and realism that few other blockbusters can match.|Fresh
A full throttle blast, Fallout delivers high adrenaline thrills, chills and fun.|Fresh
A combination of thrilling stunts, insane daring and clever writing make this a stunning piece of action cinema.|Fresh
A combination of thrilling stunts, insane daring and clever writing make this a stunning piece of action cinema.|Fresh
