McQuarrie brings grace and grit, and Cruise brings it, period. This quick-witted, fleet-footed franchise shows no sign of flagging.|Fresh
More like Mission: Impressive.|Fresh
I like the cheek of these films when they're good. The new one has long stretches when it is bad.|Rotten
The thriller version of comfort film. It's something we can return to with complete confidence in what we're getting into.|Fresh
Even with its faults, Mission Impossible: Fallout delights the audience with the over-the-top excitement and armrest gripping action.|Fresh
It never quite improves upon or distinguishes itself from previous entries in the decades-old franchise, but seeing Tom Cruise perform the Impossible still entertains.|Fresh
Mission: Impossible - Fallout is going to blow audiences out of their chairs. The action scenes are stupefyingly awesome.|Fresh
Two and a half hours of non-stop insanely well shot, choreographed and performed action sequences. Christopher McQuarrie continues to solidify Mission: Impossible as one of the best action franchises out there.|Fresh
McQuarrie makes sure to dazzle us, cloaking the expected in the unexpected, thus birthing a welcomed evolution.|Fresh
Thrilling and action packed, Tom Cruise and Christopher McQuarrie have set the platinum standard by which every action film that comes after Fallout will be measured.|Fresh
All of their derring-do is choreographed, shot, and acted in a way that looks real, in a way that puts most of this summer's other action-adventure blockbusters to shame.|Fresh
Your mission, if you choose to accept it, is to have a bloomin' good time with Cruise and co.|Fresh
Determined to perpetually raise the bar for both the series and himself, Cruise again proves, with his latest, that both of those seemingly impossible feats is possible.|Fresh
The action director Christopher McQuarrie has masterfully crafted what I promise you will not be topped the rest of the year.|Fresh
It's filled with gasp-inducing motorcycle chases, kinetic car sequences, and bruising, brutal combat.|Fresh
You'll leave the theater delightfully exhausted after spending almost the entire length... frantically piecing together the plot, feeling your adrenaline pumping during the action scenes, and gripping the seat from constant tension.|Fresh
Cruise's dynamic with Cavill is one of the film's highlights, making you think this is The Man From U.N.C.L.E. movie that should have been made...Fallout is an improvement on all the previous film's failings, drawing together all the best aspects of them.|Fresh
It misses no opportunity to prop up Cruise's indomitable earthly ego while his character runs, jumps, falls, fist-fights, sky-dives, and clambers up rope and cliff in service of...what exactly?|Rotten
Yes, Fallout is bonkers and you'll want to be caught in its preposterous, but intense blast radius.|Fresh
Cruise is back to the chase, a star on a mission, and summer suddenly feels fun again.|Fresh
Against all odds, Fallout continues Mission: Impossible's ongoing streak of extremely rewarding returns.|Fresh
As relentless and intense an action movie as you've seen since Mad Max: Fury Road.|Fresh
OK, McQuarrie may not have De Palma's sweat-drop precision, John Woo's craziness or the impish wit of Brad Bird, but his mastery of logistics here is easily sufficient to make it the blockbuster of the summer.|Fresh
Simply put, Mission: Impossible - Fallout is the best action movie you will see this year. You'll probably leave the theater overcome with an urge to go jumping from building to building.|Fresh
Fallout is a solid summer blockbuster that delivers on thrills, smiles and exuberant facial hair. Mission accomplished.|Fresh
See this movie as soon as possible, and on the biggest screen possible.|Fresh
This isn't just a great action flick, it is likely the most thrillingly exciting film of the year.|Fresh
Crashes and petrolhead spills are what this franchise is reasonably expected to deliver. And this is what it cheerfully does.|Fresh
Here is Cruise, 56, performing some of the most impressive feats of derring-do ever captured on screen.|Fresh
"Ageless, riveting and seemingly unstoppable, Tom Cruise remains a force of nature. ""Fallout"" delivers a near-exhausting amount of stupendous action sequences paired with deft character drama and the requisite life-or-death stakes."|Fresh
Works as the zippiest and most satisfying blockbuster you're certain to see this summer. What it misses in plot, it lands in character and spirit.|Fresh
It delivers. More than that, it's become the rare franchise that seems to just get better, twistier, and more deliriously fun with each installment.|Fresh
Fallout's pleasures are gratifyingly straightforward, direct without being dumbed-down. It's a meat-and-potatoes banquet, one that doesn't need to be interesting to be satisfying.|Fresh
Not since Fury Road have such viscerally practical effects been put to better use by such deliriously impractical people.|Fresh
"I think ""Oh, gosh, do we need another one of these?"" And then I see that movie and I say ""Yes, of course, you idiot. Of course we need another one of these."""|Fresh
Here, with everything that he's ever cared about on the line, Hunt proves why he's summer's most valuable action hero.|Fresh
The action here represents the mainstream cinema's version of extreme sports and these guys have staked their claim at the summit.|Fresh
Buying a ticket for a Mission: Impossible movie means surrendering to its specific brand of charm - the same charm to watching Cruise run so fast that it seems he might just take flight.|Fresh
McQuarrie's film is the most fun you're likely to have at the movies this season, a riot mounted with precision, a melee in which every punch and crunch is considered.|Fresh
Fallout is a worthy addition to the franchise and a fast pace thrill-ride. McQuarrie manages to keep the story, stunts, and structure fresh, which makes me wonder if he has another one in him.|Fresh
Just when you think Rogue Nation may have been too tough an act to follow, Fallout takes it to yet another level.|Fresh
Clearly the best ongoing action franchise in the world.|Fresh
Mission: Impossible - Fallout is cocked, locked and ready to blow you away with more than just Henry Cavill's forearms.|Fresh
