Pigs are clever and if they were pretty too we probably wouldn't eat them. Guilt and innocence marble this like fat in a prime cut, with superpig Okja caught in the middle. Funny and sad, it's an allegory about as subtle as, well, a giant farting pig.|Fresh
I didn't enjoy the film, but I am a huge fan of creative risk-taking and inclusive media.|Fresh
Whilst certainly not Bong Joon-ho's best work, this peculiar mix of corporate satire and Studio Ghibli is a sweet and thoroughly engaging watch.|Fresh
The story of Okja and Mija is captivating, but the wider implications that are left at the end of the film are impossible to forget.|Fresh
If you like weird, semi-experimental movies enough to not mind when the experiment doesn't totally come together, give it a shot.|Fresh
Bong has crafted, if nothing else, a pretty coruscating satire of modern society, and the unholy distance mankind is forging from the primal, holistic properties of our world.|Fresh
The mutant super-pig film you never knew you wanted.|Fresh
Okja is a really enjoyable family film that deserves the widest possible audience for the excellence of its animation and the worthiness of its theme.|Fresh
The movie is at once a child adventure story in the mold E.T., a scathing satire of modern corporate culture, an action film, a horror film, a demented comedy.|Fresh
That will do, super pig. That will do.|Fresh
Pigs are clever and if they were pretty too we probably wouldn't eat them. Guilt and innocence marble this like fat in a prime cut, with superpig Okja caught in the middle. Funny and sad, it's an allegory about as subtle as, well, a giant farting pig.|Fresh
I didn't enjoy the film, but I am a huge fan of creative risk-taking and inclusive media.|Fresh
Whilst certainly not Bong Joon-ho's best work, this peculiar mix of corporate satire and Studio Ghibli is a sweet and thoroughly engaging watch.|Fresh
The story of Okja and Mija is captivating, but the wider implications that are left at the end of the film are impossible to forget.|Fresh
If you like weird, semi-experimental movies enough to not mind when the experiment doesn't totally come together, give it a shot.|Fresh
Bong has crafted, if nothing else, a pretty coruscating satire of modern society, and the unholy distance mankind is forging from the primal, holistic properties of our world.|Fresh
The mutant super-pig film you never knew you wanted.|Fresh
Okja is a really enjoyable family film that deserves the widest possible audience for the excellence of its animation and the worthiness of its theme.|Fresh
The movie is at once a child adventure story in the mold E.T., a scathing satire of modern corporate culture, an action film, a horror film, a demented comedy.|Fresh
That will do, super pig. That will do.|Fresh
The film may turn many vegan in the way it so heavily empathises with Okja's plight, and so bluntly shows animal cruelty at its basest level, but there's a playfulness and serenity that we shouldn't disregard.|Fresh
Funny, inventive, deeply moving (and yes, at times distressing), the screenplay by Joon-ho and Jon Ronson roars like a lion when it comes to putting the case for animal rights.|Fresh
Bong's strange, beguiling work carves out its own place in a world that often makes little sense. In doing so, the earsplitting noise of partisanship and profit are drowned out by the joyful laugh of a hellion who won't stop pushing forward.|Fresh
Okja is a bit too uneven in its execution. Despite its flaws, though, it's a technically well-made film, its cinematography gorgeous, and leaves us with a very strong message that's hard to ignore.|Fresh
It's exaggerated, satirical, weird, and dark. The bad guys do genuinely horrifying things that will haunt your dreams.|Fresh
For the love of pig|Fresh
... has the most cartoonish performance of Jake Gyllenhaal's career as a Steve Irwin-like nature expert who gets co-opted by the meat lobby.|Fresh
...once the story moves to America, and Jake Gyllenhaal somehow becomes Jar Jar Binks the Second, its on-the-nose jabs at big business and factory farming feel hysterical rather than earned.|Rotten
In short, this is a film that wants to be an ecologist, anti-capitalist, but whose effectiveness is weakened by its own terms. [Full review in Spanish]|Rotten
"""Okja"" has a clear political agenda in mind, but its polemics don't get in the way of how wildly, strangely enjoyable it is."|Fresh
Rather less clever than its director, forever undercutting his satire with a wink, thinks it is.|Rotten
Okja pushes Bong Joon Ho's talent for spanning moods and genre conventions to its limit. The movie features his trademark sharp shifts in tone, but also melds Western imagery, music and cultural touchstones.|Fresh
There's heart and there's adventure. It's one of the must-see movies of 2017, and for Netflix that might just be the best news of all.|Fresh
Meanwhile, we as an audience are left with the flat, stinging sensation of hitting a wall. But if any feeling could so aptly reflect love in the time of capitalism, then it is this: to willingly hit a wall until an eventual point of demolition.|Fresh
These are broad, screen-chewing performances, but the two real stars are 13-year-old Seo-Hyun Ahn as Mija and Okja the super pig with bottomless brown eyes.|Fresh
A towering accomplishment that could potentially change people's outlooks on flesh consumption|Fresh
"""Okja"" is an effective piece of filmic political satire that can now only be viewed in the context of the pressures mounted against it. As is life, it's good to know who your enemies are."|Fresh
... a playful and fast-paced adventure that makes its environmentalist message and stance against animal abuse in the food industry clear. [Full review in Spanish]|Fresh
With Okja, Netflix has to put to bed any silly argument over big screen vs. small screen, because the simple fact is this movie would be a stunning masterpiece no matter what sized screen you watched it on.|Fresh
Though it is a vast improvement on his socially conscious/ woke storytelling as of late, Okja is just okay, falling prey to an incredibly weak third act.|Fresh
Okja is a chaotic but dazzling mash-up of genres, styles and moods from the electrifying director Bong Joon-ho.|Fresh
The film makes us sympathize with the animal victims that we consume daily without making it look like a Change.org request. [Full review in Spanish]|Fresh
Joon-Ho Bong knows exactly what character should be genuine and which should come off as a complete caricature.|Fresh
I'm happy to say that one of the summer's CGI inventions remains astonishing, and lovable, from first to last: the giant pet pig that is the title character of Bong Joon-ho's Okja.|Fresh
One of the most powerful films of recent years and it will easily remain in the collective consciousness for a long time. [Full review in Spanish]|Fresh
Okja is biting with tenderness and edginess.|Fresh
Okja has a heart and an original story that's about actual ideas.|Fresh
My Neighbor Totoro goes to the slaughterhouse...|Fresh
Much of Okja is sheer visual poetry, the kind you'll see in Hayao Miyazaki's Princess Mononoke or Spirited Away but with less dreaminess and much more urgency.|Fresh
It needs to be on your list of do-not-miss films.|Fresh
It's a rollicking action movie framed inside an intelligent corporate satire.|Fresh
The general playful tone... helps a great deal, and the cinematography and editing are appealingly glossy and smooth throughout.|Fresh
For all its messy tonal whiplash, Okja is an entertaining and occasionally thoughtful adventure tale that will hopefully find an audience on Netflix, if not the theaters.|Fresh
Extreme peril, swearing in violent eco-fable.|Fresh
the way Bong draws it all together is almost alchemic; it shouldn't work, but somehow it does|Fresh
A fairly colossal disappointment and misfire from Joon-ho Bong...|Rotten
The film has a snappy, witty tone that propels us into the story, with moments of satirical comedy, earthy humour and some exhilarating, inventively staged action.|Fresh
It's an intriguing and entertaining movie, certainly, but also one where a little more focus could have made it so much better.|Fresh
It may not end up being my favorite film of the year, but I can easily see it being someone's favorite-hell, I can see it being someone's favorite film of all time. It's that special.|Fresh
Though strangely delightful gives way to downright disturbing as the movie wears on, there is no way you can resist or forget the wilful, winning weirdness of it all.|Fresh
It functions as a 'dystopian' warning that manages to dodge the dangerous rise of the transgenic food industry and everything around it. [Full review in Spanish]|Fresh
A frustrating film: it's not entirely flawed, but it's annoying to see how the best moments are worn out very fast. [Full review in Spanish]|Rotten
A film that goes from the naive to the exciting and the terrible with an impressive facility. [Full review in Spanish]|Fresh
A brilliant war of ideologies over the life of a superpig.|Fresh
There is a lot going on in this film, in terms of plot, themes and tone, and director Joon-Ho Bong shows himself to be a master at holding it all together coherently.|Fresh
Outrageous as the 'Okja' plot may seem, it deals with important issues and makes us think-- not simply enjoy. It ends up being a movie that matters.|Fresh
Audacious, socially-conscious allegorical fable...|Fresh
It's everything you want a movie to be: smart, daring, lavish and packed with surprises. It's funny, scrumptious in look and design, and best of all, it's about something.|Fresh
It's a riot of shifting tones, bouncing from adorable girl-and-her-pet comedy to rescue action thriller to over-the-top satire ...|Fresh
The first half is weird and tough; until you realised you have to read the film like a fable; it's like a live-action version of Spirited Away where a tough, innocent child goes on a wondrous, painful journey.|Fresh
When the stuff we're watching in the theatre is mostly dross, and we're sharing not others' pleasure but their disappointment, isn't it nice to have something decent to watch at home, possibly with someone you at least sometimes like? Yes it is.|Fresh
While the eco-parable Okja has some good and some not-so-good qualities, it suffers from a fatal flaw that goes to its very core.|Rotten
Bong Joon-ho guarantees Okja is not your typical girl-and-her-giant-hippo-like-pig story. Of course, it's the kind of movie that only Bong Joon-ho would conceptualize, so distinct is his storytelling, in voice and vision.|Fresh
It is the many ravishing depictions of Okja's life with Mija -- the beauty the film finds in even so large and ungainly a creature -- that make Okja such a transfixing experience.|Fresh
Offers more high-energy genre subversion from South Korean writer-director Bong Joon Ho, who this time uses a Spielberg-ian children's fantasy template to bluntly satirize issues related to animal rights, environmental destruction and corporate greed.|Fresh
Bong wants us to get worked up ...but Okja's plot itself is modified for people who don't know they're watching propaganda so long as it pushes their buttons and makes them feel virtuous.|Rotten
A rollicking tale about animal rights, interspecies love, and corporate greed.|Fresh
For all of the chaos that Okja eventually steers into, its best face is as a simple story of a child on the cusp of young womanhood, trying to save her best friend.|Fresh
The fact that it exists at all, in what is so clearly a form unsullied by executive hands, is a victory. That it's brilliant is a nice bonus.|Fresh
Hijinks and high-speed chases give way to horror and Holocaust imagery as we see the conditions in which Okja's factory-farmed brethren live.|Fresh
A strange cross between a Lassie film and a radical, campaigning documentary.|Fresh
A bold but uneven cocktail of Gilliam-esque dystopian satire and the sort of girl-befriends-mythical-beast parable that could have been visualised by Studio Ghibli ...|Fresh
It's one of Netflix's best original films.|Fresh
Admittedly, not the most obvious format for a feel-good family style movie, but it really works.|Fresh
A gleefully anarchic piece of mainstream filmmaking. Like a politically radicalised Spielberg, Bong tugs at the heartstrings while punching you in the gut.|Fresh
The first great Netflix film. It's also gloriously original, bitingly hilarious, sweepingly sweet, and so startlingly powerful it will make even the most devout carnivore consider going veggie.|Fresh
Okja is a film that is so strange in so many different ways that to call it bewildering would be seriously underselling the oddness on display.|Rotten
The film shares Bong's casual ping-ponging of tones, his fascination with picking at society's many scabs, and the way his films frequently skid into violence and cruelty without warning.|Fresh
Okja moves seamlessly between fairy tale, action caper and crime drama.|Fresh
It will be a forgiving audience indeed that doesn't recoil from this approach, which is too much stick and not enough carrot.|Rotten
Chilling, subversive ...|Fresh
Okja is an uneven but never complacent mix of fantastic fairy tale; social satire; heavy-handed commentary on corporate greed and our consumer-crazed culture, and bizarro action film.|Fresh
To me the idea that it will be largely confined to people's living rooms seems absurd.|Fresh
Okja has its fair share of pacing and tonal issues, but is otherwise so technically well-crafted and entertaining throughout that it's still one of this season's most worthwhile endeavors.|Fresh
Some scenes carry the innocent charm of a Disney film. Others have a dark intensity that might trouble the most seasoned viewers. This isn't just a challenge to conventional marketing but an affront -- and all the better for it.|Fresh
This is an anti-meat industry polemic, with serious tonal issues.|Rotten
For someone whose films are bursting with outrageous computer imagery, and whose sensibility could be characterized as hyperviolent satiric pulp, Korean director Bong Joon-ho sure is a gung-ho Captain Planet.|Fresh
One of Okja's great charms lies in its director's ability to vary tone, pacing, and style between scenes without losing the viewer's patience and sympathy.|Fresh
Bong Joon-ho's all-star eco-fable of a girl and her giant pig Is wacky, weird and wonderful. It's also part kiddie treat and part horrorshow, but hang on-it's worth it.|Fresh
No one, but no one, makes movies like Bong, a South Korean master who combines baroque concepts, epic visuals, international casts, and a sense of humor that can make you laugh out loud in the middle of the darkest doings.|Fresh
An estimable film with peculiar characters that manage to catch our attention well beyond the abundance of peculiar faces. [Full review in Spanish]|Fresh
A thought-provoking and thoroughly entertaining movie.|Fresh
A work of melancholy enchantment, by turns sweet, raucously funny, scary and sad, and -- in the manner of all good science fiction movies -- thought-provoking.|Fresh
Okja demonstrates that there is no subject Bong Joon-ho cannot make compelling, thrilling and moving.|Fresh
As in Snowpiercer and The Host, Bong presents a dangerous world where people at all stages on the moral spectrum just have to do their best to survive. There are no easy victories or pat solutions.|Fresh
In short, Okja is a wrong-footing mash-up that delivers a sharp jolt to the meat-eater's conscience.|Fresh
Okja unfolds like a fable about a child and their nonhuman pal that's been warped into something bleak and outrageous -- E.T. by way of Upton Sinclair's The Jungle.|Fresh
With his latest work, Bong has created a heroine for our times, an indelible movie creature, a story that balances heart and head and a movie that engages with the boundaries of technology both on-screen and off.|Fresh
Because of Bong's technical wizardry and fondness for his characters, the titular creature's convincing CGI, and the go-for-broke cast, Okja's slapdash scrappiness routinely works.|Fresh
Hopefully people will give it a shot, because it's one of Netflix's best releases. More than that, Bong Joon-ho is a filmmaker more people need to know about, regardless of how they come across his work.|Fresh
The bucolic existence of a girl and her pig in a verdant and bountiful land, beautifully filmed by South Korean writer-director Bong Joon Ho, feels like a fairy tale. Yet its shifting tone -- from drama to comedy to thriller -- is jarring.|Fresh
It's a sweet coming-of-age story, a wonky 21st century iteration of E.T., and another thrilling opportunity for Tilda Swinton to be weird as hell. But whatever else it is, it's also exactly the movie Netflix needed to release this summer.|Fresh
Another month, another $50 million TV tentpole from Netflix. And what a fabulous, fun, thoroughly first rate tentpole. How does a director follow Snowpiercer? Precisely like this.|Fresh
"This year's ""Inside Out"" - one of the most original films of 2017. Bong Joon-ho goes for it and doesn't disappoint. [Full review in Spanish]"|Fresh
Netflix's first must-see movie.|Fresh
"...indispensable viewing for fans of Bong Joon-ho's fine work. Well worth savoring, ""Okja"" is a science fiction film destined to become folklore."|Fresh
"Only Bong Joon-ho is capable of sustaining this type of behavioral mayhem, keeping ""Okja"" about a girl and her best, mostly gelatinous pal semi-sweet, while also making sure audiences don't touch bacon for the next few years."|Fresh
It's a rant against capitalism! No, it's an assault on the meat industry! It's both, and one of the year's worst movies.|Rotten
Love him or hate him, there's nobody else making movies quite like this guy.|Fresh
In a fair world, Okja would have the power to make even the most belligerent meat eaters consider vegetarianism. It is the first great film of 2017. Protect it fiercely.|Fresh
This movie takes all sorts of chances and, for the most part, scores big.|Fresh
This heavy-handed and unfunny film is a very strange movie for any audience, young or old.|Rotten
Bong manages to strike the right note between absurdly funny and profoundly moving. But more than that, Okja is the kind of film that is just a joy to watch, because it is beautifully shot and performed.|Fresh
Okja is admirable when it is trying to be a pure fable or a sweet story. It crumbles to varying degrees when it tries to do more.|Rotten
Boon gives the audience a show. His film is the cinematic answer to the eye-popping, Looney Tunes-exaggerated world of a graphic novel. Boon throws a lot of ideas and schtick onto the screen, and they stick.|Fresh
It is very effective at creating adoration for a pig made of ones and zeroes. There might be a few tears in there too.|Fresh
The picture, which never stops moving, is dense with information and feeling. Barbs of satire pop up and are washed away on streams of strong emotion. It's all marvelously preposterous and yet, at the same time, something important is at stake.|Fresh
On its surface, Okja is a sweet, heartwarming fable about a young girl and her pet pig. But don't let that thumbnail synopsis fool you, we're galaxies away from the kid-friendly entertainments of Babe and Charlotte's Web here.|Fresh
Once you see it, you won't be able to forget it.|Fresh
Ultimately, Okja operates on too fantastical a level to function as a call to arms against the factory farm system, and its hot-and-cold tone may scald younger viewers while leaving older ones feeling cold. Consume at your own risk.|Rotten
While watching the heartfelt Okja, you'll laugh, you'll cry and you'll definitely rethink that next piece of bacon.|Fresh
Fluctuates from being sublime to tedious throughout|Rotten
It's a mess - a Spielbergian heartwarmer that's also an action movie that's also an activist screed that takes on not only capitalism but also animal rights. But that it doesn't all go together is part of the charm.|Fresh
"""Okja"" is definitely a treat for fans of Bong's work, for admirers of carefully crafted cinema and for anyone with deeply held concerns about genetically modified organisms, factory farms or animal welfare."|Fresh
Okja veers wildly, but never stalls; if Bong ... never squares the film's satirical means with its sentimental ends, he at least throws the weight of his considerable filmmaking talent behind both.|Fresh
Its lack of subtlety is somewhat endearing, infusing the movie with a youthful charm in its righteous indignation. [Full review in Portuguese.]|Fresh
It's not always a well-marbled ride. There's an inconsistent tone, with horrific moments spliced with satire and detours into vaudeville and a few moments when it's kidnapped into a heist movie.|Rotten
It's a wonder that such a garish display would be effective. But it works on two different levels.|Fresh
If you don't want to hug [An Seo Hyun], adopt her, or make her your best friend by the end of Okja, you're a heartless human being.|Fresh
From first madcap scene to last, Bong Joon-ho's film treads a fine line between engaging and annoying.|Fresh
Bong's slick and slippery offering is a game-changer. Call it Netflix's first great film. Call it, simply, great.|Fresh
Okja is a wild, tender tale of wonderment and friendship, delightful but still with smacks of vile consumerism darkness.|Fresh
In Okja, a transporting protest fantasy becomes another shrill dust-up in the waging of the culture wars.|Rotten
"Starting off as a cutesy family film, ""Okja"" will become an adventure, a wacky satire, torture porn and a message drama before climaxing in a horrific Holocaust metaphor. It's a masterful film, Joon Ho skating across genre and tone.."|Fresh
Okja combines the holistic man-and-nature themes of a Studio Ghibli animation with the alarming food-industry revelations of Cowspiracy: The Sustainability Secret.|Fresh
Big fun, but not quite the clean hit delivered by Bong's last few films.|Fresh
Beautifully shot and wonderfully acted, Okja is a story about love, resistance, bullies, and how we treat the most defenseless on the planet.|Fresh
While Mija and Okja are the heart and soul of the story, Bong does not stint on assembling an international cast to fill out what are often tiny parts.|Fresh
The breakout film ... is part fable, part action flick and part lovable animal drama.|Fresh
A super-pig of a film that is overstuffed almost to the point of nausea.|Fresh
Okja is a populist enviro-fable that's part pet-rescue drama, part mad farce, all Bong Joon Ho.|Fresh
Okja offers escapism with a generous dose of politics that makes it fascinating, funky, and fabulous.|Fresh
This time, [Bong's] ambitions seem to have outstripped his ability to realize them effectively.|Rotten
This is a film that deserves to stand proudly on its own as one of this year's cinematic gems, and another stellar entry into Bong Joon-Ho's unique catalogue of work.|Fresh
"""...reaches for great heights and doesn't always get there."""|Fresh
Okja is a thoughtful, visceral satire of the corporate meat industry. Director Bong Joon-ho once again challenges convention with brilliance.|Fresh
A pot-bellied fable unlike anything else you'll see this year. Not since Babe has an adorable porker inspired such peculiar joy or unexpected heartache.|Fresh
The movie zips around like a dropped firehose a bit when it comes to tone -- lovable, scary, silly, morbidly depressing, back to silly -- but good art can and maybe should do that.|Fresh
It's messy and alive, frustrating and fun.|Fresh
It may make you feel happy, sad, excited, dejected, angry, and hopeful... all at the same time, and that's a pretty rare feat for one movie to pull off. To me it feels like 1/3 Spielberg, 1/3 Gilliam, and 1/3 completely novel, exciting originality.|Fresh
Bong Joon Ho's uneven but still electrifying caper about a little girl and her giant pig on the run from villainous Tilda Swinton swirls a sharp dose of slapstick comedy into its pop satirical narrative.|Fresh
Okja takes the worst impulses of Walt Disney, Wes Anderson, Tim Burton and Michael Moore and rolls them into one movie.|Rotten
There's a nifty plot manoeuvre in the middle.|Fresh
Shot in bright, cinematic widescreen by DP Darius Khondji, this Netflix-produced feature belongs on the big screen, where no one would mistake Okja for a real animal, and yet the CG is convincing enough to suspend disbelief.|Fresh
A flamboyant coming-of-age cum monster movie with some of the flashiest visual effects you may see this year.|Fresh
While the film features excellent performances and stunning visuals, it falters with its message.|Fresh
The film has an impeccable manufacturing, however it's evident that the intention of the filmmakers is to create a title that all the members of the family can enjoy. [Full review in Spanish]|Rotten
Okja refines the limitations of Snowpiercer as a social satire and strengthens his message as a call to appreciate any creation. [Full review in Spanish]|Fresh
This is an international melting pot of a movie, with fresh and surprising ingredients.|Fresh
A gleeful satire about the rapacious US food industry... wrapped neatly around a moving, almost Disney-esque story of a girl and her pet.|Fresh
A slightly shorter, slightly more disciplined Okja might have been better, but the one Bong has made is still a joy.|Fresh
Once again, Bong proves that he is a master of dark comedy, a true environmentalist, and a man with a big heart.|Fresh
"It isn't without imperfections, its fancifulness is a tad over the top at times, but at least this is one film we can call ""a blockbuster with a big heart""-a rarity these days."|Fresh
Bong Joon-ho's latest will enchant some, disappoint others.|Fresh
