Tilda Swinton is doubly funny as twin corporate CEOs: the batty one in pink who places the piglets, and the fiendish one with a bad haircut who later sends the grown superpigs to the slaughter.|Fresh
The message is rudely repeated, as if someone thought that an american transnational might be benign. [Full review in Spanish]|Rotten
It's a very rare movie. It doesn't bother me but I find nothing exciting about it either. [Full review in Spanish]|Rotten
Okja fires in a lot of directions, but finds its way to a strong payoff; despite an underwhelming confrontation in its final moments, it arrives at a thoughtful epilogue that brings the drama full circle.|Fresh
A harsh criticism about torture and animal experimentation, as well as the lack of respect for the environment, and for the human being himself. [Full review in Spanish]|Fresh
There's a lot to chew on here, but in the end, I wish Okja simply worked better as a movie.|Rotten
The satirical film is entertaining and with an extraordinary display of image and sound that, unfortunately, can not be appreciated in all its dimension in small home screens. [Full Review in Spanish]|Fresh
Mija's love for Okja provides an emotionally engaging narrative that occasionally throws a few unexpected gut punches.|Fresh
Nevertheless, Okja is another radically original film by Bong Joon-ho, retaining a remarkable charm in much of its development. [Full review in Spanish]|Fresh
Okja has a wild satire tone without giving up a strong component of tenderness. [Full review in Spanish]|Fresh
Okja is plenty of fun, and smart around the edges, but the girl-and-her-pig stuff can drag, and it feels like it's pressing for resonance more than properly achieving it.|Fresh
The seamless special effects that allow the creature to interact with humans and both rural and urban environments are truly impressive. What a shame the rest of the film is such a let-down.|Rotten
Okja represents a synthesis and an upgrade - in scale as well as quality - of the director's previous outings, confirming him as one of the finest contemporary craftsmen of intelligent, ambitious blockbusters|Fresh
Okja isn't perfect; it falls down when the absurd and the serious ricochet back and forth between scenes, making it hard to track with the film's tone. But it's easily forgivable; this is a big, ambitious movie, and when it works, it is ridiculously fun.|Fresh
Okja is a buoyant, messy delight of a film, clever and rousing and full-hearted. I laughed; I cried; I chose to forego meat at lunch.|Fresh
Okja suggests that the sarcastic humor of Bong Joon-ho's best films doesn't translate well.|Rotten
['Okja' is] gorgeous and moving and thrilling and funny and inventive and unexpected. It's why Bong is a visionary among his peers. And, my god, it's why we go to the movies.|Fresh
Finds the South Korean director returning to the genre-jumping mode of his masterpiece, The Host, but not quite nailing the tonal juggling act he achieved with that exhilarating creature feature.|Fresh
This brings much-needed new life to a popular cinematic landscape overcrowded with ageing franchises and endless reboots.|Fresh
Okja is peppered with lost-in-translation lines and clunky tonal shifts.|Rotten
A movie that showcases Bong's admirable flair for artfully unhinged spectacle, deftly undercut by a chastening reality check that never allows us to enjoy ourselves too much.|Fresh
An incredible vision, both visually beguiling and overflowing with rollercoaster emotions, and its ecological themes pack a punch too.|Fresh
A madcap fable as purposeful as it is unpredictable, that bears no whiff of a committee, for (mostly) better or (occasionally) worse.|Fresh
The weakness of the film is that it really should be for children, but the amount of swearing and violence is clearly aimed at an adult audience.|Fresh
The creature effects are charming, but the pig-chasing antics and cartoonish corporate nastiness that dominate much of the film become seriously grating.|Fresh
To paraphrase Woodrow Wilson on something very different, it's like writing ecological propaganda by the light from fireworks.|Fresh
This is a gorgeously realized popcorn movie of the most satisfying, comforting, restorative kind: full as its heart is, it has a lot on its mind, yet you'd also quite like to curl up on its belly and doze in the sun.|Fresh
Okja is a classic case of a film that you emerge from not knowing quite who it's intended for.|Rotten
The pure energy and likability of this film make it such a pleasure.|Fresh
Lumbering, clumsy but ultimately as loveable as its eponymous star.|Fresh
