Koreeda provides us with another exemplary portrait of hopeful people in hopeless situations.|Fresh
Shoplifters is built on an outrageously melodramatic plot, but in Kore-eda's hands, it comes off as natural, touching and genuine.|Fresh
This is Kore-eda at his most subtle, nuanced and morally inquiring.|Fresh
Where Shoplifters ultimately goes is at once unexpected and inevitable, arriving at a startling, powerful conclusion that is carried on the back of one of the strongest screen ensembles in years.|Fresh
The film derives it gut-wrenching emotional power from just how spare it is.|Fresh
As an observer of the various dimensions and dynamics of families, [director Kore-eda Hirokazu] is a modern master.|Fresh
Koreeda's quiet, angry masterpiece reaffirms once again that no other filmmaker working today has a better understanding of - or compassion for - families.|Fresh
[Few directors] have succeeded in granting a parallel and generational role to their characters, and that is precisely what makes Hirokazu Koreeda's new film, Shoplifters, a wonderful... compendium about the ethics of crime. [Full review in Spanish]|Fresh
Kore-eda, who trained as a documentary filmmaker and once aspired to be a novelist, inserts lines that illuminate and pierce, while masterfully building to a climax stronger in reflection than the moment.|Fresh
"Kore-eda's gentle drama about a made-up ""family"" of thieves living on the margins of society is shot through with the director's trademark generosity and attention to behavior."|Fresh
Another charming, funny and very affecting example of Kore-eda's special brand of tough-but-tender humanism.|Fresh
Pinpointing the bottom of society and finding in supposedly the worst of Japan that which in fact makes it best.|Fresh
A worthy winner of the 2018 Palme d'Or, this is a compassionate and complicated love letter to family and the secrets and lies which accompany them.|Fresh
In a less composed director's hands, this would be sentimental guff. Here, it's potent.|Fresh
Shoplifters showcases one of the modern cinema's great empaths deploying compassion like a time-delay nerve agent; this is Koreeda's expansive humanism, weaponised.|Fresh
In an impeccable alchemy, [director Hirokazu] Koreeda mixes [the film's] ingredients: the legal, the ethical, the emotional, the blood ties. [Full review in Spanish]|Fresh
In his latest film, [director Hirokazu Koreeda presents a family that lives in marginalization. [Full review in Spanish]|Fresh
The filmmaker's clean, transparent and empathetic look... is manifested here with full harmony even when, starting from an unexpected accident, they begin to manifest themselves. [Full review in Spanish]|Fresh
The story hardens, even obscures, but the writing and the style used are effective and end up convincing us completely. [Full review in Spanish]|Fresh
What it lacks in newness it makes up in raw humanity.|Fresh
A complex, subtle, mysterious film that builds to the most extraordinary surprise ending, a twist-reveal worthy of psychological suspense noir.|Fresh
Who better than Kore-eda, a director who whispers instead of shouts, is able to capture contradictions and issues though such a subtle, unforced style of storytelling?|Fresh
Shoplifters is compassionate, socially conscious filmmaking with a piercing intelligence that is pure Kore-eda. This is a film that steals in and snatches your heart.|Fresh
We are confronted with a steely critique of society's (and humanity's) failings - one not seen in the director's work, with this level of clarity, since his quietly devastating 2004 work Nobody Knows.|Fresh
