[Rian Johnson] succeeded on a lot of levels; I feel like there were a lot of other levels that didn't work as much.|Fresh
The richest, most epic, most emotional Star Wars movie so far.|Fresh
A movie that allows for considerable plot development becomes stuffed to the brim with zigzagging, quick scene changes that left me sated, not satisfied.|Rotten
Star Wars: The Last Jedi is a complete shift for the Star Wars saga and a brave reinvention of the jedi mythos. [Full review in Spanish]|Fresh
It's great to have a filmmaker who evidently has been a fan of the franchise since he was a kid, but still also an 'outsider' who dared to take the 40-year-old saga into unexpected paths.|Fresh
It's a visually stunning movie, finding moments both macro and micro to highlight the beautiful imagination that Star Wars can evoke.|Fresh
I should say, that Star Wars the Last Jedi is the best Star Wars film we have to date by default. This film is a natural progression of the Star Wars films because it incorporates all the good things we loved about the previous Star Wars films.|Fresh
It may not be the reboot everyone wanted. But it's the one we deserve.|Fresh
The film is a great reminder to listen to your elders. [Full Review in Spanish]|Fresh
An enthralling and gripping piece of cinema that's both sublimely moving and visually beautiful, The Last Jedi, while flawed, is ultimately a breath of fresh air.|Fresh
[Rian Johnson] succeeded on a lot of levels; I feel like there were a lot of other levels that didn't work as much.|Fresh
The richest, most epic, most emotional Star Wars movie so far.|Fresh
A movie that allows for considerable plot development becomes stuffed to the brim with zigzagging, quick scene changes that left me sated, not satisfied.|Rotten
Star Wars: The Last Jedi is a complete shift for the Star Wars saga and a brave reinvention of the jedi mythos. [Full review in Spanish]|Fresh
It's great to have a filmmaker who evidently has been a fan of the franchise since he was a kid, but still also an 'outsider' who dared to take the 40-year-old saga into unexpected paths.|Fresh
It's a visually stunning movie, finding moments both macro and micro to highlight the beautiful imagination that Star Wars can evoke.|Fresh
I should say, that Star Wars the Last Jedi is the best Star Wars film we have to date by default. This film is a natural progression of the Star Wars films because it incorporates all the good things we loved about the previous Star Wars films.|Fresh
It may not be the reboot everyone wanted. But it's the one we deserve.|Fresh
The film is a great reminder to listen to your elders. [Full Review in Spanish]|Fresh
An enthralling and gripping piece of cinema that's both sublimely moving and visually beautiful, The Last Jedi, while flawed, is ultimately a breath of fresh air.|Fresh
[Rian Johnson] captured the tonal spirit of the preceding episodes and elevated it through bold and fresh ideas.|Fresh
When it works, it really works, but the fat overwhelms it all too often.|Fresh
The film starts off great and ends great, but sags in the middle. Still, well worth your while going to see, as it gives a good send off to a beloved character.|Fresh
A brilliant continuation of the saga that legitimizes the sequel trilogy and Disney's handling of the franchise..|Fresh
The Last Jedi is Disney's best contribution to the Star Wars canon so far and we can only hope that the final film of this trilogy will live up to the new standard.|Fresh
The Force Awakens came for your heart, but The Last Jedi is here for your spirit.|Fresh
The Last Jedi is certainly an adventure that will pull you this way and throw you that way but never ceases to be anything but Star Wars|Fresh
The Last Jedi is a powerful, emotional and ambitious film that makes for one of the best films in the series.|Fresh
The film examines a questioning of ideals held throughout the ages, a deconstruction of what we know and hold dear.|Fresh
Director Rian Johnson takes some major risks here. Some of them work well while other choices contribute to the film's uneven tone.|Fresh
It might not be what I wanted it to be, but I can't deny I was entertained.|Fresh
If The Force Awakens was an exercise in nostalgia, The Last Jedi is an experiment of expectancy. It pushes the boundaries of its characters, its audience, and the franchise's capacity...|Fresh
The Last Jedi isn't the Star Wars installment anyone wanted. It's the one we all deserve.|Fresh
A problem that carries over from The Force Awakens and becomes more evident here is the sense that the villains, and villainy in general, have been weakly determined.|Rotten
Like bantha fodder riddled with kyber crystals, The Last Jedi is a jumble of really good and kinda bad.|Fresh
A glorious cinematic tour-de-force, a sci-fi gift that never stops giving, a real achievement.|Fresh
The Last Jedi offers aimless entertainment.|Fresh
The film breaks many franchise traditions on all levels, but it does so with a lot of respect and with the ambition to build something new and exciting from what remains.|Fresh
If Awakens was about The Resistance and The First Order repeating the cycle of The Rebellion and The Empire, this one is all about how they have to become their own things and what the proper way to get there is going to be - and that's exciting.|Fresh
The Last Jedi breathes urgent purpose into the new trilogy, purpose it had yet to prove.|Fresh
More than merely a continuation, The Last Jedi is in many ways an ending to the Star Wars we've known. And like many endings, it's anarchic and frustrating and poignant.|Fresh
Whatever the future holds for Star Wars, The Last Jedi will leave a lasting mark on this legendary series with numerous moments that are shocking and powerful with just enough humor to cut the tension.|Fresh
"It's safe to say ""The Last Jedi"" is one of the best ""Star Wars"" movies ever made. It's right up there with ""Empire Strikes Back."""|Fresh
Grabs the audience from the very first scene and doesn't let up, guiding viewers on a thrill ride that will have audiences gasping, laughing and perhaps even shedding a tear.|Fresh
Big, bold and beautiful. It's hard to describe Rian Johnson's achievements here any other way.|Fresh
Rian Johnson's Star Wars: The Last Jedi manages to be both brilliant and terrible at the same time, a mix of classic mythos and insipid story telling.|Fresh
In every aspect conceivable, the film no longer operates between two realms, and the result is the most gratifying big-screen Star Wars experience thus far.|Fresh
I can only wonder what The Last Jedi might have been with Finn and Poe taking a backseat. Because there is a great film within what's ultimately a good one.|Fresh
[The Last Jedi is] proof that well-made franchise stories... can deliver a new engrossing chapter that respects the much-loved past while slowly closing the lid on it, and steer the ship in exciting, mature ways that push the boundaries...|Fresh
Star Wars: The Last Jedi works. It's macro and micro stories entertain, either if you're predisposed to like what it has to offer, or at least not actively resistant to it.|Fresh
But on many levels, The Last Jedi is the antithesis of the virulent discourse it generates: a reminder that flaws can give way to strengths, that being willing to be wrong is a strength, and that doing the work, not getting the credit, is what matters.|Fresh
"Whereas the first half is a sort of a convoluted mess. ""The Last Jedi"" becomes a dark and exciting sequel that becomes the film you've been looking for by the 75-minute mark."|Fresh
The success of The Last Jedi, like its father before it, will most likely rest on the conclusion of the trilogy.|Fresh
It's the one we've been waiting for.|Fresh
It's a two-and-a-half hour movie. It needs to be good in its own right, not just setting up for the next episode. A two-and-a-half hour, $200 million set up?|Rotten
If you're a fan, you're going to appreciate the story continuing (on and on). If you're into makeup and CGI, you'll appreciate every minute of it.|Fresh
It calls the very idea of solo heroism into question. There are plenty of daring heroics in The Last Jedi and no shortage of characters who want to step into Luke's or Han's shoes, but now that impulse is shown to just make things worse.|Fresh
Along with non-stop action, there seems to be more wonder, whimsy and humor in The Last Jedi, some of it deliciously subtle.|Fresh
When it comes to pop cinema at this massive level, isn't it better for a movie to take Imperial-sized chances than just giving you what you want? I'll go with yes.|Fresh
Johnson takes the narrative through its paces, weaving a complicated and fascinating story. Just when you think one thing is going to happen, the story shifts.|Fresh
Thoughtfully humane and visually epic.|Fresh
A wonderfully directed, acted, and progressive film. Though it takes place in a galaxy far far away, the emotions and politics are very much here on earth today.|Fresh
Whereas JJ Abrams's The Force Awakens delivered a nostalgic joy that focused on reigniting a legacy I grew to love and obsess over throughout the years, Rian Johnson instead creates a nostalgia towards my years of childhood imagination.|Fresh
With deep reverence for what has come before, Disney has proven that they aren't afraid to move the story forward.|Fresh
"The best ""Star Wars"" film since the original trilogy."|Fresh
It is overall, a good movie worth watching. And timely, as our own modern-day First Order takes roots.|Fresh
The Last Jedi is a challenging and satisfying movie on many levels. It's fluffy and diverting at times but ultimately delivers a much-needed message about how hope will always reignite the resistance.|Fresh
[The Last Jedi] is one of the best-looking movies of the year, and crafts images never before seen in a Star Wars film. I'd definitely recommend seeing it in the cinema.|Fresh
The Last Jedi speaks for the strength of a united front against imperial aggression...The final image leaves us with the assurance that young people tired of injustice will pick up the ball their elders dropped.|Fresh
On a second pass, the questionable was extremely overpowered by the bold and the courageous, and I saw Star Wars: The Last Jedi through a different prism. I connected with it differently.|Fresh
Star Wars: The Last Jedi may not be perfect, but the need to accept imperfection and keep going becomes one of the movie's themes...It's about mentorship that's invigorating rather than smothering.|Fresh
The great strength of the eighth part is also how it plays with the expectations of the audience. [Full review in Spanish]|Fresh
[Rian] Johnson fulfills the necessary action and emotion, but fails to make something intelligent. [Full Review in Spanish]|Rotten
Despite Disney's humorous sequences, [The Last Jedi] revives the good in the saga. [Full Review in Spanish]|Fresh
The highs definitely outweigh the lows, and The Last Jedi is in the upper tier of films set in that far, far away galaxy.|Fresh
The evolution of all the new characters was really good.|Fresh
It's a Force to be reckoned with.|Fresh
Even if the stuffed-gills plot grew frustrating, I'm still looking forward to the next foray into a galaxy far, far away.|Fresh
There is just enough good material embedded in the excessive padding to appeal to our cravings for more Star Wars.|Fresh
When a character is in danger, you do feel that danger...there's something about the craftsmanship in this one. That feeling of security is gone, but the movie has a lot of humor too.|Fresh
The new, machine-tooled The Last Jedi is sufficiently busy (action scenes occurring every ten minutes) to make you grateful that it is, at least, agreeably paced, even if it isn't really about anything.|Rotten
I both loved it and strongly disliked it at the same time. I feel like there's a really great movie in there, all the pieces are there, everything is brilliant, but then there's a lot of extra fat that needed to be trimmed off or rearranged.|Fresh
At two-and-a-half hours, with about nine separate cliffhanger endings, it's a bit long, but Johnson's keen visual sense, doses of humor and a couple of cameos buoy the film|Fresh
There's a lot to like in the new Star Wars film...But it is not, as so many are saying, either the best Star Wars movie ever nor even the best since The Empire Strikes Back.|Fresh
The music still feels fresh and Rian Johnson's film will please the fans with its wonderful visuals and abundance of action. But for me, there was something missing.|Fresh
The story is compelling and there are some good characters to follow on this journey through many twists and turns. The acting is solid, and the visual effects are top notch. This is an impressive effort by writer-director Rian Johnson ('Looper').|Fresh
The mission is noble. The result, disastrous. [Full review in Spanish]|Rotten
A red throne room evokes the Technicolor fantasies of Michael Powell and Vincente Minnelli, while the scratchy surfaces of a sand planet trace the arc of each combatant's footwork like a choreographer's notation, transforming a duel into a dance.|Fresh
There is simply no joy in The Last Jedi. But all great legacies, I guess, are destined to fade.|Rotten
It's fun to look at.|Rotten
Same effects, new cast. Some should stay and some should go.|Fresh
A stellar, if slightly overlong, followup to 2015's Star Wars: Episode VII - The Force Awakens...|Fresh
Daisy Ridley is always in motion. Her role of a young warrior is intense, but her moments with Adam Driver, comparing good and evil, are good, indeed.|Fresh
The thing that makes the film most interesting is its function as a bridge between two paradigms, really two distinct generations, Boomers and Millennials.|Fresh
Jedi offers a rather bold reinvention and expansion of what the Star Wars universe is capable of.|Fresh
That's when the film offers moments... that go from euphoria to sadness, from fear to uncertainty, and from incredulity to the unexpected; moments that will surely be established as some of the best in the entire franchise. [Full review in Spanish]|Fresh
Considering that the franchise returns to Abrams in the next installment, surely the producers will ask for neatness and solemnity ... for old times sake. [Full review in Spanish]|Rotten
I wish it were a much better movie than this one. [Full review in Spanish]|Rotten
The Last Jedi has been favourably compared to The Empire Strikes Back and while there's some truth to that, they're very different films. Yes, it's dark but it's the moments of light that you'll remember.|Fresh
I know I'm in the minority here, but director Rian Johnson's follow-up to The Force Awakens felt overstuffed and incredibly disjointed; a collection of uncorrelated rah-rah scenes and little else.|Rotten
Writer-director Rian Johnson repeatedly shows an inability to build to moments. His screenplay's biggest beats come off as self-defeating and lifeless.|Rotten
"They ticked off all the boxes except the one marked ""Jar Jar Binks."" You are very old if you needed to see all these characters again."|Fresh
A fantastic sequel...|Fresh
"With a script by director Johnson, ""The Last Jedi"" is a mash-up of many different stories, but all with the same main plot line; good versus evil."|Fresh
If you can accept the excess, the weird humour, the entirely inessential subplot, and the fact that it could stand to end a scene earlier, then the series will continue to thrive in a galaxy far, far away.|Fresh
Where Abrams left us eager for more, Johnson leaves us sated and willing to wait a couple of years for the next episode. Still, there's plenty of fun to be had, and the series faithful won't be disappointed.|Fresh
The Last Jedi tackles the bigger questions that the morally sure previous entries did not.|Fresh
It is the best and most innovative Star Wars film to come along in a long time and you would think that this would inspire celebration in the streets among longtime fans of the franchise.|Fresh
"Hamill and Fisher, who give ""The Last Jedi"" its emotional depth, are joined by Adam Driver, who once again shows himself to be one of the most skillful young actors of his generation."|Fresh
"""The Last Jedi"" is not a crude predictable entry to the series; Rian Johnson has delivered a luminous spark that's left the future of the franchise looking bright."|Fresh
... the director manages to raise a moving monument to something as brilliant and even corny as the possibility of a shared dream. [Full review in Spanish]|Fresh
Digressive rather than progressive, The Last Jedi fails to develop the new, exciting and complex characters we met in The Force Awakens.|Rotten
Abrams gave us the gentle re-introduction we needed, and it paved the way for writer and director Rian Johnson to take the story in strange new directions.|Fresh
Luke Skywalker rules all in this movie, but there's a lot of stuff that doesn't work.|Fresh
Although not worse than the prequels for me, The Last Jedi is its own special kind of meh that demonstrates Disney doesn't have the guts to do this franchise any justice.|Rotten
Over-funded, bloated, self-important and virtually immobile, The Last Jedi bears more than a passing resemblance to Jabba the Hutt.|Rotten
This movie feels like a TIE fighter on the fritz, spinning in circles as it fires off one light-show after another.|Rotten
Here, [Mark] Hamill turns in his best performance, giving the character a depth and complexity that wasn't as evident in the original trilogy.|Fresh
With Johnson at the helm, the torch-along with the lightsaber-is safely passed to a new generation.|Fresh
the most interesting people are no longer related to Darth Vader|Fresh
While a good Star Wars film, this was not the best. With issues across the board (technical, character and plot), The Last Jedi does leave much to be desired.|Fresh
Undoubtedly, Johnson is able to make some notable moments... [Full review in Spanish]|Fresh
There's a sense of closure. Which makes The Last Jedi an incredibly cathartic experience.|Fresh
It's nice that the Rebellion is no longer defined by suicide attacks and The Force no longer a matter of hereditary title.|Fresh
Rian Johnson leavens political high seriousness and fan-service tear-jerking with enough charm and humour to prevent The Last Jedi becoming the biggest downer ever delivered at Christmas by the Walt Disney Company.|Fresh
More good things and fewer bad things happen in this movie than in any of the three prequels, but the film is hellbent on presenting its good things in the worst possible light.|Rotten
What The Last Jedi does so well over its two-hour, 32-minute thrill-ride is start to escape the gravitational pull of orbiting the same Skywalker family squabbles on the big screen for 40 years.|Fresh
Here's the first 'Star Wars' movie since 'Empire' that you don't have to make excuses for enjoying.|Fresh
Upends expectations, demythologizes the mythos, and takes an iconic series in a bold new direction with a story full of humor, courage, and dazzling imagery.|Fresh
... The Last Jedi moves in an interesting range of grays, sacrificing part of the ingenuity and regal values ​​of yesteryear for the despair and bitterness of the times. [Full review in Spanish]|Fresh
An excellent balance is created between telling us a new and interesting story...and having good action scenes. [Full Review in Spanish]|Fresh
The force is strong with Rian Johnson, who delivers de most exciting, risky, adult and entertaining Star Wars movie since, well, you know which one. [Full review in Spanish]|Fresh
A thing of beauty and work of art about which the loudest grumblers likely expected the most conventional developments - lost in Reddit rabbit holes and clickbait in which creatives graciously fielded insistent questions about parents or provenances.|Fresh
Each of these characters finds a surprising connection to others, derailing plans and sending each person on an unexpected journey. The way Johnson orchestrates all of this is remarkable because it's both coherent and compelling.|Fresh
The Last Jedi is a grand step forward, one that we can only hope will light the way for the franchise's future.|Fresh
With Star Wars: The Last Jedi, writer-director Rian Johnson takes the Star Wars saga into uncharted territory, with exciting results.|Fresh
Its scattered pacing and tangled subplots doesn't make THE LAST JEDI a failure, but neither is it a celebration - or more importantly, an elevation - of anything other than the legacies of the late Carrie Fisher, and justly revered Mark Hamill|Fresh
In The Last Jedi, movie magic has been replaced by hocus pocus. Or perhaps even mumbo jumbo -- never has the eastern-western pop psychology of the franchise rung so hollow.|Rotten
The Last Jedi is good, in parts very good but not as good as The Force Awakens. It's too long but not tedious, it's often funny and full of action.|Fresh
From the seemingly infinite number of universes in which The Last Jedi was a bad film, or even just an OK one, Johnson has found his way to the one universe in which it is a good, occasionally first-rate one.|Fresh
For those of us who were there at the start, there's one thing that makes The Last Jedi unmissable: Carrie Fisher. Go and see it for her.|Fresh
This chapter relies so much on its call-backs and references that it all feels a little bit too safe. But still a damn fine movie, pushing the story forward in style.|Fresh
The Last Jedi should be the last Jedi. My interest died along with Hans Solo who took with him that cowboys in space humor that made the franchise so special.|Fresh
As the third act approaches, the crescendo of air-punching interludes accelerates, eliciting gasps, cheers and OMG whoops from an audience whom Johnson treats with respect, affection, and evident admiration.|Fresh
It's a bold and challenging work -- exactly what we would expect from the auteur of Brick and Looper. In the debit column, it's also a tad bloated.|Fresh
Rian Johnson has delivered arguably the best Star Wars ever, or at least certainly the most fun.|Fresh
With The Last Jedi, there's a welcome return of hope for the Sequel Trilogy.|Fresh
not the best entry in the Star Wars franchise, but parts of it rank at the very top|Fresh
Johnson infuses the proceedings with the same sense of wisecracking fun that made the original (now known as EPISODE IV: A NEW HOPE) so irresistible, while also ambitiously expanding on the mythos.|Fresh
Events fans dreamed of happening unfold differently than imagined, and that bit of reality highlights what's really going on here: Star Wars is pushing out of its comfort zone.|Fresh
Rian Johnson's spectacular expansion of George Lucas' galactic adventure franchise is everything you want it to be - and more. What a great holiday gift for moviegoers! May the Force Be With You...|Fresh
At a point where the ever-extendable Star Wars franchise looked at risk of relying too much on its own legacy and table of cliches along comes The Last Jedi to push the saga into fresh, delightfully dangerous new territory.|Fresh
Its nostalgia works well. Mark Hamill returns as Luke Skywalker and the late Carrie Fisher is again in her signature role of Leia Organa.|Fresh
The Last Jedi brings to the audience something much more complicated for a movie to cause than tears: chills. [Full review in Portuguese.]|Fresh
What serves filmmaker Johnson well is his willingness to take more risks within classic elements than Abrams may have been able to. The real measure of the success of a film in a franchise of this stature is whether or not it ignites the imagination.|Fresh
While The Last Jedi may not receive top marks for originality, the eighth official entry in the Star Wars saga is still one of the most entertaining blockbusters of the year...|Fresh
... if all you want to know is can you go in expecting a good film, the answer is yes. A resounding yes!|Fresh
Star Wars: The Last Jedi successfully combines the thrill-a-minute fun that's always been part of the saga with a fresh spin on the light/dark theme embedded into the epic tale's DNA.|Fresh
With every super-spoilable turn, 'The Last Jedi' anticipates backlash, and asks longtime devotees to look inward.|Fresh
This delightful if overlong film has so many arcs and subplots that you'll find yourself parsing them later... not because they don't work, but because the film packs so many scenes that reward closer-than-normal observation.|Fresh
Star Wars: The Last Jedi is a spirited continuation - sometimes spectacular, often humorous - of the never-ending space saga.|Fresh
With The Last Jedi, Rian Johnson's done to the Star Wars franchise what Joss Whedon had done for Marvel with The Avengers. Disney and Lucasfilm have another solid franchise base in the offing now.|Fresh
These are small choices, but important ones. The kind that make us care. The kind that make us ask, Who hurt you? Kylo Ren may be a boy at heart, but he's a villain in full.|Fresh
With The Last Jedi, Johnson finds that sweet spot of reverentially seeing out the old to firmly make way for a new, perhaps final, space odyssey.|Fresh
Hope for generational change, the power of any single, small, nameless dreamer, who may yet know a world not manipulated by gunrunners, moneychangers, the venal and power-mad. Forces against The Force. The sky is filled with more stars than we know.|Fresh
There are more genuine laughs and emotional resonance here than any of the movies have managed since 'Empire' ... But does it have even a fraction of the weird cross-genre spark that animated the original trilogy? Not at all.|Rotten
With deft direction by Johnson and his script that has its ominous and mythical moments but never quite feels over-the-top or silly, this features strong work from Hamill, Ridley, Driver and Boyega.|Fresh
