A poignant farewell to Carrie Fisher. With dynamite women leading the action on all fronts, The Last Jedi is a fitting tribute to her legacy.|Fresh
Even if real fanboys are not pleased with some of the revelations (and, perhaps, not all should be believed), the major impact of The Force will go a long way in keeping everyone relatively happy.|Fresh
The battle that inaugurates The Last Jedi is now and in the eyes of a lonely child, the ray of light in the sky that awakens his imagination. [Full review in Spanish]|Fresh
Arguably the most beautifully directed film of the series so far. About as good as it gets for four-quadrant, tent-pole film-making. Wonderful.|Fresh
The Last Jedi is awe-inspiring and poignant. Expect to be riveted, despite its runtime of two-and-a-half hours.|Fresh
Overall, Star Wars: The Last Jedi is an engaging mesh of new and old threads of past and present Star Wars narratives coming together to make a cohesive and exciting film.|Fresh
It's all watchable to those of us in the Skeptics Tribe. I tacked on an extra half star to the star rating for this solely because of my outsized affection for a glorious section in the middle that I enjoyed as I have few other Star Wars side journeys.|Fresh
Sci-fi violence, strong female characters in thrilling epic.|Fresh
[Rian] Johnson's miscue has posed a disquieting question: Are these filmmakers authors or fans?|Rotten
Star Wars: The Last Jedi is a muddled movie that has some incredibly high points and beautiful scenes... [but] also contains a lot of distracting filler.|Fresh
It's a Rian Johnson film through and through, which is why it feels like a breath of fresh air. [Full Review in Spanish]|Fresh
There are also quite a few new creatures, among them various icicle dogs, turtle-face monks, and some impossibly cute thingies called Porgs, which look as if they nest in gift shops at night.|Fresh
However, as much time and energy has been devoted to the goings on of Rey, Ren, and their various friends and enemies, try as the film might, it doesn't generate much in the way of genuine interest in these characters.|Rotten
The film is a relentless crowd-pleaser that has as much in common with a pedigreed art film as it does a traditional action blowout.|Fresh
The characters, like the movie, take what they need from the past, leave the rest behind, and forge ahead into unexpected and exciting new terrain.|Fresh
"Star Wars: The Last Jedi is a visual spectacle that expands our understanding of the Force and how it shapes a ""galaxy far, far away,"" adding to the mythology and lore of this franchise."|Fresh
"Just like The Empire Strikes Back set the benchmark for the ""orig trij"", The Last Jedi does the same for the sequel trilogy."|Fresh
Johnson - like George Lucas before him - has an eye for capturing epic moments that simultaneously feel effortless and throwaway.|Fresh
In short it is a dynamic, action-packed addition to the 40-year-old series that no self-respecting fan will want to miss.|Fresh
Remixing the structure of the originals with the aesthetics of the prequels.|Rotten
Rian Johnson's film is the real deal, a bold, risky venture unafraid to tell its own story, freed from the weight of nostalgia and formula.|Fresh
A profound spiritual experience.|Fresh
The Last Jedi represents a triumph for the series and will make you forget Jar Jar Binks ever existed.|Fresh
Johnson ends the film with the rebel forces on the defensive and with their resources mostly spent. Yet he offers a sliver of hope - there's that word again - as he assures us, when the screen fades to dark, that brighter days are ahead.|Fresh
Demonstrates an understanding of the Star Wars universe and its appeal, while also taking it into wonderful new directions|Fresh
"""Star Wars: The Last Jedi"" reminds us all over again why this franchise is so beloved."|Fresh
I can say that the film is visually spectacular, with another superb soundtrack from John Williams, and mostly well cast.|Fresh
Johnson is easily the most skilled filmmaker to helm one of these (it's not even close) and it's not just that the film has a surface beauty of its own. He's aware of what we expect narratively from a 'Star Wars' movie, and delights in subverting it.|Fresh
But the biggest thing this eighth chapter does is change where things go next in a fundamental way.|Fresh
Armed with intelligent dialogue, fully dimensional characters, and the requisite wowie-zowie audio-visual effects, the Rian Johnson-Walt Disney Pictures-Lucasfilm-Ram Bergman Productions of Star Wars: The Last Jedi is pretty darned good.|Fresh
The Star Wars franchise is in good hands with writer-director Rian Johnson, who delivers an enthralling, often funny and at times achingly beautiful galactic adventure in The Last Jedi.|Fresh
By being easily the most unconventional film in the octet, The Last Jedi underscores exactly what Star Wars was always about. Hope. We need it now more than ever.|Fresh
It's easy to forget the original movie was a terrifically bold, innovative, industry-realigning blockbuster. Lucas dreamed big and took massive risks. In that sense, The Last Jedi could not be more different to the Star Wars created four decades ago.|Rotten
Writer and director Rian Johnson will surprise you with new story possibilities, new emotions, new visuals to feast your eyes on.|Fresh
... plenty of twists, turns and pleasant surprises to hold an audience rapt over the two-and-a-half-hour running time.|Fresh
The Last Jedi is the best Star Wars film since 1980's The Empire Strikes Back because it's so much more than stars and wars. It's those stories, joys, and pains of the heroes, villains, and nobodies who lived it.|Fresh
In practically every frame, writer-director Rian Johnson conveys how much fun it is to do this stuff.|Fresh
an entertaining, engaging ride, and it's all thanks to having a true filmmaker behind the lens|Fresh
Rian Johnson understands how to balance the strengths of the franchise, which is simultaneously a fun action-comedy for kids, and a decades-long epic with meaty philosophical themes.|Fresh
Whew! ... The Last Jedi thankfully returns to the tone of fun, adventure, and especially camaraderie that J.J. Abrams established so well in The Force Awakens.|Fresh
[Johnson] clearly knows the material well enough to give us exactly what we expect, and he loves it enough to take it into new territory.|Fresh
Moving on from previous glories to start anew furnishes greater moments for the characters than the story, but it adds to a movie that's thoughtful, emotional and contemplative.|Fresh
If the previous entry presented a respectably staid melding of old and new, this one wires everything up, cranks the juice, and lets her rip.|Fresh
There is a thrilling space opera somewhere in Star Wars: The Last Jedi, if only it could rise above the echoes of its original mythology.|Fresh
Epic, fun, visually sumptuous, it will tug at your heart strings because we come to know the characters across several episodes and we root for them when we recognise our own emotional responses in theirs.|Fresh
The Last Jedi is not a film for the faint of heart. But courage, a sense of wonder, a resounding faith in the strength of love, and a healthy dose of hope will take you far.|Fresh
Rian Johnson's wildly fun and thoughtful entry into the Star Wars canon finds its heroes at a precarious turning point.|Fresh
The movie's richness invites more than one viewing.|Fresh
The Last Jedi continues that transition in a way that will gratify those who were around for the beginning of the series. In other words, let the space exploration continue.|Fresh
"Certainly J.J. Abrams' 2015 ""Star Wars: The Force Awakens"" was more than satisfying, but Johnson steps it up several notches, digging deeper into characters, and even adding nuance to the ""Star Wars"" mythos."|Fresh
Even with the warts, Star Wars: The Last Jedi feels like a big, dazzling holiday present most Star Wars fans should be able to tear into and enjoy.|Fresh
The Last Jedi is built on a series of oppositions relative to one of the best known films ever made. It's the prisoner of its middle chapter predecessor.|Rotten
The Last Jedi is a sample of what Disney intends to do with this franchise, turning it into a product full of cliches, empty plots, forgettable villains, [and] one-dimensional characters. [Full Review in Spanish]|Rotten
Nothing less than the smartest, most nuanced, most ambitious Star Wars film ever made.|Fresh
Sporadically thrilling, but overlong, exhausting, tonally uneven, and often dull.|Rotten
Johnson works in the somewhat limited palette that is Star Wars, but this middle chapter in the new trilogy also starts to break out in ways that should excite fans at the prospect of what's to come.|Fresh
With the passage of time, The Last Jedi may rise again as a necessary film, essential between one and another of the saga. [Full review in Spanish]|Fresh
The forceful 'Star Wars: The Last Jedi' is a cinematic triumph.|Fresh
"Simply put, if you love or even just enjoy the ""SW"" universe and its various trappings, you're going to, at a minimum, find this one to your liking. (Full Content Review for Parents - Violence, etc. - also Available)"|Fresh
"Nothing in ""The Last Jedi"" is allowed to be mundane, including the places the filmmakers take the story."|Fresh
But these are minor quibbles compared to the depth, wonder, and sense of heroism that The Last Jedi brings back.|Fresh
"In the end, ""The Last Jedi"" delivers everything you would want from a ""Star Wars"" movie, something that's become both a blessing and a curse."|Rotten
There are twists you won't see coming and just when you think you've figured everything out, Rian Johnson pulls a rabbit out of his hat.|Fresh
"""Star Wars: The Last Jedi"" could very well be the definite evolution of the series yet."|Fresh
Rian Johnson, writer and director of this film, took my Star Wars reveries and served them back to me with vast improvements.|Fresh
Has fresh story beats and new ideas ... Yet as the complicated, messy plot unfolds, the lack of a larger vision in this new trilogy becomes more glaring.|Fresh
Rian Johnson's middle chapter in the current Star Wars trilogy is the epic you've been looking for. Capped by Mark Hamill in the performance of his career, it points the way ahead to a next generation of skywalkers - and, thrillingly, to a new hope.|Fresh
The true star is Mark Hamill, giving the performance of his career as the anguished, isolated, tortured former Jedi Master. His scenes are worth the ticket price alone.|Fresh
Muddled by bombast, but it finds significance in the art of failure as a means to an end for a new beginning (again) for Star Wars.|Fresh
The dialogue is peppered with droll admissions and Star Wars-savvy sarcasm, which helps to prick the heroic sweep so common to these trilogies.|Fresh
Where J.J. Abrams sought to give this new trilogy a firm but predictable foundation to build upon, Rian Johnson's The Last Jedi is a risk-taker. This is to be applauded absolutely.|Fresh
Unjustifiably long and with misplaced humour throughout, The Last Jedi nonetheless delivers some scintillating action, spine-tingling lore and a loving farewell to Fisher.|Fresh
Goes in bold new directions while delivering familiarity. Written and directed with thoughtfulness and visual flair.|Fresh
Movies should be better than those we could imagine up on our own. Rian Johnson knows what we want to see, and shows it to us in ways we couldn't have envisioned without him.|Fresh
By now, the franchise is mainly about giving the audience more of what it's already given it, and the gifted writer-director Rian Johnson (Looper) delivers just that...|Fresh
...a great Star Wars film, one that honours the traditions of the franchise but boldly pushes the envelope in terms of thematic complexity and emotional tone...|Fresh
The Last Jedi deserves nothing but acclaim, and Johnson, an incredibly adept director, deserves to be handed as many future Star Wars films as he can manage.|Fresh
Lucas Hit the Jackpot!|Fresh
A reboot of Empire Strikes Back, Star Wars: The Last Jedi is overlong, heavy-handed and fun if mostly uninspired.|Fresh
Older characters pass the baton to a new, female-centric generation led by the outstanding Daisy Ridley, the new face now a confident actress with great screen charisma.|Fresh
Rian Johnson has made a Star Wars movie that features so many great additions to canon and mythological intrigue that will have fans buzzing for years.|Fresh
The perfectly paced new entry to our galaxy far, far away features so many new Star Wars moments to love...a journey full of classic hallmarks and new additions that maintains a balance of lighthearted fun, intense action and deep emotion.|Fresh
The Last Jedi is everything a Star Wars film should be, and so much more. Johnson weaves an emotionally rewarding tale while balancing all the essential sci-fi action expected.|Fresh
For Star Wars aficionados, this entry is one of the most galvanizing, from beginning to end. What an Odyssey.|Fresh
What's most thrilling about The Last Jedi is Johnson's seamless blending of old and new Star Wars lore.|Fresh
Star Wars fans old and new are guaranteed to have an absolute blast.|Fresh
The Last Jedi suffers from occasional inconsistencies in character and plot, but these quibbles are easily absorbed into the impressively vast and colorful canvas that Johnson paints with such passion and empathy.|Fresh
Thankfully The Last Jedi won't be the last Jedi movie, but it should be your next.|Fresh
Fisher would be proud of Episode VIII, an injection of freshness into a series always only one movie away from staidness -- such is the scrutiny of something as loaded as Star Wars.|Fresh
The force is still strong with this one. It just takes the occasional wobble.|Fresh
For all the complexity of the sub-plots, the storyline is reassuringly familiar.|Fresh
Big space battles are one thing, but there are smaller action setpieces here that can only be described as beautiful.|Fresh
Carrie Fisher, in her final Star Wars performance, is the heart and soul of the film, stealing scenes with ease and on more than one occasion bringing lumps to the throat.|Fresh
There's a refreshing gender balance among the key characters. Laura Dern's Vice Admiral Holdo may be dressed more for the opera but don't be fooled, kids.|Fresh
"Bottom line: ""Star Wars: The Last Jedi"" may not be the best installment in the now 40-year-old franchise, but it packs enough action and surprises to keep fans happy through the Christmas season and beyond."|Fresh
[Daisy] Ridley already proved herself a worthy addition to the Star Wars fold and does nothing here to convince us that we weren't right to welcome her for what evidently will be a long run.|Fresh
The series feels like it is truly moving forward for the first time in decades, and that future now looks more promising.|Fresh
It's full of moments both thrilling and poignant, with anticipated reunions and goodbyes, and pulse-pounding action.|Fresh
While The Last Jedi acknowledges the inevitable comparisons to [The Empire Strikes Back] by setting up some similar scenarios, it then does original and surprising things with those moments.|Fresh
"Entertains as comfort food in filmic form, but this is an altogether slighter experience than the spectacular one ""The Force Awakens"" provided. This is a fine film in spite of its many issues, easily recommendable to fans."|Fresh
The last act overcomes a sluggish middle and is as thrilling as this franchise ever gets.|Fresh
The Last Jedi delivers the all-too-rare thrill of a huge popcorn movie that respects the intelligence of its audience, while also serving up plenty of moments designed to make them lose their damn minds.|Fresh
It's a compelling feature for the most part, but it's too obsessed with surprises, often sacrificing stability just to rattle fans.|Fresh
Gorgeous cinematography, solid performances & one of the best scenes in Star Wars history. Though, it has issues incl. unnecessary comedy that affects tone. Liked but didn't love.|Fresh
Regardless of the jokes and explicit exposition, there was enough real emotion to make me care. Given the absolute ridiculousness of what happens in this unapologetic space soap opera, making me feel anything at all is an undeniable measure of success.|Fresh
...a bit of a placeholder.|Fresh
So much movie, I think my engorged eyeballs had to stick a finger down their throats and vomit out a couple of epic battle scenes just so they could get through the finale.|Rotten
The Last Jedi is an epic to inspire, an adventure that truly carries you to a galaxy far, far away, and will hold in your heart as all the best stories do.|Fresh
[The Last Jedi] features some of the best drama, comedy and action of the whole series, as well as more visual invention than ever. [Full review in French]|Fresh
The Last Jedi repeatedly goes against your every instinct, takes your emotions for a roller coaster, and takes the characters we know in directions that will blow your mind.|Fresh
Director/screenwriter Rian Johnson has truly delivered the galaxy goods on this event-the second installment of the sequel trilogy.|Fresh
[Johnson] does his best work in The Last Jedi when he stops trying for narrative complexity and just stages some cool outer-space action.|Fresh
It arrives at a very dark moment indeed, and yet like the movies that preceded it, it speaks very powerfully to where we're at right now.|Fresh
There's a sense that Johnson is giving busy-work to certain characters while others are catching up. The Last Jedi is a great 105-minute movie stretched too thin.|Fresh
[Rian Johnson] achieves what no one else has since The Empire Strikes Back: a fusion of junkyard genre parts and passion.|Fresh
On the whole, this is a great step forward for the franchise - it's deeper, it's darker and it has porgs.|Fresh
Nothing can prepare you for what Star Wars: The Last Jedi delivers and that's exactly what makes so damn near perfect.|Fresh
"While I have laughed at times during previous ""Star Wars"" movies, I did not expect to do so as quickly as ""The Last Jedi"" made me."|Fresh
[Rain] Johnson crafts an entertaining, swashbuckling flick in the series' eighth film. It possesses the whimsy, the heart and light sabers necessary for reverence in the Star Wars canon.|Fresh
This is a movie not only for Star Wars fans but also for fans of losing themselves in, and falling in love with, blockbuster movies. That's a feeling most Hollywood movies have forgotten-and The Last Jedi is here to make us remember it.|Fresh
While familiar, this is a Star Wars film that isn't overly beholden to its past, playing with the tropes, themes, and characters of its predecessors in a way that is both unsettling but necessary.|Fresh
[Director Rian Johnson's] movie has a sense of humor about itself and a sense of joy, but its emotional generosity, even in the midst of all the extravagant green-screen work, is its best special effect.|Fresh
The spectacles in Star Wars: The Last Jedi are some of the most powerful and believable in the franchises.|Fresh
Have we ever had a relaunch followed immediately by a reboot?|Fresh
Star Wars: The Last Jedi launches the franchise to another level of action and humor thanks to incoming writer-director Rian Johnson, whose imagination seems boundless as George Lucas' 40 years ago.|Fresh
You don't have to be a Star Wars fan to love this addition to the canon (heck, it works even if you haven't seen any of the other movies).|Fresh
In short, it feels like a new hope.|Fresh
It's a constantly churning engine of wonder and excitement that grapples with elemental questions of good and evil that have always been the driving force of this universe.|Fresh
Johnson has delivered the goods: a film that isn't afraid to be ambitious, that delights and dazzles in equal measure, while providing a worthwhile emotional investment. It is a crowd-pleaser that will be wholeheartedly embraced by fans.|Fresh
It soars and sinks, shrewdly building on franchise lore while scoring cheap shots against capitalism. Frustrating it is, hmmm?|Rotten
"As indebted to the previous installments and ""Star Wars"" canon as it is to classic Westerns, sword-and-sandal epics and martial arts films.... it's the blend of reverence for its roots and embrace of the new that makes ""The Last Jedi"" a triumph."|Fresh
A stunning black, white, and red color pallette, thrilling adventure, appealing new characters, worthy developments for old friends and a cause to root for.|Fresh
Star Wars fans, your sky high expectations are rewarded. Rian Johnson takes the fabled lore from a galaxy far away into uncharted territory. He will have you spellbound.|Fresh
The movie comes off as a work that's ironed out, flattened down, appallingly purified.|Rotten
Rian Johnson clearly remembers something that Lucas' most fervent followers sometimes forget: These are movies for the young, or at least the young at heart.|Fresh
The Last Jedi is that very rare thing, a brilliantly crafted, intelligent blockbuster that will deserve every penny of its doubtless immense box-office returns.|Fresh
Efficiently manufactured and enjoyable enough but overloaded with action and effects, and sorely lacking the magic that marked the first movies in the franchise.|Fresh
The Last Jedi boasts many very good performances, ones that enrich the characters and which salute writer/director Johnson's ability to find the humanity within technology, something he proved early on with his artful time-travel thriller Looper.|Fresh
A blockbuster with the beating heart of its creator worn proudly on its sleeve.|Fresh
[G]ets off to a bit of an uneven start, but finds its footing eventually... not the best of the series, and not the best of the new films, but it's still a worthwhile entry in the continuing saga...|Fresh
A spectacular, full-throttle joyride of thrills, exhilarating, screen-filling visuals, emotional heft and humor, with familiar characters and new faces we'll almost certainly be seeing again.|Fresh
The Last Jedi may not be a flawless film but continues to push the story forward. The film has a lot going for it and Rian Johnson seems to understand exactly what Star Wars fans are looking for.|Fresh
Star Wars: The Last Jedi builds upon Star Wars history for a more expansive, high-stakes adventure with plenty of fresh - and classic - elements.|Fresh
Without giving away any surprises, there will be endearing reunions, unexpected appearances and outcomes... [Full review in Spanish]|Fresh
There's a trick to taking something old and making it bigger and more impressive, yet familiar enough to sate our desire for the same. With Last Jedi, Johnson pulls it off assuredly enough to please nearly everybody.|Fresh
"The Last Jedi, however, opens up some new possibilities. It doesn't provide a ton of satisfying answers, but it creates some interesting questions. And it manages to make ""Star Wars"" feel new again."|Fresh
Perhaps like no film in the franchise yet, 'The Last Jedi' seriously considers the hubris that comes with certainty, and how knots from the past that can keep you bound from moving forward.|Fresh
While the central story concept of THE LAST JEDI, Luke's Dharmic apotheosis and Rey's Gnostic enlightenment, is a brilliant one, it's hounded by lopsided execution and a ham-fisted subplot...|Rotten
Every moment where The Last Jedi almost takes a bold risk for the series, it undermines itself to maintain the status quo.|Rotten
"Disney found a true ""Star Wars"" champion in Johnson and I'm eager to see what he does when he's able to craft the next trilogy from scratch."|Fresh
"""The Last Jedi"" may not possess its immediate predecessors' pleasant shock of the new, nor is it a stylistic detour from what's expected. But it makes up for this with wit, spirit and one wicked saber smackdown."|Fresh
It's a film of genuine beauty, one where you come away as eager to talk about the set design and the choreography as you do the fate of the galaxy or what might happen next.|Fresh
"""The Last Jedi"" is a rousing, stirring adventure that is consistently guided by the courage and fallibility of its characters, culminating in a sustained, riveting finale that overpowers any quibbles about pacing and plotting."|Fresh
[Johnson's]often-stirring addition to the saga finally lands on an affecting point about the importance of preserving essential cultural tradition without clinging too strictly to the dogma -- and the texts -- of the old way.|Fresh
Fans can expect plenty of surprises and awe-inspiring visual wizardry.|Fresh
After this - I never thought I'd say it - I'm up for more. Bring on the next Star Wars.|Fresh
The first half of the movie works in fits and starts, but Johnson makes up for it in the second, when the bundle of subplots intertwine tighter, and the narrative rockets forward, its action fleet of foot and tightly tied to its emotional highs.|Fresh
Everything a fan could want from a Star Wars film and then some.|Fresh
[Rian] Johnson's passion ends up giving wings to these last Jedi who, although wounded and disenchanted, resist stronger than ever. [Full Review in Spanish]|Fresh
While there are elements nodding to The Empire Strikes Back, The Last Jedi is no copycat. In its most daring moments, it even tweaks a few series tropes, updating them with a decidedly populist kick.|Fresh
Writer-director Rian Johnson has certainly made the busiest Star Wars film of them all, but he keeps it from becoming a slog by infusing it with humor, verve, and visual charm.|Fresh
Splits its attentions between two threads, but only half delivers spectacularly with heart, thrills, and some truly beautiful story beats while the other limps through space.|Fresh
