"""The Last Jedi"" has as much heart as it has guts and that's a stirring combination. You walk out of the cinema reminded why it's sometimes worth fighting a battle you may well lose."|Fresh
Rian Johnson's main feat is being savvy enough to know that sometimes the best thing to do is cherishing the past before burning it to the ground.|Fresh
But gradually, Johnson's many additions become too much of a good thing and The Last Jedi grows crowded, busy and long.|Rotten
So many elements in Episode VIII are recycled that it could have been called Rerun of the Jedi.|Rotten
Falsely epic, uselessly lyrical. [Full Review in Spanish]|Rotten
Last Jedi is deep. It's also rollicking. It's right up there with the very first Star Wars in terms of its enjoyability factor. It's a triumph.|Fresh
"When everything pulls in the same direction, as it does consistently in ""The Last Jedi,"" it's like watching a mind-boggling clockwork click into a deft ballet."|Fresh
That said, I'd stop short of calling director Rian Johnson's undeniably impressive initiation into the Star Wars fold the masterpiece that some desperately want it to be. The film simply drags too much in the middle.|Fresh
You cannot kill the past. What you can do is build on it to enable an intriguing future. At the very least, The Last Jedi does that.|Fresh
[Carrie Fisher] is luminous here. Every time she's on screen, it's impossible to look away, and she is as tough, loving, and wily as we would ever want our Leia to be.|Fresh
The emotional pay-offs are huge, the visuals are stunning, the performances are brilliant and, even as it eagerly explores the darkness, The Last Jedi never loses sight of its heart.|Fresh
"""The Last Jedi"" is the best directed, most beautiful-looking ""Star Wars"" movie since ""The Empire Strikes Back."""|Fresh
'The Last Jedi' walks a fine line for fans, creating a solid standalone film that shines within the franchise canon.|Fresh
It feels fresh, exciting and playful, without losing the operatic grandeur Star Wars thrives upon.|Fresh
If Star Wars: The Last Jedi isn't a complete deconstruction of the original trilogy, it's at least an acknowledgement that these archetypical characters must evolve in order to survive.|Fresh
It's not a perfect movie by any means; some of the comedy is a little too silly and one or two of the plot threads feel a bit less important than the others, but these quibbles were minor when compared to the parts that work. Those REALLY work.|Fresh
The Last Jedi at its heart is a love letter to a childhood. From Luke's sly wink to an old friend to General Leia's leadership, the familiar heroes dominate the screen, earn the biggest applause and serve as a compass to the next generation.|Fresh
The Last Jedi opens up with one of the best space fights the series has seen, and it carries that quality throughout. It has one of the best light saber fights, one of the best endings, and some of the most fun the series has seen.|Fresh
It provides top-drawer popcorn entertainment for the casual cinema goer, while hardcore fans will love it for the respect it has for the franchise history and for what it promises for the future.|Fresh
My favorite among the new castmembers is Laura Dern as Leia's Vice Admiral Amilyn Holdo, a poker player of near-Vulcan inscrutability.|Fresh
This is a GREAT Star Wars movie, possibly the best. It's certainly more satisfying and easily the most emotional.|Fresh
This mid-section marker in the current trilogy simply doesn't disappoint, realising the courage of its convictions with an intelligent story and a heart-swelling emotional resonance.|Fresh
The Last Jedi is a top-of-the-line, A-plus Star Wars and scifi movie -- one that we'll be watching and discussing for as long as there's a galaxy far, far away.|Fresh
The movie suffers a little from uneven pacing and occasionally lost my focus here and there but it is a worthy addition to the canon.|Fresh
The Last Jedi is not just a bold, fresh and humorous new addition to the franchise -- it's the one that will change it forever.|Fresh
Mark Hamill has never been better in his interpretation of Luke Skywalker. [Full Review in Spanish]|Fresh
An excellent middle chapter bursting with wit, wisdom, emotion, shocks, old-fashioned derring-do, state-of-the-art tech, and stonking set-pieces.|Fresh
Taken as a whole, this eighth episode of the franchise will be porgnip for the faithful, though the answer to one of its Big Questions seems disappointing, and generously entertaining for the rest of us.|Fresh
For those hoping that there may have been a substantial uptick in quality between J.J. Abrams's The Force Awakens and Rian Johnson's The Last Jedi-in much the same way that The Empire Strikes Back improved on Star Wars-you may need a new hope.|Rotten
When the feelings come in The Last Jedi, and they do come, they're deep and they're real. Go ahead and try to watch the penultimate scene without crying, or pretending not to. And may the Force be with you.|Fresh
It took them 40 years, but they've finally done it. The best Star Wars film of the series. There. That's it. It's that simple.|Fresh
It supplies us with all the things we expect - nay, demand - in a Star Wars movie, and manages to surprise us by revealing that this fictional universe, in which we've already clocked so many hours, can still surprise us.|Fresh
The future of the galaxy has never been in safer hands.|Fresh
Propped up by strong material, every member of the Star Wars: The Last Jedi cast delivers performances worthy of the iconic franchise, but deserving special mention is Mark Hamill.|Fresh
It certainly captures the sense of awe and imagination of what we love best about that universe. While it's not entirely without faults, it is entirely entertaining.|Fresh
Star Wars has been with us for four decades now, telling that same essential story in a format that's overwhelming and engulfing. With wit, skill, and love, The Last Jedi takes up the torch and carries it for a new generation.|Fresh
"By breaking down some of the old mythology, [Rian] Johnson has staked out new territory. For the first time in a long time, a ""Star Wars"" film feels forward-moving."|Fresh
The Last Jedi works on several levels, but most importantly it's a rip-roaring good time. That's what Star Wars fans want the most, and that's what they get with this dynamite installment.|Fresh
Star Wars: The Last Jedi is the perfect antidote to the year that is 2017 and introduces the tonic for what we need to enter 2018: hope.|Fresh
Sure, The Last Jedi can occasionally be too goofy or free-roaming for its own good, but it's an impossible film to sit in front of and not have a good time.|Fresh
Time and again, [Rian] Johnson finds a cinematic grammar that feels new to Star Wars; big close-ups (tender touching hands), top shots, elegant camera tracks and pulling out in-world sound, leaving just music and image.|Fresh
The Last Jedi is funny, it's emotional, it's fast-paced and it has a good story to tell.|Fresh
... The Last Jedi challenges itself with moments that, if mishandled, could easily have tainted beloved Star Wars moments in the same way that many people feel the prequel trilogy did. Instead, it navigates those narrative rapids with aplomb.|Fresh
[Rian] Johnson's ability to deliver a fresh and engaging riff on this beast of an enterprise suggests that not every free-spirited storyteller can be corrupted by Hollywood's dark side, and some may even give it a new hope.|Fresh
The Last Jedi is the best Star Wars film since The Empire Strikes Back, and is awful close to being its equal.|Fresh
"You don't see many sci-fi action extravaganzas that are about late middle-aged disappointment, about wondering what it's all about and whether any of it was worth it. It's this element that gives ""The Last Jedi"" an extra something ..."|Fresh
A nuanced, touching, humorous adventure, laced with thrilling space battles and some jaw-dropping visuals.|Fresh
The Johnson and Abrams movies live dutifully in the universe of the original George Lucas trilogy - after the Phantom Menace trilogy debacle, it's what fans claim they wanted.|Fresh
The Last Jedi mounts some genuinely startling narrative twists and feints, while charting an onward course for the franchise that has you itching to discover what comes next.|Fresh
The Force is, to me, still silly Star Wars mumbo jumbo, but Johnson finds a way to underscore it with humanity, with a classical Greek rumble of true pathos.|Fresh
The Last Jedi, unlike its predecessor, has the freedom to be daring, and perhaps the most thrilling thing about it-and there are many, many thrilling things-is how abundantly it takes advantage of that freedom.|Fresh
I lost count of the jaw-dropping moments The Last Jedi presents, and it's a movie I can't wait to revisit.|Fresh
Star Wars: The Last Jedi makes for an inventive nail-biter of a chapter in the franchise's long run.|Fresh
Everything is respected, but nothing is sacred. It's a sweeping gut-punch. How it deals with our own hopes and dreams for these characters, and how deep it cuts into existential concerns that drive us all - its effects will run around in the mind.|Fresh
"A fresh visual style makes this middle ""Star Wars"" a welcome addition to the saga."|Fresh
No matter how many exotic creatures & internecine struggles that galaxy far away may accommodate, it is a remarkably closed system, reechoing the same themes across the ages, & preferring regression & eternal return to anything like real progress.|Fresh
Every new Star Wars movie since Disney bought Lucasfilm has been heralded as the first worthy successor to the Original Trilogy, but with The Last Jedi it's finally true.|Fresh
I really enjoyed spunky, relatable Rose, and I held my breath every time she raced into danger.|Fresh
The Last Jedi, written and directed by the gifted indie auteur Rian Johnson, nails the balance of novelty and nostalgia in much more satisfying fashion.|Fresh
No one could mistake The Last Jedi for an outstanding contribution to cinema, or even to escapism, but it has its attractions.|Fresh
[Director Rian Johnson] doesn't radically reinvent Star Wars... But he does dig into the impulses behind the new trilogy's younger characters, cracking them open and examining their psychology in a way Star Wars rarely has.|Fresh
This is grand powerful entertainment, and one of the finest films in the Star Wars Saga.|Fresh
Star Wars: The Last Jedi is the quintessential Star Wars movie. It embraces everything in the franchise that came before while taking big risks to push the story into new and unexpected places.|Fresh
This is an emotional ride all right, an incident-packed epic that introduces new characters, reacquaints us with old friends, answers some questions and raises some more.|Fresh
Watching The Last Jedi is a conversation with your younger self.|Fresh
The Last Jedi is a very satisfying entry into the Star Wars Saga with some fantastic, jaw-dropping moments.|Fresh
That's not to say Star Wars: The Last Jedi will go down in history as a better movie than the franchise's gold standard, The Empire Strikes Back, but director Rian Johnson has pulled off a complete rejuvenation of the saga.|Fresh
'The Last Jedi' is not a great movie because it's a 'Star Wars' film. It reasserts 'Star Wars' as a top-tier blockbuster franchise by being a great movie.|Fresh
Writer/director Rian Johnson's entry into the Star Wars canon is rebelliously bold at times and full of rousing surprises, which make up for a few lulls in the lengthy two-and-a-half-hour run time.|Fresh
"The Last Jedi provides a resoundingly positive answer to an old smuggler's long-ago query: ""Let's see what this piece of junk can do."""|Fresh
A more complicated visit to a galaxy far far away, one that manages to be a great stand-alone adventure in its own right.|Fresh
Star Wars: The Last Jedi is the greatest Star Wars film since The Empire Strikes Back|Fresh
[The film] not only delivers everything fans could want from the sequel but also gives them a whole load of other stuff they never knew they wanted into the bargain.|Fresh
Falls right behind Empire Strikes Back and maybe the original film in providing the thrills and the heartbreak, the heroism and villainy, and the romance and betrayal that makes these films such a treat.|Fresh
Optimistically, The Last Jedi leaves plenty of intriguing possibilities for the climactic installment. But there's also the kind of room for improvement that remind us when it comes to Star Wars, such hopes -- new or otherwise -- spring eternal.|Fresh
More than anyone else on screen, Driver seems to know exactly how to pitch his character. He is magnetic in his scenes, and his sequences sing with (space) operatic melodrama that, for all its showiness, is absolutely correct for the piece.|Fresh
A stellar entry that owes much to George Lucas' original films while finding a signature vibe of its own and unleashing a few welcome twists.|Fresh
"Star Wars: The Last Jedi is striking, stunning, visually hypnotizing, thrilling - everything ""epic"" about the famed franchise rolled into a tremendously overcharged start to Rian Johnson's Star Wars career."|Fresh
Star Wars: The Last Jedi is weird, wild, emotional, and fantastic.|Fresh
Johnson is to be lauded for not locking himself into a retelling of the same old story. While there is plenty of familiarity -- this franchise basically demands it -- he isn't afraid to go in new directions.|Fresh
"""I laughed. I cried. I screamed and cheered so much that my throat went raw, and I left the theater on a high of exhilaration."""|Fresh
One of the strongest aspects of The Last Jedi is its writing. Written and directed by Rian Johnson, he shakes the foundations of The Force and puts everything we think we know to the test.|Fresh
It is a satisfying, at times transporting entertainment. Remarkably, it has visual wit and a human touch, no small achievement for a seemingly indestructible machine that revved up 40 years ago and shows no signs of sputtering out (ever).|Fresh
Loaded with action and satisfying in the ways its loyal audience wants it to be ... generally pleasing even as it sometimes strains to find useful and/or interesting things for some of its characters to do.|Fresh
This is the first Star Wars movie made by an artist instead of a craftsman, and it leaves us on the verge of something new. I'm very, very excited to see what that might be.|Fresh
Still, this is no mere placeholder of a story. Huge, important things happen to characters secondary and primary. Surprises big and small abound.|Fresh
Put simply, The Last Jedi is lodged several parsecs up its own black hole.|Rotten
No romance, little pathos and lacks a single heartfelt punch-in-the-gut moment.|Rotten
I'm so thrilled that I'm able to say that Star Wars: The Last Jedi made my heart soar and filled me with happiness. I'm heartened to say that it did our Carrie proud.|Fresh
Johnson has crafted such a powerful, screaming geekgasm of a movie.|Fresh
The Last Jedi gives you an explosive sugar rush of spectacle. It's a film that buzzes with belief in itself and its own mythic universe - a euphoric certainty that I think no other movie franchise has.|Fresh
The most intelligent film in the franchise by several light years, The Last Jedi can be seen as the space-opera equivalent of Clint Eastwood's revisionist western, Unforgiven.|Fresh
The miracle of Star Wars: The Last Jedi is its rejection of series formality. Writer/director Rian Johnson manages to honor mythology while also having fun disrupting it.|Fresh
It may sound like a backhanded compliment, but with so much on the line, Johnson deserves credit for not messing things up.|Fresh
The Last Jedi goes big on identity, confusion and loss as [Rian] Johnson puts characters through the existential wringer like no Star Wars director before him.|Fresh
Rian Johnson's Episode VIII is a true space opera-a masterful blend of humor, fun, and pathos that bares the souls of its characters and pushes the franchise to new heights.|Fresh
The best Star Wars since The Empire Strikes Back.|Fresh
Johnson has made something that isn't just a worthy addition to one of the most fan obsessed franchises ever, but is also a powerful standalone story.|Fresh
No one can say that Star Wars: The Last Jedi is a previous entry in a different skin as Rian Johnson has crafted an installment that largely defies saga standard narrative structure and tone|Fresh
Rian Johnson has created a movie that is both quintessentially Star Wars and richer than anything that has come before.|Fresh
For all its strengths, The Last Jedi is a very manic film, fueled by excellent ideas that could have been parsed out in smarter ways.|Fresh
This is the longest movie in the franchise. It just doesn't feel that way. I haven't been this into a Star Wars picture since the Empire struck back in The Empire Strikes Back.|Fresh
Rolling up with the kind of intergalactic swagger that gives us a cosmically infuriating phone prank within the first five minutes, Star Wars: The Last Jedi is a work of supreme confidence: witty, wild and free to roam unexplored territory.|Fresh
Rian Johnson has made a film that will delight and divide fans in equal measure. It is a bold and brilliant new step for the saga, moments of inspired silliness, pure heartbreak and thrilling action.|Fresh
'The Last Jedi' is phenomenal! Bold, compelling and unexpected, it's also the most emotional entry of the saga. [Full review in Spanish]|Fresh
You may or may not be surprised to learn I do not automatically swoon every time I hear the words 'Star Wars'. But, I'll be damned if I didn't feel a distinctive shiver down my spine watching The Last Jedi.|Fresh
[SPOILER-FREE REVIEW:] Johnson sticks with the Star Wars house style and seems pleased to have the opportunity to inspire children with this story of overcoming inner conflict to become one's best self, the key ingredient being hope.|Fresh
Rian Johnson has made the best directed episode in the saga, one that will have deep emotional resonances for fans of this space opera. [Full review in Spanish]|Fresh
