"It's no surprise that ""The Disaster Artist"" is funny, but what is surprising is how moving it can be."|Fresh
I simply cannot endorse a film that excuses and glorifies the abusive behavior of a rich and powerful man with a victim complex.|Rotten
[The Disaster Artist] not only lovingly recreates so many of its trademark scenes, it is full of compassion for those who will never fit in.|Fresh
There is a perfect balance of humor mixed with drama that makes for a good time at the movies. [Full Review in Spanish]|Fresh
By recreating the true story behind a weird film, Franco also creates a weird film.|Fresh
The finest film about Hollywood foibles since Ed Wood|Fresh
This absurdist comedy about an enigmatic auteur emerges as Franco's warmest, most crowd-pleasing directorial effort to date.|Fresh
A total triumph, and thank goodness for that. Imagine if it had been terrible and someone else had to make a film about the making of the worst film ever made about the making of the worst film ever made. We'd be here for decades, getting ever more meta.|Fresh
A good movie about a bad cult classic that embodies the essence of Hollywood: dream big, stumble spectacularly, but never let your failures define you.|Fresh
This isn't the next coming of a great meta-masterpiece, but its largely a damn good retelling of one of Hollywood's most beautiful disasters.|Fresh
"It's no surprise that ""The Disaster Artist"" is funny, but what is surprising is how moving it can be."|Fresh
I simply cannot endorse a film that excuses and glorifies the abusive behavior of a rich and powerful man with a victim complex.|Rotten
[The Disaster Artist] not only lovingly recreates so many of its trademark scenes, it is full of compassion for those who will never fit in.|Fresh
There is a perfect balance of humor mixed with drama that makes for a good time at the movies. [Full Review in Spanish]|Fresh
By recreating the true story behind a weird film, Franco also creates a weird film.|Fresh
The finest film about Hollywood foibles since Ed Wood|Fresh
This absurdist comedy about an enigmatic auteur emerges as Franco's warmest, most crowd-pleasing directorial effort to date.|Fresh
A total triumph, and thank goodness for that. Imagine if it had been terrible and someone else had to make a film about the making of the worst film ever made about the making of the worst film ever made. We'd be here for decades, getting ever more meta.|Fresh
A good movie about a bad cult classic that embodies the essence of Hollywood: dream big, stumble spectacularly, but never let your failures define you.|Fresh
This isn't the next coming of a great meta-masterpiece, but its largely a damn good retelling of one of Hollywood's most beautiful disasters.|Fresh
Never has a bad movie been so good - The Disaster Artist will delight members of the Tommy Wiseau cult and newcomers simultaneously.|Fresh
The genius of The Disaster Artist is that they made a universally funny movie that doesn't alienate anyone in the audience who hasn't seen The Room.|Fresh
The Disaster Artist is more about circumstance and the unexpected virtues of vanity projects than it is about who the people at its center really are. It still comes off as a wildly entertaining ride -- and one I'd happily take again.|Fresh
The Disaster Artist finds James Franco and brother Dave Franco homaging the world's worst movie with one of their bests.|Fresh
"Eventually wants to posit the ironic enthusiasm of The Room's midnight-movie fandom as a kind of ""validating moment"" for Wiseau and company - in effect, congratulating its makers and stars for being fans of The Room."|Fresh
The Room endures because there's nothing quite like it, and The Disaster Artist presents a delightful portrait of why the cult classic has absolutely no peers in the world of so-bad-it's-good cinema.|Fresh
Leave it to one of the most notorious 'best worst movies' to inspire something so entertaining.|Fresh
The film sticks the landing and provides a funny and sincere look at the making of The Room as well as the relationship between Wiseau and Sestero. But enough about that. Anyway, how's your sex lives?|Fresh
This is a hollow and condescending exercise that invites you to poke fun at something that was only fleetingly funny on an ironic level.|Rotten
Franco could have easily just played Wiseau's eccentricities for laughs, but he sheds a little light on the man, making the audience care about him.|Fresh
What begins as something so unfathomably absurd and truly hilarious becomes a surprisingly moving portrait of one man's unwavering love of filmmaking.|Fresh
Even if you haven't seen The Room, The Disaster Artist is still worth a viewing.|Fresh
After The Big Sick and Lady Bird, here is another remarkable tutorial for life delivered through the most outstanding of personalities and the most compact of films.|Fresh
The Disaster Artist causes so much pleasure it should be illegal in more conservative states.|Fresh
[Franco's] created a movie that craves the reaction Wiseau never wanted but received anyway.|Fresh
I loved every minute of this film...we go to the movies to see characters, and Tommy is a character, all right...|Fresh
The Disaster Artist is a love letter to The Room. The painstaking recreations of certain shots are fascinating to watch. Be sure to stay through the credits.|Fresh
The Disaster Artist is a love letter to The Room. The painstaking recreations of certain shots are fascinating to watch. Be sure to stay through the credits.|Fresh
"The Room falls under the category of ""so bad it's good."" The Disaster Artist, directed by James Franco, looks to capture everything that went wrong, and a few things that miraculously went right."|Fresh
More than a mere impersonation, Franco invests Wiseau with a naïve vulnerability that makes this potentially horrifying and definitely deluded would-be artist into a sympathetic human being desperate to share his art with the world.|Fresh
As a meta commentary on the misunderstood visionary, The Disaster Artist is a triumph. Yes, it's another of Franco's earnest forays, but this one works because it's so deeply personal.|Fresh
With solid direction and great performances from himself and the rest of his cast, this cinematic love letter to the best-worst movie ever made is one of the best of the year.|Fresh
I was simply struck by how lucky one wealthy, self-centered maniac got by gaining so much notoriety for something so lame. I think he inadvertently expressed something so raw and naked that it becomes watchable on another level.|Fresh
Overstays its welcome, and overplays the notion that Wiseau, though a chump, represents the true spirit of Hollywood dreams, but plenty of amusing moments.|Fresh
Along with being endlessly funny, this film is a singular look at the debilitating cycles of rejection, and the ways in which a life-long villain can look like a hero when peacocking in the right light.|Fresh
It is a bit odd to have such warm and fuzzy feelings about a film based on The Room, but there is a certain degree of affection for it.|Fresh
[The Disaster Artist] brings heart to a side of Tommy Wiseau and his fellow filmmakers that is not talked about enough...|Fresh
The result is one heck of a blast.|Fresh
Keeping the story structure familiar likely acts as a way for the film to stay grounded as it explores its weird subject and you see them coming clearly.|Fresh
The Room is wondrously mindless, whereas The Disaster Artist is just kind of dumb.|Rotten
Like everything James Franco directs, The Disaster Artist is a work of appropriation art.|Rotten
The Disaster Artist is an incredibly entertaining movie, and Franco delivers a rendition of Tommy Wiseau that is award worthy.|Fresh
...an intelligent comedy. [Full Review in Spanish]|Fresh
If the point was to show that Waseau was weird, the creators of this film achieve that point. However, you also have to wonder about the self-indulgence exhibited by James Franco.|Fresh
Overall, 'The Disaster Artist' is a triumph through and through.|Fresh
The Disaster Artist is a film absent of substantial dilemmas. [Full Review in Spanish]|Rotten
It is difficult to stop laughing. [Full Review in Spanish]|Fresh
The Disaster Artist ends up being almost the best possible movie about the worst movie of all time. [Full review in Spanish]|Fresh
...an entertaining comedy with striking drama. [Full Review in Spanish]|Fresh
[James Franco's] performance is, for long stretches, the most admirable of the film. [Full review in Spanish]|Fresh
Funnier than Ed Wood and costarring James' brother Dave Franco, it's the best buddy picture about bad filmmakers since Boogie Nights.|Fresh
The Franco brothers bring the same creative energy to their project that motivated Wiseau in his own endeavor. The difference is, they have talent.|Fresh
James Franco did a great job directing and starring in the movie...you appreciate the general mannerisms he has. He's not Daniel Day-Lewis, but he did a really good job.|Fresh
As an actor, Franco effectively appropriated the tics of the one-man-orchestra Wiseau, but the comedy ends on the side of condescension and the punishment of others. [Full review in Spanish]|Rotten
The story of Greg Sestero and Tommy Wiseau is quite special, and I don't regret experiencing it --at all-- either in book form, or through this excellent film. [Full Review in Spanish]|Fresh
Perfectly balances eccentricity, humor and respect. [Full review in Spanish]|Fresh
Extremely entertaining. [Full review in Spanish]|Fresh
A satirical look at bad filmmaking that is itself bad filmmaking. . .Wiseau and Sestero are both pitied and ridiculed. . .The Disaster Artist is being bizarrely acclaimed, proof that the idea of art has died in Hollywood.|Rotten
A desperate love letter to cinema that puts the stupidity and nonsense of many of our dreams right before our eyes. [Full Review in Spanish]|Fresh
The Disaster Artist is a comedy that is frequently laugh-out-loud funny. But it is also sympathetic towards Wiseau's insatiable desire to create, to find fame.|Fresh
There's a clear fondness for the subject matter here, a respect for the protagonists that goes beyond caricature, and an unexpected poignancy to the challenges.|Fresh
This is the kind of stranger-than-fiction gold that gets crazier the deeper you delve into it.|Fresh
James Franco brings out a moving 'bromance' from 'The Room' while celebrating the creative impulse over talent. [Full review in Spanish]|Fresh
...large swaths of The Disaster Artist completely fail to completely capture and sustain one's interest...|Rotten
"The Disaster Artist unfortunately takes Wiseau as seriously as he took himself during the filming of The Room, but at least it provides some insight as to why the ""worst movie"" ever made was created."|Fresh
The built-in level of affection and support between the two siblings lends the movie an extra layer of heart that helps keep The Disaster Artist from being the condescending hatchet job it could have become in many other directors' hands.|Fresh
The result is one of the best comedies of the year. [Full Review in Spanish]|Fresh
The Disaster Artist is arguably the most unlikely film about film-making in recent memory...resulting in one of the best comedies of the year.|Fresh
The Disaster Artist might just usher in the golden era of Tommy Wiseau. Naaht a bad film at all.|Fresh
It's a hilarious and at times heartwarming film about the lengths people will go to achieve their wildest dreams.|Fresh
This is the year's funniest film. I suspect that the more you know about how films are really made, the funnier this film will seem to you, and vice versa.|Fresh
A thoughtful, deeply humorous portrait of a man who wanted to make a movie in spite of the cynicism of others, and did so entirely on his terms - in this case, for far worse results than most.|Fresh
A very trivial and insubstantial character study.|Rotten
Franco feels the same affection and respect for Tommy that the tandem Tim Burton/Johnny Depp have for Ed Wood. [Full review in Spanish]|Fresh
The film alternates between embracing the individual viewer and the collective appreciation of bad, bad art, and while we are often laughing uproariously at the audacity of the story unfolding, there are moments of sadness where we fear we shouldn't.|Fresh
Anger and self-pity practically bleed off the screen in The Room, but The Disaster Artist only hints at what could have inspired such animus.|Fresh
"The movie condenses the complicated Wiseau-Sestero relationship into a broad ""two friends take on Hollywood"" narrative, robbing the story of so many of its eccentricities."|Rotten
Oxymoronic, Oscar-quality acting that's simultaneously godawful!|Fresh
The success of The Disaster Artist is less a thoughtful almost-adaptation and more a testament to one man and his quest for greatness - even if it means being the worst of the best.|Fresh
It feels unhealthily backward-looking to allow Franco to elevate Wiseau to a hero worth rooting for.|Rotten
Even viewers who haven't see The Room should be able to relate to this affectionate real-life shaggy-dog tale about dreamers, set in the shadow of Hollywood.|Fresh
The fiercely clever casting alone makes it worth the price of admission, but this is also the kind of movie that makes us fall in in love with cinema all over again. And it'll make you less afraid to admit your guilty pleasures.|Fresh
James Franco has made a wickedly funny and very good movie from the ruins of one of the worst ever made.|Fresh
It doesn't matter if you've seen The Room or not. You'll be laughing regardless at this truth is stranger than fiction tale.|Fresh
"Instead of being consistently funny, much of the film is downright cringeworthy. As a cautionary tale, ""The Disaster Artist"" succeeds, but as a comedy, it's more disturbing and subversive than a laugh riot."|Rotten
When Franco and Rogen show up in something together, good things tend to happen.|Fresh
Stacking the cast with a This is the End-style comedy ensemble, only to have them sit around commenting on Wisseau's follies like they were guests on a podcast, exposes the smugness at the movie's core.|Fresh
A wild true story about obsessively chasing a dream, finding a friend and yearning to belong, this Ed Wood-style effort will make you want to hurl spoons at the screen with sheer joy.|Fresh
Franco's film is disappointing and more than a little patronizing.|Rotten
The Disaster Artist is directed by James Franco, who also stars as Wiseau in a performance of fascinating weirdness.|Fresh
Please savor the irony that one of the worst movies ever made has inspired one of the best movies of 2017.|Fresh
As I laughed at The Disaster Artist, there's still a hint of sourness to the proceedings that made me feel crappy afterwards.It's easy to see that everyone involved has great affection for The Room, but I'm not sure that love carries over to Wiseau.|Rotten
Here's an enjoyable account of the daffy behind-the-scenes goings-on during the filming of the cult film 'The Room.'|Fresh
As with Ed Wood, which paid tribute to the director of Plan 9 From Outer Space - another film that does not deserve its reputation as one of the worst ever made - The Disaster Artist champions the value of persistence in the face of all odds.|Fresh
We may never know exactly what was going on in Tommy Wiseau's mind when he created one of the worst movies ever made, but The Disaster Artist is a valiant attempt at understanding just that.|Fresh
Franco leaves flattery behind and finds the authenticity of this man, pointing the way to a real shot at critical redemption for Wiseau and The Room.|Fresh
It's entertaining, if framed and cut a touch manically.|Fresh
The irony is that this farcical comedy just might win the Oscar Wiseau always coveted. I'm sure Wiseau will take credit for it if it happens. And we won't mind.|Fresh
James Franco and the entire Disaster Artist team have created a modern fable. Someone who went for their dream achieved it in the most unlikely way possible. We can all relate.|Fresh
That sunnier-than-truth finale suits The Disaster Artist's relentlessly cockeyed optimism. Franco doesn't ask viewers to reconsider bad art but to respect the artist behind it.|Fresh
The spiritual companion piece to Ed Wood, The Disaster Artist is another cheerful Hollywood-insider piece about a man whose ambitions far outweigh his expertise.|Fresh
Although the humour is Marmite, the story is good.|Fresh
Franco's portrayal of him is brilliant: obscured by prosthetics and that impenetrable accent, he digs deep into Tommy's complex and by no means unsympathetic personality, and never makes the mistake of letting his character in on the joke.|Fresh
The film is still just an ironist freak show, albeit one now enacted by Franco and his celebrity friends.|Rotten
The Disaster Artist is an endearing tale of friendship and chasing your dreams that packs a surprisingly poignant punch.|Fresh
The funniest bad movie ever made becomes a mildly amusing celebrity piss take with a few moments of shoe-horned conflict and plastic pathos.|Rotten
Director and star James Franco simply gets how to make a good film in equal measure to the ineptitude of Tommy Wiseau, whose classically bad movie becomes the subject of this very funny one.|Fresh
James Franco -- as we've never seen him before -- steals the show playing Tommy Wiseau in 'The Disaster Artist,' based on a true story.|Fresh
Good news, everyone: We found the role that James Franco was born to play.|Fresh
"Not ""only"" a good movie within a movie. [Full Review in Spanish]"|Fresh
Unlike its bosom buddy, Tim Burton's Ed Wood, it might be too niche a subject to resonate with mass audiences but it's evident Franco and crew are having a whale of a time.|Fresh
What do 'The Room' and The Disaster Artist have in common? An absolute dearth of insincerity.|Fresh
What distinguishes The Disaster Artist is that it celebrates drive and, much like an episode of American Pickers, turns trash into treasure.|Fresh
Franco's performance as Wiseau is an extreme, frightening, hair-tearingly bizarre and almost always hilarious feat of daring.|Fresh
Franco clearly has a whale of a time with Wiseau's punch-drunk accent, bizarre mannerisms and dada laugh; it's a staggering piece of mimicry.|Fresh
The Disaster Artist proves through its onslaught of ludicrous scenarios, that truth can sometimes be much stranger than fiction.|Fresh
Perhaps this one is just for the die-hard fans, burning to know how such a bad film was ever brought to life. Clearly, I'm not one of them.|Rotten
Taking a cue from Ed Wood, this loving portrait of a terrible filmmaker could have indulged in ridicule, but instead it's about passion and dedication.|Fresh
Why The Disaster Artist works so well is that it doesn't judge our reactions to it; the film is not in the slightest ironic or, as is fashionable these days, meta.|Fresh
"""The Disaster Artist,"" James Franco's charming love letter to one of the most fabulously awful movies ever, earns ""Hi Marks,"" indeed."|Fresh
I don't know if The Disaster Artist will rock your world, but I do know that I laughed at the comic touches that Franco, who also directed, brings to the subject of dismal failure.|Fresh
The Disaster Artist will remind of The Producers in places but there is another great movie that it also brings to mind - in Hollywood terms, it is the equivalent of This is Spinal Tap.|Fresh
"""The Disaster Artist,"" despite all its Hollywood cynicism, has quite a big heart."|Fresh
Seth Rogen steals the show as Sandy Schklair, a continuity expert who seems to be the only person involved with The Room who knows how a set or even real life works.|Fresh
It's difficult to cheer on Wiseau as an anti-hero when it's not clear exactly what, other than a vehicle for his own narcissism, he was championing.|Rotten
The Disaster Artist is an enormously entertaining look at film making dreams and the legacy that comes with making a truly terrible one.|Fresh
"Like Tim Burton's ""Ed Wood,"" ""The Room"" is both a movie that pokes fun at its subject and celebrates it, with an odd but strangely inspiring message: Do what you love. Even if you're terrible at it."|Fresh
"James Franco's story about filmmaker Tommy Wiseau, his friendship with aspiring actor Greg Sestero and Wiseau's making of his film, ""The Room,"" is funny, creepy and a most singular experience."|Fresh
Wiseau, The Room and the making of a celluloid catastrophe are the subjects of The Disaster Artist, a fabulous, strange and frequently hilarious comedy-drama from the self-styled polymath James Franco.|Fresh
"Some familiarity with ""The Room"" certainly enhances the humor here, but ""The Disaster Artist"" delivers its own inspired, often hysterical comedy."|Fresh
It's a benign salute to a midnight melodrama.|Fresh
As with Ed Wood, its nearest cinematic neighbour, you don't need to have seen its subject's work to get the surprisingly sweet-toned humour that comes mostly at a pseudo-auteur's expense.|Fresh
It might not be as amusing as discovering the mind-boggling awfulness of The Room for the first time, but it's a decent intro to the madness.|Fresh
If you strip the fiddly premise out, this is an immensely silly movie about an immensely silly person. Watch it. You'll be glad you did.|Fresh
It's smart and funny and knowing, and is propelled by a strong cast led by Franco himself and his brother Dave.|Fresh
[The Disaster Artist] will surprise you at exactly the moment you think you've got it figured out.|Fresh
The key to The Disaster Artist and Franco's success: he finds the heart and soul of the film. It's not difficult to predict what those things are, ultimately, but there will be no spoilers here. Go see it.|Fresh
While it doesn't match the brilliance of 'Ed Wood,' it's a mightily enjoyable, and equally affectionate, tribute to a misguided moviemaker.|Fresh
"If The Room is the ""Citizen Kane of bad movies,"" as it has notoriously been tagged, then The Disaster Artist, the story of the making of that film, is the shaggy-dog redemption story that it deserves."|Fresh
Disaster Artist is... a consistently funny film that has enough warmth to make it an ode to both friendship and the artistic spirit, in whatever direction they may take.|Fresh
Being able to avert disasters along the way in the service of capturing the nuances of interpersonal relationships is their artistic calling.|Fresh
The Disaster Artist should definitely first be seen in the theater, with a raucous crowd roaring with laughter. But later it should be seen at home where you can also observe the film's sneaky empathy and grace.|Fresh
"Like Tim Burton's classic ""Ed Wood,"" ""The Disaster Artist"" is a testament to the communal joy of movie-making. But more than that, it's an unforgettable appreciation of the pleasures of movie-watching."|Fresh
Both The Room and The Disaster Artist prove exceptions to the old adage that you can't polish a turd: while Wiseau saw his 'disasterpiece' evolve beyond his imagining, Franco, for his part, has spun tragicomic gold from the most tragic of base materials.|Fresh
"""The Disaster Artist"" is a lot of fun, even if some of it is uncomfortable. And of course it's way better than ""The Room."""|Fresh
This movie isn't just some Hollywood parody or inside joke. It takes Wiseau's humanity seriously and portrays him as a wounded individual who wanted to be an All-American James Dean-type hero and not the ogre or villain everyone else saw him as.|Fresh
Sincere and sporadically funny, The Disaster Artist is an endearing tribute to failing in Hollywood. Anyway, how is your sex life?|Fresh
It's The Room with a view from people with talent, sniggering with a veneer of generosity to save face.|Fresh
It'd be an absolute tragedy if it wasn't so funny...|Fresh
Funny and alarmingly factual.|Fresh
The Disaster Artist really hangs on James Franco's performance. He's an uncanny mimic of Wiseau's legendary accent and mannerisms, but what he really nails is Wiseau's complete lack of self-awareness.|Fresh
A fascinating glimpse into the genesis of one of Hollywood's worst releases and is worthy of a space alongside Ed Wood on the shelf for dreamers who succeeded because of a lack of self-awareness and an epic void of talent.|Fresh
... it is the enduring, infectiously unsettling weirdness of Tommy Wiseau which ultimately delivers one of the most amusing comedies of 2017.|Fresh
Like the hilariously inept melodrama of The Room itself, Tommy Wiseau offers Franco a gold mine of oddities.|Fresh
"""The Room,"" a movie that had audiences laughing AT the director is transformed into a laugh-out-loud film that has us laughing WITH the director."|Fresh
Superficially slick, yet schlocky, a muddled misadventure...|Rotten
Don't expect much new information to come to light if you've already read Sestero's book on which the film was based, though; despite a bravura performance from James Franco, Wiseau remains as inscrutable as ever.|Fresh
The side-by-side comparisons during the ending credits will leave you speechless if you're magically not already dead from laughing|Fresh
Imbued with his own divisive but wholly vivid personal mythology, James Franco is just as important character to The Disaster Artist as Tommy is.|Fresh
A good, shallow movie about a bad, shallow movie... Funny and highly energized.|Fresh
one of the year's best|Fresh
A hilarious ode to talentless passion. James Franco gives the bizarre Tommy Wiseau depth without solving his mystery, but skips a deserved zing at Hollywood.|Fresh
Franco gets credit for focusing every bit as much on the artist as the disaster - and for taking something most saw as trash and spinning it into something close to treasure.|Fresh
