This winner of Best Actor and Best Screenplay at Cannes observes a couple who dance around a stressful event without ever verbalizing their innermost thoughts, beautifully realized in Farhadi's closing shot|Fresh
This psychological drama about an Iranian man and his wife under emotional stress while staging a production of 'Death of a Salesman' wanders into some unexpected twists and turns.|Fresh
Bruising but elegant, conceptually intricate within a street-realist style, The Salesman asks through its final shots: when we stare at each other, do we see each other, or only ourselves?|Fresh
It's almost too tense to bear but Farhadi is a gifted storyteller, particularly with beginnings and endings.|Fresh
People caught in rapid change pour their hearts out. Is anybody listening?|Fresh
While The Salesman doesn't quite hit the emotional highs or deft narrative moves of his earlier films, it's certainly at least a worthy addition into his filmography.|Fresh
Revealing neorealistic drama about the human condition in modern Tehran.|Fresh
"Seeing as how ""Separation"" was a perfect film, Farhadi is on quite a roll."|Fresh
It's in this casual disregard for the wishes of women, and the complete misunderstanding of women by men, that is where the film finds greatest purchase.|Fresh
Farhadi's deliberate, dialogue-heavy drama allows for incredible work by his cast, particularly his two leads.|Fresh
As in A Separation, Farhadi privileges a woman's viewpoint without either sharing or exploring it.|Fresh
Creating tension that ratchets up in sly increments, Farhadi steers his narrative to a shattering conclusion about the quality of mercy and vengeance.|Fresh
'The Salesman' engages with the choices of its characters, and their consequences, with a particular urgency. That is Asghar Fahardi's gift, and it should not be undervalued.|Fresh
Given that The Salesman strives to be far more than a revenge thriller, Emad's story isn't enough to make it an unqualified triumph, but it's still a genuinely good film, and worth watching.|Fresh
The reliance on Arthur Miller's play feels like a bit of a reach, and the climax is more than a little manipulative. But Hosseini and Alidoosti find the truth of every scene.|Fresh
A minor Farhadi still is a Farhadi. That's enough. [Full review in Portuguese.]|Fresh
Profits from the strict decorums of Iranian cinema, and indeed of Iranian life, to mount serious reflections on guilt and shame, trust and forgiveness.|Fresh
Farhadi may hardly be reinventing himself, but his old tools serve him just fine.|Fresh
