Franco plays this fascinating outsider with a cheeky wink, making for a very funny character study of a man who marched to the beat of his own drum.|Fresh
James Franco shows less conviction than his muse, Tommy Wiseau.|Rotten
Even if you've never heard of The Room, what James Franco has to offer here a fantastic, hilarious true Hollywood story that is as phenomenal as its subject matter is awful.|Fresh
James Franco's all-over-the-place career hits its sweet spot with his hugely entertaining recreation of one Hollywood hopeful's master class in how not to make a movie.|Fresh
The comedy, for all its scenes of giddy wonder, never gets past Tommy's mask of mystery; avoiding speculation and investigation, it stays on the surface of his public and private shtick, leaving little more than a trail of amusing anecdotes.|Rotten
The most surprising aspect about this singular movie about a singular individual is its universal entertainment value.|Fresh
A great film and one of the must-sees for award season.|Fresh
The Disaster Artist is an indulgent salute to the cockeyed dreamers of the film world and softens its ridicule with a good measure of affection.|Fresh
This is a film with heart as well as humour.|Fresh
"James Franco hits all the right wrong notes in this hugely entertaining, true-life tale of Tommy Wiseau's 2003 ""disasterpiece"" film The Room."|Fresh
Tommy Wiseau is flat-out weird, even a tad scary, but Franco seldom fails to make his character's acute form of self-delusion charming and infectious.|Fresh
Sorry, must disagree with majority. This film is a frequently too boring film about boorish filmmaker with a lot of mystery money, Maybe as a five minute SNL skit. But as a feature, it's a drag.|Rotten
Hilarious... the film may be the best use to date of James Franco's off-kilter energy|Fresh
The Disaster Artist is a study in empathy and this year's darker, grittier answer to La La Land, peddling as it does in the dreams of Angeleno artists.|Fresh
The Disaster Artist has all the fascination of a train wreck and will be essential viewing for anyone at all interested in the current status of the film industry.|Fresh
Fans of The Room will find much to love here, but even if you've never heard of it, The Disaster Artist should delight.|Fresh
It's a professional and personal triumph for the reinvigorated Franco.|Fresh
The Disaster Artist misses its shot at greatness but it is still an enormously entertaining work that serves as a celebration of the artistic process.|Fresh
Even more impressively, Franco makes Wiseau, maybe the most unpleasant character he's ever played, someone you genuinely root for in his demented quest for greatness.|Fresh
As a filmmaker, Franco has often tended toward high or performance art... The Disaster Artist allows for both these Francos to shine.|Fresh
By channeling his inner Tommy Wiseau, James Franco manages to craft an intentional comedic sensation out of an unintentionally hilarious failure, The Disaster Artist rising to a level of genuine greatness that's astonishing.|Fresh
Entertaining enough but increasingly repetitive as it goes. (Full Content Review for Parents - Profanity, Nudity, etc. - also Available)|Fresh
Franco creates this heightened reality, almost like you've stepped into Bizarro World, where you're cheering for Tommy's movie to be as terrible as it possibly can be.|Fresh
A broad, winning adaptation of a fantastic book.|Fresh
Perhaps the greatest compliment one can pay Franco's The Disaster Artist is that it encourages audiences to laugh with Wiseau and his clueless cohorts rather than mock them.|Fresh
When I saw the end of this bizarre movie, I realized that I enjoyed it more than I thought I had. The additional few scenes shown after fade-out are pretty amazing and eye-opening. In fact it was those scenes that raised my rating considerably.|Fresh
Franco transforms Sestero's BTS memoir into a genuinely touching tale of two outsiders.|Fresh
The point is well taken - that both projects unapologetically deserve a place in the cinematic landscape, quality be damned.|Fresh
I can certainly imagine a director emerging from a screening of The Room filled with the fear that he's been making the same kind of movie this whole time. Maybe it just took a terrible movie to finally inspire James Franco to direct a good one.|Fresh
The Disaster Artist is a movie that supplements an excellent film and an entertaining book while not quite hitting either's mark, but it is entertaining.|Fresh
A galaxy of great guest stars adds comic coats of appalled disbelief as Tommy makes his movie every wrong way he possibly can - while Franco, off-camera, makes one of the weirdest and best films about a movie ever.|Fresh
It's also a reminder that Franco is a smart and funny performer with perverse comedic instincts that pay off constantly.|Fresh
By the end of The Disaster Artist, Wiseau is still a joke.|Rotten
Like watching a meme come to life.|Fresh
Not a lot unlike watching The Room itself...|Fresh
Franco's very funny movie meticulously re-creates The Room's most famously botched scenes, but shies away from its tortured soul.|Fresh
Funny, heartfelt and utterly bizarre.|Fresh
Franco gives Wiseau and his story the film he was not able to give himself.|Fresh
It's one of the best, touching and funniest films you'll see this year - Franco will have some way to go before he can top this one.|Fresh
On its own terms, The Disaster Artist is a funny movie.|Fresh
On one level it functions as a useful demolition job on the artist-as-savant myth that too many films and documentaries indulge, but on another it's a reminder that even bad art can spring from and inspire compelling human stories.|Fresh
Without the endorsement of real life, The Disaster Artist would tell a story far too weird to believe.|Fresh
The Disaster Artist has broad appeal because it's not just about making a movie, it's about believing in yourself against all odds.|Fresh
"So, to see the machinations behind it - the never-ending takes, the adding of the water bottle, Wiseau's commitment to ""real human behavior"" - gives depth to what, on the surface, appears purely trash."|Fresh
Franco follows the model of Tim Burton's biopic Ed Wood, approaching Wiseau with a delicate balance of affectionate mockery and a heartfelt appreciation for his creative passion.|Fresh
The old alchemist's trick of turning lead into gold has nothing on The Disaster Artist, a film that masters the trickier feat of transforming trash into art.|Fresh
There's something joyful about the Franco brothers playing a fun-house mirror version of their own Hollywood arrival, and the film's best scenes are with Rogen's production manager, aghast at Tommy's incompetence.|Fresh
The film is ... funny -- hilarious at points -- and an enlightening look at the production of one of the most infamous movies ever made.|Fresh
"Behind the camera is really where Franco flourishes, as there's a pace to ""The Disaster Artist"" that makes up it for its occasionally uneven and clunky structure."|Fresh
"Mr. Franco recreates the production of ""The Room"" - and the escalating behind-the-scenes nuttiness - with an assured, energetic touch ..."|Fresh
"Spelling out a joke may be the quickest way to kill it, but the obvious, expository nature of the mockery in ""The Disaster Artist"" doesn't make it any less funny or illuminating."|Fresh
The Disaster Artist is a truly, profoundly funny film. But it is also something more. There's a poignancy here and an insight into the necessary self-delusion that it takes to even imagine becoming a successful actor or film-maker.|Fresh
It's a film to see with an audience familiar with what it's about to see, with people who can appreciate the dedication with which Franco and co. have recreated so many of the original film's woeful scenes and performances.|Fresh
"There's a nagging feeling we should expect something more from this guy. To borrow the most quotable line of dialogue from The Room (bellowed at the top of the lungs): ""YOU ARE TEARING ME APART, FRANCO!"""|Fresh
"In a kooky yet vulnerable and heartfelt performance, Franco gets right at the heart of what makes Wiseau a true hero - his sheer willingness to try - and that is what makes ""The Disaster Artist"" work so well."|Fresh
"""The Disaster Artist"" is a breezy, entertaining and even affectionate movie about the making of ""The Room."""|Fresh
Perhaps Franco's two decades of résumé mongering has all along been in the service of harnessing the real freak he had inside all along.|Fresh
Both the book and the movie try to explain what makes The Room such a phenomenon, but Franco loses patience and takes a scalpel to the story.|Rotten
James Franco's very funny The Disaster Artist is possibly the best narrative film about an outsider filmmaker since Tim Burton's Ed Wood, and it's anchored by three wise choices.|Fresh
Given his own failed attempts at becoming an auteur, it is all too perfect that James Franco finally finds his muse, successfully humanizing one of cinema's few genuine eccentrics.|Fresh
The real genius of The Disaster Artist is its understanding of anti-genius.|Fresh
The Disaster Artist is still approximately 783 times better than the film it's lampooning. Intoxicating fun, it deserves to be on a double bill with The Room whenever the so-called 'Citizen Kane of bad movies' is shown.|Fresh
(James Franco's) team did a terrific job with the re-creation, and The Disaster Artist is a fun look at Hollywood dreams at their woolliest.|Fresh
"In the end, ""The Disaster Artist"" decides that the only bad movies are the ones that fail to bring us joy. ""The Room"" certainly can't be accused of that."|Fresh
"Should newcomers to this particular cinematic phenomenon see ""The Room"" first? Yes. Seeing ""The Disaster Artist"" is less crucial to their camp education."|Rotten
It's based on a true story, but you will shake your head in disbelief - in a good way.|Fresh
Director/star James Franco allows us to laugh at Wiseau's atrocious acting, incomprehensible direction and oddball vanity but also encourages us to respect his creative spirit.|Fresh
[An] entertaining, if weirdly incurious and incomplete true-life story.|Fresh
As an artist, Wiseau was a disaster. But what a mess he made.|Fresh
James Franco's film is a triumphant and uproarious comedy that celebrates flawed creators and their mistaken creations.|Fresh
Perhaps the biggest surprise about The Disaster Artist is how utterly sweet it is.|Fresh
A terrific film about a terrifically terrible one, The Disaster Artist is good-bad movie gold. Double bill alert!|Fresh
"""The Disaster Artist"" is a love letter to a freak, straddling the line between admiring and appalled."|Fresh
This sweet, affectionate (and unapologetically slight) comedy is an all-too-rare homage to harmless, hilarious incompetence, at a time when there is plenty of the more hurtful kind to go around.|Fresh
One of the funniest films I've seen in years ... epic chops as a faithful adaptation of an intriguing memoir, an odd-couple buddy movie, Tale of Hollywood, and meditation on ambition ... an honestly motivated biographical adaptation, not a piss-take.|Fresh
The Disaster Artist -- James Franco's hyphenated turn as star, producer and director -- deftly falls into that comedic pantheon, joining the likes of Ed Wood in making an entertaining movie about a truly terrible one.|Fresh
The Disaster Artist is funny from the beginning, but it becomes downright side-splitting once Tommy gets onto a film set.|Fresh
What Franco's performance brings out is a sense of emotional pain that's perhaps not obvious in the real Tommy Wiseau.|Fresh
It's a nice irony that one of the worst movies in recent history has enabled James Franco to make one of the best films in his own chequered career.|Fresh
A perfect recreation of Wiseau's very imperfect creation, and a celebration of anybody who ever made art - no matter how egregious.|Fresh
For something based around such an extraordinary phenomenon and involving such a remarkable real person, the film is ultimately rather ordinary and unoriginal.|Rotten
An ode to gloriously terrible filmmaking, with Franco turning in perhaps his best performance to date.|Fresh
An audacious high-wire act, a quirky tribute to outsiders everywhere and a celebration of a particularly bizarre moment in Hollywood-outsider footnote history.|Fresh
The Disaster Artist proves to be a hilarious and heartfelt tale of ambition, friendship, and the imponderable mind of creative force Tommy Wiseau, played here in astonishingly believable fashion by director James Franco.|Fresh
The Disaster Artist deserves to stand alongside Tim Burton's Ed Wood as an appreciation of someone whose creative enthusiasm somehow managed to shine through their total lack of talent.|Fresh
James Franco has placed enough links to the original film that his based-on-fact look at the making of The Room is weirdly fun on its own and one of the most creative films of the year.|Fresh
James Franco's affectionate take on [The Room's] bizarre creation may yet end up at the Academy Awards.|Fresh
[The Disaster Artist] is a wildly entertaining jaunt into the strange and wonderful world of independent filmmaking, and it's difficult to argue with that result.|Fresh
The result is a hysterical and loving tribute sure to generate just as much raucous cheering as one of The Room's urban midnight screenings.|Fresh
You could just look at this as one of the most seriously funny movies about movie making, but why stop there? Thanks to James Franco's canny eye, this love song to a film so bad it's good also delivers one of the best emotional surprises of the year.|Fresh
Whatever my queasiness about laughing at a head case, I couldn't help myself from thrilling to Franco's timing, his relish, his swan dive into an egotism that has no bottom.|Fresh
Director James Franco's enjoyable ode to the creative process - any creative process, really. It's also one of Franco's strongest roles as an actor, capturing every little quirk and quality of a definite eccentric.|Fresh
James Franco has turned one of the worst movies ever made into a great one. That's not merely the result of hard graft, skill and luck. That's straight-up alchemy.|Fresh
The Disaster Artist, which Franco directed and stars in, has to be one of the best and sweetest and funniest films about failure I've ever seen.|Fresh
A sense of gnawing inadequacy is a universal feeling, and The Disaster Artist certainly mines the notion that there's a little bit of the outsider in everybody - which is exactly the kind of magnanimity you'd expect.|Fresh
Painful, but it's positive, too. It's walking that line that takes The Disaster Artist beyond cringe comedy to an unexpectedly touching tribute to a 21st-century icon.|Fresh
James Franco is firing on all his creative cylinders in this comic bonanza about Tommy Wiseau, the worst filmmaker of the 21st century. Franco hits a new career peak by making sure his film is as heartfelt as it is hilarious.|Fresh
"For Franco, the opportunity to dramatize this prolonged agony of production is irresistible, and his wildly entertaining ""The Disaster Artist"" is a loving ode to the power of delusion."|Fresh
"... as actor Paul Scheer said at The Disaster Artist's Toronto Film Festival premiere, ""it's the perfect prequel for those who've never seen The Room and the perfect sequel for those who have""."|Fresh
James Franco goes behind the scenes of The Room, a legend in its own right, and offers some of his best work yet in The Disaster Artist.|Fresh
A big reason why The Room is so effective is that there is but one, confirmed, solitary individual on that set that doesn't understand the burning building around him: Tommy himself. But in The Disaster Artist, that essential straight-man doesn't exist.|Fresh
Oh hai, great movie! The Disaster Artist is a loving tribute to all those who dream big, even when everything seems to be going wrong.|Fresh
Good, but more clever than brilliant, more respectfully mocking than touching|Fresh
This is an absolute crowd-pleaser that will have you laughing harder than most studio comedies.|Fresh
James Franco directs the film with sensitivity and painstaking detail, and gives a fantastic performance as one of the worst filmmakers -- and one of the most unusual human beings -- ever.|Fresh
Franco does not make fun of Wiseau, on the contrary, he seems to have a certain fascination with the character. [Full review in Spanish]|Fresh
Know that you're in for a movie that flogs its fan service so vigorously (forget about a wink -- this is a squint), it barely remembers to be anything more than a mildly weird story of friendship and betrayal. Maybe that's all it needs to be.|Fresh
As a tagline for The Room once famously, falsely promised, The Disaster Artist burns with the passion of Tennessee Williams. As the subsequent tagline more honestly stated, experience this new black comedy; it's a riot.|Fresh
The hilarity and insanity will hook you, but the core of the film is male camaraderie and the indomitable spirit of an enigmatic 'auteur.'|Fresh
A breezy and occasionally gut-busting story of a clueless, striving industry hopeful whose desire for success is in inverse proportion to the tools he possesses to achieve it.|Fresh
The Disaster Artist exudes a more authentic understanding of the phenomenon. [Full review in Spanish]|Fresh
Rather than simply turn Tommy into a laughing stock, Franco teases out the tragicomedy of the man.|Fresh
Everything here depicting the making of Wiseau's magnum opus is detailed and hilarious.|Fresh
It features a genially goofy (and accurate) impersonation of Wiseau by Franco himself, plus irresistible interplay between the actor-director and his brother Dave Franco as Sestero, making this a genuinely moving bromance in every sense.|Fresh
Franco remains one of the most fascinating performers of his generation, even if his directing ability needs a little work.|Fresh
What could have been a parody, evolves into a touching celebration of the man behind the worst movie ever made. [Full review in Spanish]|Fresh
Inhabiting Wiseau's skin gives [James Franco] liberty to be as weird as he wants to be and it completely works. Even when Tommy's actions seem cruel, Franco's interpretation brims with sympathy.|Fresh
The Disaster Artist comes off a lot like Ed Wood or even American Splendor, as it feels like there's always multiple layers to what Franco is doing.|Fresh
Not just providing a one-note take on an enigmatic person, it captures unexpected layers that we never would have thought existed.|Fresh
The Disaster Artist perfectly communicates the surreal hell of what the original production of The Room must have been like.|Fresh
The Disaster Artist is a love letter to movies and the people who dream big enough to make them, even when they have no clue what they're doing.|Fresh
A hilarious love-letter to Tommy Wiseau. You don't have to have seen THE ROOM to enjoy it, but you - ya know - should.|Fresh
How did a story with this much potential get turned into something so unimaginative?|Rotten
The Disaster Artist makes a case for bad films everywhere by proving that some good (in this case great) can come from even the worst of them.|Fresh
James Franco pulls off what Tommy Wiseau only dreamed of.|Fresh
A triumphant story of friendship and a testament to the phrase 'go big or go home.'|Fresh
Franco's performance as Tommy Wiseau is a thing of beauty.|Fresh
The dazzle of the cast and the targeted in-jokes never take away from the film's core messaging about the importance of believing in one's own ability as an artist.|Fresh
Franco takes what could have easily been a parody and make Wiseau into a real, three-dimensional person who not only makes us laugh with all of his eccentricities, but also gets us to care about his loneliness and insecurities.|Fresh
"I'm not saying ""The Disaster Artist"" is the best movie you'll see this year, but it's certainly the most fun."|Fresh
The Disaster Artist is just a total delight.|Fresh
A shockingly poignant portrait of the jealousies that arise when the creative process goes haywire.|Fresh
Whether or not you actually like The Room is irrelevant; The Disaster Artist is its own giddy thing, and you don't have to force yourself to laugh.|Fresh
Franco brings his A game to this project and puts his heart and soul into the material.|Fresh
Franco wants to have his cake and eat it too, openly mocking Wiseau for his weirdness, then heralding him for his persistence and ability to embrace The Room's reputation.|Rotten
Conversely, The Disaster Artist - a new film about the making of The Room - is not only the rare example of a genuinely funny biopic, but a subtle meta-commentary on the state of cult filmmaking.|Fresh
Gives you context to start and really makes you feel like you've seen the best parts of The Room, although I'm told it's all great.|Fresh
Miraculously, the supporting players end up illuminating Wiseau's eccentricity instead of undercutting it.|Fresh
Nothing this great has ever come from something so bad. A career-best performance from James Franco.|Fresh
The Disaster artist is obscurest hilarity set to a filmmaker's struggle, all linked to James Franco's transformative performance as the mythical Tommy Wiseau.|Fresh
"It's James Franco's best performance since his Oscar-nominated turn in ""127 Hours"" and as a director it is nice to finally seem him embrace the comfort zone of comedy with enough cameos to rival Robert Altman's ""The Player."""|Fresh
It's a hilarious master class in self-referentiality, as well as an affectionate and reverential tribute to Tommy Wiseau and his mad creation.|Fresh
It may soon join Tim Burton's Ed Wood in the ranks of great movies about terrible movies.|Fresh
The Disaster Artist largely works because it brings us closer to Tommy while reveling in the same ingredients that have turned him into an icon.|Fresh
"[Boasts] a genuine capacity to delight, whether or not the audiences in question have seen ""The Room."""|Fresh
Strikes a giddy, winning balance between hilarity and heart.|Fresh
