"""An exceptionally rich psychological portrait of a woman, it's an enormously compassionate and sadly relevant film about misplaced blame and the often impossible demands of motherhood."""|Fresh
I like to imagine watching this chilling Australian horror film with late, great authors Shel Silverstein, Roald Dahl and Edward Gorey - all of whom would have relished its twisted children's storybook at the center of things.|Fresh
Simple, elemental horror, pretty well-executed.|Fresh
What really distinguishes The Babadook, however, is the metaphorical potency of its narrative.|Fresh
One of the smartest and most effective horror films in years.|Fresh
It's almost a shame it turns into a ghost movie at all, but not quite.|Fresh
This is a different kind of nail-biter that has less to do with demonic possession than with the renegade power of an untamed imagination.|Fresh
An engrossing Australian ghost story.|Fresh
Let a law be passed, requiring all horror films to be made by female directors.|Fresh
The Babadook is anything but predictable, unveiling a chilling tale with emotional depth, well developed characters, and intense, heart-pounding moments of terror.|Fresh
Intelligently presented creepy mood piece 'Old Dark House' horror thriller.|Fresh
Somehow, Kent takes these tried and true tropes, whacks them on the nose, and conjures something surprisingly eerie, Freudian and jittery.|Fresh
An oppressive experience that fills one with tension, causes the hairs to stand up, the fingers to curl and nails to dig into the upholstered arms of the chair.|Fresh
Using the imagery of German Expressionism and the creepy techniques of David Lynch, Kent has created a psychological horror which gradually shifts the ground beneath our feet.|Fresh
Jennifer Kent's debut excels at what you might call grief horror ... the ending finds a rare emotional realism in what could have been a run-of-the-mill creepshow.|Fresh
A solid (if derivative) little thriller...|Fresh
The Babadook promises many sleepless nights to come. Fresh, moving and hide-behind-your-coat scary this will undoubtedly be the standout horror film of 2014.|Fresh
A scary, stylish, beautifully acted and, for the most part, refreshingly original haunted house movie.|Fresh
An instant classic. Urgent yet compassionate, unyielding as well as frostily whimsical, the film transforms again and again as it cackles in the face of expectations.|Fresh
"To borrow a line from Pixar's Monsters Inc: ""We scare because we care."""|Fresh
What's been delivered here is a potent brew of psychological terror mixed with a genuinely spooky story, making The Babadook easily the best horror movie of recent years.|Fresh
Jennifer Kent's striking debut feature is a bold and intensely emotional psychological horror.|Fresh
The supernatural undercurrents are spooky, but the intimations of real-life traumas are still more disturbing.|Fresh
The Australian writer-director Jennifer Kent's bravura new horror pic combines subtlety and psychological depth with some very full-blooded shock tactics.|Fresh
"The vast majority, however, follow the ""baby in peril"" route most recently seen in the generic demon doll picture Annabelle. It's surprisingly rare for a film to tap into the genuinely scary things about parenting."|Fresh
This slow-burning Australian chiller is well-acted and often quite stylish but it feels awfully familiar and surprisingly tame by the time it reaches an anti-climax of an ending.|Rotten
Eerie and unsettling, this is a promising debut from an exciting new talent.|Fresh
Genuinely horrific and deeply scary in a way that draws on the most primal of emotions. A horror flick with rare emotional and psychological resonance.|Fresh
The film is a feast of inventive design emanating outwards from the book's pages, which suggest a collaboration between the Polish pop-up artist Jan Pienkowski and the morbid dreamscapes of Edward Gorey.|Fresh
The Babadook leaves behind it a satisfyingly toxic residue of fear.|Fresh
Kent's picture has all the requisite creepy atmosphere of your standard possessed-home flick, but its trump card is an almost unbearable dread.|Fresh
A haunting tale with deep wells of howling grief at its centre, this is one bedtime story that will stay with you for weeks. Sleep tight...|Fresh
An atmospheric psychological thriller which unfolds like a postnatally depressed Repulsion.|Fresh
One of the strongest, most effective horror films of recent years - with awards-quality lead work from Essie Davis, and a brilliantly designed new monster who could well become the break-out spook archetype of the decade.|Fresh
The Babadook is a brilliantly made, elegant horror film, with real psychological depth.|Fresh
The Babadook is a horror fable that's light on terror and heavy on whiny children, making for an uneven watch that squanders potential around far too many corners.|Rotten
I never believed that it would be a fable that ended in a moral, hard-won, rather than a fairytale with a happily ever after.|Fresh
it tells an unnerving, tragic tale of grief and guilt, of maternity and madness, of love and loss, while always sublimating its subtext to cellar or closet... it is beautifully told, giving untold horrors a true, anguished face.|Fresh
Skilfully directed, the film is perfectly poised between real and unreal and manages to be both emotionally rich and disturbingly creepy, remaining ambiguous to the end.|Fresh
The raw honesty which lies beneath this tale of loneliness, loss and coping mechanisms makes for emotionally impactful viewing, tinged with both sadness and hope.|Fresh
Similar in tone...to stylish spookers such as Mama and The Ring, The Babadook is highly proficient, tightly directed, armrest-clutching stuff made by people who know how to press the right buttons.|Fresh
The Babadook proves once again that an original and personal vision is the principal requisite for an interesting film, but in this case the director's work with two wonderful actors is crucial to the film's success.|Fresh
What I really liked about this film was the cohesiveness of the ideas in it and, I don't know, I just thought it was so finely pitched and intriguing from go to whoa.|Fresh
Jennifer Kent's clever, thoroughly satisfying and neatly unsettling debut feature is about a kind of haunting, but of who or what? This is the question that simmers throughout the film.|Fresh
I'm no fan of horror movies but this one delivers a convincingly powerful study in domestic havoc.|Fresh
Featuring both a gripping lead performance by Essie Davis and one of the most creepifying monsters to ever stalk your dreams, The Babadook sets a bar by which future local horror films will be measured.|Fresh
So much more interesting and idiosyncratic than most horror films (whether from Japan or Australia or America), The Babadook is original and compelling|Fresh
Creepy from the outset, Jennifer Kent's debut horror thriller has plenty going for it, from the unsettling mood created to a standout performance by Australian actress Essie Davis|Fresh
You may not believe in bogeymen, but you better believe The Babadook is the best Australian film in years.|Fresh
Essie Davis delivers the best performance of her career (thus far), an emotionally draining, physically demanding portrayal of a mothers love tested by demons both psychological and supernatural.|Fresh
Davis gives possibly the performance of her career in The Babadook, portraying this emotionally destroyed woman with an authenticity and honesty that is punishing to watch.|Fresh
The film works as great horror fiction thanks entirely to the believability afforded the protagonist's psychological state.|Fresh
The tension is real, the scares are genuine and the end product is a classic horror masterpiece that deserves a place among the greats.|Fresh
Its horrors go beyond any single raggedy phantom, reaching back to the primordial fear of death and loss: of a child, of a loved one, of one's own sense of self.|Fresh
Manages to deliver real, seat-grabbing jolts while also touching on more serious themes of loss, grief and other demons that can not be so easily vanquished.|Fresh
The Babadook is the best genre creature creation since the big black wolf-dog aliens from Attack the Block.|Fresh
...The Babadook is a smart, respectful horror that puts character and emotional issues first, yet never at the cost of a delightful and haunting fright.|Fresh
An impressively chilling exercise in old-school restraint.|Fresh
Throw in a few fresh images, great performances and enough creepy audio to have you fearing those dark corners again, and you have one entertaining and frightening experience in store.|Fresh
Who thinks up a film like The Babadook? Actress-turned-debuting-feature-director Jennifer Kent has the narrative chutzpah to show her entire hand in the pop-up story and then make us squirm as foretold events come true.|Fresh
With its whimsically ghoulish creation and frightfully real lead performances, The Babadook feels just like that actual nightmare you once had.|Fresh
