A three-dimensional microcosm of the millions of families denied their share of the American dream by a corrupt system that tends to only reward the rich.|Fresh
This is a story told with authenticity and power, helped along by its cast of newcomers.|Fresh
The Florida Project, despite its ability to marvel at the natural wonders that offset poverty-stricken circumstances, doesn't sugarcoat harsh realities.|Fresh
For all that kitschy beauty, I wouldn't want to spend one more minute with Moonee, here or anywhere else.|Rotten
One surprising thing about The Florida Project is how rife it is with hope, even as it's weighed down by the hapless, unsustainable situation of its protagonists.|Fresh
These people aren't living the American dream. They're barely making do. But still, The Florida Project suggests that our most precious relationships are held together with some undefinable, beautiful glue.|Fresh
It's film that'll make you wince at times, and you'll most likely not want to see twice, but seeing it once is an experience you'll not soon forget.|Fresh
This movie puts the wild, comic tales of resourceful poor kids into a frame, pulling back just enough to make it clear that the situation Moonee's in - while exciting - is untenable.|Fresh
The Florida Project is not just a downer, although parts of it are harrowing. The young lead actors are funny and vivacious, speaking with unaffected charisma and honesty.|Fresh
Alexis Zabe's rapturous cinematography reminds us that magic is where you find it. You don't need a golden ticket to Mickey's kingdom, although you can see it from here.|Fresh
Baker has made a surprisingly joyous film from this despairing situation...|Fresh
A fascinating look at lives lived on the fringe|Fresh
As Bobby, the saintly, suffering bastard who keeps order, Dafoe is like a new man.|Fresh
The sun-washed reality of The Florida Project, which concludes with a touch of poetry that might break you in two. It's not a happy ending, but it is, like the rest of the film, pretty much perfect.|Fresh
Dafoe delivers his finest performance in recent memory, bringing to levelheaded, unsanctimonious life a character who offers a glimmer of hope and caring within a world markedly short on both.|Fresh
The Florida Project may seem to have more episodes than a narrative through line, but that seems also true to the occupants of the Magic Kingdom, who believe they're simply in a transitional state while they're actually stuck in idle.|Fresh
Its humanist depiction of families on the fringe of society - an experience that is too often erased from the narrative we tell ourselves about the place where we live - makes it essential viewing.|Fresh
Dafoe has never had a role this warm and sweet, and he plays it for low-keyed honesty. The kids and the adults, some non-professionals, all become part of a bright purple beehive.|Fresh
Rarely in a movie will you want a character to succeed more than Moonee. Yet Baker doesn't sugarcoat the odds, which, despite eventual moments of real magic, remain long indeed.|Fresh
It may be impossible to overstate just how wonderful Willem Dafoe is in this film.|Fresh
"""The Florida Project"" is - in nerve, guts, heart, and mind - one of the finest films of 2017."|Fresh
... perfectly set up and disappointingly executed story about down-on-their-luck folks who call a motel in Orlando home.|Fresh
The Florida Project is perceptive to the charm and strength of character you can find in humble places.|Fresh
Dafoe's performance as Bobby is superb, a guardian angel for the 21st century.|Fresh
Baker & Bergoch's examination of the low class and welfare lifestyle in Florida is eye opening and at times hard to watch.|Fresh
A tattered tale about kids growing up in an American economy barely afloat offshore Florida's signature tourism mecca, making their own magic in the shadow of the Magic Kingdom.|Fresh
These characters are the detritus left behind by a 21st-century America with increasingly less room for the poor and undereducated. The Florida Project never looks at them with pity, only understanding and sympathy.|Fresh
The impression is a disturbing film of energy and compassion that left me with an inescapable sadness, from which director Baker offers no way out.|Fresh
As it stands, there's a greatness in it, but also stretches of emptiness. Still, this is an original piece of work, and no one who sees it will forget it.|Fresh
The Florida Project represents a new low in class condescension. . .[Director] Baker loves irresponsible, antisocial types, and his method is similarly undisciplined.|Rotten
The Florida Project is tonally playful while in fact being a wondrously sad piece of art.|Fresh
"Nothing ""HAPPENS"" in ""The Florida Project"" but lots of stuff ""happens"" as we live with Moonee, her mom and her friends in a world that is both modern and retro at once."|Fresh
There is no other film quite like it, this year or any other.|Fresh
Willem Dafoe knows from tortured roles (Platoon, The Last Temptation of Christ), but this creation -- a delicate blend of protector, fusspot and secret survivor -- is his richest, most lovable piece of work.|Fresh
This is a deeply humanist filmmaker, and he's sympathetic to these characters, flaws and all.|Fresh
Few movies about children capture the very essence of youth, the precious intersection of innocence and wonder that so often co-exists along the margins of a darker reality.|Fresh
The Florida Project is spattered with profound sadness, with moments of externalized, violent frustration at presumed helplessness, at practically being born into all this.|Fresh
Baker has imbued this whole terrific movie with a child's sense of discovery - the sort that can turn a decrepit, pastel corner of Orlando into a vibrant cinematic playground.|Fresh
It is because Baker views the world without blinders that the moments of lyricism in The Florida Project are so piercing. When a rainbow shows up in the sky, it's not just a rainbow; it's a benediction.|Fresh
The film ends on a fantastical note that is jarring in its change in tone, yet provocative in what it has to say...a humanistic work of art that lingers.|Fresh
The Florida Project is eye-opening, unconventional, sweet, scary, odd and heartbreaking. It's a fantastic movie, one I haven't stopped thinking about since I saw it.|Fresh
...a triumphant exercise in cinematic empathy that also serves as a subversive societal challenge.|Fresh
"...a style of filmmaking that feels almost like an Errol Morris documentary (""Vernon, Florida"" comes to mind). It's pretty magical."|Fresh
The Florida Project is one of this year's best films, a remarkable slice of life. If ever there were a sleeper deserving of wide recognition, this is it.|Fresh
The Florida Project is by no stretch an easy watch, but it's an incredibly rewarding one.|Fresh
Dafoe's sensitive performance anchors the movie's slippery adult world, and Baker builds a cinematic mood beautifully; the strip malls and swampland and buzzing cicadas on screen feel as real and tactile as the theater seat beneath you.|Fresh
Though Moonee's story may not have a Hollywood happy ending when she's grown and the world has been cruel, Baker has created an indomitable character who's at least got a fighting chance.|Fresh
It is impossible not to fall a little bit in love with The Florida Project.|Fresh
"The Florida Project achieves something rare and magical: presenting existence from the perspective of a young child while, at the same time, providing enough ""clues"" that viewers are able to decipher what's really going on."|Fresh
"All childhoods must come to an end, few of them as piercingly as the one in ""The Florida Project,"" Sean Baker's raw, exuberant and utterly captivating new movie."|Fresh
As in previous films, Mr. Baker mixes amateur and professional actors to exceptional effect.|Fresh
Director Sean Baker crafts one of the best and toughest films about childhood ever and gives a never-better Willem Dafoe a clear shot at an Oscar.|Fresh
To balance joy and desperation as gracefully as Mr. Baker does - to interweave giddiness and heartbreak - is no easy feat.|Fresh
Written and directed with rich texture by Sean Baker, The Florida Project, which just debuted at the New York Film Festival ahead of its release this week in theaters, is the latest in a vivid, intensely naturalistic new subgenre of white-trash cinema.|Fresh
The pleasure of The Florida Project is that we lose ourselves in Moonee's Eden: its aesthetics; its logic.|Fresh
The Florida Project is both radiant and unsentimental.|Fresh
... Dafoe's warm and generous performance is simply astonishing.|Fresh
This is a film of rare joy, even in its more unsparing moments, and the kind of film that should be seen by anybody who loves movies.|Fresh
Sean Baker's beautiful heartbreaker scratches just below the cheery lilac and bubblegum pink to expose the layers of privation festering in this sunshiny state.|Fresh
Shots are held just long enough for us to ponder all the details; strong closeups bring the characters' emotions uncomfortably near.|Fresh
Sean Baker's latest is a melancholy slice of wonder, viewed through our pint sized protagonist's eyes.|Fresh
The Florida Project lights us onto an authentic perspective, never shying away from the grime and sorrow of its world, but never making it the film's unyielding focal point, either.|Fresh
Baker's neo-realistic eye for humour, honesty and heartbreak has crafted a slow burn, potent commentary on America's struggling underclass.|Fresh
While Baker's previous movie, Tangerine, is a milestone in LGBTQ filmmaking, The Florida Project doesn't ring as true to life.|Rotten
Sean Baker's rollicking movie about kids running loose in a rundown Florida hotel starts as colorful entertainment and ends up as a portrait of how people fall through the cracks in modern America.|Fresh
"""The Florida Project's"" great find is Bria Vinaite, who seems to run the line between Taryn Manning's work in ""Hustle & Flow"" and Elisabeth Shue's hooker with a heart of gold in ""Leaving Las Vegas."""|Fresh
Harrowing and magical...one of the best pictures of 2017|Fresh
When Florida Project works, it works beautifully, but one never quite shakes the nagging feeling that this insistence on finding joy and momentary pleasure amidst hopelessness is the province of storytellers more privileged than their precarious subjects.|Fresh
When it hits, like a sudden thunderstorm after heat wave, the impact is astounding.|Fresh
As Moonee, Brooklynn Prince is a revelation. There's not a single artificial note in her performance, just raw charm.|Fresh
The story seems to be armed only with trivial vignettes, although I must confess that the protagonist's charisma ends up winning over the audience. [Full review in Spanish]|Fresh
Underneath the vibrancy of Moonee's spirit, Baker delivers a heavy-handed statement about the fraudulent hopes offered by Disney magic, and the way so many American dreams have been shattered.|Fresh
You come away better for having known this crew, a demographic that's sorely underrepresented on the screen.|Fresh
The Florida Project is one of this year's most warm, vibrant films.|Fresh
Sean Baker spends much of the film investing the minutia of the down-and-out lives within this little ecosystem with a bittersweet energy and significance.|Fresh
A film of small notes that combine to form something major, the kind of movie that sneaks up on you and sticks with you|Fresh
A magnificent look at the freewheeling wonder of childhood.|Fresh
A wonderful piece of filmmaking.|Fresh
Vividly shot in 35mm, The Florida Project continues Baker's insightful chronicling of society's underbelly.|Fresh
[Sean] Baker mostly crafts a tiny adventure of absorbing wonder.|Fresh
Sean Baker once again pulls us into a world we never thought we could fall in love with.|Fresh
Bring Advil. You'll need it.|Rotten
The Florida Project won't let us look away. Nor, given its brilliance, would we want to. Instead, we laugh, we watch silently, and we're challenged to stop simplifying people's lives so we can offer easy theoretical answers.|Fresh
Frenzied, colourful and heart-breaking, Sean Baker's The Florida Project is a remarkable feat of filmmaking.|Fresh
In an era with remarkable child actors in films such as 'Room' and 'Moonlight', Baker's ability to siphon such authentic performances is truly a marvel.|Fresh
Steeped in glorious colour under the warm glow of a Florida sun, Sean Baker's The Florida Project is as indelible and warm as it looks.|Fresh
Indeed, this struggle can feel like real life at times so it's a shame that no apparent effort has been made by the director to give the viewer cause to empathize.|Fresh
Beautiful, vibrant, heartfelt and hilarious.|Fresh
Sean Baker's follow-up to TANGERINE is a triumph on many levels.|Fresh
The Florida Project is very much its own pink plastic beast. It is one of the great films about childhood.|Fresh
A film with its own universe and fascinating, and a complaint - without underlining. [Full review in Spanish]|Fresh
Baker establish an antithetical parallelism between the concept of happiness of the first world children and the one of the misfits. [Full review in Spanish]|Fresh
The Florida Project is a work in a state of grace. [Full review in Spanish]|Fresh
Baker offers little hope, and the only certainty is that childhood, and innocence, always have an expiration date. [Full review in Spanish]|Fresh
The Florida Project completely turns the American dream and shows us the devastated backyard of Donald Trump's tacky America. [Full review in Spanish]|Fresh
The off-kilter, unusual, matter-of-fact observations from a very young child bring a fresh perspective, realism and humour to well-worn territory that too often drowns in pity, sentiment or demonisation.|Fresh
A truthful and sublimely bittersweet slice of life, tracing celebratory highs and lamentable lows on the outer economic edges of the Sunshine State.|Fresh
A remarkable study of poverty, family and personal responsibility, The Florida Project meticulously illustrates how life on the margins affects one impressionable six-year-old.|Fresh
As a filmmaker, Baker is a graceful neorealist voyeur who thrives on improvisation, and his storytelling, in The Florida Project, is mostly just a series of anecdotes. But that turns out to be enough.|Fresh
Things look grim for Halley and Moonee, but we can expect a lot from the people who brought their marvelous story to light.|Fresh
The Florida Project further cements Baker's status as one of the most innovative American directors working today, but he's also an essential advocate for the stories this country often doesn't get to see.|Fresh
The deceptive intelligence of The Florida Project is how immersive this bouncy-castle reality is while sitting exactly on top of the drawn-out, unremarked tragedy that is life on the margins of respectable, solvent society.|Fresh
A fabulous mosaic of one particular pocket of America's invisible homeless population - families living hand-to-mouth in motels originally designed to catch the tourist overspill from the flashy theme-park resorts across town.|Fresh
[A] brilliant, buoyant, and ultimately heart-wrenching film.|Fresh
