Its portrait of maternal exhaustion is intense and disturbing.|Fresh
A deftly inventive and psychologically charged horror story that trades on the ways in which the prospect of maternal failure can be just as fearsome a boogeyman as any monster under the bed.|Fresh
The film has a solid grasp on the mutable, but ever-present pain of loss.|Fresh
The line between terrifying reality and terrifying fantasy isn't so much blurred as altogether obliterated.|Fresh
This simple yet shiver-inducing tale, the auspicious feature debut of Australian writer/director Jennifer Kent, makes for one of the better horror movies of recent times.|Fresh
It presents grief as a demon, questions reality, and creeps out the viewer by making psychopathology seem like something that could happen to anybody.|Fresh
The Babadook is our worst fear and it clings to us in hopes to suck us dry of happiness and joy and love - the Babadook wants us to turn into everything that is wrong and evil in the world.|Fresh
Kent is smart to keep the deliciously charismatic Babadook as her trump card but the result is a story that never quite reaches the emotional complexity it aims for.|Fresh
... a non-stop ball of tension from beginning to end, the acting is freaking amazing, the creature F/X are great. I can't even express how surprised I was by this movie.|Fresh
The Babadook will stick with you. It is brilliantly done, imaginative horror that grips us where most of us live.|Fresh
The Babadook...is a brilliant manifestation of grief.|Fresh
The Babadook is an incredibly well-made movie, with each aspect of the film fitting neatly into an overall theme.|Fresh
It had amazing acting, a creative storyline, and it still was able to give me the heebie jeebies. It's a horror film with a deeper meaning about how people deal with grief after the death of a loved one.|Fresh
Silly name; very smart movie.|Fresh
I cannot recall a recent horror film that so effectively utilized sound editing to jolt the hairs on the back of your neck to attention.|Fresh
A horror movie we will be talking about for years to come.|Fresh
Rich in mental metaphor, the monster knocking at the door only exists from the power we give it.|Fresh
Almost everything about Jennifer Kent's film is powerful: the haunting music, the sharp visual sensibility (including phenomenal use of old TV clips), the tightening tension as Amelia's isolation grows.|Fresh
Kent knows what she's doing - possessed parents, sinister children and haunted homes - this is the stuff sleepless nights are made of.|Fresh
Jagged thrusts of dark humour pepper the scary stuff and will appeal to any less-than-perfect mother who has 'lost it' in the heat of the moment.|Fresh
Nestled deep within this teeny Australian thriller packs a simple yet profound message about what it often feels like to be a single parent, and even what it feels like to be the child of that parent.|Fresh
The filmmaker understands that things barely glimpsed are infinitely more terrifying than the monster in full view.|Fresh
The Babadook is very rich, and while it pulls on a number of other resources, it delivers its own unique aesthetic and storyline.|Fresh
It's become increasingly rare for horror films to make an effort to truly scare us these days, but Jennifer Kent's 'The Babadook' gets under the skin in ways that are both visceral and highly emotional.|Fresh
The Babadook's villains and victims are still running amok in my brain. I think they might be there for some time.|Fresh
While short on terror this is a brilliantly acted and powerful film about a mother facing her demons.|Fresh
For her first feature, Australian actress-turned-filmmaker Jennifer Kent creates a startlingly effective horror movie by combining serious scariness with some darkly evocative emotion.|Fresh
There are legitimate terrors here -- legitimate because, as any bleary-eyed parent will verify, they come from a real and terrible place. And for those who do enjoy at least some defiance of natural laws, The Babadook has that too.|Fresh
What's most terrifying about The Babadook is that Kent grounds a bizarre supernatural premise in very real feelings of anxiety and depression.|Fresh
Tell yourself it's only a story by all means, but you're still going to have to kiss the kids goodnight and then switch off the reading light.|Fresh
It's brilliantly acted, beautifully shot, has loads of tension and announces newcomer Jennifer Kent as a writer-director of real class and depth.|Fresh
It's as likely to thrill more casual horror audiences as it is to satisfy long-time aficionados of the genre. Given the time of year, I couldn't recommend it more.|Fresh
Where the film truly excels though is in its sound design. The Babadook is truly a film to see in a well equipped cinema.|Fresh
Rest assured, Jennifer Kent's debut more than lives up to the hype.|Fresh
I can't think of a movie since Rosemary's Baby which acknowledges the unspoken fears of motherhood with such humor, horror, and compassion.|Fresh
It's amazing what Kent manages to squeeze out of some of the most worn horror tropes in the book (in this case the literal book).|Fresh
It's an incredibly well made horror film, and Kent is superb at getting under the audience's skin.|Fresh
For all its otherworldly flourishes, it confirms that the most terrifying monsters are remarkably local -- domestic, even.|Fresh
The Babadook is the best horror movie I've seen in some time, because it works on all those emotional and psychological levels in addition to succeeding as a straight genre outing.|Fresh
It would be easy to call this a thinking person's horror film, but that would be to deny its many deliciously visceral moments of flesh-crawling terror.|Fresh
Davis gives one of the best performances you will see this, or in any other, year.|Fresh
Writer/director Jennifer Kent has crafted a masterfully scary movie that relies on sound design and a claustrophobic atmosphere to build tension to nearly unbearable heights.|Fresh
The style of the film is not teasing exactly -- it's too sad and lonely -- but there is certainly a hair-pulling mixture of glum laughter and vast apprehension. Is the demon real? Does it matter?|Fresh
The Babadook and his escalating presence in this exacerbated single-parent family are very scary indeed, however metaphorical they may be.|Fresh
It's an intriguing and welcome change from the hellish Hollywood formulas. Where was this Down-Under boogeyman a month ago, when we needed him, for Halloween?|Fresh
While it's not exactly fun, it's deeply meaningful, which I guess is the whole point of art anyways(?).|Fresh
Jennifer Kent's debut is an assured chiller that successfully piles on the dread, thanks to great casting and the creepy-as-all-hell character of the title.|Fresh
Cheap scares are refreshingly absent... It turns out they're not needed when you can drop temperatures effectively by way of precision ratchet clicks in tension, excellent sound design and chilling allegorical nods to the monsters within.|Fresh
A considerate, weird, lingering psychological horror, The Babadook is a must-watch this Halloween.|Fresh
The Babadook is a worthy addition to the psycho-horror genre.|Fresh
Jennifer Kent's feature is beautifully made and cleverly filmed and paced. It's one of the most satisfying horror films I've seen in a while, and ends on a refreshingly original note.|Fresh
The Babadook is as accessible as any number of less accomplished ghost stories -- and more genuinely unsettling for its portrait of parent and child locked in mutual but potentially conquerable hell.|Fresh
The proceeding thrills are economically constructed but extremely effective.|Fresh
Kent is tapping into something far more unnerving than serial killers or the supernatural: the everyday terror of being a parent.|Fresh
This isn't to say it's only about how disturbing it can be to be a mom; it's also not only about how difficult it can be to be a mom to a child who reminds you each day of your most dire trauma... The film is also about institutions that fail to serve.|Fresh
Rarely outside of drama do we see the kind of imperfect motherhood shown in The Babadook, which is what makes this Repulsion-like household of horrors so frightening.|Fresh
Come for the dread, stay for the subtext, and top it all off with a little nightlight shopping on Amazon.|Fresh
The Babadook, one of the best and most original horror films in years, raises goosebumps with old-fashioned scares, relatable characters, and a provocative psychological foundation.|Fresh
Strikingly evoking a sense of dread in the most every-day and well-lit places, Kent's accomplished effort is built around Davis' tremendous turn.|Fresh
[Writer/director Jennifer Kent] skillfully keeps us locked into the moment-by-moment thrills of a monster movie, but also insists that this Babadook is clearly a stand-in for the other problems that inflict the lonely household.|Fresh
The Babadook lures you in with the familiar childhood fears about something lurking under your bed but delivers something fresh and even surprising.|Fresh
Full of great little touches that add up to a whole lot, and a wonderful reminder that one need not re-invent the wheel to create a quality horror movie.|Fresh
The Babadook doesn't just introduce a new horror classic to audiences. It also marks the assured feature debut of Jennifer Kent.|Fresh
It won't rewrite the book on horror movies, but it offers a fun chapter.|Fresh
The Babadook descends to the truly horrific when you begin to see it as the literary manifestation of insomniac's murder fantasy.|Fresh
A stirring little piece of psychological drama in which all the optimism and joyful human interactions have been stripped away, leaving behind only the negative extremes.|Fresh
... one of the best and most original horror films in years, raises goosebumps with old-fashioned scares, relatable characters, and a provocative psychological foundation.|Fresh
"If you are brave enough to watch this low-budget gem from Australia, then you'll know it's a ""special kind"" of scary."|Fresh
Making a significant feature-film debut as both director and writer, Jennifer Kent has fashioned a psychological drama that's ultimately more about real-world terrors than about the types of monsters that reside in the closet or under the bed.|Fresh
The Babadook will trap you in its pages with its compelling performances. but like every kid's book, your happy ending is waiting for you on the last page.|Fresh
...essentially a two-hander about a mother and child, with the film's supernatural aspects serving to amplify aspects of that relationship.|Fresh
[Blu-ray Review] Superlative picture, skin-crawling audio courtesy of Mister Babadook himself, and a slew of special features delving into the project's creation add up to a must-own release.|Fresh
The Babadook may overplay its hand, but it's still a harrowing tale of a mother-son haunting that manages to uncomfortably detonate several theoretically reassuring parental platitudes. Probably not the ideal gift for Mother's Day.|Fresh
Writer-director Jennifer Kent eschews most horror conventions in favour of wholly original visuals and resonant human drama, abetted by a very powerful performance by Davis.|Fresh
If you go to see The Babadook, be sure to have your wits about you. This movie will scare you out of them.|Fresh
"At its heart, ""The Babadook"" is a story of mother and son, whose relationship ultimately determines whether they survive the demon - or die trying."|Fresh
When the film turns horrifying, The Babadook deftly negotiates the thin line between a well-handled metaphor and a hamfisted one and never strays from the right side of it.|Fresh
In the running with Boyhood as my favorite movie of 2014 is another work that turns on the challenges of parenting. This one is a tad more insane.|Fresh
As someone who has developed a pretty thick Critic's Shield from years of watching standard haunted house/possessed human/mythological-creature fare, I have to say I was genuinely freaked out by some of the passages in The Badabook.|Fresh
Tthrowback horror picture that grips us with pounding in the night, startling effects such as the appearance of roaches and pools of black blood, and lightning-flash manifestations of the supernatural.|Fresh
It's incredibly chilling, but the horror doesn't take away from the raw emotion of a mother struggling against herself and stuck between connecting with her child or hurting him.|Fresh
The direction is plain and demonstrative, emphasising the isolation and confinement of the characters in a world (and specifically a home) that seems to have turned against them.|Fresh
The Babadook is a stunning feature film debut for writer-director Jennifer Kent, who lends humanity to the genre without sacrificing the creep factor.|Fresh
It's a movie that uses dread and suspense, not cheap jump scares. It's also a movie that unsettles with deep psychological unpleasantness. And it's got a pretty killer title, as well.|Fresh
The Australian thriller The Babadook is one of the most terrifying horror movies this year, because it roots its shocks in the most primal of emotions: mother love.|Fresh
Boasting brilliant performances from the two leads, it will be the cause of many a nightmare.|Fresh
The Babadook is easily the best horror film of 2014. But bolstered by knockout performances, and a mind-bending narrative beautifully shot and colored, The Babadook is so much more. It's one of the best films of the year.|Fresh
The Babadook frightens because it feels true.|Fresh
A haunting masterpiece of psychological horror, claustrophobia and paranoia in the vein of Roman Polanski's Rosemary's Baby and The Tenant, Stanley Kubrick's The Shining and William Friedkin's The Exorcist.|Fresh
The Babadook makes a convincing argument for classy, psychological horror cinema even as it fails to meet its own lofty standard.|Rotten
Few male directors could've conveyed Amelia's wretched state without making her seem hideous or shown Sam's deep anger without making him unlikable. Kent has done both and left us to decide exactly what we think about this troubled [relationship].|Fresh
The best horror movie I've seen in a very, very long time.|Fresh
About halfway through, I grabbed my notes and moved to the back row of the theater, because the empty seats behind me were creeping me out. By the end of the movie, I was wishing I could turn the lights on.|Fresh
Jennifer Kent's tremendously atmospheric and creepy horror comes highly recommended for those who like complex characterisation and ambiguity with their thrills and chills.|Fresh
The imminence of both half-term and Halloween certainly makes for a varied batch of releases, with The Babadook firmly at the scary end of the spectrum. It is properly chilling.|Fresh
"It's very personal, and it plays on the very real fears and anxieties of parenthood in a way that never feels ""cool,"" but that always feels authentic."|Fresh
A supernatural fairy tale with real humanity, The Babadook is a resounding success. If you hear him knocking, be sure to let Mister Babadook in.|Fresh
The Babadook doesn't just tower over this year's other fright films: It's one of the most emotionally affecting pieces of macabre cinema in years.|Fresh
In this fickle genre, the recently released Jennifer Kent-directed Australian film The Babadook offers hope and reminds us that classic suspense is still alive.|Fresh
Finally, a good horror movie with scary thrills, but also ambiguity and psychological subtext|Fresh
This Australian thriller is refreshing because it smartly generates its chills from true psychological horrors rather than jump scares or technical gimmicks.|Fresh
"An elegant little horror film reminiscent of Roman Polanski's ""apartment trilogy"" ... albeit minus Polanski's kinky male gaze."|Fresh
"""The Babadook,"" a small but inventive and seriously chilling horror story, is a monsterpiece."|Fresh
The film strives for horror in the way of The Shining or Silence of the Lambs, but it's more like Annabelle with better cinematography, which isn't a compliment.|Rotten
"""Babadook"" an Impressive Calling Card"|Fresh
... a minor masterpiece of the macabre ... Be afraid, be very afraid: the Babadook is more than a Down Under Freddy Krueger ... Reminds us that the real monsters under the bed are Mommy and Daddy.|Fresh
"""The Babadook"" is a well constructed character study, but may fail to creep out some jaded horror lovers."|Fresh
While The Babadook is a well-crafted, insightful, and overall excellent film, it's not going to be for everyone.|Fresh
Smart, emotional, intelligent and above all terrifying, it's the sort of film that keeps you wondering, the sort that will delight horror fans and might even convert a fencesitter to the genre.|Fresh
This is a dark and shivery story about motherhood, a common subject for horror movies, but one that's rarely treated with such intelligence or seriousness of intent.|Fresh
This movie is the glass in the soup, the big bad wolf under the bed.|Fresh
"Kent has taste, an eye and a knack for brisk, accelerated pacing. In the case of ""The Babadook,"" familiarity breeds an eerily gratifying contentment."|Fresh
Suggests the pressures faced by working women can be more harrowing than any horror movie...|Fresh
Director Jennifer Kent's first feature is one of the best debuts, and scariest films, of the year.|Fresh
Writer-director Jennifer Kent lets the dread creep in slowly, and wisely goes easy on the effects; she knows that hand-drawn pop-ups can be more than enough to unsettle things|Fresh
An extraordinary film that taps into the fears of both childhood and adulthood.|Fresh
Jennifer Kent's startling debut is an artful horror-chiller that gets under your skin and into your psyche.|Fresh
It's an impressive benchmark in the genre and a most powerful debut.|Fresh
Thanks to its deft melding of psychological and physical terror, as well as its unwillingness to rely on cheap tricks, Jennifer Kent's debut feature is a triumph.|Fresh
Credit writer-director Jennifer Kent for lending her Australian indie a healthy dose of brains and subtlety, giving it a distinct advantage over most modern horror films.|Fresh
We can't help but follow because we empathize with every character -- even the big black sharp-fingered monster that pops up from the dark depths of the subconscious to wreak havoc in the supposed safety of daylight.|Fresh
as dramatically compelling as it is scary (and it is, indeed, very scary)|Fresh
I don't scare easily. This one freaked me out.|Fresh
"With its mixture of frights both literal and literary, ""The Babadook"" will, I suspect, satisfy horror's devotees as much as the genre's doubters."|Fresh
This is a really scary movie.|Fresh
Kent knows that maternal madness is a subject for prime cinematic terror. Either placidly succumbing to insanity with heavy eyelids and a half-smile, or roaring, caught in its vortex, the brave Essie Davis is completely convincing.|Fresh
This film is a fresh combination of familiar horror elements.|Fresh
Calling it the best horror picture of the year -- though it is -- does it a grave disservice, since it is, in fact, one of the best horror films of our relatively young century.|Fresh
The Babadook, for all its primal borrowing from other movies, is first and foremost a Jennifer Kent film, and it's great. She's burned her influences, and the result is indelible, and toxic and scalding and scarifying and terrific to the touch.|Fresh
Writer/director Jennifer Kent has created a modern horror masterpiece in this film. It is about as creepy as creepy can get.|Fresh
One of the best horror movies to come along in years.|Fresh
Sometimes you go to a movie and know from the first image that whoever made it knows what she's doing. You don't need convincing. You're there with her. Jennifer Kent's The Babadook is like that.|Fresh
The Shining in miniature. If Sylvia Plath made a horror film, this would be it.|Fresh
It wants to get to the core of our fears: the ones that don't need a fright mask to keep us up at night.|Fresh
Director Kent has made the kind of striking film that is going to have mainstream Hollywood haunting her like a Babadook in a bad mood. For the sake of her idiosyncratic vision, let's hope she doesn't frighten easily.|Fresh
Director Jennifer Kent's first outing as a horror director is a downright flawless effort...|Fresh
The Babadook is without a doubt the most thrilling and satisfying horror film of the year. Its thick, gloomy atmosphere and remarkable performance from Essie Davis certifies the long lasting significance of a terrific cinematic experience.|Fresh
Reminiscent of German Expressionist horror films-The Cabinet of Dr. Caligari in particular-Mister Babadook himself is a masterpiece of design and implementation.|Fresh
...about the dark side that any bone-weary parent can sometimes feel creeping up within.|Fresh
"What makes ""The Babadook"" great is the depth in which it sinks its fangs into human emotion, particularly the way we grieve. Keeping the pain bottled up can literally kill you. But facing it and learning to tame it, live with it, can be liberating."|Fresh
No matter how successful The Babadook turns out to be - and Jennifer Kent's horror story deserves all the success it gets - the prospects of a best-selling kid-lit tie-in don't look good.|Fresh
No one likes to think there are limits to a parent's love, especially a mother's - tricky but fertile territory for horror, explored here by first time (!) writer-director Jennifer Kent.|Fresh
A potent journey through the fears, anxieties, and repressed rages of motherhood.|Fresh
"Shot in chilly shades of blue, ""The Babadook"" will haunt anyone who's ever heard a cry in the night - or wondered what was under the bed, in the dark."|Fresh
Australian writer/director Jennifer Kent makes a stunningly assured feature filmmaking debut with this unnerving thriller.|Fresh
There's a grand divide between what Kent has done here and what most of us consider horror. You'll spend your first week after the experience sleeping with the lights on. You will also come away enriched and provoked.|Fresh
It's rare that you get a good, new movie monster.|Fresh
Deeply unsettling, thanks to Essie Davis' gradually more unhinged performance and writer-director Jennifer Kent's emphasis on atmosphere over quick scares.|Fresh
Forget Insidious and its ilk, The Babadook is where it's at for supernatural horror in the home.|Fresh
"Writer-director Jennifer Kent's domestic-horror movie The Babadook satisfyingly pierces the obscene sanctification of ""mommyhood"" -- a pathological mandate that seems to have become an irreversible cultural imperative."|Fresh
The Babadook burrows under your skin, continually prodding you with increasingly disturbing ideas. You don't just walk away from this movie; it follows you.|Fresh
An intense, terrifying indie horror film with more on its mind than scaring its audience.|Fresh
Kent's debut feature combines the bumps and creaks of the classic haunted-house movie with the visceral kick of Australian exploitation films.|Fresh
An expressionist masterpiece that engages with personal concerns in a fashion that is terrifying and emotional. It will one day be ranked in the pantheon of horror classics|Fresh
The disturbingly realistic performance from Essie Davis as a mom out of her depth makes The Babadook one of the most chilling horror stories of the past few years.|Fresh
Still capable of sending viewers into watch-through-fingers mode. That it has substance and understanding of real-world dread is merely icing on the cake.|Fresh
The finest and most genuinely provocative horror movie to emerge in this still very-new century.|Fresh
The Babadook makes everyday domestic life seem like the most natural possible place to encounter monsters of every description, including the monsters that we ourselves have the capacity to become.|Fresh
The Babadook makes the most of its special effects as needed, but this smart little frightener keeps its head close to the rising anxiety of a young widow whose husband died a violent death.|Fresh
You will be scared. And also, perhaps even more scarily, moved.|Fresh
Although the supernatural seems the likeliest answer, it's not the only one, and audiences can read the film either way.|Fresh
The film's scares rely on the unknown, and Kent shows a great deal of restraint in avoiding the typical tactics of the genre...|Fresh
One of the best scary movies in a decade... presenting a completely unnerving spooky story about one of contemporary horror's most deliciously-expressed monsters|Fresh
With The Babadook, Kent has created an iconic boogeyman and an intense psychological horror film that cuts to the core of actual human grief and tragedy by way of the fantastic|Fresh
A small film that packs a horribly big punch.|Fresh
"""The Babadook"" is a smart, darkly drawn modern-day horror movie of monsters, memories and mothers."|Fresh
The Babadook is a film that Val Lewton and Jacques Tourneur, screen horror's high priests of the unseen, would approve of.|Fresh
In an age when horror movies have mostly become lazy and toothless, here's one with ambition and bite.|Fresh
This psychological thriller from gifted first-time filmmaker Jennifer Kent will have you climbing the walls simply by plumbing the violence of the mind. Brace yourself.|Fresh
Thick with atmosphere and rife with foreboding happenings, The Babadook is one of the best horror films so far this decade.|Fresh
It's the most horror I've felt at a horror film since Neil Marshall's The Descent, one where the scares don't release the tension - they harrow.|Fresh
The Babadook knows your true fear - having a kid who sucks|Fresh
