A terrific and funny summer adventure.|Fresh
"This is how good ""Toy Story 3"" is: Even the ending credits have more story arc, more emotional resonance, than many other movies have in their entire running time."|Fresh
In execution, entertainment value and integrity, the latest Pixar animated feature vastly outdoes the live-action summer movie fare that surrounds it.|Fresh
If the first half is uncertain, the second is flat brilliant.|Fresh
Both a paean and a monument to creativity and the love of things that bring us joy. Please reward the studio for giving us the best.|Fresh
Adults, especially those who had -- or still have -- a favorite toy will grasp the poignancy underlying the entire feature.|Fresh
I confess: I had to steel myself as if I were preparing for a punch in the face to keep from bawling like a baby during 'Toy Story 3' (which, among many other things, is a very witty spoof of the classic Hollywood prison movie).|Fresh
Can we put Pixar in charge of every movie sequel?|Fresh
In the cleverly entertaining Toy Story 3, Ken is confused and superficial, and also pretty fabulous.|Fresh
A loving, nostalgic, heartfelt treat for the kid in all of us, 'Toy Story' may be the most treasured animated trilogy of all time.|Fresh
is as close to moviemaking perfection as you could possibly ask for and easily stands as not just the summer's best film, but an easy favorite for the year's best as well.|Fresh
As Lotso, Ned Beatty offers the most compelling portrait of avuncular villainy since, well, Ned Beatty in Network, and Michael Keaton's Ken is the quintessence of himbo-ism.|Fresh
TS3 is so much more than mere child's play: a poignant, funny and sometimes surprisingly disquieting experience. Pixar has once again flown to infinity ... and beyond.|Fresh
Toy Story 3 may not be a masterpiece, but it still had me in tears at the end.|Fresh
A bona fide summer delight loaded with action, humor, nostalgia, a veritable blizzard of pop-culture references and general good vibes.|Fresh
My advice? Bring a tissue.|Fresh
Dare I say that Toy Story 3 is a perfect film? Pixar, yet again, delivers a brilliant film that will make you laugh, cheer and even shed a few tears. Bravo!|Fresh
It's a soulful movie, but it's also very nearly as funny as the earlier Toy movies are.|Fresh
A fitting capstone to a landmark series of animated films.|Fresh
The Toy Story saga comes full circle with an installment that's easily as compelling and consistently involving as both Toy Story and Toy Story 2...|Fresh
The third time isn't exactly the charm for this friendly series of films, but this next step in the evolution of Buzz and Woody is dutifully manic and frequently engaging.|Fresh
A true circle of life that may end as the credits roll here but, as all good souls do, finds a way to begin again in a film that is every bit as wonderful as its predecessors.|Fresh
It's a sequel. It's in 3-D. It has no kiddie-flick competition. Really, how good does it have to be? Apparently, as good as Pixar can make it.|Fresh
"This third installment co-scripted by Michael Arndt (""Little Miss Sunshine"") turns out to be a surprisingly dark evocation of Steven Spielberg's ""A.I.: Artificial Intelligence"" (2001), readdressing the fear-of-abandonment theme, and it has several chuckle"|Fresh
A Pixar film is the closest thing you have to a guarantee in Hollywood. Name even one other cinematic enterprise in which you can take your seat, brazenly certain of complete fulfillment.|Fresh
Toy Story 2 remains the high-water mark, but in this finale Pixar once again reaches for the sky.|Fresh
How does Pixar keep doing it? I think it's voodoo; does anyone else think it's voodoo?|Fresh
I seem to be defending each issue with a surprising amount of forgiveness. Maybe it's one of those amazing conundrums where you love the stuff it does, but you hate how it gets there, and you're stuck with this push-pull of pleasure and remorse.|Fresh
There's a saying, not often heard in Hollywood: Third time's the charm...Fortunately, Toy Story has had a nice long rest -- it's been 11 years since part two -- while its makers at Pixar have kept in shape with a string of seven hits.|Fresh
I don't want to oversell it, but Toy Story 3 is the single greatest thing mankind has ever produced.|Fresh
These characters, this story, has matured at arguably the same rate as each installment as hit theatres, the level of insight to be found bordering on the breathtaking.|Fresh
If in singing the film's praises one can do no more than follow a familiar hymn sheet, so be it. Like their plastic space ranger, Pixar is a company prepared to reach infinity and beyond, and there's little sense arguing with such lofty ambition.|Fresh
... if there is a word more complimentary than perfect I would have used it, but I can't come up with one. Wait, now that I think about it, maybe masterpiece is that word. Yep, that will suffice. Toy Story 3 is an absolute masterpiece.|Fresh
A worthy finale to a fantastic franchise.|Fresh
This is a highly entertaining, mega enjoyable and extremely well-made pic. (Parental Review also Available)|Fresh
The Pixar team can combine storytelling, art, and emotion into a movie that still surprises and delights the audience whether they are 4-years old or 94-years old.|Fresh
Their last playtime, an emotionally potent assertion of the importance of memory and the ongoing cycle of childhood wonderment, has come, and it has been a joyful dance.|Fresh
A work so effortlessly charming and emotionally powerful that viewers will find their faith in the power and glory of film at least temporarily restored.|Fresh
"Smart, funny ""threequel"" a little scarier than first two."|Fresh
The ending is the best scene in the best movie of the year, a deeply moving smiling-through-tears moment that I won't soon forget.|Fresh
A fine family film with an edifying tale, endearing and funny characters, and an appealing emotional undertow.|Fresh
"While the 3D ""Toy Story 3"" isn't utter perfection, as the first two films were, it is a welcome reunion with old friends, often funny and eventually quite moving."|Fresh
...one of Pixar's top-three finest works and, if the Academy does what is right, a surefire Best Picture candidate.|Fresh
The characters have always shown their feelings, but this time around, they show heart, and it makes for the most emotionally satisfying Toy Story of the bunch.|Fresh
"The oft-misused term ""trilogy"" probably will accompany this third film, but Toy Story 3 feels less like a final chapter than a long, superficially satisfying afterword."|Fresh
The story mixes comedy, drama and action with impressive skill, except this is beyond skill -- this is inspired.|Fresh
Most giggle-inducing are occasional detours into random silliness. Including a supremely vain and possibly duplicitous Ken doll, and a candy vending machine as a cover for an internal gambling den, where incorrigible toys play with your deposited money.|Fresh
A fine quality film, affecting and carried out with just the right bittersweet touch. Seek out the 2-D theatrical presentation. The 3-D serves absolutely no purpose and is a disservice to the visual artistry of Pixar.|Fresh
A worthy finale to one of the screen's best trilogies.|Fresh
It's a beautiful, vibrant story about memories, the passing of time and how you treat the people in your life.|Fresh
A brief flashback sequence filled with breathtaking mastery of telling, evocative detail...with wit and style and chase scenes, and then brilliantly, perfectly resolved.|Fresh
The studio's third outing with the motley crew of talking toys is ridiculously entertaining, tightly plotted, laugh-out-loud funny and emotionally true. It might even be the best in the series.|Fresh
Toy Story 3 lives up to its predecessors in terms of cute yet clever humor and action-packed journeys, grabbing you immediately with an incredible opening.|Fresh
It winds its way gently toward its big themes instead of grabbing desperately at them, and because its plot is so beautifully worked out, getting there is almost all of the fun.|Fresh
Toy Story 3 is as good as any movie Pixar Studios has made, and better than a few of them. I'd be tempted to say it's Pixar's best film, but it's a close call.|Fresh
I won't tell you what that ending is, but it took my breath away, and I'll bet it takes yours. Do see this lovely film sooner than later.|Fresh
Toy Story 3 pays attention to the reasons we return again and again to the motion picture experience.|Fresh
Some toys -- and Toy Storys -- are to be treasured forever.|Fresh
Another sentimental journey with some old friends, new scene-stealers and a powerful, heartfelt mix of sugar and spice.|Fresh
A worthy sendoff for a landmark series.|Fresh
It's easily the best film of the summer so far ... if not the entire year.|Fresh
In a summer that will be littered with bad sequels, bad 3-D and bad storytelling, it is a movie to be heartily embraced.|Fresh
The best children's films aren't only for children.|Fresh
The technical wizardry only enhances Toy Story 3's emotional resonance.|Fresh
It's an emotional dissonance Pixar has always been supremely comfortable with, as Toy Story 3 once again proves with knowing humor, wildly imaginative visual virtuosity and bittersweet rue.|Fresh
Toy Story 3 is a near-perfect piece of popular entertainment.|Fresh
Phenomenal. The perfect addition to what is now an unparalleled cinematic trilogy.|Fresh
Tears tell no lies in the end: Toy Story 3 is sketchy, but it's also profoundly moving.|Fresh
Toy Story 3 rouses itself, rung by rung of visual and conceptual invention, until it can stand close to the level of Pixar's best. More than that: The heart still beats in this franchise's digital chest.|Fresh
It might be G-rated, but Toy Story 3 is fully mature.|Fresh
Toy Story 3 is solid, smile-inducing stuff. But by the inherent nature of a sequel, and our familiarity with the main characters, the glow of originality has dissipated.|Fresh
It's all neatly thought out and executed but, at this point, the Pixar mixture of antic slapstick and hard-sell sentimentality has lost some of its potency.|Fresh
How the animation wizards at Pixar keep coming up with innovative and rapturous stories is one of the miracles in modern film.|Fresh
You can try to put on your game face, to resist the emotional call of Toy Story 3. But you'll find yourself practically sobbing over the fate of inanimate objects.|Fresh
This film -- this whole three-part, 15-year epic -- about the adventures of a bunch of silly plastic junk turns out also to be a long, melancholy meditation on loss, impermanence and that noble, stubborn, foolish thing called love.|Fresh
The film never lets banter, visual gags, or the usual manic kid-flick running about interfere with its more delicately handled thoughts on loyalty, longing, broken relationships, and generational continuity.|Fresh
You'll probably enjoy it, because it's good-humored, snappy, endearingly familiar, produced with intelligence and care. But it's the first Pixar effort that feels less like a creative outpouring and more like an obligation.|Fresh
More than with any other Pixar film, there's an edge and sadness that clings to Toy Story 3, even as it's bouncing from one zany situation to the next or trotting out some impossibly cute toy character.|Fresh
Toy Story 3 continues Pixar's unique tradition of sending grown men out of the theater pretending they're not crying.|Fresh
That even grown-up viewers feel invested in the toys' ultimate destination is indicative of the affection held for this franchise; that a third movie in a sequence can still offer charm and delight is the cherry on the sundae.|Fresh
By the time its poetic ending arrives, encapsulating the transformative, continuing power of play, we recognize that none of us move from one stage of life, or beyond, without help from our friends.|Fresh
Toy Story 3 is every bit as amusing and delightful as its predecessor, but there are darker elements to the saga.|Fresh
One of the best films of the year, Pixar's long-awaited latest scores in every department. Funny, affecting and dramatically fearless, it's as fine a threequel as you could hope for. Bring tissues -- lots of tissues.|Fresh
Toy Story 3 inspires an uncomplicated adoration: the kind we reserve for our best-loved if ill-worn -- and even occasionally misplaced -- childhood playmates.|Fresh
It's a well-earned curtain call for some of the most beloved characters in one of the best-sustained feats of recent cinema.|Fresh
"Yes, Toy Story 3 is a dandy addition to landmark series, and, frankly, the timing of its release couldn't be better. A perfect antidote to the news of the ""real world"", this worthy entertainment will also certainly boost what has been a sagging box office"|Fresh
"I know you don't want to hear that a movie with a ""3"" in the title is really good. But it's really good."|Fresh
After all is said and done, Toy Story is Andy's story as much as it belongs to his toys, and we're not only in that theater to watch him, but we're seeing him the way that Pixar does.|Fresh
Though uneven and less witty than the first two, Toy Story 3 delivers quite enough in two dimensions.|Fresh
I expect its target audience will love it, and at the box office, it may take right up where How to Train Your Dragon left off. Just don't get me started about the 3-D.|Fresh
The most mature, most childlike, best movie of the series. Pure joy in a box. Made me happier than any movie has this year so far.|Fresh
Toy Story 3 is the first truly must-see film of the summer.|Fresh
Andy, someone has made a movie for us!|Fresh
It's pretty much an all-purpose metaphor for, well, everything.|Fresh
...evokes that time in your life when anything was possible if you had a toy or two and an hour or so on your own.|Fresh
I feel no sense of guilt here. I still have my first teddy bear...but it was a wonderful film.|Fresh
Toy Story 3 is a worthy and delirious final chapter to this hallowed animation franchise.|Fresh
Pixar has done it again, extending an amazing streak of successes that stretches all the way back to the original Toy Story.|Fresh
I walked out of Toy Story 3 feeling as if my heart was too full. Pixar has already given us two utterly perfect Toy Story movies, yet this may be the best one yet.|Fresh
Even with the bar raised high, Toy Story 3 enchanted and moved me so deeply I was flabbergasted that a digitally animated comedy about plastic playthings could have this effect.|Fresh
Toy Story 3 looks mortality square in the face in a way unheard of for a film ostensibly focused on kids.|Fresh
Suffice it to say, it's proof of how much we love these characters that Toy Story 3 breaks your heart like you've never had it broken before.|Fresh
A stunning, heartfelt and tremendously entertaining third entry that lives up to the standards of one of the best movie franchises of all time.|Fresh
A crowning achievement for Pixar.|Fresh
As usual, the toy-box gang is filled with complex characters with flaws and virtues. The 3-D sequel's just as strong as the 2-D classics that came before it.|Fresh
Dazzling, scary and sentimental, Toy Story 3 is a daringly dark and emotional conclusion to the film series that made Pixar famous.|Fresh
Toy Story 3 is very much a worthy entry in the series, a movie well worth making (and seeing). It continues the legacy. It just doesn't expand upon it.|Fresh
Funnier and more poignant than the previous two Toy Story installments. Up there with WALL-E and Ratatouille as one of Pixar's best-realized films.|Fresh
Toy Story 3 is an overwhelming success, rounding out what might just be the best film trilogy ever made.|Fresh
Clearly, Pixar's genius for adventurous storytelling continues unabated; a prison film would seem to be the furthest idea from safe, but the tale poses a serious challenge to the old saw of terrible second sequels.|Fresh
That rare sequel that lives up to and even surpasses its progenitors...a pure winner, with more suspense and laughs (and tears) than any live-action film so far this year.|Fresh
Toy Story 3 is a rare meditation on the connections that make us human and the value we place on those connections, and an adventure film in which the greatest treasure you can find is a place called home filled with friends you love.|Fresh
Adults in the audience will undoubtedly shed a tear or two. But that's how good the folks at Pixar are: They make you feel genuine emotions for hunks of plastic.|Fresh
Once it kicks in to unexpectedly become a prison-break thriller, it fires on all cylinders all the way to the finish line.|Fresh
Uma montanha-russa emocional de fazer inveja a muitos projetos voltados ao público adulto.|Fresh
Nostalgic in tone and sentimental in ideology, Toy Story 3 lacks the visual and thematic sophistication of Wall-E and Up, but it's still emotionally touching and likely to please all members of the family.|Fresh
Woody, Buzz and the gang are back on the screen and that's cause for major celebration for moviegoers.|Fresh
Locating a winsome blend of peppy ensemble adventure and nostalgic reflection, Toy Story 3 is the type of film adults might goad their just-as-eager children into seeing again.|Fresh
On a scale of one to ten, Toy Story 3 goes to infinity, and beyond.|Fresh
This tertiary adventure delivers welcome yet nonessential fun, landing well after its creators have grown up and succeeded toying with more sophisticated stories.|Fresh
Woody, Buzz and playmates make a thoroughly engaging, emotionally satisfying return.|Fresh
