When teenaged Andy plops down on the grass to share his old toys with a shy little girl, the film spikes with sadness and layered pleasure -- a concise, deeply wise expression of the ephemeral that feels real and yet utterly transporting.|Fresh
There are many sweet laughs and joking allusions to horror and prison-break movies, but the Pixar gang gets at the most primary fear -- being cast off and no longer of use.|Fresh
I seriously doubt there will be a more hilarious and heartfelt blockbuster all summer.|Fresh
It's still more inventive, clever and laugh-out-loud funny than any other movie out there now.|Fresh
The 'Toy Story' films are deservedly seen as the gold standard for computer-generated animation...|Fresh
It's sadder and scarier than its predecessors, but it also may be the most important chapter in the tale.|Fresh
Something deeply, almost primal in a powerful way, tapping into the emotional core of an entire generation and the eternally young at heart.|Fresh
More than lives up to the lofty expectations as a worthy addition to the already classic series. There is something for everyone in the film, which is easily the best major American studio release I've seen in 2010.|Fresh
Toy Story 3 has magic in spades.|Fresh
Dear Pixar, THANK YOU for not churning out yet another inferior straight-to-DVD animated sequel, and instead taking the time to create something that will be as dear to Toy Story fans at the first time we saw Woody & Buzz on screen.|Fresh
From moments of pure delight to one of the most heartbreaking goodbyes in recent movie memory, the trilogy wraps up in a masterful way and once again proves Pixar is on a level all its own.|Fresh
Leave it to Pixar to subvert the Hollywood rule of sequels, which states that each subsequent film must have eyes full of dollar signs at the expense of quality.|Fresh
With a heart felt ending and truly outstanding story, Toy Story 3 has ensured that the franchise and all the characters we have known and loved, will be remembered for infinity, and beyond.|Fresh
What's so distressing about all this, as I keep pointing out, is the tremendous talent of the Pixar team getting wasted on nostalgic goop, forever presenting idealized 1950s suburban culture as the norm.|Rotten
Moments of uproarious humor and emotional farewells offset the darkness and send Woody and his pals on a memorable ride off into the sunset.|Fresh
Like last year's Up from the same company, Pixar, this film tickles the funny bone but also brings a tear to the eye.|Fresh
Hilarity, terrors, the melancholy of love and loss and growing up, and millions of adult-baby tears ensue.|Fresh
It's not the usual Hollywood conveyor-belt product. Made with love and intelligence, this adventure has enough thrills, laughs and emotion to satisfy any adult or child.|Fresh
A reasonable amount of fun ensues.|Fresh
Toy Story 3 isn't in the same league as its predecessors, but it's close enough that most people won't care.|Fresh
It affirms that change is inevitable, and even in this weird and fascinating universe of talking toys, love lives on in the next generation.|Fresh
The genius of the computer-animation powerhouse Pixar is stamped on every single frame of Toy Story 3. The studio that brought you Finding Nemo, WALL-E and Up has come up with another classic.|Fresh
What continues to astonish about the Pixar films is the way they manage to pair blissful entertainment with the miraculous experience of being human.|Fresh
There's no way this Pixar sequel could match the peerless level of the first two films, and it doesn't, but after a slow start this one gets into gear, and the third act is a barn-burner.|Fresh
The ostensibly inanimate objects are far more animated than most movie stars.|Fresh
It takes a kind of genius to combine a children's movie for grown-ups and a grown-up's movie for children in one glittering digimated package, yet the folks at Pixar have done it time and again.|Fresh
Maybe, sadly, there comes a time when the toys of childhood have to be packed away. But, not as long as this movie is playing which, we expect, will be forever.|Fresh
Come for the joyful kid stuff, but be warned, these animators don't play around.|Fresh
As much as we may love Woody, Buzz, and the other characters in this toy box, Toy Story 3 shows it's time for Pixar to put away these toys for good.|Fresh
Action-wise, this is essentially a prison-break caper, but there is so much more to it than this.|Fresh
Forget Butch and Sundance, Bogart and Bacall or Hepburn and Tracy. There is no more engaging double act in the movies than Woody and Buzz and the pair make a triumphant, long-awaited comeback in Toy Story 3.|Fresh
Tthis is one of the best films with the number three in the title you're ever likely to see.|Fresh
Toy Story 3 does not live up to its predecessors. It surpasses them.|Fresh
The sheer artistry makes it worth watching, even as it sends the wee ones shrieking into their mothers' arms.|Fresh
Toy Story 3 is just the right mix of adventure, joy and, most of all, wonder that we all need right now.|Fresh
It's sweet, innocent, intelligent, poignant -- and, most importantly, as wonderfully playful as movies can be.|Fresh
While the franchise's sentimental mould is inviolable, this sequel has a darker, more satirical edge.|Fresh
More than 10 years have passed since Toy Story 2 but that lengthy absence has only increased the appetite for a further adventure and allowed the geniuses at Pixar to devise an inventive and satisfying story.|Fresh
Genuinely moving and a beautiful farewell to a beloved series, Toy Story 3 is the must-see movie of the summer.|Fresh
Consider it one last farewell to the innocence of youth and bid adieu to this Story.|Fresh
Sit back, put on your glasses, and enjoy: It's summer, and Pixar has made you a treat.|Fresh
While the concept has turned darker, Toy Story 3 carries it off brilliantly.|Fresh
The whole project is so masterfully conceived and executed that you either go along for the ride or sit in stunned appreciation for how singularly Pixar has maintained control over the creative quality of its output.|Fresh
From 1995's Toy Story to now, we know these are not mere toys. Woody, Buzz and the rest have inner lives of their own, demonstrating unconditional loyalty, love, camaraderie and tearjerking nostalgia.|Fresh
This one wraps up the series perfectly and lets us all move on.|Fresh
... this is [Pixar's] prison film, and they load it with suspense, clever references, invention and action.|Fresh
While this is a good sequel, I wish it had had more of the emotion that had made the first two films so memorable.|Fresh
The best movie I've seen so far this year.|Fresh
You can intellectualise and even defend the reasons why the film is disappointing, but that doesn't stop it being disappointing.|Rotten
Toy Story 3 is probably the best of the series ...|Fresh
"Another worthy entry in a much-heralded series that amounts to a prison break story as exciting in its own way as Steve McQueen's ""The Great Escape""."|Fresh
"""Toy Story 3"" is a bit on the safe side, hemmed in by its concept from offering the imagination that makes the best Pixar has to offer so good ... but the filmmakers still understand real heart."|Fresh
I can understand the creators not wanting to sugarcoat life merely because the colors are brighter and voices chirpier, but why is Toy Story 3 so intent on being such a manipulative downer?|Fresh
Woody, Buzz & Co. triumph again but lose a bit of magic.|Fresh
Sin llegar a la altura de las dos primeras entregas, esta tercera parte ofrece un muy digno cierre a la trilogía, con buenas dosis de acción, humor y emoción.|Fresh
Pixar have once again reminded me that there is a way to create a film that not only appeals to just about everyone, but also prove that three-quels need not suck.|Fresh
A story with timeless, universal themes: family, coming of age (and leaving behind childish things), and the inevitable time when, past our prime, we will all face potential social obsolence. [Blu-ray]|Fresh
|Fresh
These toys may be old, but there's still plenty of mileage left in 'em.|Fresh
It's funny, warm, clever, exciting and touching, a story of friendship and imagination and a last blast of childhood joy...|Fresh
A kids' movie for grown-ups. A grown-up movie for kids. Exactly what you'd expect -- and hope for -- from the latest, and we're guessing final, Woody and Buzz adventure.|Fresh
The audio is almost obscenely immersive, boasting some of the finest separations these ears have ever heard.|Fresh
A fitting finale for a Disney trilogy guaranteed to resonate with kids of any age for generations to come.|Fresh
"It may be darker, but favorite moments abound in this film--Pixar treats that make ""Toy Story 3"" a fun film to watch over and over."|Fresh
The question was never going to be, 'Is Toy Story 3 any good?' ... The question could only be, 'To what degree does Toy Story 3 make you wish you could grab a hold of the wonder that is life and squeeze it as if it were a teddy bear?'|Fresh
Toy Story 3 has all the sass, action, and derring do of the Indiana Jones movies, the charm, admiration, and fun of its predecessors and cousins at Pixar, and enough laughter and imagination to fuel generations to come,|Fresh
Whether or not you'll be able to stomach this sequel depends on one thing: whether you welcome the broadening out of the franchise's mythology.|Fresh
Impecable producción en todos sentidos... sin embargo, es una versión menos blanca y más cargada de dramatismo. Una cinta más para adultos que para niños.|Fresh
The Toy Story movies have always been impossible not to love thanks to their mixture of heart, humour and action, but this last goodbye is the best yet.|Fresh
Toy Story 3 is equal parts hilarious, touching, insightful and exciting and anyone who doesn't come out smiling probably isn't human.|Fresh
full review at Movies for the Masses|Fresh
Comes across at once as a tender, thoughtful valedictory and a symbolic renewal.|Fresh
The best film Pixar have ever made.|Fresh
By [Pixar's] high standards this isn't the best, but by anyone else's, it's close to perfection.|Fresh
I tried stuffing paper into my nose and into my mouth and in my ears to stop the flow. It was hopeless. Toy Story 3 is not only a masterpiece but is the most heart-rending film I have ever seen.|Fresh
The perfect film does not, and cannot, exist. But if it did, it would probably look a lot like this.|Fresh
Even the hardest of hearts will have melted by the time the lights come back up.|Fresh
It's a sign of Pixar's ongoing brilliance that even when there would appear to be no real need for another Toy Story sequel the studio delivers one that feels utterly essential.|Fresh
Toy Story 3 surpasses the 1995 original and its 1999 sequel for thrills, spills and laughs, delivering the most satisfying journey of the trilogy.|Fresh
It's an effortlessly superior family movie.|Fresh
I doubt we'll see better all year.|Fresh
This is an almost flawless example of a movie that will keep pretty much any person of any age enthralled and entertained.|Fresh
It's a film that moves as much as it entertains, that will make adults cry as much as -- perhaps even more than -- younger children.|Fresh
A film to enrapture children, and make adults weep. Plastic cowboy hats off to Pixar once again.|Fresh
Toy Story 3 is clever, inventive and deeply moving, a fabulous film which can be enjoyed by all ages -- and you can't say that about many movies.|Fresh
If there were a Nobel Prize for Digital Animation it would have been won almost every year by Pixar.|Fresh
The glow of originality may have dimmed, but Pixar's third rummage in the toy box delivers exactly what it's supposed to, with appealing fringe benefits.|Fresh
A fitting, poignant close to the series, and -- thankfully -- entertaining not only for kids of all ages, but people of all ages too.|Fresh
Like an overdue reunion with an old friend... it's a trilogy that's grown up without losing its soul.|Fresh
An absolutely dreadful summer at the movies is rescued by the wizards at Pixar.|Fresh
All this wealth of material earns Pixar the right to go sequelling for the first time in 11 years.|Fresh
Toy Story 3 expertly combines dazzling visuals and thrilling adventure, with a touching story about saying goodbye to old friends.|Fresh
Toy Story 3 is well made, charming, and has a heart -- in fact, it wears it on its sleeve -- yet it also shows all the symptoms of acute sequelitis: declining imagination, bloated budget and a tendency to repeat oneself.|Fresh
There's legitimate poignancy in the way the characters have retained their handcrafted look even after 15 years of ruthlessly streamlined computer animation|Fresh
The film succeeds mostly because yes, it's more of the same.|Fresh
But for a nip tuck, Toy Story 3 might be a masterpiece. Heck, I'll take it anyway.|Fresh
These toys are unbreakable - in a series that will last to infinity and beyond!|Fresh
I appreciate it as an efficient, effective machine - even a thing of beauty. But you can't make me love it. And it scares me just a little that so many of you love it so loudly.|Fresh
You can't get your childhood back but for one hour and 38 minutes Toy Story 3 gets you pretty close. Oh, and by the way -- your kids will love it, too.|Fresh
It makes sense that the film was penned by Michael Arndt, whose Little Miss Sunshine provided a similar balance of mirth and melancholy.|Fresh
The writing quality is what makes this film work as a comedy, an adventure, and a film with some serious affecting human drama.|Fresh
To call this film critic-proof is an understatement, but here's a fact: there really isn't any way to improve upon Pixar's pitch perfect ending to their Toy Story saga.|Fresh
The best movie of the year so far.|Fresh
Another outing for Woody and the gang, another masterpiece for Pixar.|Fresh
Toy Story 3 is a Mr. Potato Heady assemblage of nostalgia, excitement, and danger. It flies in all directions, but Woody keeps it pleasurably intact.|Fresh
Like all the best sequels, Toy Story 3 builds upon and deepens the characters, relationships, and themes that fueled the previous entries in the series|Fresh
When graded on the Pixar curve Toy Story 3 feels, even for all its scariness and darkness, kind of weightless.|Fresh
It's by now a worn out verdict: Another masterpiece by Disney/Pixar.|Fresh
Managing to create real moments of suspense, a hugely powerful emotional sequence towards the end is testament to the relationships we've built up with this bunch of toys.|Fresh
A fun adventure with plenty of laughs and a strong narrative. It will undoubtedly capture the attention of both kids and adults. It's almost impossible not to like.|Fresh
Funny, inventive, touching; flawless.|Fresh
The pain of goodbye is beautifully balanced by the trademark excellence of the Toy Story series. A fantastic way to go out.|Fresh
And it's not cheap sentiment. There's something really deep and sweet about everything in the Toy Story series.|Fresh
The 3D animation is quite beautiful, and there's the usual bonus of a Pixar short film before the feature, the clever and enchanting Night and Day.|Fresh
Perhaps it's more likely to give parents nightmares than children!|Fresh
While packed to the margins with witty jokes and visual gags, the charming third instalment never loses sight of its emotional core.|Fresh
Once again, you're left with a groundswell of admiration for the skilled people at Pixar, who have an uncanny way of balancing emotional weight with outrageous moments of comedy and action.|Fresh
Anyone who's ever felt left out and abandoned will understand the emotional heart of this triumphant tale of friendship and loyalty.|Fresh
I found myself crying a bit for these animated inanimate objects.|Fresh
One sequence alone has more heart, humour, intellect and hair-raising thrills than most films - live-action or animated - have overall.|Fresh
...suffice it to say - it's great.|Fresh
Good but not great.|Fresh
As people grow up, life moves on, and it's inevitable that they'll part from people, places and things they love. Toy Story 3 illustrates this movingly and with real poignancy.|Fresh
Amid all the lively antics, this is a thoughtful story about regret for the past and fear of the future.|Fresh
This is another home run for Pixar. A perfect conclusion to a perfect movie trilogy.|Fresh
Woody and the gang stare into the abyss in this crazy, inspired homage to jailbreak films|Fresh
Such a deep wrap-up that it makes the previous two movies feel like episodes, while this movie feels like the summation.|Fresh
Despite its flaws, it retains the innocence, charm and (some of) the wit of the classics, and handles some potentially difficult subjects with Pixar's now-trademark ingenuity.|Fresh
Worthy threequel to the wonderful Toy Story franchise with gorgeous animation, terrific vocal performances and a brilliantly written script that's consistently both laugh-out-loud funny and powerfully emotional.|Fresh
It doesn't try to surpass its predecessors but simply continues the story in such a wonderful, natural progression that it melds with ease into the brilliance that is the Toy Story lore.|Fresh
Aims right for the sadness and ache that comes along as life shifts around you.|Fresh
Another Pixar masterpiece, capping a groundbreaking and exciting trilogy. Emotional, well crafted and intelligent. The hallmarks of Pixar quality.|Fresh
The best of the bunch. Touches the funny bone, the brain and the heart.|Fresh
The film does go through a lot of extra action sequences just to fill up time (not just one, but three trips in a dump truck) but it is worth the wait for that exquisite ending.|Fresh
Pretty much a perfect film...|Fresh
Driven by a good plot and clearly defined characters, Toy Story 3 is injected with humour and powered by fun as the adventure of their lives brings these toys together in ways that will entertain and move you|Fresh
Everything works: from the excellent voice cast to the way the story naturally evolves and leaves us in a happy place. This is a film that will certainly endure the test of time|Fresh
Balances rollicking adventure, personality-driven comedy and wrenching pathos with a deftness only surpassed by a handful of animation efforts.|Fresh
The Pixar team are true masters of their craft. Their stellar cinematic efforts do indeed go to infinity and beyond|Fresh
Ever moreso than the other films: you only thought you felt bad about your old toys--oh my God, you're going to feel horrible.|Fresh
Are there moments in Toy Story 3 that work? Yes, and when they hit, they're very good, which is what makes the film's overall mediocrity so much harder to take.|Fresh
The perfect ending to a near perfect series of films.|Fresh
I was shocked with how much joy and sweet sadness this threequel gave me. I will no longer doubt you, Pixar.|Fresh
The emotional roller coaster this film takes its audience on is better than anything at Disneyland.|Fresh
It shouldn't be surprising that Pixar can make a sequel that retains all the charm of the film that preceded it. After all, they've done it before.|Fresh
The storytelling and animation are delightfully engaging.|Fresh
There is so much to be absorbed here that a second viewing, at least, is a prerequisite.|Fresh
Pure, unadulterated enjoyment ---|Fresh
At best, Toy Story 3 stands as a refinement of Toy Story 2, a movie which was an unnecessary sequel to begin with.|Rotten
Toy Story 3 is a remarkable film and a fitting conclusion to one of the most consistently enjoyable trilogies ever made.|Fresh
This endearing escapist summer adventure will bring tears to your eyes and is not to be missed. The design work is spectacular and the cinematography is vivid utilizing every color imaginable in the crayon box. The sight gags and jokes make this a...|Fresh
Toy Story 3 feels like a once-every-five-years confluence of perfection in tone, delivery, timing, humor and drama.|Fresh
The eternal questions that the first two movies raised, about what happens to toys when playtime is over, are answered in ways that are both surprising and gently comforting.|Fresh
[I]t seemed like a good thing not to get one's hopes up too much... because how long can Pixar's streak of genius and spirit and wonder last?... [But this] brings the overarching story to its satisfying conclusion...|Fresh
A fitting finale for a Disney trilogy guaranteed to resonate with kids of any age for generations to come.|Fresh
If this is the final chapter of the toys from Pixar, then I couldn't have imagined a better send off...|Fresh
By the high standards of Pixar, the new Toy Story falls slightly short - which means it's still better than anything else in the computer-animated sweepstakes.|Fresh
Three-peats may be rare in the sports world, but they're even harder to achieve in the cinematic realm. Yet Toy Story 3 emerges as the perfect final chapter in a trilogy that's guaranteed to live on for generations (to infinity and beyond?).|Fresh
What a triumph this incredible new 'Toy Story' adventure is! It does a terrific job emphasizing the relationship between toys and a child's imagination.|Fresh
I wish I could be one of the few to hate on this movie, it'd drive up my traffic numbers. But I can't, it has an Evil Stuffed Bear! Toy Story 3 is not perfect, but it's strong. This coming from a Pixar Hater.|Fresh
Pixar produces the best movies on the planet. Period. Want proof? After Toy Story 3 the audience cried then cheered. And critics cried. Critics don't cry. Ever.|Fresh
Another summer, another Pixar feature, another masterpiece.|Fresh
The intelligence, wit, emotion and sheer care that the studio brings to this production is more than enough to make up for the few instances where its ambition outstrips its execution.|Fresh
In TS3, we come full circle to the biggest question of all: What does it mean not to feel outdated, or misunderstood, but truly useless? It's Waiting For Godot at Lego scale.|Fresh
How dare you, Pixar! How. Dare. You... It really isn't fair for other studios who are constantly playing hit-and-miss with the moviegoing public.|Fresh
Woody's insistence on rallying everyone back to their bedroom makes him the toy box Tina Turner, and the flick is smart enough to know it.|Fresh
Toy Story is a funny, touching and most excellent farewell to the characters we've come to know and love.|Fresh
Delivers the goods as an engaging animated adventure and also gives the characters we've come to love the farewell they deserve.|Fresh
The gags are all of a piece, right up to the forlorn yet enchanting finale.|Fresh
I hope this is the last Toy Story...a fitting and moving final chapter that takes the premise of the first movie to its logical conclusion.|Fresh
Toy Story 3 is so besotted with brand names and product-placement that it stops being about the innocent pleasures of imagination -- the usefulness of toys -- and strictly celebrates consumerism.|Rotten
[VIDEO ESSAY] An obvious split between the accomplished progression of the first two movies and the inferior last installment is the departure of the enormously talented writer Peter Docter from the franchise.|Rotten
Make no mistake: this Toy Story trilogy, and Toy Story 3 in particular, is a great work of art - one of the cleverest pieces of story-telling magic that Hollywood has ever conjured.|Fresh
It's said Pixar doesn't make bad movies. It may jump the shark one day, but I'm happy to report that day isn't today.|Fresh
At its best, most moving moments, Toy Story 3 is a story about the pang of a young adult moving away from home and leaving child-like things behind.|Fresh
It hits every button from laughter to tears and lifts you up on waves of visual dazzlement. And you don't need to take a kid along to appreciate it... Tag it as one of the year's best.|Fresh
Suffice it to say that it's the funniest comedy and the most exciting action movie I've seen so far this year. (And I might have ruined a vintage handkerchief during the last 20 or so minutes of the film, but I'm not saying.)|Fresh
What Pixar does better than any other artistic source is make us believe, including the notion that a fourth Toy Story, if it ever happens, would be even more carefully perfected than this.|Fresh
Toy Story 3 succeeds not because of its glossy and gleaming high-tech pixels, but rather because it is so well-written that you could tell it with low-tech hand puppets and still thrill and reach an audience of children and adults both.|Fresh
Consider the oft-amusing, terribly clever G-rated sequel Toy Story 3 as the brightest student in the class delivering a very fine B paper.|Fresh
characters that are as real as a kid's sense of wonder, and the kind of magic that transports everyone in the audience, regardless of age|Fresh
Pixar does it again - that is, they take a bunch of animated toys and teach us all about the human heart in an entertaining, magical way.|Fresh
Enormously entertaining third chapter in the computer-animated series that started it all. Delighted audiences will ensure a long shelf life for Pixar's iconic toy collection.|Fresh
Briefly loses its footing during the first hour, but still manages to be an imaginative, witty, poignant and hilarious adventure that will captivate everyone. Bring on Toy Story 4!|Fresh
Exactly what this bummer of a summer needs -- a creative, intelligent, heartfelt slice of immensely satisfying entertainment.|Fresh
Brilliantly tying up the two films that came before in a way that so many sequels fail to do, the geniuses at Pixar have done it again. It's another masterpiece.|Fresh
Pixar's storytelling masterminds serve up yet another exceptional film packed with humor, imagination, adventure and emotional resonance.|Fresh
