Charlize Theron, Mackenzie Davis, director Jason Reitman and screenwriter Diablo Cody whip up the great existential-crisis Mother's Day movie. It's funny, touching and vital.|Fresh
A first-rate comedy-drama about the joys and challenges of motherhood that both provokes and entertains.|Fresh
Compared to sanitized Hollywood depictions of motherhood, this is messy and daring in all sorts of ways, and it's the nicest early Mother's Day present we could wish for.|Fresh
Though the ending is a little heavy-handed, Diablo Cody's smart, funny dialogue makes Tully an enjoyable watch even when it's uncomfortable, and Charlize Theron gives a strong performance as an exhausted, burnt-out mom.|Fresh
This is a film about mothers and motherhood, but through its stubborn empathy, even people who will never be parents have some idea of just how exhausting and unfair it can be.|Fresh
Tully is that rare movie that I wished were longer, in order to spend more time with two fascinating characters who could potentially have been part of one mother of a tale.|Fresh
Honestly, I'd have written this off completely if it weren't for the actors.|Rotten
While Tully is a comedy, it's dark, dark, dark! As you watch, you may find yourself thinking, Wait... should I be laughing at this?|Fresh
"Not many films address motherhood with as much irreverence and insight as ""Tully."""|Fresh
Charlize Theron is marvellous as Marlo...|Fresh
More often than not, Tully comes across as a group of relatable characters marooned in a story with nowhere to go.|Rotten
"Ms. Theron and Ms. Davis make a pleasurable, watchable pair - Ms. Davis is obviously happy to be the moon to Ms. Theron's sun - but ""Tully"" isn't really interested in the sustaining joys of female bonding."|Rotten
What holds the film together are a couple of really strong performances by Charlize Theron and Mackenzie Davis. They have a terrific, and unique, chemistry that helps smooth over a few rough patches.|Fresh
[Tully] features Cody's hyper-verbal brand of snark, cynicism and subtle poignancy, but it's tinged with the wistful perspective that comes from hard-earned maturity and experience.|Fresh
Yet that tiny slip cannot undercut a charming, touching, and deeply compassionate depiction of modern middle-class motherhood.|Fresh
Theron, who gained almost forty pounds for the role, conveys the utter exhaustion and physical toll of childbirth and child care with numb perseverance, love drowning in the chaos of breast milk stains and stationary Lego assaults.|Fresh
Theron and Davis are the heart and soul of Tully, a pair whose onscreen chemistry flickers with a magnificent glow.|Fresh
Captures the complete exhaustion of parenthood in funny and profound fashion.|Fresh
It's barbed, bighearted, and brave.|Fresh
"At its spiky, intermittent best, ""Tully"" is the best work Cody has done in the conventional feature format since ""Juno."""|Fresh
It tackles subject matter that seldom finds its way to the big screen and does it thoughtfully. It's not what I expected to see, but it's just maybe something I needed to see.|Fresh
Theron does minor miracles in the lead, her eyes registering Marlo's pride, insecurity, desperation, and rage, all under the smiling surface of the capable mom next to you at the supermarket.|Fresh
When Jason Reitman and Diablo Cody team up together, the two can do no wrong...a commanding performance from Oscar-winning actress Charlize Theron.|Fresh
"""Tully"" plays a specific game of misdirection, but it's another remarkably observed picture from Reitman and especially Cody, who saves her spot as one of the most perceptive writers working today."|Fresh
Theron's a perfect avatar for Cody's irrepressible empathy for her subjects, wounded and loving in equal measure, and she's hardly been more watchable.|Fresh
They say you have to experience to fully know what it feels, Theron, in a performance of immense honesty makes you feel every ache, every strain, of her character's everyday struggles. This is the fiercest of feminism portrayed on-screen.|Fresh
Tully is still a strong depiction of parenthood that also makes for a startling and entertaining movie.|Fresh
You can see in Theron's overly caffeinated eyes and slumped back the layers of loneliness and self-loathing that finally burst through, demanding change. Their truth, if taken seriously, could reorganize millions of lives.|Fresh
A movie unlike any we've seen before, one deeply, intimately sympathetic to modern motherhood - to modern womanhood. Brilliantly wise and funny, and profoundly moving.|Fresh
It's surely one of the most authentic portrayals of young motherhood that we've had - and it's not like that's a much chronicled subject for Hollywood.|Fresh
Tully is a serendipitous treasure.|Fresh
It's a compelling performance worthy of an Oscar nomination, but I'm afraid the film won't have enough juice to get [Theron] there.|Rotten
Ultimately, there's too much sting in Tully to dismiss, and Theron's fierceness nails this down. The movie is so fervent, it's a kind of apology for the callowness of Juno.|Fresh
Tully is laugh out loud funny, but it's also extremely poignant with a meaningful bittersweet touch to it.|Fresh
There is a deeper dynamic going on between Marlo and Tully that is going to elicit mixed reactions, but also thought-provoking responses, and a bunch of stressed-out mothers are also going to come away from this film ready to hire some night nannies|Fresh
From these desperate beginnings, writer Diablo Cody and her regular director partner Jason Reitman have fashioned a film with a spiky charm and unexpected tenderness.|Fresh
Charlize Theron was destined to specialize in bruising comedy.|Fresh
Despite the rich setup, the plot is undercooked. It's a cute idea in need of development. The longer it hides Tully's identity the more apparent it is that it doesn't have a story or personal conflict to explore.|Rotten
I've seen the film twice now, and while I enjoyed it the first time, on second viewing I found it nearly profound.|Fresh
Cody seems to be taking aim at the feminist mindset that a woman who raises her children and is not in the workplace is somehow lacking in some social stature or hierarchy.|Fresh
While the story ends up too neat and tidy, Theron is a powerhouse.|Fresh
Much but not all of this movie's good work is undone by its silly and unconvincing ending.|Fresh
Diablo Cody's style of turning deeply felt pearls of wisdom into entertaining dialogue feels more natural and confident than ever.|Fresh
It's smart, funny and bursting with ideas about the joys and rigors motherhood and reckoning with the past and the future.|Fresh
Turns out Furiosa had it pretty easy compared to the rigors of modern parenting, but Theron's fierce performance and Cody's witty script will have you believing she can overcome anything.|Fresh
As usual, Cody's dialogue crackles, but never for the sake of mere amusement. Her insightful subtext stays with you after the laughs fade.|Fresh
Tully is at its best when it's simply moving intuitively from one negotiated respite to the next.|Fresh
Theron holds the movie in her hands and gives it to us like a gift; one we accept with joy.|Fresh
That it works as well as it does is thanks to a screenplay that largely drops Cody's signature sarcasm - so often used to mask painful underlying secrets - for a voice that is much more raw and direct.|Fresh
Tully encapsulates the psychological process of maturity with pithy humor and vertiginous insight.|Fresh
"It is brutally, hilariously honest about motherhood -- which will make it an important film for the many women who see it and think with relief, ""My god, it's not just me."""|Fresh
Messy, but then again, so is motherhood.|Fresh
Tully's strength lies in [Diablo] Cody's signature harmony between acerbic, wry humor, and stark, naked emotion.|Fresh
But [Jason] Reitman and especially [Diablo] Cody approach the material with the freshness of filmmakers still learning new things about themselves, still figuring out how to reconcile their grown-up selves with who they may have been in youth.|Fresh
...a major movie about motherhood in which Cody's signature sarcasm has deepened into anxiety, exhaustion and wisdom -- she's truly becoming a voice for the ages.|Fresh
Reitman handles the material with sensitivity and an unflinching eye for the detail of pregnancy, parenthood and female friendship that's by turns humorous and desperately moving.|Fresh
A delightful return to form for Jason Reitman. Diablo Cody's sterling script cracks along at a fine pace, eliciting strong performances and a memorable emotional afterglow.|Fresh
Theron is astonishingly good, giving a subtle, vanity-free performance full of deadpan comedy and emotional truth...|Fresh
Sharply observed but tenderly realised, Tully brings back the Reitman we knew and loved, represents Cody's finest work since Juno, and reminds us why Theron deserved that 2004 Oscar.|Fresh
In Marlo, Diablo Cody has created her most complicated character to date. Would that her writing displayed similar richness and empathy in painting the film's supporting characters.|Rotten
Tully is a remarkable film for its admirable effort at portraying a stripped down, raw version of the mother wish fulfillment genre.|Fresh
It's real and raw, bruising and bleak and honest to fault. All this makes it entirely wonderful as it's an unapologetic, unwavering, unvarnished look at motherhood.|Fresh
The Tully-Marlo relationship is born of solipsism and inner drama, and Cody turns out to be amazingly gifted at it.|Fresh
Tully takes some daring detours that I didn't see coming. And it's a better, less predictable movie for it.|Fresh
Despite a premise that welcomes comparisons to psychological thrillers of the past, Tully is an honest look at the tireless situation of one mother, that thanks to its sincerity and universal nature, speaks for the lives of so many others.|Fresh
With the help of Theron and Davis' magnetic chemistry, Cody and Reitman's synergy, and an intricate yet touching story about motherhood, Tully perfectly blends comedy and drama, creating a powerful, tender meditation on societal stigmas.|Fresh
It's the mix of the mundane and the mystical in Tully that will likely divide audiences. I won't say it all fits together narratively. But I think it works thematically.|Fresh
"The beauty of Tully is that Diablo Cody takes an experience we all go through and intensifies the drama and humor of the situation to the point where she slaps you in the face and says, ""this is you!"""|Fresh
Uneven, but Charlize Theron is undeniably excellent.|Fresh
Tully is both bitingly funny and observant-and a quietly radical statement on motherhood, sure to make mothers everywhere feel less alone.|Fresh
Theron looked happier driving across a post-apocalyptic desert with a car of frightened slave girls. The terrifying former high school beauty queen she played in Young Adult would glance at Marlo and sneer.|Fresh
Marlo is an incredibly complex character and Theron has no problem emerging herself into this role.|Fresh
[Charlize] Theron and [Mackenzie] Davis are dynamite together, the actresses playing off each other like two sides of the same coin.|Fresh
Diablo Cody knows her screenplay had to be innovative enough to make that familiar subject matter compelling. The result will feel slight to some and fresh to others, but, most importantly, it never overstays its welcome.|Fresh
Theron will put to rest any doubts about her feel for comedy; the darker the better.|Fresh
Packed with more than a couple of possible feminist readings as regards the parenting/career/life question, the often very funny picture entertains while affording its characters their share of no-laughing-matter concerns.|Fresh
"""Tully"" has its heart (and many other things) in the right place, but by the end you wish it had an imagination finely executed enough to match its empathy."|Rotten
